username,tweet
syifa_syifo,tapi bonceng
syifa_syifo,yang komenanya putri sedih alami
syifa_syifo,ayo baru normal baru normalin jam tidur tawa
syifa_syifo,suka tidur tani suara hujan
syifa_syifo,manusia lihat teman anda manusia
syifa_syifo,paling lucu antara yang belum saudara wanita tawa
syifa_syifo,iyaya doa semoga dibukain bas
syifa_syifo,bagaimana dapetin kunci ya whatsapp
syifa_syifo,ngechat beliau lagi tapi malu sekali bagaimana
syifa_syifo,gimanasih komunikasi orang tutup susah sekali
syifa_syifo,tawa amin doa teman teman
syifa_syifo,mau ngumpet ngumpet sial tekan vidcal tryas gila
syifa_syifo,tidak bisa gunung anda syukur diam anda rumah mutih cara paksa tawa
syifa_syifo,lelah dari kita terbaiq
syifa_syifo,tawa cocok sedih jam
syifa_syifo,kopi terus
syifa_syifo,sial syarat dufan
syifa_syifo,bos
syifa_syifo,teman jadi seperti ayam warna warni sampai dengan sampai dengan gin
syifa_syifo,tawa humoris juga
syifa_syifo,buat sama jantung kalah kalah super fast sampai hafal sial
syifa_syifo,tawa kalau anda ibu mesti ibu yang masak tidak
syifa_syifo,saudara wanita
syifa_syifo,yeu dasar netizen
syifa_syifo,cupu ahk lindung twtrnya tawa
syifa_syifo,lagi rindu ibu nurjanah bege biarinin
syifa_syifo,ce sial proker dulu mesti jalan ke dufan
syifa_syifo,kalau yang buat kerudung syarat poni mesti
syifa_syifo,tawa tukik anda lagi ini tukik
syifa_syifo,gbk sudah ramai
syifa_syifo,tawa utama dirmh seperti
syifa_syifo,ongkir gosend ditangung tapi tawa
syifa_syifo,saudara laki tidak boleh
syifa_syifo,ken utama masak an tapi tidak mau cemil
syifa_syifo,tawa agar tidak tanjung saudara
syifa_syifo,humoris sekali sudah
syifa_syifo,ribut sudah anda bedua
syifa_syifo,mnahan kantuk
syifa_syifo,cw anda cakep sekali pe tidak paham lagi
syifa_syifo,ayo ayo ganti kacamata
syifa_syifo,asli saudara wanita proker harus jalan sempurna jadi tahan kantuk
syifa_syifo,yang rindu pacar tapi yang disalahin pikir
syifa_syifo,subhana
syifa_syifo,astaga ukh tingkat iman kan tapi
syifa_syifo,lagi lagi huf
syifa_syifo,tahan perut rata juga sulit sekali saudara wanita
syifa_syifo,selesai masalah kacu
syifa_syifo,tahu setuju yeu dasar
syifa_syifo,mesti hati memang
syifa_syifo,tidak kesal biarin dia yang suruh henti gosip dia juga yang sangkut pauitin kesitu bagaimana
syifa_syifo,ken diri harga tapi memang goa habis apa tidak kenapa in
syifa_syifo,tidak buka lebaran
syifa_syifo,kabupaten bekas benar planet
syifa_syifo,semoga besok tukang ayam buka
syifa_syifo,belum tambun jarak benar dari adab begitu saudara wanita anti
syifa_syifo,tapi saya kembali dulu sesuai jalan ninjaku
syifa_syifo,anti sj sadar aplg saya
syifa_syifo,tiup tiup sama hingga lelap
syifa_syifo,kacamata teman foto merem alias kalau melek pusing sial itu silinder besar sekali
syifa_syifo,tawa nanti konten cantik
syifa_syifo,wkakakakakaka karena revo sepi yagaksi
syifa_syifo,tawa gasalah tapi
syifa_syifo,kalau goreng ikan takut minyak bletak bletuk panggil saja jadi yang goreng
syifa_syifo,tidur cepat eh bangun nasip
syifa_syifo,tiba tiba pikir sama dunia terus takut sekali
syifa_syifo,kejut
syifa_syifo,wkwkwkwkwkwkwkw nyensus
syifa_syifo,goa mendengarkan cerita anda thur vieneta
syifa_syifo,bapak ibu kalau lagi vidcal sama teman sama saudara suara sampai kedengeran retweet
syifa_syifo,iya iya
syifa_syifo,selamat lebaran ol monmap lahir batin
syifa_syifo,parah
syifa_syifo,tawa papi dido
syifa_syifo,nyusul kayao jadi pegawai negeri sipil
syifa_syifo,malas taruh revisi astaga syifa
syifa_syifo,yang nge sg sidang dari kemarin ken sidang motivasi dimanasih adoh
syifa_syifo,sama saudara irman kayao tempat sampah cemil hanya ke saudara irman tawa
syifa_syifo,tawa padahal manusia alfriza manis anda tahu siapa yang budak cinta
syifa_syifo,tawa salah goa unggah begini salah
syifa_syifo,napas manusia
syifa_syifo,suka tidak kaca memang kebo mangil kebo
syifa_syifo,tawa
syifa_syifo,mel semangat
syifa_syifo,kejut hebat lumayan lahya saudara laki jadi tidak ngeblur tawa
syifa_syifo,kejut markicob alias mari coba
syifa_syifo,cpt sekali tidak 
syifa_syifo,tidak apa apa mz
syifa_syifo,ken utama kembang api
syifa_syifo,tidak lelah sama ya teman teman
syifa_syifo,jadi en en
syifa_syifo,kalau lagi niat niat sekali kalau lagi malas malas sekali gitudeh
syifa_syifo,bhahah kalau gasalah hapyfit kemarin lagi cakram saudara wanita
syifa_syifo,senang ulang tahun akbar
syifa_syifo,habis corona
syifa_syifo,leher sakit sekali tidak bisa nengok kayak salah bantal padahal tidur gamake bantal terus salah siapadong
syifa_syifo,mimpi
syifa_syifo,ken gilir buka puasa kenyang tidak jadi
syifa_syifo,sikasik semangat kel mawar tawa
syifa_syifo,goa carin benang tutorial tawa habis buat tidak manja
syifa_syifo,buat malam besok tidak buka puasa cemil
syifa_syifo,helaw masih tidur sampai sekarang
syifa_syifo,kalau pintu saja goa nangor detik terus lagi
syifa_syifo,ngebut sekali malu
syifa_syifo,sabar saudara laki lagi puasa
syifa_syifo,vagabond piya
syifa_syifo,tawa gosip di blkg seperti agar dapat pahala hai
syifa_syifo,benar kali jadi ayam utuh ya manusia
syifa_syifo,rem tidak teman psikopat
syifa_syifo,pikir goa tidak suka rendang tawa
syifa_syifo,kata mau aduh
syifa_syifo,catat
syifa_syifo,olah kan tapi
syifa_syifo,cemil buat nasi enak tinggal goreng ayo teman teman dom bekas
syifa_syifo,ciken katsu tetap
syifa_syifo,kuk earphone
syifa_syifo,yang jual jomblo ini teman teman cakep tapi berisik ayo sekali beli jualananya
syifa_syifo,kan tidak suka keju
syifa_syifo,ken sop ala korea sudah tapi tidak tahu bumbu tawa
syifa_syifo,tapi tapi resep masak ibu kutin hidup sial tawa
syifa_syifo,tolong tutorial saudara wanita
syifa_syifo,katsu juga ditepungin
syifa_syifo,terus cemil pakai apa samlikum
syifa_syifo,nugget di kulkas saya buat nugget lagi saudara wanita tawa
syifa_syifo,dada ayam katsu di apain ya
syifa_syifo,sumpah goa juga gakuat lihat kucing jahatin
syifa_syifo,kemarin nge pap tiba tiba sudah warna bleaching an sekarang pap warna abu iya tuhan
syifa_syifo,tapi tadi belum vc gabaca tweet anda yang asli tawa karena lihat sg anda jadi pikir
syifa_syifo,tidak paham lagi
syifa_syifo,tawa memang sudah kalau bicara mudah sekali
syifa_syifo,puasa gapuasa sama seperti orang puasa inimah
syifa_syifo,gila mantul sekali pengirim
syifa_syifo,ayah mau
syifa_syifo,tumben an saya dapat receh shopee tawa
syifa_syifo,kagalih semangat
syifa_syifo,gosah waro atur erel
syifa_syifo,tidak ada yang lucu orang tidur hanya tawa
syifa_syifo,parah sekali nyonya gibahin
syifa_syifo,tawa anda tahu oiya anda kembar saya jadi tahu
syifa_syifo,maaf tidak mengangu damai beranda anda
syifa_syifo,dasar bodoh
syifa_syifo,teh segar teh basi buat
syifa_syifo,gila gila
syifa_syifo,karena akhir saeroyi tidak sama jadi sama yi seo malah goa dukung sama yi seo kurang serasi saja memang sama saeroyi tawa
syifa_syifo,tawa
syifa_syifo,dapat berapa thr kira pikir
syifa_syifo,sudah bnrn ya tapi foto anda ugel cakep sekali warna motor xixi jk
syifa_syifo,berapa jam wtspn sudah mau ribut lagi ini
syifa_syifo,gila gila
syifa_syifo,semoga lancar berkah bas puasa tahun
syifa_syifo,oke kalau begitu
syifa_syifo,tidak ngabuburit pabukon tahun
syifa_syifo,selamat puasa besok mentemen monmap lahir batin
syifa_syifo,telan tidak
syifa_syifo,telan ludah tidak anda
syifa_syifo,cemilan malam saya
syifa_syifo,mau seperti fizi tawa fizi upin ipin
syifa_syifo,pansi
syifa_syifo,tawa sudah overproud padahal ribetsi
syifa_syifo,yah rip
syifa_syifo,bri
syifa_syifo,pikir segera nti kirimin tapi foto ya
syifa_syifo,coba saudara wanita tanyain tolong kalau buku kos bagaimana jarang taruh minjem buku minjem denda padahal baca belum
syifa_syifo,kirimin bahan nti kalau sudah jadi saya gojekin
syifa_syifo,buku dikosan
syifa_syifo,saudara wanita tidak keitung sial corona
syifa_syifo,omong kosong mnelan ludah
syifa_syifo,ken brownies
syifa_syifo,ken nanas
syifa_syifo,kerasnyo dunia cinta an pengirim
syifa_syifo,coba anda pikir coba anda renung
syifa_syifo,saya tahu anda cinta fakboi
syifa_syifo,pegang anda boleh tidak
syifa_syifo,kapan rio dewanto gondrong
syifa_syifo,goa lihat itaewon akhir kurs ini
syifa_syifo,jaman sekarang kasih foto juga tetap bisa berita palsu akhir
syifa_syifo,cemil drama korea enak sekali memang
syifa_syifo,iyaya jadi bingung asli
syifa_syifo,azka iya
syifa_syifo,foto profil anda muka anda goa masih ngenalin sudah tawa
syifa_syifo,orang ganti uname ganti foto profil ganti dn aneh sial anda syp alias bingung tae
syifa_syifo,gila gila yang seperti gin ditingalin
syifa_syifo,kalau niat sama mau selalu jalan tidak 
syifa_syifo,intel ini tukang baso jam gin
syifa_syifo,benar itu kenapa selalu bilang gosah pedulin mau lihat orang bagaimana kita benar tidak dan orang kita tahu yang benar sudah lelah kalau mesti jelasin tawa
syifa_syifo,gila sekali dunia sugardady sugarbaby an
syifa_syifo,yuhu selamat dila cantik sekali omong omong dandan buat mua yang sen wisuda tawa buat maman dil sidang hibur sekali asli tawa
syifa_syifo,tidak bulcit
syifa_syifo,janji
syifa_syifo,jadi tidak heran tawa
syifa_syifo,ken mcflury yang heran tapi mau dapat warna kuning bagaimana
syifa_syifo,gila sekali sampai besok skt perut karena baik
syifa_syifo,anda seperti ganti yang buat game
syifa_syifo,sudah rekat sblmnya saudara wanita tapi begitu memang sudah rapuh
syifa_syifo,anyonk
syifa_syifo,yang putus tapi hubung
syifa_syifo,bolu pisang anda saudara wanita bhikikik
syifa_syifo,sudah tidak cium bau mayat nyamuk
