username,tweet
arisetiyani12,labil maju mundur
arisetiyani12,akhir cuaca labil
arisetiyani12,ayo ayo
arisetiyani12,template lelucon favorit blundernya orang tawa
arisetiyani12,tidak apa apa penting sampai malas napas
arisetiyani12,ini rabu wib menit adalah hari
arisetiyani12,akhir twitter ramai sekali baku hantam onlinenya
arisetiyani12,sudah bismillah
arisetiyani12,detik buka syukur tidak aman astaga ada
arisetiyani12,kalau obat ampuh tidak aman pikir lebih jamin keras
arisetiyani12,drama korea vip transtv tiba ditamatin gara rating rendah
arisetiyani12,anda tahu sungguh sungguh buat
arisetiyani12,tidak apa apa
arisetiyani12,denting piano mai pakai gitar
arisetiyani12,kali uap tetap gagal lelap dasar
arisetiyani12,ken cerita tapi tidak tahu cerita
arisetiyani12,saudara laki memang tidak peduli saya
arisetiyani12,lelucon tawa saya benar tidak masuk
arisetiyani12,benar sekali akhir ini memang rindu yang waktu kuliah kecuali tidak telat makul salah dosen tidak masuk kelas
arisetiyani12,diterapin uang bentuk jadi langsung bisa tawa
arisetiyani12,ralat buat peras tambah beranta memang sudah beranta piss
arisetiyani12,benar sekali ini ampun rindu ngitung begini tawa
arisetiyani12,saudara laki ini memang jakarta garis keras tiada sih
arisetiyani12,apik untuk tawa siap ke ngawi agar afdal harus tahu lagu
arisetiyani12,coba mendengarkan ya kayak nuansa sendu dapat tawa
arisetiyani12,tumben tidak jakarta saudara laki tawa coba tek mendengarkan
arisetiyani12,lagu juta umat shawn mendes ibu nyanyi merem agar hayati tawa
arisetiyani12,mantap ini tidak rasa beri atas diri
arisetiyani12,turun lagu sering mendengarkan seminggu
arisetiyani12,cepat seperti saya amin in tawa
arisetiyani12,jalan jalan jalan syukur syukur syukur syukur syukur syukur syukur syukur syukur syukur syukur syukur syukur syukur syukur syukur syukur syukur inti syukur terhinga dulu semoga nikmat tidak terhinga amin
arisetiyani12,tolong tidak pikir ngecrop
arisetiyani12,dong tidak hal diupdate mau diupdate juga apa inti ibu gantung masing individu asal paham batas lebih bijak memposting jepret whatsapp sih kunci malah aib umbar di jepret whatsapp malu
arisetiyani12,ini kesal tidak buat apa bisa mesem haha malu tahan makdeg doang
arisetiyani12,kena banding kena banding kena banding kena banding kena banding kena banding kena banding kena banding kena banding kena banding kena banding kena banding kena banding kena banding kena banding kena banding kena banding kena banding diri sendiri dengan
arisetiyani12,yiseo jadi bisa pilih satu ini kalian tidak ban taman saeroyi tawa
arisetiyani12,langsung cemil sudah pengirim
arisetiyani12,temulawak kunyit lengkuas jahe ketumbar lada adas jinten
arisetiyani12,jang nara benar misteri sekali selingkuhanya
arisetiyani12,waktu lalu ken tonton episode jadi tunda tawa
arisetiyani12,drama vip kayak bagus
arisetiyani12,ini oknum nyanyi harus waspada dunia usaha peng angkring
arisetiyani12,rindu sego kucing sambal teri sambal hati goreng hangat wedang jeruk sate usus bakso puyuh kabeh menu saudara wanita angkring pokoke
arisetiyani12,benar sekali meski akhir nasi cooker saya hilang semester skripsi
arisetiyani12,tidak banding diri sendiri dengan lain orang anda yang cantik hanya itu cara anda adalah
arisetiyani12,sering sekali gin tapi tidak apa apa turut bagi media curah emosi yang kadang sudah tahan bahkan sudah tapi sekarang tidur mendengarkan podcast habis nyetel murotal antar tidur asli jamin nyenyak bgtapk
arisetiyani12,pesan moral bisa ambil baca adalah saya mudah percaya ilustrasi buka
arisetiyani12,ninuninu
arisetiyani12,silakan dewek tawa
arisetiyani12,tidak apa apa kalau tidak tahu kalau ngawi barangkali minat ke kartonyono tanpa medot janji tawa
arisetiyani12,alula sudah besar bayi dong waktu begitu cepat
arisetiyani12,ke kartonyono medot janji po
arisetiyani12,buat baik dan baik akan datang untuk anda
arisetiyani12,tidak ayah bisa nabung yang kalau sempat laku tidak lewat nabung dulu yang pasti panen juga yang tidak sangka saking biasa baik yang panen
arisetiyani12,sudah serah sama maha kuasa tidak pikir lebih hanya waktu pada
arisetiyani12,tipe gabah sungguh keluar dari itu kotak alias kreatip sekali nya pikir sampai tawa
arisetiyani12,data seperti gin di jalan gas kelakar baru normal
arisetiyani12,nilai dari dosen beberapa kuliah wajah cantik itu sebut buah hak istimewa kalau dulu sering saksi demikian omong omong saksi rasa maklum kntnk tawa
arisetiyani12,datang wisuda bawa bunga foto studio doesn buat dia dia tinggal
arisetiyani12,sekali ibu tawa
arisetiyani12,uang hasil korupsi tonton konser coldplay ini punya otak karena ngelakuin hanya yang brainless akhlakles
arisetiyani12,kalau ngeprintnya perum uri uang kalau ngeprintnya kanon tidak mau
arisetiyani12,tul harus optimis ya gambar saldo rekening benar yah amin tawa
arisetiyani12,peta jadi ngerepotin buat otak pikir tawa
arisetiyani12,tidak sombong dengan keras nabung akhir beli kouta unduh gepok uang ratus ribu
arisetiyani12,bagaimana sudah temu jala tawa
arisetiyani12,tidak tindak ibu bukankah harus utama kemanusian
arisetiyani12,kata coba cari jalan balik bagaimana tawa
arisetiyani12,tolong buntu ikan beberapa pintu
arisetiyani12,gotta dapat kembali untuk anda gotta gotta dapat kembali untuk anda
arisetiyani12,saya lokasi tidak tahu
arisetiyani12,kayak risiko kampus konservasi tengah rindang gunungpati
arisetiyani12,tawa
arisetiyani12,nge tweet anak anjing ramai
arisetiyani12,kalau butuh ketawa tawa tonton
arisetiyani12,tonton drama waikiki baru paham kul tawa
arisetiyani12,ayo ini untuk sendiri tawa omong omong rindu junki
arisetiyani12,pagi sudah dapat baik suasana amin semoga ya
arisetiyani12,benar sekali tidak tahu behind itu scenenya seperti yah karena cuma lihat luar iya lagi ajar iri tempat
arisetiyani12,gantung kalau lucu halunya sekali eh tidak ding tawa
arisetiyani12,sudah lanjur iri jadi ganggu iri dengan behind itu scenenya
arisetiyani12,manis hidup dalam bentuk cemil minum
arisetiyani12,besok habis pandemi selesai ajak dia agar rasa kasi tawa
arisetiyani12,peta tidak bosan cari aman takut tidak untuk eh tahu dalam efi tidak dapat kursi alhasil duduk pakai alas kardus
arisetiyani12,baru normal jawab habis corona selesai tawa
arisetiyani12,kasi bisa efi yogyakarta baru untuk semarang seperti sama pernah gin
arisetiyani12,besok kalau ngumpul ajak diskusi rectjeh ya seperti wkawk
arisetiyani12,tidak tahu hasrat hibah tahun merosot drastis alias baik gosip yang buat cerdas pintar kritis asupan otak ribut gosip hidup yang tidak tahu benar seperti
arisetiyani12,ilmu agama ilmu parenting semua memang tidak anda ikut akun tawa besok tambahin ilmu lagi tad
arisetiyani12,anda penyet jeruk garis keras tidak cemil ketemu sana wakwk
arisetiyani12,sih pikir gin takut plin rencana alias tidak konsisten ya tetap balesnya pakai kromo
arisetiyani12,syukur tidak tawa
arisetiyani12,jenis buah buah hai ngejudge tad
arisetiyani12,ngechatnya pakai bahasa indonesia eh dibalesnya pakai boso kromo turun sekali nama hai alias jadi tidak dan tidak sopan
arisetiyani12,ampun dulu ajak anda cemil dosono asli taruh
arisetiyani12,lee minho saya tim tunggu akhir tawa
arisetiyani12,drama hai sudah tidak tonton drama
arisetiyani12,kali atas kompor kedap api hai
arisetiyani12,omong omong buat tweet stories whatsapp menit kuping belah kiri tiba jadi panas
arisetiyani12,pala ikan ini pengal
arisetiyani12,bisa orang macam ini sudah minta bantu dibantuin humoris malah ghibahin memang ada tingkah manusia jaman
arisetiyani12,omong omong masih hapal lirik
arisetiyani12,nyimpen lagu di telepon
arisetiyani12,alula bangga ini
arisetiyani12,kesal lagi ejek sih pakai hadap cuci produk doang tidak pakai lagi anda pakai produk biasa tapi muka tetap hai nama muka tetap sama ada hidung mulut alis dahi dagu pipi bulu hasmboh
arisetiyani12,untuk saya etik amin
arisetiyani12,yang nama setal uang jual dapat uang cemil ngirit tawa
arisetiyani12,memang cerdik peluang anda tapi asli milik juga doyan jajan tawa
arisetiyani12,kalau beli rawat kulit mikirnya puluh eh yakin beli kalau jajan cemil tidak pikir alias lihat saja langsung beli
arisetiyani12,salah target kemarin biasa minum liter mulai kemarin minimal liter hari
arisetiyani12,kita biggest fans ini minggu mlndmnsr terimakasih anda via
arisetiyani12,mungkin semoga tidak
arisetiyani12,lebaran akhir masih hari esok
arisetiyani12,teman nge pesan langsung instagram saking saya tidak buka instagram sudah pindah planet dia kayak instagram jadi salah tolak ukur kita eks masih hidup pikir
arisetiyani12,matur nuwun saudara laki
arisetiyani12,marketing ini saudara laki agung
arisetiyani12,syukur mei dua kali lipat berkah senang eid mubarak senang milad semoga berkah tambah terus amin
arisetiyani12,yah dicheck var mati sisi tidak pinalti tawa
arisetiyani12,mal aidzin wal faidzin ya saudara wanita
arisetiyani12,tahun ngucapinya pakai sama matematika habis pikir mikirnya seperti kalau biasa seperti
arisetiyani12,nama manusia kadang mbatin mohon maaf lahir batin sobat
arisetiyani12,kenapa puasa ramadan cepat sekali tiba sudah lebaran
arisetiyani12,benar sih lebaran pada sibuk sekali sibuk pikir cari gr ditanyain itu orang
arisetiyani12,tidak sangka tahun tambah umur tidak raya idul fitri semoga awal lebih dari lebih depa untuk segala untuk amin
arisetiyani12,yah tahu kalau ganti
arisetiyani12,yakin hasil sidang isbat bahwa lebaran tahun celaka tanggal syawal hijriah
arisetiyani12,rumah lari tawa
arisetiyani12,sehat dek dan ayah surga pasti bangga anda
arisetiyani12,coba kalau yang nyanyi dapat rasa rasa ken naboknya tawa
arisetiyani12,kayak memang serentak pusat perbelanjan saat mulai ramai orang yang beli pakai lebaran kayak pada pengaruh konspirasi soal orang yang masang stories konspirasi corona eh pagi pergi beli baju lebaran
arisetiyani12,benar mvnya usung kampanye antikekerasan begitu tapi tetap kalau mendengarkan lagu sedih dapat
arisetiyani12,tolong kalau mendengarkan lagu tidak pakai peras sekali saudara wanita
arisetiyani12,tonton awal tidak paham akhir tonton kali mayan paham tawa
arisetiyani12,syukur tuhan
arisetiyani12,unes hari masuk tren kali baik nes
arisetiyani12,anda lari satu pilih hidup terima nasib tidak
arisetiyani12,kawan imunity
arisetiyani12,balas pakai gambar tapi tidak soal usaha edukasi agar tidak cemil judul doang orang dapat ss an grup whatsapp sebar baca isi selurah
arisetiyani12,ada yang whatsapp dengan ss an dan tanya saudara wanita ari bagaimana
arisetiyani12,yiseo
arisetiyani12,harus damai virus
arisetiyani12,sudah buat dari ini untuk ini tinggal aman
arisetiyani12,tad tidur bentar agar begadang sampai sahur
arisetiyani12,tidak buat lihat anda sudah orang kenapa
arisetiyani12,nambahin tetap sangat untuk panutan
arisetiyani12,benar apa saya rupa dari pernyatan halus pria specialkan bahwa diri lebih ketimbang lain
arisetiyani12,sudah ke tidak kurang jam lebaran
arisetiyani12,huruf dulu kalau ily tidak apa apa tapi sama sapa
arisetiyani12,balas obrol sampai paragraf eh cuma balas doang harap dapat feedback alias diskusi
arisetiyani12,lihat realitas yang nyata hidup tidak adil saudara laki orang yang tidak milik jabat dengan pihak yang jabat suatu kuas lampau adil saudara laki yang jabat dar milik dekat dengan yang milik kuas
arisetiyani12,ibadah bisa salah mohon ampun
arisetiyani12,dari kaji guru adi hidayat
arisetiyani12,misi buru lailatulqadr malam rabu mei malam jumat mei malam ahad mei malam selasa mei malam khamis mei cari malam lailatulqadr malam ganjil hari bulan ramadhan hari bukhari muslim
arisetiyani12,terlalu kagum untuku tidak aman ran
arisetiyani12,ampun lupa mau cemil teh nok yah ibu tidak tawa
arisetiyani12,alasan ke daerah gerbang utama ke kalimasada
arisetiyani12,apa tinggal jalan jari kaki dekat warung cemil dulu sayang tetap anda pergi bolak ke banar wkawk
arisetiyani12,paman aup kila ada saja ide kreatif konten halusinasi tawa hormat pis
arisetiyani12,kenapa jadi anda lebih hayati sekali tidak utama malah axl
arisetiyani12,sekarang tahu itu hidup isn sebuah ras dengan semua orang else
arisetiyani12,tidak dilist sudah lupa saja eh tawa kawasan gang strategis memang apa juga
arisetiyani12,bentar ngelist pokok mantap tidak palang pintu tetap aman
arisetiyani12,tumpah tidak ini tawa tidak ding memang tidak jaga kosnya ada jaga aman gang lebih sangar
arisetiyani12,tidak begadang tidak sabar tunggu malam tawa saudara wanita sekali begadang karena tunggu balas obrol perlu sekali baca
arisetiyani12,ninu ninu ninu
arisetiyani12,saking orang tidak kalian balas obrol singkat yang intropeksi
arisetiyani12,semangat saudara laki hansol bisa tunggu
arisetiyani12,sutradara putra mahkota lee chang benar nang kejer ibu cosplay jadi itu selamat zombie
arisetiyani12,satu buat epron dong tawa
arisetiyani12,edisi jarak tulis ikut
arisetiyani12,ketangkep roy kiyoshi diplesetin saudara laki saeroyi tidak kasi dia sudah mati mati bam dan ic sampai kalah janga loh sudah acak sekali
arisetiyani12,ini tadi sore pada heboh cerita kalau ada tetangga sengaja beli bahan cemil agar besok tidak rumah saya usaha apa saya paham
arisetiyani12,ini paman aup versi muda tawa
arisetiyani12,stiker laptop ada stiker himpun ukm peristiwa peristiwa itu tawa
arisetiyani12,tidak utama itu runding ini tawa
arisetiyani12,saya minggu nyala twitter mentions suka retweet retweet capai balasan lihat milik anda dengan
arisetiyani12,para abk kerja indonesia telah gugur kapal semoga amal ibadah terima saudara wanita amin
arisetiyani12,benar sekali
arisetiyani12,habis tonton video saudara laki hansol ini syok masih ada orang bentukanya manusia kelakuanya seperti
arisetiyani12,cireng koh
arisetiyani12,bilang begitu fakta yang atas benar cuma kalau marah balesnya doang tidak saya itu alias baik tidak balas chatnya tawa
arisetiyani12,gemini saya tidak seperti gin tawa
arisetiyani12,semoga abah sehat limpah rizki lancar dan berkah amin lagi sangat gagal syukur
arisetiyani12,beranda isi tebar keuwuwuan sudah nyimak
arisetiyani12,saya minggu nyala twitter mentions suka retweets retweet capai baru total ikut lihat milik anda dengan
arisetiyani12,kita biggest fans ini minggu sikecilmarmut novitahaida terimakasih anda via
arisetiyani12,raya patah hati banyak tembang tembang karya selamat jalan raja didi
arisetiyani12,untung belum pasang buat akun tawa
arisetiyani12,ekspresi ditingalkan alas tsana alias tiba tiba tinggal tidak langsung tawa
