username,tweet
ociirosiana,siapa ini foto walpapernya
ociirosiana,rindu
ociirosiana,kira otak sudah batu
ociirosiana,dokter januari cuci ac bulan kemarin yang netes oke bochor debu sudah nyumbat padahal sudah coba semprot tidak mempan mangil saudara laki ac akhir
ociirosiana,cuy
ociirosiana,keren
ociirosiana,memang cantiq saya suka
ociirosiana,yang dingin sikap ke ac yang servis saudara laki tidak gr
ociirosiana,klairs myluv
ociirosiana,teh tahun persis januari rantau
ociirosiana,semangka jelas rasa tekstur
ociirosiana,rumah hobi cocok tanam sekarang aktivitas jenguk anak di teras nyiremin awas in ulet pindahin pot suasana hati sudah tidak bagus langsung lihat geng hijau langsung sejuk lagi kelihatanya rawat tanam tapi ini diri carenya harap saya untung
ociirosiana,coba
ociirosiana,roti jala donat roti goreng pau tongkat royco kripik malaysia kue bawang bakwan risol martabak dadar gulung mie pastel engah banyak saudara wanita
ociirosiana,badan mobil tolak koh suami bilang alarm sudah heboh sampai bolong meja yang telepon tidak sadar
ociirosiana,vi saya juga maaf lahir batin
ociirosiana,peluk
ociirosiana,sudah nyapu ngepel rumah wangi yang datang tidak
ociirosiana,syukur tahun pakai baju tahun saudara wanita itu sesak longar masya
ociirosiana,tidak itu keras jika anda lihat nyala milik anda weigher saya tahun lalu
ociirosiana,hanya henti
ociirosiana,tongseng sapi dokter
ociirosiana,siyap
ociirosiana,gin bang
ociirosiana,iyeh sudah lihat cuma saya belum paham beli taneman dari kota tawa
ociirosiana,bunga yang mati serang ulet hih itu ulet kali mbuh kenapa cuma pot saja karena bunga wangi ya hf saya bunga canciku tidak foto adan miris
ociirosiana,sangking tidak tahu ngapainya psb ya sudah nyemai cabai rawit buah matoa nangka pokat mentega matoa cakep kali batanga sudah cuma rawit sudah telunjuk tinggi nangka sudah pecah biji pokat belum tanda
ociirosiana,servis ac tapi parno
ociirosiana,yang bohong h
ociirosiana,tidak daya kesal
ociirosiana,itu sesuatu yang tapi eksekusi buah bohong ya tidak ngenakin kepercayan barang utama
ociirosiana,saudara kakau kenan kesini
ociirosiana,teh ini lagi nyemai buah matoa nangka pokat mentega rawit setan
ociirosiana,humoris hari ini
ociirosiana,kambing coba sate gin coba sate kambing yang tidak cemil beda huks kapan tahu coba nasigoreng kambing enak iya
ociirosiana,sekian hanya pantau beranda paru balado
ociirosiana,titip jual ibu saudara ayo yang batam siap kue untuk buka puasa roti kirai kuah kari risol bakwan lup putu mayang epok epok donat soya rumah made icip baru langanan ayo
ociirosiana,jadi tidak aman begitu yak jadi sedih
ociirosiana,sumprit bawa rasa bagaimana tawa
ociirosiana,jual ibu titip saudara laki daerah batam
ociirosiana,misoa balik krispi pempek kakdel
ociirosiana,batam daerah jual ibu mamay kue takjil buka puasa spesial roti kirai alias roti jala kuah kari ayam
ociirosiana,waktu isya yah rakat tawa isya tarawih witir bang tidak lelah saudara laki tidak sanggup mundur tidak apa apa elah bapak cepat
ociirosiana,hari kena teror acin kenapa tidak puasa acin kenapa tidak solat anak laki pinggang cenut cenut tolong
ociirosiana,desember di bukitingi jam hari mungkin damin balap liar tambah keber an knalpot yang buat kuping pakak yang begini didiemin ya heran subuh bubar
ociirosiana,jual ibu kirai jagat raya batam daerah teman teman bakwan sambal merah rona nagih jamin kabar ini siap kirai bakwan risol epok moci nona manis lapis soya kue ganti hari ibu memang suka jail buat tahu saja gitcu
ociirosiana,pee waktu agak tengah jam lagi baru selesai bisa tidor begini
ociirosiana,sepakat
ociirosiana,martabak sayur sama tempe grg dokter tapi sudah sekali tidak beli goreng
ociirosiana,jado saudara laki cukur tan
ociirosiana,bubur bayi kaldu soto semur sop tongseng doc
ociirosiana,saya iya
ociirosiana,hidup ketrampilan istri
ociirosiana,iyha kepala kalau copot juga sudah cecer mana kakyas
ociirosiana,suami tidak ini tapi yang kesal kunci taroknya suka serampang sudah ain gantung kotak untuk kunci kakyas sebentar ujung tanya ya meneketehek
ociirosiana,akhir negara yang suara isi hati dokter awal bahas sama suami gila ini rugi dunia
ociirosiana,naik punc hilang sinyal
ociirosiana,malam coba ngupi kembung kakyas
ociirosiana,sambal terasi ayam bakar lalap
ociirosiana,utama buku anak
ociirosiana,admin kenal oci admin puan resmi lembaga yang ibu susu riau sekira kenan meretwet tweet saya terima kasih
ociirosiana,kunjung di fanpage inisiatif zakat instagram sampai tweet whatsapp mutia fanpage puan resmi instagram
ociirosiana,mari gotong royong zakat corona bantu tahan pangan keluarga dhuafa corona zakat sampai infaq rekening bank mandiri syariah dan inisiatif zakat indonesia kode unik belakang nominal infaq contoh rp
ociirosiana,puan izi wakil riau galang donasi nanti guna bantu keluarga dampak corona dian apd rekan tenaga medis lawan gelombang wabah sakit
ociirosiana,sahabat terfikirkah saudara dengan ekonomi rendah andal hasil mereka pilih untuk penuh butuh ekonomi turun banyak pelang kerja di rumah sosial jarak
ociirosiana,situasi wabah corona kini landa seluruh negara dunia indonesia dengan diberlakukanya sosial jarak wilayah mungkin sadar ini timbul dampak ekonomi keluarga rekan tetangga kerabat kita
ociirosiana,inisiatif zakat indonesia izi wakil riau sampai puan gotong royong zakat corona
ociirosiana,kenal tanya jawab terima kasih
ociirosiana,cyin
ociirosiana,sumpah tawa hai
ociirosiana,jadi rebu saudara tapi tetap beli
ociirosiana,dapat teh
ociirosiana,semangat dokter
ociirosiana,anak jadi susah tidur siang ada ayah utama dan rules geser ayah longar
ociirosiana,saat ngoplos cc teh
ociirosiana,sampai dengan hari gofod kaefsi habis cemil gegoleran kejut mantap
ociirosiana,sampai dengan hari anak luk sore olahraga cemil minum biasa tidak lupa buah keluarga cemil salak jeruk
ociirosiana,yang habis restok belanjan tidak lupa belum mobil cuci tangan pakai sabun mobil bawa sabun suami wajib cuci tangan nanti garase wajib cuci jari kaki tamgan masuk rumah sudah siap sabun keran garase ikhtiar ikhtiar ikhtiar bahaya sudah dekat
ociirosiana,sekarang suami lagi beli sayur wangi duren sudah mobil enak
ociirosiana,mobil parkir tahu maju nubruk pot taneman drum besi gigi ibu duduk bangku tumpang panik langsung narik henti telepon suami yang lagi mampir di saudara laki duren suami lupa mindahin gigi misi lalu tendang anak
ociirosiana,sampai dengan hari restok buah sayur anak bujang durian beli biji rebu jeruk juga saudara laki kilogram salak pondoh kilogram yang turun bapak negara tunggu mobil tidak belanja ikan an stok aman untuk seminggu depan
ociirosiana,pelampung bebek flamingo bertenger atas kasur cosplay renang kata orang
ociirosiana,sampai dengan hari anak ayah utama bola dalam rumah pegang bola tiga bola mantul kesana dalam rumah awut awut ti tidak
ociirosiana,suami libur hingga bulan
ociirosiana,ayang acin malu belum ganti jaman baheula
ociirosiana,kalau tahu bucinya bagaimana la
ociirosiana,saya yang syok tidak niat beli
ociirosiana,loh teh saya tadi kepala bayi
ociirosiana,mobil istighfar saudara wanita khilaf ya
ociirosiana,yah
ociirosiana,baca ketika ngambil air minum teguk sadar hamba puasa rab
ociirosiana,saudara laki tadi pagi mencak bungkusin nasi uduk emaknya sudah siap mau masakin nasi goreng sudah kepalang tanggung sudah buatin porsi untuk saudara nasi uduk datang cemil suap minta nasi goreng tukar saudara cemil nasi uduk saudara laki nasi goreng
ociirosiana,semangka
ociirosiana,hidup toddler jilid segala utama ayam naik tidur syok hai tahu metok hidung
ociirosiana,maret memang low musim yah
ociirosiana,iyes coba ceki dek maret oke periksa lagi turun sekali harga seperti jaman
ociirosiana,tawa kalaupun tidak pulang memang tidak dibawain cemil belum cemil saya bicara langsung bojo loh saya tidak tempat sampah cemil sate begitu mobil jadi jalan bedua minimal ibu tidak mendem sedih kelelawar sudah
ociirosiana,pun tidak cuma diam kayak saudara wanita yang curhat panjang urusanya lapar buat kesal saya gas tawa
ociirosiana,coba ubah pribadi baik tidak tunggu salah nikmat anda sekarang cabut baru tobat
ociirosiana,tadi lihat aplikas burung biru bunderan kuning
ociirosiana,harga lagi murah sekali coba periksa coba periksa
ociirosiana,obat alergi tapi buat ngantuk
ociirosiana,minum ctm gih
ociirosiana,kejut citilink kejut
ociirosiana,ini suami heboh benr sikit kasih obat untung bini keren anak anteng tidur cemil seperti syukur tidak salah dokter rana rana tekan memberi obat juga tambah in sakit anak
ociirosiana,yang putus beli sate malam malam nimbag berat badan turun ons kemarin gas beli
ociirosiana,tuhan maha haid harus lagi arti dengan jadwal uji bayang rumit waswas tahu tahu maju minggu arti sudah selesai syukur mudah an uji nyaman dan tenang
ociirosiana,tahan tahanin tidak ngedrakor mau uji ajar sambil gulir gaduh twitter
ociirosiana,mau tolong saya ya ya
ociirosiana,siapa
ociirosiana,toko emas nunjuk cincin berapa itu berlian saudara iya kenapa memang berlian toko benci tidak pulang sadar suami pakai kaos robek yang sudah asing tapi pakai pacar
ociirosiana,suka halusinasi bingung saya itu
ociirosiana,suami cinta ayah anak ibu jadi pasang tumbuh dekade sebab lipur lara dorong semangat topang celaka malu ayah tas risih mengengam tangan teman cerita keluh kesah debat
ociirosiana,sudah bisa kawan bicara
ociirosiana,tidur siapa hai
ociirosiana,apus mekap kapas bolak sudah selesai kapas tetiba yang seru beranda scrol sadar kapas tadi tangan megang telepon clingak clinguk kenapa tidak sayup sayup celaka dahi situ iya
ociirosiana,iya
ociirosiana,semangka
ociirosiana,sekali ilustrasi begini
ociirosiana,congrats nad semoga lancar
ociirosiana,yeay anak yang dokter sombong tidak ini
ociirosiana,kejut sekian tidak cemil micin cemil pedas asam chickenya kfc lidah ada kelu mangstap micinya iya kita sudah tidak cocok
ociirosiana,tus perut untuk bayi imune dorong termometer untuk itu selamat
ociirosiana,langsung saya lapor blok kucing hari saja
ociirosiana,tunggu utas dokter
ociirosiana,bolu meranti capucino sungguh wenak
ociirosiana,semua nasihat sentuh hati tidak tidak sudah coba kita tidak tahu nasihat yang di hati orang tersebut baik pagi darl
ociirosiana,saya sukan tus bau tidak nyiksa
ociirosiana,tus tus untuk itu selamat
ociirosiana,paling tipu tawa
ociirosiana,kemarin namain boneka beruang udin boneka gajah dinamain siti mangstap anak arif lokal
ociirosiana,anak boneka beruang nama udin
ociirosiana,malam susah tidur karena anak gadis ngomel pagi ajak kopi suami mayan benarkan suasana hati bini yang merah flag
ociirosiana,iri hati dengki
ociirosiana,ini daftarin anak bujang sekolah kejut ada siapa yang bilang tidak ada hai tidak istilah anak sudah tapi tidak ada tidak ada ngeliatin doang yang ngomel hari ngerayu tidur siang hari suruh damar utama hati ibu ada
ociirosiana,bagi baik tidak barang barang hits penting jari kaki lebih mai iya
ociirosiana,otak pintar cari alternatif pakai barang yang maksimal fungsi agar manfaat yang si barang hits tetap rasa pikir bagaimana bisa beli
ociirosiana,tinggi cita cita angan angan makin turun ingin ngamburin uang bagaimana memanfatkan ada agar manfaat sama dengan barang hits lagi beken
ociirosiana,ya sekarang cemil nanyain cabai sambal begitu luar memang anak sekarang nyuapin sudah tidak piring saudara laki
ociirosiana,anak gadis bilang sudah jelas begetar pipi nyebut imbas mau selip huruf
ociirosiana,amin
ociirosiana,umroh cita tahun semoga capai kalau tidak ingin bawa anak taman safari malu
ociirosiana,tahu yang buset
ociirosiana,betcul kota saja begini keren saudara
ociirosiana,navigator abadi suami diri gmaps waze suka memberi jalan tikus yang benar tikus tikus doang sudah yang
ociirosiana,nyetir berat badan angsur turun umroh jalan ibu
ociirosiana,masya cincin tunang sudah muat
ociirosiana,tiket pesawat pp tiket atraksi tinggal beberes koper cari hotel malam ngebolang yuhu hawa jemur renang baca berendem sudah ada letsgo
ociirosiana,kos an tempat cemil dokter
ociirosiana,anak laki thn anak perempuan t usia bulan saudara sukses pee burit toilet usia kalau mau baca cerita lihat maci
ociirosiana,buru
ociirosiana,tatih selesai lenong buruk
ociirosiana,tidak kapok iya sudah tahu pait harap juge buah manis tidak apa apa orang tidak jera
ociirosiana,kenapa ambil libur gurl
ociirosiana,mayan anak naik ons mayan
ociirosiana,saat libur istri cemil cemil yang dengan suami boleh bilang less gula dia hianat timbang istri kilogram suami kilogram alias kenapa kejam bahkan hamba nyusuin tidur akhir bangun awal ngegendong juga
ociirosiana,seperti keluh goni beranda
ociirosiana,mengapa pilih gaul cerita diskusi sama yang
ociirosiana,anak duduk aduh pipis pait nganu malam krim
ociirosiana,gila iya pernah keseleo tapi tidak sembuh begitu iya
ociirosiana,seperti tangan dulu cin
ociirosiana,tawa
ociirosiana,naksir sepatu ukur kosong baik tolong
ociirosiana,dong mai ya saya pikir itu tidak ajak diskusi cuma tapi jadi maaf mau minta benar hal yang salah saya baik undur cuma bawa energi negatif saja anda begitu dalam hati
ociirosiana,ingat sim yang belum juge
ociirosiana,rsdc salah iya tidak admin
ociirosiana,loh panam sejuk benar hujan tengah admin sejuk
ociirosiana,ay sudah deh tidak dipijetin badan acin gel oya sebentar cin tidurin anak tidak kemudian saya dengar sayup suara dengkur bojo jadi duluan pacar tidur anak
ociirosiana,kejut banyak yang jual akika tidur nanti haih
ociirosiana,agak jengah banyak ngilmu parenting kayak mesti positif tidak marah dan jadi jadi lah tidak tidak salah ya saja yang perlu ajar tolong kadang tidak realistis dengan hidup asli itu seperti nan racun tidak
ociirosiana,stok sabar saya tuhan gin ngadepin anak
ociirosiana,motor aki scopy kata orang salah ibu
ociirosiana,suami pulang cerita binar binar tadi dari toko utama dia napsir scooter yep yang napsir sudah ingin angkut tidak jadi tadi belum selesai ajar ngoperasinya jalan ke toko utama kesengsem dengan utama anak
ociirosiana,mana tahu
ociirosiana,kalau dapat yang cocok mursida info saudara
ociirosiana,insyirah gih pisang grg tahu grgnya juga
ociirosiana,pulang tidak tahu
ociirosiana,hitung yak
ociirosiana,ibu syok tatap nanar moisturizer tbs yang hemat saja yang syok ibu rembes
ociirosiana,anak gadis gendong ayah terus nunjuk tumpu rawat kulit ibu ngambil botol yang ibu tidak sadar untung ayah inisiatif tanya cin lihat anak mainin mahal tidak tidak ibu lirik tidak ambil pi cepat anak ngebuka jarnya
ociirosiana,coban ya tuhan anak gadis bebal gin
ociirosiana,apa jawab pantas saja pertama grabfod tidak nongol bagi untuk kaih tip jadi salah
ociirosiana,rambut rontok gin
ociirosiana,benar anda
ociirosiana,tidak apa apa lemari sudah ain
ociirosiana,sejati anak takut diam emaknya ketimbang emaknya ngomel kali lebar tahu begitu baik diam mode kapan tahu
ociirosiana,saudara laki sate ditunguin tidak datang datang koh
ociirosiana,coba
ociirosiana,aok malam pula itu
ociirosiana,cegat sate jam rikues kopi monmap budi ada hajat sebentar malam
ociirosiana,leyeh tetiba dengar suara oek oek oek suami tetiba lari gradak gruduk te sate bang sate tekejot hai
ociirosiana,tolong henti anda racun orang
ociirosiana,sayang apa pe ngali empat semangat shay
