username,tweet
athayaanabila,cerita tidak henti malemnya datang ke rumah sama ibu bawa sekali cemil sembako terus ujung minta dikenalin minta nomor terus syukur malam tidak rumah kalau saya di rumah bingung jadi takut
athayaanabila,jadi nemuin telepon yang dilock seperti gin terus bingung bagaimana balesnya sistem kunci tidak memberi nomor yang dihubungin saya ngembalin langsung nelfon hpnya sendiri saya tinggal angkat besok dia ambil itu telepon rumah
athayaanabila,tuhan kalau syafiq dimana
athayaanabila,anda pindah kmn lagi hai tidak bilang ke gulon ujung
athayaanabila,nang rindu ceker
athayaanabila,giat teman kemarin hari
athayaanabila,nang sekali
athayaanabila,rindu jerapah di kos wendie tinggal
athayaanabila,tidak telepon anda kn
athayaanabila,tawa
athayaanabila,apa budak cinta nespes raung
athayaanabila,sumpah syok sekali hai dulu memang baru rajin baca berita tonton televisi ini karena bosan tawa rem fal
athayaanabila,memang mana pancasila yang kacau nang
athayaanabila,maksud yang sudah prinsipil sudah bangun jaman kala bisa tiba tiba ubah yang isi sgt relevan harus laksana malah hapus yang kacau
athayaanabila,wacana ngubah pancasila trisila dulu dulu
athayaanabila,tidak aman sekali gas
athayaanabila,rek takut sekali sekarang wni sumpah
athayaanabila,wid tolong ini benar mahkota saya pakai mur bagaimana
athayaanabila,cara mai gmnsi
athayaanabila,twetku jelas tapi tanya bias literasi anda
athayaanabila,begini tapi sudah tidak karena takut jadi ganggu malu maaf teman saya yang sempat isi kalau saya nanyain hanya
athayaanabila,ken saya itu saat buka lapang pekerjan mentemen disabilitas seperti gin alias keren sekali hai logo pakai bisindo bk pikir saja ini burgerking keren
athayaanabila,sial
athayaanabila,tawa
athayaanabila,jinjit mangkanya rem
athayaanabila,hade belum sempat anda benar ini tugas akhir
athayaanabila,berisik sekali manusia
athayaanabila,sih harus baca di tengah malam jadi tawa
athayaanabila,ken kebab sama staykult surya tuhan tiba tiba jam gin
athayaanabila,begitu kalau sebuah suka sama sebentar bisa suka an aneh sekali dunia
athayaanabila,syafiq kalau nmax kuketawain seperti kebo takut syafiq gakuat bawa takut tangis tidak suka digonceng syafiq nmax
athayaanabila,mixer joys
athayaanabila,tim pakai jepit bulmat maskara susah sekali cuy pakai maskara terus lihat jadi pikir baik maskaran
athayaanabila,bintang sampai ngeprotect twiternya sial
athayaanabila,smala isine tidak jerome tok rek
athayaanabila,sial anda tidak tahu
athayaanabila,biadab begitu
athayaanabila,sama saya masih cantik kece biasa
athayaanabila,naya itu urusin
athayaanabila,tawa
athayaanabila,hari saya edit brosur corelku macet selamat athaya silah rebah
athayaanabila,benar tidak bicara anda tapi syukur kalau rasa tidak apa apa temuin pacar semoga sehat ya semoga rindu nila itu nyawa pacar malu
athayaanabila,anda surabaya ya iku poine kon gelem tugas akhir kota dadi koyok surabaya apa janck isuk ngarai emosi saja aduh
athayaanabila,kenapa sensi sekali kalau orang di tengah situasi seperti gin parno sekali saya baik parno daripada bodoh bodoh kalau sudah tular sebar gaisok dicancel soale dan transaksi corona jalan isok kembali dana
athayaanabila,anak djeqi mana ini atas kota funk anda
athayaanabila,yang tidak mau memberi
athayaanabila,belum momen sih jadi memang tidak pernah memberi tawa
athayaanabila,bicara coba lagi seperti begitu terus waktu anda nge proker sosio itu apa kotak momogi itu apa
athayaanabila,untung paham hal tanpa saya jadi sudah habis situ saudara laki ifan bau rokok sekali tentu tapi saudara wanita tetap harga yang tidak bisa dekat rokok yaitu dengan ngerokok arah angin
athayaanabila,benar atur tulis kalau lagi sama tidak mau ngerokok pasti saya ngomel ganggu saya tahu malam seperti smsm pusing saya tidak mau antem kubiarin dia ngerokok tidak sampai saya asap tawa
athayaanabila,ingat saudara laki ifan rumit sekali pindah duduk sesuai arah angin agar asap rokok tidak kali bolak kanan kiri serong agar saya tetap cemil dengan tenang dia bisa pikir dengan tenang
athayaanabila,mungkin akan buat itu sama alias sial jiwa surat surat camil saya menang ingin sekali buat begini
athayaanabila,ken sandwich pakai ayam lembut
athayaanabila,hari saya cetak stiker agar tidak tangan sanitizernya sampai itu langsung dipack saya mager sekali
athayaanabila,sebut kali gausa gimmick henti ikuti ikut leng siapa saja iya twitter ini sgt lihat able kalau orang yang interaksi sama harus ngecek saja
athayaanabila,apa tawa langsung skakmat saya tidak lihat difolow janc kapan ini mangkas oke folbek sekarang
athayaanabila,rindu pacar tapi tidak chatku balas kan yang mangil
athayaanabila,astaghfirulahaladzim irfansyah putra saya difolbek berapa gemar
athayaanabila,ndang kon lak biasane mahir lettering nang cerita
athayaanabila,purane
athayaanabila,anda tidak pertalite bola
athayaanabila,saat lain perhati kasus novel air keras dan teman saya ngeributin spotify bagaimana gambar
athayaanabila,ayo mbaten ini
athayaanabila,akh
athayaanabila,cia
athayaanabila,persudzonan tidak ada habis
athayaanabila,misi
athayaanabila,lucu anda lek onok sebentar ket hijrah moro ngaku lulus agama nang vatikan terus dakwah banyak yang percaya huahaha nang
athayaanabila,semangat ndo jok ubah tawa
athayaanabila,yang gin ini yang buat runyam dunia silat kadang tidak bisa nyalahin kalau islam hilang umat ubah memang tidak jarang muka agama ngejudge bagus in agama dan parah yang diomongin tidak dasar tawa menang
athayaanabila,juga humoris ken
athayaanabila,humoris
athayaanabila,manusia yang cemil pisang tidak kupas
athayaanabila,seperti kn uns gelombang malu
athayaanabila,mangkanya ayo jadi orang
athayaanabila,sakit
athayaanabila,sakit anda
athayaanabila,merah beludru sekali sekali sekali sekali sekali rindu jajan solo
athayaanabila,sinom sari dele sudah benar rek
athayaanabila,malah ada normal tidak suka taro semua yang kenal suka taro
athayaanabila,pernah sok edgy tidak suka buah cenderung hal matcha memang dulu waktu nama standar hijau teh saya sudah tidak suka aduh
athayaanabila,nang begitu itu kalau yang tawa
athayaanabila,tuhan ujan tinggal ini tapi malas sekali
athayaanabila,ampun athaya pikir sekali apa
athayaanabila,tidak usah mancing emosi
athayaanabila,sial tolong kemarin sedih sekali ngmgin sama saudara laki sakip sama saudara wanita taruh juga tebang saudara wanita shab belum peluk anda
athayaanabila,oke mau buat mie
athayaanabila,biarpun dikit kata orang
athayaanabila,buat look seperti peduli kinda suasana hati
athayaanabila,janc nanges
athayaanabila,rek icad
athayaanabila,bohong
athayaanabila,ajar ya
athayaanabila,hancur mudah tahan ajar dar
athayaanabila,kalau nadin ibu mati enggan hidup susah
athayaanabila,obrol yang terus an relevan kita ambil kiblat nia ramadhani tawa
athayaanabila,mau mie setan benar sekarang begitu
athayaanabila,amel udu saudara
athayaanabila,cerita rumah beda jarak hanya sentuh jarak doa
athayaanabila,anda alas saya ken orang seperti yang didik
athayaanabila,saudara wanita opi doang yang omong kosong ini ibu
athayaanabila,senin ujan kenapa
athayaanabila,maaf saya ketriger rasa less hak istimewa benar tawa karena manusia banyak syukur saya tetap rasa oke kati semua
athayaanabila,tanjung euy di twitter isi bahas hak istimewa hanya nang bangga kalau baca in itu tawa inti kalau orang sukses itu faktor nya tidak disamaratain tolong dari segi mulai proses finishnya oke
athayaanabila,juga nikmat ajak belanja
athayaanabila,saudara wanita putri belanja luwes
athayaanabila,oke
athayaanabila,iya benar memang buat tidak aktif cuma an doang tawa
athayaanabila,ngucapinya besok pagi ya sekarang tidur
athayaanabila,tyas saudara wanita puput hari dan besok jam
athayaanabila,sudah daftar tonton tapi belum sempat kn biadab
athayaanabila,tuhan ken kebab
athayaanabila,kasihan sekali sudah jujur tawa kn corona apa sial ksl
athayaanabila,simpan lain saudara wanita shb
athayaanabila,oke
athayaanabila,oke dplku tonton itu dunia dari itu meni
athayaanabila,akh kenapa ini
athayaanabila,saya
athayaanabila,guduk tawa
athayaanabila,dapat nomor yang benar cari tanya anak psiko belum sudah penuh juang kn saya dih kara nomor dpl doang
athayaanabila,lpm salah kasih nomor tentu tidak balas bapak dpl
athayaanabila,tawa
athayaanabila,saran teman yang sedia contek usul knya pukul saya atas yah
athayaanabila,bagaimana peras waktu sudah ngechat dpl kemarin siang tetap daftar periksa sampai gataunya nomernya memang tidak aktif saya kelompok kn sampai sekarang tidak dapat instruksi padahal harus cepat buat usul
athayaanabila,alas kadang pikir ken tutup spidol pingiran kursi
athayaanabila,sengol bey butuh ini jenis dari gercep
athayaanabila,oke jadi ini ujan neuro saya saking tidak tenang sudah bangun tengah tawa
athayaanabila,anda nyaman saya dia waktu tidak sengaja ceplos anda diam besok potong sudah daripada tawa mangkanya kalau bicara sama yang jabodetabek saya benar pakai anda saya medok biarin pokok tidak diangep bawa rasa
athayaanabila,ayo nangisin tugas akhir bareng
athayaanabila,perhati kalau saja tonton mv twice yang judul lagi sampai lagi baik gausa karena kali tempat jadi ular trims
athayaanabila,saya juga ajar neuro
athayaanabila,h bom mendengarkan
athayaanabila,sudah gasa mau anda
athayaanabila,tidak rekues bisa dan adalah sejak
athayaanabila,simpul malam
athayaanabila,kalau mraktekin ibu saya suruh nguntal sandal posyandu
athayaanabila,tidak ngeblak tugas akhir ini nyanyi ngombe lek legine koyok ngono
athayaanabila,sudah maksud salah fokus sama deutsch jermanya
athayaanabila,apa lha pakai atur jerman benar kan
athayaanabila,omong omong buagus tangis
athayaanabila,salah fokus sekali sama deutsch saudara laki
athayaanabila,tawa saudara wanita dit
athayaanabila,tolak yach rantau akhir sudah tidak pernah kebun itu yang foto taneman rumah yang rekues ayah dirawatin sama ayah jadi baru ini saya pegang sendiri tung januari
athayaanabila,pesan langsung cok mbiyen tawa tidak saudara ngefolback dengan cepat
athayaanabila,nyanyi sampai saiki jek tidak percoyo rek lek jerome eroh saudara sampai nakok nang saudara tawa saudara laki jerome tahu tugas akhir jawab tahu orang papas kita
athayaanabila,wid saya gin lagu kunto aji terus ujung sudah dengar in lama kena tawa memang belum waktu tidak kesengol seperti ibu
athayaanabila,lombok beberapa krucil saya yang lain peta cocor bebek rontok saya ceroboh
athayaanabila,suka sekali taruh cermin
athayaanabila,saya sedih turns pada jijik dan itu saya buruk racun traits
athayaanabila,syukur tonton chandraliow sore hingga bisa temu cakap selip
athayaanabila,iya baru saja saya beli elpigi karena masak ya henyak pandang pandugo sekitar
athayaanabila,peta ahli kubur ini virus konsep macam fitnah nyebarnya mulut mulut elah
athayaanabila,gimane tidak wuhan segera untuk jadi setan orang nyaman benar sudah nongki kopi andok sego goreng tidak ngawe masker anak juga dengan riang utama teman mereka peluk an
athayaanabila,selamat saudara laki saja sekarang
athayaanabila,ngegas
athayaanabila,mahir sepik anda
athayaanabila,rindu barracuda
athayaanabila,ini tidak gendut tidak sekali da saya minum susu hangat memang muntah
athayaanabila,oke lebaran selesai waktu ke realita ujan
athayaanabila,apa ini apa indomaret
athayaanabila,kalau hujan marah sore saya saudara wanita ken hujan
athayaanabila,ter akurat
athayaanabila,tuti suroya indah alvin puput
athayaanabila,wifi knpsi malam lelah
athayaanabila,lagi lebaran sampai jam gin rebah kasur tonton drama korea
athayaanabila,rumah sial
athayaanabila,tong kosong nyaring bunyi ini benar ya tawa
athayaanabila,saudara wanita dari kemarin kemarin bercengkrama dengan teman ini banyak vidcal malu terima kasih sudah warna ramadhan hingga syawal tsah
athayaanabila,tetap tidak anda masih kalah sama sibuk tugas ujan gila kn sedih tapi tidak apa apa di least niat coba
athayaanabila,oya tidak ramadhan kemarin tepat sekali memang baru saja khatam ken khatamin tapi dengan target tiap saya baca juz antisipasi kalau haid jadi tidak bisa baca agar tetap khatam bulan ramadhan
athayaanabila,tipis ya macam saudara wanita dian sastro ojok diarani sombong rek ini cuil kisah juang paham agama baik soale
athayaanabila,tawa tolong tidak telepon saya hari tolong saya lelah
athayaanabila,kalau saya ke takut buat lain mati tangis
athayaanabila,buset
athayaanabila,mauk ada taro yupinya
athayaanabila,kilas kira saudara laki rahmad tidak vidcal pacar sudah jadi
athayaanabila,omong omong onok nyanyi lapor temu kon nang tinder lengkap dengan ngecapture profilemu tawa
athayaanabila,ken kayak gin tapi boro tawa uns gtl
athayaanabila,kena buat balas dendam tolong mereka keluar untuk hapus semua mereka shits
athayaanabila,tidak butuh
athayaanabila,wqwqwqwqwq tidak komentar
athayaanabila,tidak mz anasta tidak
athayaanabila,pa memed saja
athayaanabila,es teh versi adalah warung yang di tembus kabut surya
athayaanabila,tidak kalau pria yang rada korslet gin agar hidup saya tidak penuh drama
athayaanabila,saya pikir begitu tawa tapi yaudalah toh amelnya juga
athayaanabila,heboh
athayaanabila,oke jadi teman lagi heboh mari sebut haha habis yang saya jadi bingung responsif heboh seperti bagaimana sudah agar mereka nikmat mereka benda ngagetin sudah bagaimana selamat ya cc
athayaanabila,andarini tuhan sampai tutuk kene
athayaanabila,se setan nyemangatin icad skripsi duyung
athayaanabila,gemas ah anda ibu
