username,tweet
baksopangsitnya,sudah nyala saudara
baksopangsitnya,sore saudara listrik daerah poncowolo barat pindrikan lor padam saudara sedang pemeliharan baik
baksopangsitnya,pikir wakakaka
baksopangsitnya,tahu beda
baksopangsitnya,bang antar pindah domisili
baksopangsitnya,mari gas wakakakaka
baksopangsitnya,nyata hidup
baksopangsitnya,saya suka versi
baksopangsitnya,kayak kalau parsel tidak sampai sampai
baksopangsitnya,seperti begitu terus sampai lebaran tahun
baksopangsitnya,peras tidak banjir
baksopangsitnya,lelah lelah buat kastengel nastar eh saudara saya buat insta cerita buat iyak dia kocok telur parut keju doang tidak mangang dia tidur
baksopangsitnya,kaliwungu gelap admin sampai
baksopangsitnya,semangat semoga listrik atas
baksopangsitnya,kendal mati listrik
baksopangsitnya,ayam geprek mie kuah nasi uduk nasi goreng lontong kari sate ayam
baksopangsitnya,tonton
baksopangsitnya,rindu nasi krempyeng unes
baksopangsitnya,mbah
baksopangsitnya,hati hati dek kalau pesan langsung paman paman
baksopangsitnya,kayak gin malam kalau dengar duar duar syok sekali
baksopangsitnya,kalau adegan paling pintar buat gugup gugup ser
baksopangsitnya,umur dek
baksopangsitnya,suka cemil seblak tapi jaga omong
baksopangsitnya,kemarin begitu dokter kira corona tahu asam lambung sampai sebentar napas tidak sedih benar
baksopangsitnya,baca buku asma nadia tidak sama itu yang buat mantap pakai kerudung tidak buka tutup buku ilana tan buat ken ajar tulis
baksopangsitnya,apa ini ruang isolasi pasien corona
baksopangsitnya,tunggu stiker whatsapp pril
baksopangsitnya,itu sims
baksopangsitnya,minggu mulai baru normal jadi anak kos bobok sekolah
baksopangsitnya,mantap
baksopangsitnya,lapor konten coba saudara wanita atau
baksopangsitnya,cilok mie ayam bakso enak tidak seblak nastar cemil pedas mcd kebab es teh kering sambal goreng rendang sosis
baksopangsitnya,maaf lahir batin saudara
baksopangsitnya,baik tahu nomernya saya akan blokir daftar waris
baksopangsitnya,maaf lahir batin sayang
baksopangsitnya,apalagi memberi undang nanti kondangan purworejo sayang
baksopangsitnya,momen tepat edukasi anak kalau lebaran bukan baju tapi hati pola hidup baru arah lebih ayo mulai ubah mindset lebaran tidak punya baju baru kenapa
baksopangsitnya,wakakaka kayak kemarin tidak foging kecoanya semua tidak kejar tidak wakakaka
baksopangsitnya,congratulation
baksopangsitnya,agar drama korea unduh kartun saja banyakin
baksopangsitnya,chagiya
baksopangsitnya,iklanya kayak bawang bombaynya
baksopangsitnya,tidak sekali ken tipi
baksopangsitnya,sempurna
baksopangsitnya,tidak mie ayam bakso
baksopangsitnya,coba mie enak
baksopangsitnya,pelosok
baksopangsitnya,pikir
baksopangsitnya,rayu tulis gratis ongkir admin rupiah jadi checkoutnya tidak tangalnya
baksopangsitnya,duet maut bahaya shopee mbanking
baksopangsitnya,ulang rutin sayang nenek sudah keno godan shopee ngembang tok durung tekan tengah sudah ngempes
baksopangsitnya,wakakakaka ono koncone jebul
baksopangsitnya,terimakasih info saudara
baksopangsitnya,semua ngembang kecuali dompet
baksopangsitnya,seperti diam rumah lebih sampai lemak numpuk tapi seperti gin
baksopangsitnya,kaliwungu selatan kendal tadi dzuhur listrik mati ya saudara hari juga listrik mati ganguan nyonya
baksopangsitnya,kalau malah kenya habis akad aji jadi yang resepsi buat beli rumah perlu karena itu awal hidup rumah tangga kalau sih begitu kenya
baksopangsitnya,tambah skrip sinetron
baksopangsitnya,sudah paham pola
baksopangsitnya,dapat
baksopangsitnya,semoga dapat agar checkout yang keranjang
baksopangsitnya,ada yang jual itu sims tahu wakakaka
baksopangsitnya,yang gadis saudara wanita lihat cantik tidak buat alami
baksopangsitnya,game anak laki
baksopangsitnya,mau apa mau nice orang buruk anak laki bisa bagus sekali rani tidak kecewa tonton drama film totalitas akting
baksopangsitnya,keren sekali tidak masak
baksopangsitnya,apalagi tidak akhir episode ada tips masak
baksopangsitnya,saudara laki hancur
baksopangsitnya,cie
baksopangsitnya,sumber kebahagianku saat es teh kayak
baksopangsitnya,e saudara sebuah rendra
baksopangsitnya,baca sudah pagi saudara wanita jadi tidak cemilan mimik
baksopangsitnya,itu sims dong rin
baksopangsitnya,balas admin pesan moral
baksopangsitnya,cie bangunin sahur
baksopangsitnya,cara unduh video bagaimana
baksopangsitnya,yeon seok
baksopangsitnya,saya tidak ningalin mikirnya sampai istikhara itu tidak pasti kasih batas waktu seminggu begitu kasih waktu seminggu akhir tetap luka
baksopangsitnya,lagi hamil minggu dokter
baksopangsitnya,sugeng ndalu saudara laki mboten gung engih sampun les engkang nami kulo takuya
baksopangsitnya,terap tidak punya hubung klien
baksopangsitnya,wakil saudara laki
baksopangsitnya,sugeng siang saudara laki nami kulo anis
baksopangsitnya,ken sen baso aci lagi tunggu gratis ongkir admin rp omong omong baso aci yang tidak coba kirim dari garut homemade begitu bumbu cinta sekali
baksopangsitnya,tampan kece syeft aro kalau masak
baksopangsitnya,tim gadis kalau cari pasang nyaman tanggung dan keras
baksopangsitnya,sahur syeft sudah sahur pakai endog syeft
baksopangsitnya,rekomendasi sekali pokok
baksopangsitnya,maaf salah ketik balas
baksopangsitnya,tipi indonesia tidak yang nayangin replg rsud daftar putar ini rekomendasi sekali lho pesan moral dapat
baksopangsitnya,saudara tips pindah nyala cepat
baksopangsitnya,sugeng enjang
baksopangsitnya,buku wejang syeft
baksopangsitnya,lahir semarang di semarang kaliwungu orang kalong semarang orang semarang anak sampai sekarang sering tanya anak sama jawab sudah tahun tolong badan jadi masih sama
baksopangsitnya,baik drama korea bisa ubah milik anda hidup juga rubah hidup asal buka pikir kalimat sederhana dalam dek bisa ngebuat yang rasa pindah nyala susah jadi mudah balikin telapak tangan
baksopangsitnya,iya ya yang kalimat roy tidak warna hijau
baksopangsitnya,kenapa gagal diet ini
baksopangsitnya,sambal bawang ketemu nasi hangat tahu tempe gereh sempurna sa
baksopangsitnya,saya bilang benar saya tidak ngayap sampai tengah malam untung tipes kena corona
baksopangsitnya,mamas baca tweet syeft yang
baksopangsitnya,malah mikirnya grup obrol isi atau coba perhatin
baksopangsitnya,syeft dekat pria tidak curhat sudah syeft mau whatsapp saja
baksopangsitnya,prioritas
baksopangsitnya,syukur sudah damai mantan
baksopangsitnya,jebul
baksopangsitnya,sudah di situasi saya itu veteran kalau di tinggal tinggal saya tetap ambyar
baksopangsitnya,rsud daftar putar sudah tebar spoilernya
baksopangsitnya,syukur ada
baksopangsitnya,opa keren
baksopangsitnya,baik nyerah
baksopangsitnya,dukung tim
baksopangsitnya,pidionya
baksopangsitnya,tawa takut dosa tapi juga baik tonton drama korea ketimbang video apalagi kalau aktor saudara laki
baksopangsitnya,saudara laki nyimpen gambar saya suka deret jajan bentuk wayang malu
baksopangsitnya,tim rsud daftar putar mis
baksopangsitnya,mana
baksopangsitnya,wakakaka aura tukang rebah bapak dhe
baksopangsitnya,benar
baksopangsitnya,tidak kenapa apa kenapa detak jantung seperti gin
baksopangsitnya,syukur agus
baksopangsitnya,saudara
baksopangsitnya,wakakakaka
baksopangsitnya,bagi
baksopangsitnya,sayang hanya imajinasi
baksopangsitnya,nasi goreng kasih acar itu
baksopangsitnya,begitu aquarius jasa capricorn saja jodoh
baksopangsitnya,ruwet ruwet ruwet
baksopangsitnya,gubernur sudah benar benar rakyat yang kayak gin bagaimana cepat selesai kalau corona kena saja sakit rawat mati kubur sendiri orang karepe dewe rak manut atur perintah
baksopangsitnya,sudah tabok tabo
baksopangsitnya,wakakakakakakak
baksopangsitnya,perang dunia sosial cetak sejarah lihat tipu yang ini tipu kita nyaring kita balas dengan tipu kita saya adalah itu lawan bela ciao bela ciao ciao bela ciao
baksopangsitnya,thp
baksopangsitnya,ngageti sekali untung sudah buko
baksopangsitnya,podo sa
baksopangsitnya,pilih telepon
baksopangsitnya,saudara laki kemarin keren sekali tidak kerja matematika saya tawa lihat masak
baksopangsitnya,kasih napas syukur
baksopangsitnya,pria sakit sekali tahu kayak bagaimana
baksopangsitnya,suka baca malu
baksopangsitnya,tawa tapi juga
baksopangsitnya,setuju menikah resepsi turut biaya resepsi alih perlu lain resepsi hidup menikah mulai akad
baksopangsitnya,jawab kapan bisa menang
baksopangsitnya,itu sims rindu utama itu sims
baksopangsitnya,tuhan tawa
baksopangsitnya,ada tonton cuplik anime tahu iklan sasa
baksopangsitnya,peluk anak ibu kita ajar utama teman teman
baksopangsitnya,syeft muka bruntusan dipakein ya agar hilang bruntusanya
baksopangsitnya,tahan tidak misuh nang kalau bentak kalau aduh mulut sudah kalah duluan
baksopangsitnya,adminya usaha
baksopangsitnya,dong
baksopangsitnya,cuma nyala pergi karena saudara laki yeon seok
baksopangsitnya,jadi pacar buat nopang beli rawat kulit kalau menikah tanggung yang pria kecuali pria yang nawarin memberi
baksopangsitnya,sehat sehat bapak guru terimakasih jasa
baksopangsitnya,samsung s
baksopangsitnya,terbaik kutip dari syeft syukur obrol balas
baksopangsitnya,saudara laki handa calon yang
baksopangsitnya,kalau tetiba yang iya sudah bangun bang terimakasih sudah dibangunin sahur wakakakakak
baksopangsitnya,segitunyakah ikut euforia saya
baksopangsitnya,kan gusti saya lihat jam gin
baksopangsitnya,terimakasih
baksopangsitnya,saudara jam oprasional untuk trans normal ada jeda jam
baksopangsitnya,ganti sistar kalau buat album comeback tidak puasa
baksopangsitnya,mudah lupa urus asmara seperti pindah nyala butuh waktu tahun
baksopangsitnya,lama pasar burung elang kayak sinema indosiar jadi ini
baksopangsitnya,wakakakakakak
baksopangsitnya,memang anda tidak budak cinta zie
baksopangsitnya,harga pilih itu buat nyaman coba
baksopangsitnya,sama
baksopangsitnya,wakakaka anda ake kacamata tidak gabung boyband belah zie
baksopangsitnya,ini daerah semarang
baksopangsitnya,kasi tugas
baksopangsitnya,cardcaptor sakura
baksopangsitnya,dia adalah saya pertama cinta shaoran
baksopangsitnya,orang tua pabrik orang seperti wakakaka kayak memang cari perhati saudara wanita karena rasa berani sangat usia tahun mungkin sudah jarang kalau jaman gadis menikah umur tahun semoga suami bisa menuhi kebutuhanya
baksopangsitnya,saya nangkepnya begitu saya sama
baksopangsitnya,tidur senjata utama redam gila amarah
baksopangsitnya,siapa masih hari terimakasih beri layan untuk masyarakat indonesia angels storynya buat ken peluk mamas
baksopangsitnya,tenang saudara wanita juga
baksopangsitnya,tawa yang ngajakin
baksopangsitnya,baca pagi jadi harap semoga tahun bukber ya itu rumah atau rumah apa rumah kita saja saudara laki
baksopangsitnya,samsung
baksopangsitnya,corona tolong cepat pergi sudah rindu mie ayam mie ayam bakso lontong sate tri supeno ayam geprek ibu risma gimbal ada siliwangi bakso gajah mungkur saya rindu anak anak saya
baksopangsitnya,iya makane kui pril wakakaka
baksopangsitnya,itu tidak habis pikir alas menikah rawat kulit telepon cukup butuh dia bilang lho tahun sudah dewasa mikirnya pilih menikah muda sumpah ken jambak nang kartini lihat wanita seperti gin dia juang
baksopangsitnya,omong omong sih bangga beli rawat kulit tidak sangat antara agar rawat kulit buat dapat telepon cemil jamin terlalu kasi alas sangat muda rawat kulit telepon hidup kasi adil agama
baksopangsitnya,kejut terkejoet wakakakakaka
baksopangsitnya,e saya tidak sebuah
baksopangsitnya,e saya tidak sebuah
baksopangsitnya,sudah tahu zona merah saja ngayap sampai tengah malam kalau kena corona silakan tapi kalau langsung temu tuhan jadi tidak tular yang
baksopangsitnya,ken
