username,tweet
prastikavivi,apa saya peluk
prastikavivi,tawa iya memang tetap sama yang salah
prastikavivi,kasih tahu nan
prastikavivi,tolong marahin iya bandel suntik agar tahu
prastikavivi,kalau sudah gin bilang tidak sengaja
prastikavivi,orang kenapa kenapa neraka sekali
prastikavivi,butuh berapa vitamins tolong
prastikavivi,virus hilang orang sudah saja adan sudah normal saya yang parno tetap bagaimana
prastikavivi,apa tidak sekali
prastikavivi,coba siku papan lutut untuk siku papan menit pusing sekali sumpah
prastikavivi,gina saudara wanita sekali sudah tawa
prastikavivi,gerak kesana kemari bebas gerak dikit kesandung kalau tidak jedot dinding tawa
prastikavivi,gerak dikit cidera memang paling benar rebah
prastikavivi,semangat
prastikavivi,iya tuhan dia jadi imut
prastikavivi,jam pulang sekali
prastikavivi,ikut mawik lumayan pertama coba sudah peringkat
prastikavivi,syukur
prastikavivi,kantuk
prastikavivi,marahin bang wil
prastikavivi,kesini itu lebih hati hati batas apalagi pilih pilih
prastikavivi,kesini dibanyakin bantal bicara bareng saudara wanita
prastikavivi,kena amazed oleh itu basics catat
prastikavivi,baik untung saudara wanita semoga rezeki
prastikavivi,tahun hidup saya juga buat
prastikavivi,chef arnold menang ini
prastikavivi,iya benar sekali saya
prastikavivi,ini buat malas pacar mau pergi tidak bilang sembunyi kata bohong daripada rumit ditanyain yang aneh aneh
prastikavivi,ini inti movies marathon sponsor oleh transtv
prastikavivi,ibu rindu iya
prastikavivi,pikiranya ot sekali tawa
prastikavivi,tengah obrol keluarga tibatiba nyeletuk kadang tiap malam pikir corona bagaimana kenyal bagaimana begitu baik saya tahu mana ke aneh pikir
prastikavivi,iya mal aidzin wal faidzin
prastikavivi,mal aidzin wal faidzin
prastikavivi,tanjung hari ribut hanya debat hanya diam baik tenang begitu tidak bisa sudah mau pingsan
prastikavivi,rumah juga sepi tapi tidak ada mudik
prastikavivi,apa
prastikavivi,kalau tidak dapat sudah tidak apa apa relain
prastikavivi,ini mulut sih kalau suasana serius diam baik kalau suruh bicara tidak saja nomor
prastikavivi,ampun dua satu frame tidak kuat
prastikavivi,peras kemarin nyebrang tabrak hanya sudah
prastikavivi,humoris
prastikavivi,offline otaku kadang dijelasin langsung masih mikirnya luama pol bagaimana kelas online tidak tatap muka langsung
prastikavivi,humoris sekali astaga
prastikavivi,dibercandain anak sampai terus detected
prastikavivi,syukur
prastikavivi,puasa keluh pahala tidak
prastikavivi,lahir malang di malang ayah malang ibu malang tanya tidak bisa bahasa jawa tugas akhir pakai bahasa indonesia
prastikavivi,pustakawan tugas mereka tahu begitu tapi benar lebih kompleks itu
prastikavivi,tidak tahu sudah bawan lahir bagaimana
prastikavivi,sekali ngobrol hal begitu imajinasi sombong seru sekali sampai ada seperti benar begitu eh lama bawa rasa
prastikavivi,mobil nyanyi
prastikavivi,diam tidak kenapa apa sudah muka berak saudara wanita
prastikavivi,dari hari ini ajar itu growing atas adalah tidak senang jadi sekolah
prastikavivi,bingung tawa sedih lihat
prastikavivi,kena harap juga banyak dengan seseorang masih pendekatan kalau ghosting itu oke arti dia bukan kita saya ayam
prastikavivi,saya hidup adalah awesome dengan positif dan negatif sesuatu in itu allow myself untuk jadi senang tidak masalah apa semua akan dapat lebih baik sooner atau later
prastikavivi,jadi sedih apa dia does untuk milik anda fanart harap ini adalah itu akhir kasus bagaimana milik anda fanart adalah awesome bruh
prastikavivi,tawa
prastikavivi,laku semua orang itu anda penuh dengan milik anda jenis jantung karena saya sebagai humans tidak pernah tahu ketika dia leaves kita
prastikavivi,gina ajar gombal siapa
prastikavivi,benar sekali
prastikavivi,kadang suka gin
prastikavivi,aquarius saya tidak cuek misal yang curhat
prastikavivi,kampret
prastikavivi,pasuk jam rawan ini sampai yang kirim gambar es minum segar segar awas
prastikavivi,juga gin mau obrol dosen mikirnya menit menit takut yang salah bicara periksa teman sudah ini kalau sudah sent
prastikavivi,tonight tunjuk apakabar bungkus admin
prastikavivi,anda look jadi imut
prastikavivi,oalah sudah sabar jadi skripsi memang begitu nyebelin sekali
prastikavivi,ingat puasa puasa tidak boleh marahmarah
prastikavivi,cerita sok asik aduh maaf ramashok balas
prastikavivi,humoris pol
prastikavivi,drama sahur bangun akhir mute imsyak
prastikavivi,hai kena jadi menang kena tahu anda baca masalah tapi saya cantik tentu itu anda baca kuat enough untuk dapat through ini cara
prastikavivi,cob bisikin telinga ngangur sampai iri dengki urus hidup tawa
prastikavivi,tidak tahu suka sekali urus hidup
prastikavivi,begitu jadi told kurang rangin iri dengki agar hidup bahagia rezeki lancar
prastikavivi,cemil lapar sudah cemil kenyang benar rebah
prastikavivi,iya
prastikavivi,pikir jika radit in nyata hidup itu akan jadi seperti anda
prastikavivi,kalau kakaku teman in itu lalu saya saudara sudah kadet omong omong taruna terlalu percaya tapi tidak juga yang sekali
prastikavivi,bodoh mau tidur
prastikavivi,gin kalau dosen memberi tugas kadang bilang aduh kalau tidak begitu iyain agar cepat cabut tetap tugas dikerjain juga karena nilai tugas penting
prastikavivi,harap temu manusia seperti koh lius
prastikavivi,semangat jadi
prastikavivi,ayo semangat ayo
prastikavivi,akhir pola cemil hancur sekali bulan tetap seperti gin benar daging babi
prastikavivi,baca tema seperti gin buat semangat turun saat sama seru sekali baca balas an support sistem saya sekali kerja keras syukur
prastikavivi,hampir duapuluh tapi ada kemarin hatihati jalan
prastikavivi,tepat
prastikavivi,mon peta bang tawa
prastikavivi,selamat pagi
prastikavivi,bang mon peta ini belum tiap buat video situ hanya memang sudah set seperti begitu bagaimana
prastikavivi,tuhan suka benar omonganya
prastikavivi,jadi asing gin
prastikavivi,tempe sekali dimarahin dikit bawa rasa
prastikavivi,astaga pagi loh apa
prastikavivi,pikir seperti daging babi
prastikavivi,someday
prastikavivi,hujanya sekali buat tidak jadi pulang
prastikavivi,arayan airlanga has pernah ucap itu tidak itu sulit sebagai panjang sebagai anda baca tetap ajar itu itu most critical masalah benar sekarang banyak orang sudah tahu itu keras untuk dapat baik kerja belum mereka bisa hanya keluh tapi doing tidak apa apa untuk baik themselves dan tuju dengan dia
prastikavivi,gin sekali seperti
prastikavivi,mau pengirim nipu ibu
prastikavivi,tidak apa apa dijalanin
prastikavivi,benar memang butuh cokelat
prastikavivi,aduh gakuat lihat
prastikavivi,pakai bumbu campur pedas mantul sekali
prastikavivi,bakso susu cin kali
prastikavivi,anda ucap saya baca hanya friends tapi friends kena tahu itu cara anda rasa la la la
prastikavivi,begitu sih ris napas ngos an biasa tidak saya
prastikavivi,salah fokus bulu coba
prastikavivi,sedih ini teh
prastikavivi,hormat sekali orang bijaksana sedih lagi rasa kadang pilih tidak tapi sedih itu juga nunjukin peras sayang
prastikavivi,gin memang kalau kamar goa tidak tahu pagi siang malam gelap soal aduh
prastikavivi,nama betul nasib lucu tidak tawa
prastikavivi,yang tidak pernah
prastikavivi,sial lagi
prastikavivi,mati itu mendengarkan bosan itu bilang hilang tawa
prastikavivi,lucu cerita in itu pagi manusia jadi seperti saudara laki ega tolong
prastikavivi,sudah tahu akhir seperti gin sedih kalau lihat
prastikavivi,dom malang saya
prastikavivi,semangat r pergi untuk rsud jika anda needed kirim virtual peluk dari saya
prastikavivi,tunggu apa nick di gado sumpah tidak sangka sekali dia kayak gin
prastikavivi,ini
prastikavivi,waspada mode nyala sekali
prastikavivi,benar sekali sudah parno waktu kemarin tengorokan sakit sakit pikir saya infeksi saya rumah eh saya habis minum es sirup
prastikavivi,karena dosa laku kali akan ada dosa cinta curi
prastikavivi,jaga sehat ya
prastikavivi,insya tuhan tidak apa apa
prastikavivi,tompi
prastikavivi,mimpi ot sekali mustahil sekali tawa
prastikavivi,seru ingin sama
prastikavivi,bismillah jadi baik monday tolong
prastikavivi,tawa benar sekali bukan saudara wanita ikut malu dengernya
prastikavivi,gin itu waktu rapat lanjut giat sekolah karena isu corona yang bilang loh begitu pada takut kayak tidak iman waktu masker kasih protes jawab loh takut tugas akhir saudara wanita saya kira berani mati
prastikavivi,cinta anda saudara laki
prastikavivi,saudara wanita
prastikavivi,slengkat kepala astaga
prastikavivi,terimakasih
prastikavivi,vivi mendengarkan penting sudah usaha maksimal kalau hasil tidak sesuai ekspetasi tidak apa apa itu oke untuk sekarang saya untuk myself
prastikavivi,sekarang apa
prastikavivi,gila saya nyaring instagram
prastikavivi,pasar bululawang ada jadi jauh sekali anda
prastikavivi,dari tentu anda bisa saya maaf jika saya salah hanya pikir itu gadis notes taruh themselves in gadis pov untuk umum anda tahu apa maksud benar
prastikavivi,cause itu adalah gadis notes mungkin
prastikavivi,saya in cinta
prastikavivi,acak tanya untuk saya jadi seperti nanti usia begitu tahun saya punya baik tanggung jawab bijaksana solved masalah paham each lain penasaran sekali
prastikavivi,syukur yang pegang
prastikavivi,bukan bang dayat selamat ulang tahun
prastikavivi,titip hok hok agar ramai lubang
prastikavivi,hok hok
prastikavivi,bersih bersih saya pantat
prastikavivi,usia tidak jamin punya masalah solving bagus
prastikavivi,hujan gin mie kuah ini
prastikavivi,saudara wanita lihat selamat saya
prastikavivi,pula
prastikavivi,bang pais kasih tips agar pagi orang saya bangun pagi matin alarm tidur
prastikavivi,jadi jenis siapa meski foto umbar yang harus jadi tidak yang pikir
prastikavivi,memang tidak tahu itu apa temu kenal dekat kalau lewat pos pict instagram tidak boleh nilai karena kita tidak tahu benar
prastikavivi,memang rada biadab saya
prastikavivi,semangat ya cepat istirahat tidak begadang
prastikavivi,ohmygod hilang iya suara
prastikavivi,tolong saudara
prastikavivi,buru buru sudah ayah
prastikavivi,iya ampun tawa
prastikavivi,semoga kabar
prastikavivi,cepat sembuh iya
prastikavivi,saja mai saudara laki tugas akhir
prastikavivi,tengah bercandan obrol saudara wanita lapo kenapa kayak gorila saudara laki ancen kong saudara wanita iya anda kingnya mobil diam sadar kalau salah bicara iya ampun gin ya saudara tidak yang pintar
prastikavivi,arap sesuai mati sudah
prastikavivi,dilaporin kram tawa
prastikavivi,budak cinta nicholas saputra
prastikavivi,baik pagi
prastikavivi,perang sudah tembak kena anak panah syukur hidup
prastikavivi,bismillah
prastikavivi,luntang lantung rebah ayo ayo
prastikavivi,kilat petir takut benar
prastikavivi,hadir
prastikavivi,otak sih
prastikavivi,habis pikir terbit lapar
prastikavivi,cinta rahasia yura yunita ft lembah kecil
prastikavivi,luar biasa cara
prastikavivi,harus tabung gas larang
prastikavivi,memang tuntut yak tawa
prastikavivi,sulit buat fokus
prastikavivi,bukan seperti ujian nasional kasih scot emulsi karena susah sekali suruh cemil niat agar doyan cemil begitu telah habis botol biasa tidak effected
prastikavivi,lihat teman kelas pakai toga ini rindu kantuk wisuda tawa
prastikavivi,apa an hebat cerita bagus sekali
prastikavivi,gampar mulut
prastikavivi,anda made saya hari punya buruk hari jadi ketawa lihat tipe dua rambut loh tawa
prastikavivi,jadi senang punya nicest orang sekitar saya
prastikavivi,gila curigan sekali jadi
prastikavivi,telat sekali baca tahun haru sekali saudara laki speak atas seperti gin karena susah sekali orang di diagnosa hiv positif hormat energi positif untuk tahan semangat saudara laki
prastikavivi,ci wen gemas
prastikavivi,nyaman itu tidak enak nyaman bisa jebak kalau kita tidak bisa ngolah nyamanya baik obrol babibu
