username,tweet
wydyudi_,minum saudara wanita aus jam telepon
wydyudi_,kalau tempat yang tidak ngeroko suruh pegih agar tidak asep tawa
wydyudi_,tanjung yarob
wydyudi_,sia nyiakan waktu biadab
wydyudi_,tugas tugas tugas tugas
wydyudi_,jadi debat seru fren fren
wydyudi_,sudah tangan tidak geber nyabet alias main badminton ke ayo hai
wydyudi_,istirahat
wydyudi_,hai
wydyudi_,coba
wydyudi_,penting sehat
wydyudi_,superhero darat deadpol
wydyudi_,selesai smstr sekali yogyakarta tidak tahu bodoh sudah kusut sekali
wydyudi_,justin bieber cinta milik anda diri
wydyudi_,memang sudah benar tidak dekat sama gadis ah tai kuda lumping surup
wydyudi_,tiga tutup alat kelamin muka anda seperti botol
wydyudi_,kenapa ribut hanya karena bodoh
wydyudi_,tahun puasa pasti pikir kalau pribadi benar tidak maksimal manfatin yang penuh berkah
wydyudi_,kuliah berani banyak waktu luang tapi tidak produktif produktif sekali hancur
wydyudi_,kenapa ya seperti gin
wydyudi_,makas
wydyudi_,yang
wydyudi_,mabuk sampai ketawain warkop gara ajak
wydyudi_,goa ngapah
wydyudi_,sial kabeh
wydyudi_,hari bulan puasa jam jelang buka uta duy anda lapar tidak lapar uta di jalan sesap buah mistri orang yang teman orok
wydyudi_,teman juang neraka mana kenapa tumben sudah tengah puasa tidak yang ajak warteg istn
wydyudi_,susah bangunin semangat dalam
wydyudi_,asal saudara wanita tidak teringat kemarin
wydyudi_,dari sisi ambil sisi dan harga sisi lain
wydyudi_,sebuah
wydyudi_,luncur
wydyudi_,semoga hari
wydyudi_,ayah cinta ntah depa
wydyudi_,benar benet tahun berat
wydyudi_,tidak tukat tukatnya
wydyudi_,hati lagi beranta ay takut nti goa ratain di kamar sampai teman juga goa hedsotin
wydyudi_,maaf
wydyudi_,wht shld buat
wydyudi_,lemme istirahat
wydyudi_,waktu tenangin pikir
wydyudi_,tanjung
wydyudi_,besar boys kena menang
wydyudi_,sampai tidak napsu cemil
wydyudi_,istirahat otak
wydyudi_,kusut
wydyudi_,semoga
wydyudi_,dekat tahun ketemu baru tawa
wydyudi_,nti kalau bapak bapak pinggir jalan buat saung dada
wydyudi_,seperti kenal tapi pura pura tidak kenal ah
wydyudi_,sakit pengugur dosa amin
wydyudi_,saking sejuk sampai perlu pikir apa akan di esok
wydyudi_,gelas tidak batu ginjal
wydyudi_,deadpol bang
wydyudi_,goblo tawa
wydyudi_,cepat muntahin atau tidak bisa pulang
wydyudi_,saudara wanita saya pernah sampai inap mal gara tiket parkir ilangin sama saudara wanita mantan
wydyudi_,tidak gadis kalau tanya tiket parkir sama kan iya sama kalau ada baik idam
wydyudi_,saudara laki abangan lagi mabuk dari jam rumah reak ketawa gajelas sudah subuh pada nyetel nisa sabyan maulana imbang tawa
wydyudi_,lebih baik sekarang
wydyudi_,hilang som
wydyudi_,bingung
wydyudi_,bom tidur tadi malam terus selesai kelas berani dari jam tadi blenger
wydyudi_,gila suru buat kerangka karang dedlenya jam
wydyudi_,anda keren anak laki
wydyudi_,bilang mau gultik wi butuh instastory
wydyudi_,tahu warkop jembatan biru jadi tutup hanya tai
wydyudi_,selesai main poinbleng
wydyudi_,dulu kalau pala lagi pusing obat musik keras
wydyudi_,beda beda memang tapi nti kalau anda olang sudah tua baru rasa kalau curhat sama itu anugerah indah
wydyudi_,waktu acara ayan warung bakmi godog mbah ntah yang puluh tahun sya saudara wanita foto saudara wanita mbanya nengok spa lagak akrab
wydyudi_,bab ansis bang kiky cjr
wydyudi_,pikir
wydyudi_,bom tidur tadi malam tidurin tidak merem merem sudah lanjut main pb sampai ketemu besok pagi
wydyudi_,pusing
wydyudi_,terapi hai
wydyudi_,depok matahari lagi nyentrik sekali asli seperti lagi akupuntur
wydyudi_,hai
wydyudi_,lebih satu sudut pandang suatu
wydyudi_,tgtr terimakasih allah hari ini hujan
wydyudi_,goa kalau malam gaperna tidur sudah kenapa yaiya pagi anda tidur sampai sore bagaimana bisa tidur tidak malam ibu
wydyudi_,tahun banyak libur huahaha
wydyudi_,gila keren goa cari mobil besok lihat tawa
wydyudi_,bom tidur tadi malam segar benar ajak putar gbk ayo
wydyudi_,lah tampan
wydyudi_,et yang gocap
wydyudi_,malam turut main pb sampai pagi sama soib
wydyudi_,beli utama gocap item agar omong kosong mabar
wydyudi_,gambar sempurna anda kena butuh tidak nyaring
wydyudi_,saia debat ini kelompok yang isi dosen adil yang lahir cakap jelek tarung lawan keras hidup dunia nope mereka semua bilang adil alas ramashok
wydyudi_,tidur pagi
wydyudi_,juga suka gayalo saudara wanita
wydyudi_,kamar kalau cemil sama boker doang mandi kalau ingat
wydyudi_,terima kaji gadis wi rumah fahrul kabarin waktu
wydyudi_,hv gd dia
wydyudi_,hai
wydyudi_,smstr lagi butuh butuh bimbing dosen tapi liburin sampai ujian tawa tawa hai hik tangis
wydyudi_,sudah tidak nyediain plastik saudara laki
wydyudi_,produktif inap harus tep yang materi
wydyudi_,ini jadwal hibernasi
wydyudi_,pban doloe
wydyudi_,salah dari nyeletuk trobos lah biadab virus gituan ibu kerokin bini goa besok sembuh
wydyudi_,teman ojolku benar takut sama tuhan tep narik malah saudara wanita karena jalan jakarta tidak macet haha
wydyudi_,libur pekan
wydyudi_,et sudah goa tunguin
wydyudi_,tidak yang seru banding begadang sampai pagi main game bareng soib kentel
wydyudi_,yang naro bawang
wydyudi_,duduk manis minum kopi tonton minion main semua england
wydyudi_,tgif
wydyudi_,ajak sebentar ntah tonton atau cemil habis jamin tidak banyak
wydyudi_,besar boys kena menang
wydyudi_,piro
wydyudi_,halusinasi
wydyudi_,beli nti pinjam
wydyudi_,marih
wydyudi_,ada rasa kuliah susah smstr smstr ibu geli geli doang
wydyudi_,madang pis ini
wydyudi_,resah sampai pagi tapi tidak mau meningalkan kasur
wydyudi_,tgif
wydyudi_,selesai main pointblank dari jam huahaha tidak ada sama sekali
wydyudi_,kelas jam itu mahasiswa smstr jam
wydyudi_,perhati sekali bwang jadi bawa rasa
wydyudi_,main pb tidak cit seru abes
wydyudi_,sks mantap
wydyudi_,yang rasa banyak dosa mobil putar
wydyudi_,liverpol doang
wydyudi_,matkul jam coban sekali memang
wydyudi_,sudah tikar ayo sudah main pabji lagi sudah agar temu yang yang omong kosong ajak turun gatka
wydyudi_,sudah sekali tidak kopi warkop
wydyudi_,nyabu
wydyudi_,nangung sekali jam lagi elclasic kikc mati tapi tumben sudah gakuat melek
wydyudi_,konsisten
wydyudi_,hai kenapa tidak gambreng main kucing kucing elah
wydyudi_,tidak apa apa chelsea seri yang liverpul kalah alias kasi gagal invisibel huahabahaha
wydyudi_,sungkem makas
wydyudi_,nikmat bola kecuali fans liverpul raya menang watford
wydyudi_,kenapa ogah memang kenapa peras sama gadis sudah seperti ciku brti ini anda sama ciku mandang fisik astaga sadar seperti
wydyudi_,budak cinta
wydyudi_,tapi kalau spek pc anda sudah ryzen gtx ti gb tapi ram saudara laki gb tep tidak ngangkat main gem berat buka chrome tab sudah ngos ngosan pc
wydyudi_,sambil ngokang iya
wydyudi_,ulil ibu tidak seperti begitu tikar ulil waktu hobi ngintipin tetangga lagi mandi ngintipinya pria lagi gadis tawa
wydyudi_,tidak rasa sayang
wydyudi_,pusying
wydyudi_,sama doa dapat ajaib kaki
wydyudi_,jakarta pingiran
wydyudi_,ulil gabung
wydyudi_,sudah kalau tidak jadi ayo yang semarang baca syahadat bela tawa
wydyudi_,woilah tenang ulil sudah ngebaptis saudara adenya di baptisin sama ulil tawa
wydyudi_,tikar jakarta nti baptis sama agar agama sama bela tawa
wydyudi_,tenang wi senin sudah kuliah guasa dipikirin nti langsung angkat minum sedih sendiri kantin
wydyudi_,cakep sekali memang hujan jam gin
wydyudi_,cinta semi gatka
wydyudi_,penting sehat
wydyudi_,seks anda lil tawa
wydyudi_,saya anthonytaylorfpf
wydyudi_,kasi tahu ngab
wydyudi_,hai
wydyudi_,selamat calon lulus ip tinggi kurang rangin pamer dunia anda tidak punya teman kalau sifat suka pamer seperti gin
wydyudi_,bingung yang dipelajarin saking yang buat bekel
wydyudi_,butuh referensi
wydyudi_,benar
wydyudi_,gedung seperti
wydyudi_,mendengarkan pakai earphone taruh
wydyudi_,indonesia juara badminton asia tim championship
wydyudi_,penuh rumah sampai sore mau tonton badminton
wydyudi_,anjnyir rem anyir
wydyudi_,hobi sekarang mbaca
wydyudi_,negatif positif
wydyudi_,asli yang yel yel saia yang malu tawa
wydyudi_,spertinya sudah mlai btuh kaca huahaha
wydyudi_,iyaiya peta
wydyudi_,telap ada
wydyudi_,muak sekali sama kt tapi mau bagaimana lagi istigfar
wydyudi_,rasa semester penuh kuliah tidak megang leptop tugas gaperna ngumpulin kecuali yang kelompok syukur syukur tidak ada yang ngulang
wydyudi_,waktu bo
wydyudi_,mau seperti goa kartu sebagai ini tinggal keluarin saja jelek anda blkng lama hubungan jarak jauh
wydyudi_,hasil buat teman sekitar tidak rasa kalau saia punya masalah
wydyudi_,jenuh
wydyudi_,goa lahir bukan bang sebab goa lahir buat ngerebut ciku anda
wydyudi_,durhaka anda seperti disuruh ciku langsung nurut tapi gilir orang tua yang nyuru ogah ogah tawa
wydyudi_,unduh pabji si
wydyudi_,bersih sampai akhlak
wydyudi_,trailer tapi lihat kalau jalan cerita ff sama seperti ff hob sampai saw
wydyudi_,akhir malas malesan rumah
wydyudi_,tapi kalau dwi bawa teman minimal ber ibu bisa ptpt rebu
wydyudi_,jam gocap bos tidak main bawa rban ptpt lapang
wydyudi_,pada bicara doang sebentar sudah boking pada malas san curug tapi anggota tidak bisa main dua
wydyudi_,jakarta bicara apa bajing
wydyudi_,mao main ya
wydyudi_,tai
wydyudi_,aa conte makas peta kelola chelsea baik aa conte
wydyudi_,siang siang tidur begitu seperti anak sampai dengan
wydyudi_,sebentar sebentar panas sebentar hujan sebentar panas sebentar sebentar panas depok cuaca lagi tidak konsisten seperti punya teman
wydyudi_,mirip kepribadianya wi fakboi
wydyudi_,memang farel anak bajing sudah di demenin sama gadis blaster jepang tapi pilih gadis sakit
