username,tweet
ladafiq,syukur senang akhir tidur tenang
ladafiq,makas anda spoilernya jadi tenang tonton khusyuk sudah download
ladafiq,bau bau senang akhir
ladafiq,pikir ini
ladafiq,rsud daftar putar tonton episode saja sempat tidak tonton terus lihat ulas pada seru jadi tonton memang seru
ladafiq,tidak eneg aneh pokok aman aman tapi buat yang tidak hamil belum menikah
ladafiq,omong omong akhir ini twitnya drama korea ya ada tidak beban hidup kan
ladafiq,akhir tidak seperti overs tolong
ladafiq,makan malam pasang mistik pop atas bar seru drama apalg makan malam pasang
ladafiq,tadi pikir sampai dapat simpul drama itu raja kekal raja ini seperti drama bulan cinta ratingnya rendah korea drama bagus tren dan mungkin seperti bulan cinta yang sudah tamat tetap masih yang bahas
ladafiq,lagu paul kim sayang saya rasuk relung hati
ladafiq,lagu gembira yang introduce saya baik orang ini sekali
ladafiq,bantu jawab senin selasa tayang
ladafiq,waktu bilang saya cemil mie ibu ibu rina kan mie orang indonesia tidak cemil nasi cemil nama
ladafiq,ibu rina benar ken gemuk sudah tempat sampah mie ayam pedas disuruh cemil nasi
ladafiq,bayang itu akan seperti goblin di episode sudah paham beberapa episode konflik sudah turun begitu ah
ladafiq,episode episode yang ter tidak saya paham tolong ini dari ekspektasiku
ladafiq,tonton latih tidak syok ada rencana putar di episode sambil tanam mantra tidak banyak harap senang akhir daf
ladafiq,twitter itu surga cinta spoiler
ladafiq,uang tidak yang ken beli sungguh kontras adan
ladafiq,dasar
ladafiq,beli bersih minyak mikirnya sekali sampai browsing segala macam ulas lihat ujung ujung pusing gakjadi beli
ladafiq,dots
ladafiq,kepada sendiri lapar masa cemil saya belum cemil siang lupa pikir
ladafiq,enak itu urun
ladafiq,harga dtolak dompet bul
ladafiq,beli
ladafiq,ada kupu kupu
ladafiq,mr sinar matahari langit kastil
ladafiq,hotel del luna
ladafiq,makas fira
ladafiq,tkem drama korea fir disemangatin jadi semangat ngedrakor ini
ladafiq,baik pasrah daripada pusing
ladafiq,pusing kepala habis baca teori tkem
ladafiq,obat sembuh dari namatin
ladafiq,makas
ladafiq,grup teleku belum pengirim bagi link tidak pengirim
ladafiq,hilang sakit butuh waktu akhir benar ikhlas lepas tidak hadap anda hebat tahan saat hilang juga berat
ladafiq,kantong bisa tempat uang receh ini
ladafiq,ik jun
ladafiq,ketika cemil bakso miu miu makananya manusia cemil bukan bakso miu meong sila terjemah bahasa miu
ladafiq,lup drama ding judul drama sedang langsung ya sudah tamat saya di episode
ladafiq,bosan sedang cari lari daf
ladafiq,nyata pertama saya tonton drama sedang langsung judul wah sekali saya bosan
ladafiq,siap sakit hati tidak cerah mungkin rendah potensi senang akhir drama jadi tonton
ladafiq,ada darurat pasang yang utama lagu ji hyo toilet
ladafiq,vagabond dia pribadi hidup goblin masih lagi
ladafiq,neraka tentang waktu memorist menikah tidak dating ada darurat pasang doctors
ladafiq,manis manis gin suka sekali di beranda saya untg sabar
ladafiq,minum masih pikir sudah tidak puasa ya
ladafiq,fi kenapa tidak gila ibu saya lupa mau cemil ada puasa takut dosa kalau cemil
ladafiq,akhir yang sedih pengirim bagus tapi cerita
ladafiq,loading hanya telkomsel
ladafiq,akan kekorean waktu
ladafiq,kalau memberi rekomendasi drama korea bagus begitu bingung banyak bagus jadi gakbisa pikir sampai lupa judul
ladafiq,dimafin tidak
ladafiq,kasi lambung keras gara gara makanya maaf lambung
ladafiq,lelah cari untuk lawan takdir akhir di fase terima
ladafiq,maaf lahir batin ya lintang
ladafiq,amin maaf lahir batin ya nimas
ladafiq,pikir pikir gakbisa komentar
ladafiq,sama
ladafiq,ayo tonton film kuruna
ladafiq,maaf lahir batin teman teman selamat raya idul fitri
ladafiq,rindu tonton film bioskop
ladafiq,tonton tktem sisi goblinya sisi mr sunshinenya ada sisi dotsnya harap akhir tolong ini tolong sekali seperti mr sinar matahari
ladafiq,memang nguin minggu itu uji sabar tawa sebentar kukabarin kalau sudah tamat
ladafiq,maksud akhir episode akhir episode begitu malu
ladafiq,akhir episode astaga gila sampai ulang ulang
ladafiq,keluar surat edar bulan juni mulai posyandu tapi tetap dengan protokol corona semoga selalu sehat amin
ladafiq,sudah tidak tahu berapa saking
ladafiq,saya newbie masih hafal judul lagu saudara wanita
ladafiq,salah ketik ceri
ladafiq,lagu iu vibesnya musim semi bunga bunga matahari pagi blueming tidak spring cinta atau riang mekar ft tinggi musim gugur pagi
ladafiq,lagu ngenesnya iu akhir tempat jadi makna
ladafiq,kenapa twetku dua kali lipat yak baru sadar
ladafiq,belum jam bobok ini ibul apakabar
ladafiq,lepas sebagai fans iu suara pacar memang heartwarming sekali
ladafiq,daftar lagu iu susah tidur versi knees through itu malam sayang name saya old cerita antar tidur tenang tidak lantas buat anda bobok drekomendasikan yang suka korean yang tidak suka sebentar pusing hujat
ladafiq,daftar lagu iu susah tidur versi knees through itu malam sayang name saya old cerita antar tidur tenang tidak lantas buat anda bobok drekomendasikan yang suka korean yang tidak suka sebentar pusing hujat
ladafiq,yaudahlahya nyalahin rasa ini salah rasa sudah usaha memberi tahu yang benar tapi dcuekin ada yang ngelawan jadi gakbisa ngelawan malah jadi ribut nama tambah ya sudah ya yaudahlahya
ladafiq,desa sudah jadi zona merah desek desekan toko baju tidak pakai masker masih nongkrong dekat sungai
ladafiq,orang kalau tidak keluarga sendiri atau orang yang virus tidak kapok maaf ini doa memang kan begitu kalau sudah tetangga tidak belah rumah kena begitu heboh sudah
ladafiq,yang sudah pasrah sudah kalau virus bagaimana yang kasi tahu bilang paham tapi dsuru pakai masker tapi gapake masker dsuru cuci tangan sabunya tidak pakai orang ini disuruh alas pintar sekali
ladafiq,era hati saja saja susah subhana kadang susah dtgnya orang seperti keluarga teman tetangga yang sudah paham soal virus yang konspirasi yang yakin kalau virus tidak sampai dia
ladafiq,dtanya seperti begitu agar virus tidak sebar sebar diri ke keluarga orang dsekitar lingkung dengan atau tanpa kapan smw kita tapi harus sabar spti
ladafiq,yang drumah drumah kalau tidak urus ptg ya tidak rumah klau trpaksa ya pakai masker cuci tangan masker kain murah sudah dapat anda cuci tangan tidak sulit bangun candi dalam tadi malam
ladafiq,masa pandemi gin gerak hadap ini sgt berat kita karena mg ini hadap dengan kalah turun ego ya demi penting brsma cuma kpntingan nakes saja semua masyrkt
ladafiq,la toko pulang kenal maesan itu
ladafiq,eh
ladafiq,acara kucing
ladafiq,sprei beli online gara gara mega busana ramenya masya serasa tidak pandemi toilet
ladafiq,libur mau ya gakboleh mana
ladafiq,libur lebaran itu tidak kenal kenal ayo tahu tahun bisa dapat libur lebaran
ladafiq,kan batas yang balas doang tetap lihat orang ya
ladafiq,juga pikir begitu
ladafiq,tim rujak pakai royco buat masakan tim masako
ladafiq,susah deskripsi
ladafiq,bisa harap pasti
ladafiq,jumat kemarin tidak episode itu raja
ladafiq,arti harus cicil dari sekarang agar tidak ledak otak tidak
ladafiq,aman kebal
ladafiq,begadang miu
ladafiq,eh sentuh alias labskil ngu corona selesai labskilnya
ladafiq,lupa toilet malu tapi ngampus kan gakbisa labskil online tidak praktek lagi ini gara corona
ladafiq,nahkan diri pakabar dek kuliah online ini sudah lulus
ladafiq,manga
ladafiq,tidak
ladafiq,nahkan fodfes sekali foto mie instan untung lagi rujak jadi rayu
ladafiq,waktu indonesia cemil mie instan
ladafiq,hanya wacana rujak tengah malam realisme dengan bumbu instan alias royco cabai doang luput utama sang manga rujak pagi siang sudah tidak bisa alias puasa
ladafiq,saya tidak tengah malam gin ken rujak manga untung manganya sudah seperti orang ngidam heleh
ladafiq,nokia
ladafiq,sampai olah olah kamar sudah buat hidup tidak lupa kamar mandi
ladafiq,orang mesti pikir saya kamar itu tidur padahal banyak yang laku kamar anda sudzon
ladafiq,pacar tidak temu
ladafiq,dafi siang gin sudah tepar habis apa habis konser
ladafiq,tidak dosa sudah minum saudara
ladafiq,puasa dia
ladafiq,salah karaoke siang siang gin selesai tepar ada habis lari
ladafiq,malam anda alias jam
ladafiq,itu rindu tidur jam begitu anda
ladafiq,tuhan tawa lihat tempat jadi
ladafiq,peh
ladafiq,episode sedih
ladafiq,dea imut kapan utama drama menang indosair
ladafiq,mbaku ultang tahun sekarang gais
ladafiq,tolong minta pilih lee admin ho ji chang wok
ladafiq,punya aplikasi instagram la saya buka pakai web
ladafiq,keren keren
ladafiq,sama
ladafiq,sama
ladafiq,ini saya jadi sudah lama saya tidak cemil mie
ladafiq,unduh telegram sebentar kas link gabung grup cinta drama korea begitu saudara wanita
ladafiq,anda cari yang resolusi bagus sekali mungkin rasa tidak nila pengirim tapi saya sebagai yang tonton drama korea telepon nila sekali updatenya cepat donlotnya mudah tidak pakai iklan
ladafiq,yang masalah yang pikir yak
ladafiq,kenapa takut sebentar halal sgla buat jadi ratu sampai ganggu jong tae eul begitu takut kerja lee lim
ladafiq,yang beli parfum yang pusing cium bau bagaimana saya kemarin tidak beli saya cium pakai hidung
ladafiq,dan lupa pakai masker hitung pakai jari
ladafiq,rip fisik jarak pasar pujer
ladafiq,kucing kalau liay laptop memang bawa ken didudukin atas keyboardnya masalah si kucing laptop itu
ladafiq,jenang sapar versi mini
ladafiq,dukacita peh
ladafiq,iu hari
ladafiq,tetes micelar air harga
ladafiq,ui drdlu sampai sekarang pendam ken kuliah walaupun dtolak tawa alasan tidak tahu ui macam pertama cinta
ladafiq,pantas saja bolak kamar mandi bising usus disko
ladafiq,ada hal yang ramai tuiter ini
ladafiq,anda anda pikir keras pikir sampai begadang nyata cuma putar putar putus duga memang dasar kalau sudah beli apa coba buka shopee sampai pikir astaga lihat kn yang bodoh
ladafiq,jam jam bolak buka shopee pikir keras sekali yang beli sampai begadang pikir sekali oke urus diri checkout kmudian tulis tunda hari karena psb gagal terus ngmng sndiri beli lgsung ajadeh
ladafiq,sama bunga plastik kah
ladafiq,cantik
ladafiq,sampai bingung harus duduk model bagaimana agar tidak bosan
ladafiq,sepi sekali iya  orang pada buka daf
ladafiq,nangkring pemdaftaran rumah sakit tunggu jam praktek dokter jelas saya buka ini ibu
ladafiq,sambal mentah
ladafiq,astaga mengawalai dengan pikir hal yang tidak pikir
ladafiq,masih tidak habis pikir pikir pulang tidak suka orang sakit orang sakit nyusahin mati sudah nyusahin serius kalimat yang sakit dia manusia tengah setan
ladafiq,segala tentang iu gakbisa memang suka saya saudara wanita iu
ladafiq,salah bentuk mampu pindah nyala drama bulan cinta nontonin pria nyala misi doa dalam hati tuhan kapan iu lee jun ki utama drama pikir
ladafiq,rindu kuliah
ladafiq,gakpeduli baca bacan bacan
ladafiq,nya di prinkan tulis seperti begitu dapat itu puskesmas tetap tidak hirau perlu buat spanduk besar acara seminar ya agar dibac
ladafiq,fira tidak lupa pakai masker keluar rumah cuci tangan
ladafiq,lagi hade
ladafiq,tindak yang sederhana tapi sangat bantu sebar virus corona semoga orang yang sadar segera sadar mengunakan masker cuci tangan amin
ladafiq,miris adan seperti gin banyak yang tidak pakai masker sadar mengunakan masker cuci tangan rendah kasi tahu marah jadi saya sgt berterimakasih skli semua orang yang sudah sadar pakai masker mau dsuru cuci tangan
ladafiq,pakai masker demi sendiri cuma nakesnya agar tidak tular buat sendiri kalau sudah tegur nakesnya yang salah marah nakesnya bagaimana kita memberi tahu malah marah dekrema
ladafiq,saya bicara ibu pasien susah sekali dsuru pakai masker cuci tangan kalau tidak dtgu tidak diliatin tidak dpake sabunya padahal utama ya demi sendiri fasilitas yankes tmpt pasien yang gaktau yang bawa virus
ladafiq,mau negur sudah lihat pasang tidak mau bilang ibu rina datang seperti memberi kode sudah dek gpa saya diam konsultasi pasien pulang ibu rina bicara saya memg orang susah dbilangin dek sok orgnya
ladafiq,lihat kesal bicara disa kanto sobung corona saudara wanita desa apa corona saudara wanita brusaha sabar sabar ibu bapak cuci tgn tapi tidak niat gapake sabun juga terus lgsung oke tmpt periksa
ladafiq,itu datang lagi pasien pasutri sudah tua begitu datang gpake masker lgsung masuk tegur buk cuci tangan terus ibu beh sudah wudhu brusan saudara wanita saya pun nyaut ibu tapi cuci tangan sekarang wajib cuci tangn ibu kalau kesini
ladafiq,saya selesai sholat dtgulah pasienya ibu rina nyeletuk agar dek pulang apa pasienya ngosok ngambek seperti dsuru pulg ambil masker sudah gpa saya mbatin tuhan pakai masker diri padahal sampai hingga seperti itu
ladafiq,yang telah buka pasien datang suntik kb rumahny dekat sekali saya sholat ibu rina dsuru pulg dulu ngambil masker karena sekarang fasilitan yankes memg wajib pakai masker aplg adan pandemi gin dn maesan sudah zona merah
ladafiq,sore ada yan ibu rina miris saya malah ke sedih dalam hati gin sekali
ladafiq,lah kalau begitu tawa
ladafiq,serius ken kuliah
ladafiq,agar bobok lelah pikir tugas lelah pikir yang
ladafiq,ken kuliah tuhan
ladafiq,fir sudah tdur brusan
ladafiq,salah bentuk neraka diri adalah tidur sekali tadi malam pagi
ladafiq,tidak mempan tetap pikir astaga
ladafiq,gakpapa gakpapa
ladafiq,amin serius
ladafiq,tapi lagi akhir buah cerita soal apa mau sih tawa
ladafiq,baca teori drama itu raja kekal raja buat pusing cuma jelimet akhir yang seperti sama seperti akhir goblin padahal mau hidup bahagia cuma ketemu doang akhir
ladafiq,semangat cemil ngantuk hai
ladafiq,saking semangat cemil tempe sampai tangan mau cemil
ladafiq,kedengeran alas tapi hpku kalau dpake tethering banyak asli soale
ladafiq,gakbisa download apnya balas
ladafiq,iu apa
ladafiq,ke kesal benar
ladafiq,saya saja pengirim matte begitu hasil cuma memang kentel begitu kulit kombinasi omong omong
ladafiq,maximus lawan minimus
ladafiq,sabar
ladafiq,sudah sekian bahas grup keluarga canda ini ibu sampai sampai rasa olah olah jomblo umur gin itu seperti helaw anda menikah umur berapa biuh perkara menikah tinggal menikah begitu
