username,tweet
ccarenth,goa tidak akan balik nad proses mayan malas taruh kalau buat akun tawa
ccarenth,dilock twiternya nad karena goa set tanggal lahir tidak goa buat twitter umur goa belum tahun tawa
ccarenth,hai twitter diunlock tawa
ccarenth,nad semangat kalau lagi skripsi memang saja yang buat turun anda bisa nad
ccarenth,sudah nep tawa
ccarenth,syukur goa bisa sampai layan masyarakat semoga tuhan lindung goa sampai keluarga goa semoga semesta pulih
ccarenth,sedih juga karena saudara goa bulan rasa dan dapat uang hasil keras paksa rumah karena klinik tidak kalau tetap jalan
ccarenth,sedih karena ibu tibatiba cerita mei di dia laku hari libur gaji gaji
ccarenth,sedih karena ayah pulang indonesia mei ancam batal karena masih lockdown
ccarenth,kondisi rasa sedih juga syukur
ccarenth,admin tolong periksa pesan langsung tolong tolong
ccarenth,buat anda ingat ketika anda gabung twitter buat
ccarenth,tahun indah
ccarenth,putri minta id garis tidak malu
ccarenth,dapat jadi sungguh segera ayah dengan keburu dan keluarga di omni rsud pic
ccarenth,saya ll lihat
ccarenth,sabarsabarsabar
ccarenth,saya tidak oke tapi ini adalah oke
ccarenth,sebagai biasa
ccarenth,ex chairmate ken ingin tahu kesan pesan gu ami panjang waktu tidak lihat pikir kita htp co fialmknt
ccarenth,tidak prob dia
ccarenth,pap pacar ser tawa ini saja foto ya rindu sekali rindu sama htp co vbufmeskre
ccarenth,tidak bisa dilupain goa aseh maaf baru saya balas tentang sah bekas hati saya htp co xy dpdb
ccarenth,panjang desc na maaf baru balas ini kenal enak itu kelas kalau mana sama dea anda htp co eanpcehcgc
ccarenth,tengah lalang kendaran orang anak yang
ccarenth,turun tidak lemah tolong
ccarenth,gaduh anda tawa sama yups
ccarenth,saya truly maaf untuk saya kata dan actions didn meant itu
ccarenth,cewekcowok cocok kelas alasan kejut ipa yang ngepoin kasih sudah elfan mae htp co tqsl wsf
ccarenth,tuhan
ccarenth,senang baru tahun saya cabai tawa
ccarenth,senang baru tahun allah kati
ccarenth,tepat htp co rzawr ty
ccarenth,jadi inspiring
ccarenth,gembira riana
ccarenth,selamat natal jbu maaf telat sekali balesnya retweet
ccarenth,terimakasih anda allah rumah manis rumah
ccarenth,ini nyanyi senandung hati ibu buah lagu sederhana lagu cinta ibu loveyou ibu
ccarenth,mana gils
ccarenth,apa adalah milik anda biggest sesal selamat itu salah orang allah sungguh harap itu baru satu adalah itu benar orang ami htp co eoktvsngnc
ccarenth,soeta selamat datang rumah ayah
ccarenth,induk ayam anda
ccarenth,itu traktir tawa retweet traktir xd
ccarenth,terimakasih anda amin ikut yups retweet senang ulang tahun saudara harap anda semua itu terbaik iya ikut kembali yah
ccarenth,ayo sudah tahun tidak ketemu tawa sedih
ccarenth,terimakasih andinong tawa sukses bareng kita
ccarenth,si cabai berizik tawa ikut ya retweet ikut kembali ulang tahun gadis jadi
ccarenth,cla senang ulang tahun sukses terimakasih dela sukses bareng ya kita amin htp co ehfumfjpfb
ccarenth,hai terimakasih hana
ccarenth,terimakasih adite amin amin rindu adit retweet selamat ulang tahun semoga yang ingin kenyat
ccarenth,terimakasih hendry teman sampai dengan tawa retweet senang ulang tahun carenth
ccarenth,terimakasih nol malu retweet selamat ulang tahun carenth
ccarenth,terimakasih awam semoga anda nurut goa tidak bandel tawa cinta anda tapi benci anda tawa
ccarenth,senang ulang tahun swetseventen saya senang saudara jesus selalu kati anda htp co xjfawyfqv
ccarenth,baru keponakan selamat ke dunia bianca nathaniela tanod allah kati anda htp co vmgt pv
ccarenth,ros pergi jalan goa retweet anda les pergi kenapa saya ketemu anda tawa
ccarenth,edun harkos ibu cepat nes tawa goa sms anda bilang sore tjoy
ccarenth,nes goa datang gereja jam anda datang jamber buset cepat
ccarenth,tambah sepupu yey selamat ke dunia anastasya zefanya putri
ccarenth,sama yep tidak dilema mele tawa traktir namanye
ccarenth,bagaimana buat anda usually ekspresi milik anda emotions senyum anda kena menang htp co aegaubge
ccarenth,eh gadis selamat jadi yups semoga tidak gagal pindah nyala eh tawa traktir tonton kalau kumpul keluarga mantap itu
ccarenth,senang ulang tahun sepupu semoga sukses ya harus amin tua yay tawa sayang sisa banyak mau yep
ccarenth,jika anda bisa jalan anywhere in africa dimana akan cuma ken ketemu ayah naik kapal pap htp co rab nkgub
ccarenth,kadang tidak itu tenang
ccarenth,dia dia dia
ccarenth,judul malam minguan pibesdey tidak sedih lagi buka lupa tapi rencana maaf teman sayang htp co stkc onjm
ccarenth,jih dikatain anak anjing tawa sama iya goy
ccarenth,hepib tjoy semoga hepi paman hepib aselole joss tidak dilema mele pusing pala berbi tawa sciex
ccarenth,akan anda pikir untuk tell kita tentang milik anda cinta cerita em gambar tulis malu htp co feab sdkze
ccarenth,lekas sembuh tidak kelam rumah sakit kan sudah tengok kita tawa katek sepi ini hadir gbu
ccarenth,sama yups amin amin tawa
ccarenth,amin ca malu sama maafin ya ca
ccarenth,senang ulang tahun ies cantik pintar pokok tidak tinggi bagi tinggi tawa sukses brg
ccarenth,ica senang ulang tahun sukses bahagia amin
ccarenth,cerita kali maaf baru balas cerita saja hari mbah aun kakek ulang tahun ke htp co psi dc
ccarenth,jika tidak sekarang lalu ketika indah waktu kenapa htp co zubpqrgbf
ccarenth,kamar impi retweet sher saya ngiler sher retweet jatuh tidur under itu bintang htp co nwmd xc
ccarenth,gila waktu dengan htp co xoihpgce
ccarenth,uji
ccarenth,carenth coba imp anak ipa oke panjang jawab ini non maaf baru balas ayah clar agama htp co pu nedyd
ccarenth,pikir
ccarenth,apa retweet hanya hih
ccarenth,puncak yey
ccarenth,ayo eci juga malu kapan shel
ccarenth,oke orang shel
ccarenth,apa teman lunya saja shel gaenaklah goa kalau ibu
ccarenth,film keren sekali ayo tonton anda teman anda kapan memang
ccarenth,sheila tonton tidak goa lagi ken taruh tonton itu salah in kita bintang ini anda mau tonton apa
ccarenth,hubung gacukup jawab tadi memberi bonus pap sciex tidak jogjakarta sciex baju larang htp co guylyciol
ccarenth,sama akis saudara wanita
ccarenth,sama geth saudara wanita haha siapa geth malu amin anda ya sukses di smanlinya
ccarenth,sudah al gadelip retweet buka banyak mau eh penasaran
ccarenth,selamat tempuh hidup iya saudara saudara dharma cie sekali tawa jesus kati anda muah
ccarenth,selamat ulang tahun sukses yups
ccarenth,senang ulang tahun dapat harap anda semua itu terbaik iya panjang waktu tidak lihat ini rindu getha sukses terush jesus kati anda
ccarenth,ikut kiki retweet kali folowback
ccarenth,undang pin satu saja nad goa lupa pinya sebentar goa sms anda ya
ccarenth,tangis dasar sudah haha retweet tidak ada pulsa sms ntran misi iyanih nad malu cerita sms dums retweet
ccarenth,sama sudah ini goa gagal puasa sedih
ccarenth,iyanih nad malu cerita sms dums retweet anda mati cerita coba malu
ccarenth,uji
ccarenth,hening retweet aduh htp co fbdeyfhla
ccarenth,goa mati nad malu cemes retweet cer pin cer saya cerita ini malu
ccarenth,rambut kuda al segera ingin tahu itumah retweet cie cie sekali seren rahasia kagum ehem
ccarenth,saudara nama clarista ambil bahasa yunani claresta bayi perempuan yang pintar carenth htp co bl lcfu
ccarenth,bisa jadi milik anda bintang bisa saya em iya mati segera ya lelah htp co srpl ym cw
ccarenth,bagaimana cara memberi gadis non pasti kalau anda rasa ke dia htp co ll tsc uh
ccarenth,senang sunday
ccarenth,buat dapetin gadis bagaimana apa pengaruh em bagaimana gin inti kalau anda ken htp co misi aqelo
ccarenth,ajar anda rumah seperti bagaimana em jujur ya goa jarang ajar ajar kalau ulang doang sa htp co guym mn
ccarenth,em begitu dulu dipangil sheren tawa
ccarenth,tulus nyala woho
ccarenth,begitu malu ketemu di sama dulu dipangilnya
ccarenth,pria suka tidak kelas suka tawa mati anonlah htp co kiz siybj
ccarenth,lagi dekat pria kalau pria yang suka kam kenapa segera ingin tahu haha dekat siapa non saudara htp co f jao
ccarenth,haha anak sekarang retweet senang easter juga tk saya wacana
ccarenth,senang easter cipeng peta telat sekali malu
ccarenth,kenapa retweet banyak mau anda mati
ccarenth,gabilang bilang lelah retweet memang dia ibu goa sudah tidak tahu dulu sharen retweet eh anda tahu christinerchel juga
ccarenth,al goa belum nyala retweet pokok nyala retweet cerita al retweet cerita retweet
ccarenth,uji
ccarenth,eh anda tahu juga tk saya wacana retweet di smanda juga di tk saya wacana tawa
ccarenth,cerita al retweet cerita retweet al memang retweet syer mati
ccarenth,al memang retweet syer mati
ccarenth,dipangil sheren retweet sial nama pangilan anda teh retweet anda sisil teman dekat goa iya ampun
ccarenth,tonton pilem seperti haha plesbek retweet apa anda teh tawa
ccarenth,anda sisil teman dekat goa iya ampun di dekat rimbart goa dipangil sisil anda tidak ingat goa memang rumah anda mana
ccarenth,dulu anda dipangilnya sudah retweet serius goa tk saya wacana yang bukit asri retweet apa satu tk retweet
ccarenth,rumah anda haha retweet serah saja tidak libur ujian nasional
ccarenth,apa satu tk retweet apa goa tk saya wacana retweet tk saya wacana cipenk retweet cl
ccarenth,tk saya wacana cipenk retweet clarista anda tk mana
ccarenth,sahabat di pria da mungkin itu contoh seperti cuma hubung persahabata htp co ls zkyjflb
ccarenth,tetap fi goa dong fi ini kelas yak bada besar tetap midut itu tetangga pandan htp co wum fmrbsl
ccarenth,fi des impers saya fi sepupu goa tinggi kelelawar lelah desc tidak putih kelelawar seperti bule htp co hejcvkcvl
ccarenth,orang masih sayang mantan dia lagi in relations mati segera baru deh htp co zurjsc
ccarenth,cantik apa dalam cantik dalam non htp co comxotgsjs
ccarenth,baik gadis segera segera anak ipa htp co dca anda
ccarenth,mana dite
ccarenth,nobody ucap itu sudah mudah
ccarenth,uji
ccarenth,jalan untuk ingat
ccarenth,em
ccarenth,sama teluk amin terimakasih haha tidak sombong anda teluk
ccarenth,selamat ulang tahun teluk sukses iya
ccarenth,iya senang sunday pep pamer bagaimana
ccarenth,setia bukan saat tapi sampai pada nanti yang setia tuhan senang sunday allah kati
ccarenth,tidak kenapa boong dosa retweet itu cla tidak boong takut tuhan buka ibu ayah tidak bohong
ccarenth,raja kati saya besar keluarga
ccarenth,takut tuhan buka ibu ayah tidak bohong ibu sampai ayah
ccarenth,saudara kalau yang disukain suka juga saudara yang widih terbang para kupu kupu bintang htp co sxuc xre
ccarenth,mblo wetseh asam benar tawa anda pasti mblo non sudah tahu kenapa goa htp co misi sldrdw
ccarenth,musik yang dengar saat lagu tulus teman hidup itu memang mantap kelelawar htp co txw urahj
ccarenth,pekerjan impi jadi dokter amin htp co iv ysjmw
ccarenth,tidak lupa foto tidak sudah malu
ccarenth,bentuk lope penk goa ogah
ccarenth,tidak kertas concordenya warna biru cipenk iya mungkin diwarnain wetseh mami anda itusi
ccarenth,pesan langsung
ccarenth,kertas concorde cipeng nama memang
ccarenth,ikut ayo retweet ikut kembali yak lupa kawan eheh
ccarenth,ini sudah goa ikut sampai tidak difolback goa cholok anda
ccarenth,goa kasih ketek ini tawa okidi goa pena rumah anda ih tonton lelah
ccarenth,saja induk ayam eh memang benar induk ayam tawa
ccarenth,upaya retweet tidak tahu diri anda saudara bukan hai kesal
ccarenth,saudara bukan hai kesal
ccarenth,sama clarista anda mangil goa sheren rindu heny juga rindu lihat heny nyanyi haha amin
ccarenth,selamat ulang tahun teman sampai sukses dan segala gala
ccarenth,et iya mungkin tawa
ccarenth,kalau anda sedang celaka cinta sih goa sikap saja dia terus tidak tahu kenap htp co jxtbzxm sb
ccarenth,iya ampun sher saya kapan tidak balas sms anda xl anda kemarin anda gabales juga lelah hai saja htp co rtymzcykr
ccarenth,ya tinggal sekolah kelas bogor sman bogor htp co wxgo xji
ccarenth,loh saya elah cel cuma fi sampai doa memang anda haha okedeh ini fi orang gau htp co mx ohodo
ccarenth,oy carenth fi desc imp saya dongz dimski ask fm saya untuk itu allah ikut kembali goa dim fi asan htp co hzqzyt yge
ccarenth,cela fi sampai pawit dong tawa nyasar dari baik anda akal dianon mati anonya goa htp co hoqgjqk bz
ccarenth,cela suka tengil sentil ini ini pawit ngaku anda htp co njitgwtzds
ccarenth,tawa eh kemarin anda sms cuman bilang rindu doang abs sms yang ini lupa malu anda kemarin gabales htp co fokvnosrd
ccarenth,lupa mati segera goa tangis cipenk anak bodoh tangis ikut iya htp co dbnujeau
ccarenth,clarista ikut kembali cipenk ini htp co qcbydgvox
ccarenth,folowback ikut fatia htp co rmrksya
ccarenth,baik gadis fi desc imp eyke cyn helow saudara wanita sudah iya impersnya bom imp cela li htp co eft iuw wd
ccarenth,terimakasih ya seperti tomboynya sama jah iya feminim sekarang yeh htp co wul gdrmgf
ccarenth,pasti dikabarin malu sipdeh kalau begitu htp co kpub iv po
ccarenth,pria dekat anda ayah ini non lagi duduk samping htp co egva algun
ccarenth,fi desc def ayo cela saudara wanita uki fi seperti asik tapi sombong tidak desc saudara htp co bwfe wreuq
ccarenth,flwbck qnya backntar ikut sudah qnya htp co eqiwms t
ccarenth,senang ulang tahun sukses ris nya
ccarenth,eh dodol banyak mau silang goa sudah rumah nenek goa ini sore goa rumah anda
ccarenth,bisa ini
ccarenth,uji
ccarenth,ayo buru kesana retweet dong cak retweet puncak seru itu rum yegak retweet arumwdyani seminggu kelabu
ccarenth,semangat teh tidak patah hati tawa retweet hua cela bosan nic lantai tawa
ccarenth,puncak seru itu rum yegak retweet seminggu kelabu
ccarenth,sudah periksa jak tapi dmnya banyak retweet eh cel anda harus tahu ibu pesan langsung yah
ccarenth,sudah disms jak
ccarenth,jak nomor
ccarenth,hahahart lagu tulus sepatu padahal kalau sama tidak satu ibu sendal jepit bisa
ccarenth,selamat pendeta lely gkp bogor selamat layan
ccarenth,senang sunday
