username,tweet
nneninot1996,tidak tahu
nneninot1996,jadi baik hari tolong
nneninot1996,terimakasih dingatkan
nneninot1996,tonton bola sekian purnama tapi besok saya melayank
nneninot1996,saya
nneninot1996,coban berapa
nneninot1996,nang
nneninot1996,hari cemil pedas minyak hanya suara sudah samar
nneninot1996,rindu ikan ikan utama air nguras kolam utama mikroskop hehew
nneninot1996,rindu
nneninot1996,permisi
nneninot1996,lebih begini kalau memang lagi bosan tawa
nneninot1996,kemarin sudah lihat di beranda sengaja tidak sebut anda kenapa anda tunjukin saya
nneninot1996,terus dapat pesan langsung cuy sudah tawa
nneninot1996,baiq
nneninot1996,humoris lagi nanyain berkas sbmptn saudara instagram yang nanyain sudah isi rapotnya ken sudah tahun lalu
nneninot1996,saudara admin di tahap kembali pilih prodi masih laku anti pilih prodinya
nneninot1996,ayo ngunu langsung ganti password terus log keluar log in ulang
nneninot1996,hola
nneninot1996,melambang depan yang cerah
nneninot1996,grup apa isine mung ngene ki pembicaran batin tawa
nneninot1996,kesal ngempet tidak maido slama tahun tawa
nneninot1996,ariana si bieber jebak dengan tawa
nneninot1996,emoh ingat nizamudin tawa
nneninot1996,keburu dipaido
nneninot1996,saya begitu tawa
nneninot1996,jam gin masih muterin lagu yang ulang sudah
nneninot1996,lagu album lexiconya makna saudara tadi malam habis buat virtual konser lucu
nneninot1996,karena suka jajan tapi pernah olahraga
nneninot1996,buat bong segera buat bong kembar buat bong ki
nneninot1996,nerbener
nneninot1996,saya paham celotehanu itu saya sadar yang nampak tidak arti kandung di
nneninot1996,pinksun
nneninot1996,tidak sabar lihat saudara syan
nneninot1996,mereka pikir saudara laki
nneninot1996,jadi deep jadi benar
nneninot1996,makasy
nneninot1996,baik saja bahagia
nneninot1996,saya tidak akan pegang milik anda tangan ask jika anda ingin tari
nneninot1996,kenapa lupa ada tragedi larang bocor
nneninot1996,untung tidak lok ini tawa
nneninot1996,berapa bilan yang kan ke vantay
nneninot1996,sudah pergi selamat senin semangat
nneninot1996,anda adalah saya favorit semua telah berita anda itu sejak
nneninot1996,tahu saya tidak sempurna tapi saya sudah
nneninot1996,kenal sekali iya
nneninot1996,yoroshiku
nneninot1996,ketemu virtual tidak apa apa saudara syan
nneninot1996,sudah tidak usah kwak hyun tidak normal sabar tidak sekali kalau ngadepin ibu
nneninot1996,kira lagi daripada kata tawa
nneninot1996,anda paksa senyum buat bohong
nneninot1996,nur aulia yulianto
nneninot1996,acak sekali sudah merem kucing lompat muka ntung sayang
nneninot1996,arigatou grad umum haruka saudara melodi ada yang naruh bawang sayang
nneninot1996,motor digituin pe humoris itu warna merah muda
nneninot1996,nya mimpi nyetirin mobil momota tidak kejar paparazi dasar
nneninot1996,adil tangungjawab urus peras
nneninot1996,saja yah begini umur hidup tolong
nneninot1996,peras urus peras ayo urusen dewe lur
nneninot1996,scared untuk jadi sepi akustik vers enak
nneninot1996,doano ndang putuso tapi yoiku kebahagianmu
nneninot1996,hardisk laptop saya sekabeh
nneninot1996,dia orang malam cc saudara syanachan
nneninot1996,sampai merinding saudara syana semoga yang luka sembuh
nneninot1996,selesai nge drama korea ada ost yang nyangkut kepala tawa
nneninot1996,saudara ros nelongso itu
nneninot1996,selamat ulang tahun saudara syanachan semoga sehat yah tunggu konser kamus di jatim asap xx
nneninot1996,sudah selesai kah
nneninot1996,iya  tom tom sama
nneninot1996,ken ngidupin laptop yang sudah wafat abad yang
nneninot1996,yeay
nneninot1996,benar sekali tidak bisa pakai softlens
nneninot1996,lihat tidak beda
nneninot1996,harus
nneninot1996,hai babe heran masih ingat itu password dari ini rekening
nneninot1996,sadako kunci gudang dia nembus televisi nembus dinding
nneninot1996,rumah tidak debat dengan saya luvly tom
nneninot1996,berani tonton hantu begitu
nneninot1996,hotel del luna
nneninot1996,sekali hotel sudah hari ini
nneninot1996,obaiq
nneninot1996,sering bicara kasar kucing belah bisa dengar masih umur
nneninot1996,bisa tunggu
nneninot1996,bagaimana tentang itu jawab adalah selalu iya
nneninot1996,gara gamis atas kepala apel
nneninot1996,merek tiru gasih saudara
nneninot1996,iya tuhan bisa tunggu
nneninot1996,nti kalau sapa tahu dapat juta tapj sampai lebaran tahun
nneninot1996,kira panen thr jt tawa
nneninot1996,kalau lelah istirahat tidak renti
nneninot1996,dapat begini pinksun wekap pinksun wekap begitu terus sampai ultang tahun
nneninot1996,bisa celaka kali senyum yang
nneninot1996,langsung sautin tawa
nneninot1996,tidak tidak tawa
nneninot1996,mudah kompor tawa
nneninot1996,hilang anda
nneninot1996,bagus tugas akhir
nneninot1996,jelas tidak mau lihat selingkuh an begitu kn
nneninot1996,sudah ya tidak bicara model
nneninot1996,bimbang andah
nneninot1996,nya mimpi tonton konser mozart tapi badan pendek terus pakai celana lutut mafkan alam sadar mbah mozart
nneninot1996,sini tugas akhir uhuy
nneninot1996,adudu siji geng
nneninot1996,juga saja
nneninot1996,orang tidak kenal
nneninot1996,kesambet apa tiba tiba nanyain kabar tawa
nneninot1996,untung tidak kadaluwarsa iya
nneninot1996,sekali ditunguin
nneninot1996,kembali dengan diz foto profil tawa
nneninot1996,bentar
nneninot1996,tidak tampil soto sama sekali
nneninot1996,sudah doa segar pergi benar
nneninot1996,rindu xi bo ba
nneninot1996,apaqa rawon
nneninot1996,ter bakpia lah
nneninot1996,mendung cuy ke pantay sayang sekali sudah nyewa motor
nneninot1996,bagaimana lur tawa
nneninot1996,mau jalan ini malioboro pantai
nneninot1996,ambil saya untuk milik anda tempat ketika kita hati bong together
nneninot1996,sandiwara kah ini sekian kita tlah
nneninot1996,serius swedih
nneninot1996,ada jalan ada tawa
nneninot1996,bisa bilang anjur bgmn
nneninot1996,istirahat in damai salah nyanyi suara merdu sukan
nneninot1996,tangis sampai lupa cari tahu punya twitter atau tidak tawa
nneninot1996,kapan terima kasih pakai syi tawa
nneninot1996,scorpio tunggu lagi ngetik balesan obrol sekali tidur
nneninot1996,imdosiar cinta masa tawa
nneninot1996,jaman anak
nneninot1996,dae jang geum sampai sudah lupa jalan cerita tawa
nneninot1996,napas judul musik klasik itu susah hafal
nneninot1996,tiba tiba kedenger musik yang sering sekali saya mendengarkan laptop tapi sejak laptop mati sudah tidak karena tidak hafal judul
nneninot1996,ada pikir
nneninot1996,beda theo tampan gtw lagi
nneninot1996,juga tidak suka pesta suka hadrohan
nneninot1996,anu maaf siapa
nneninot1996,tidak rindu titip cilok sama saya anda
nneninot1996,itu hari adalah datang
nneninot1996,tebak tanggal muda
nneninot1996,belanja eh
nneninot1996,lucu congrats saudara syan
nneninot1996,hitam janda undur november bolelah sabar lagi
nneninot1996,seperti kuat sulap
nneninot1996,gosah
nneninot1996,peta tapi anak tjakeup amad cemil iya kalau blh tahu
nneninot1996,hanya pergi kembali disini
nneninot1996,kamo tapi
nneninot1996,tidak akan paham sih
nneninot1996,anda saat kita alami masa sulit harap anda semua tahan segala ayo bisa ayo semoga ini lekas selesai
nneninot1996,susah cari jajan anak sampai dengan libur
nneninot1996,tidak apa apa jail pakai dandan rumah tapi bwat
nneninot1996,cemil kecintan saya
nneninot1996,pakai gincu tidak sejak masker
nneninot1996,ndekeming sudah
nneninot1996,yang dwong admin
nneninot1996,sudah mau menangiz tawa
nneninot1996,makane youtube iku dokter ojok gawe ngrungokno lagu saja orang ceman
nneninot1996,saya duga jadi negeri cinta
nneninot1996,lagu cinta versi air sekali tidak bosan bosan
nneninot1996,senang untuk lihat saya friends senang karena saya senang
nneninot1996,sayang pramel walaupun telat panas tawa
nneninot1996,jam gin sudah rebah rumah nikmat yang langka
nneninot1996,jodoh yang tidak bosan kalau ajak kebun binatang iya tuhan
nneninot1996,refleks
nneninot1996,kalau suka lagu tidak suka alir ini tidak suara dan terima telinga ini adalah oke
nneninot1996,ibukmu
nneninot1996,suka kesal diri tidak rumit terus otak tidak singkron mulut bilang habis minggu yang malah habis raya betul
nneninot1996,seperti peduli
nneninot1996,kalimat sederhana tapi dampak biasa
nneninot1996,sampai buat ranjau
nneninot1996,simpan sendiri
nneninot1996,sekali mei
nneninot1996,situ tahu hal orang tua bisa lahir perut anak
nneninot1996,suka kerapihan mab tata hanya
nneninot1996,kelen juga lihat iya jodoh lupa
nneninot1996,selamat malam naw terima kasih rangkai kalimat indah
nneninot1996,saya dengan
nneninot1996,apa
nneninot1996,nge falaw tidak tidak
nneninot1996,buka twitter tumben sekali
nneninot1996,untung sudah atur mobil restart jam jadi tidak bablas sampai pagi
nneninot1996,tidur lupa matin youtube sesuatu
nneninot1996,jadi malu
nneninot1996,nerbener buibh setrong
nneninot1996,tahan tidak ikuti sekali jalan tidak tahu berapa tahu yang dapat
nneninot1996,salah episode tom jerry favorit
nneninot1996,apalagi tidak pada utama terus dicuekin
nneninot1996,brgkt pagi sudah siap gila cuci baju dulu terus nganter anak sekolah brgkt keren sekali sungguh
nneninot1996,peka benar kalau lebih ibu tidak
nneninot1996,tidak orang yang tiba tiba loncat indah jurang belah kenapa
nneninot1996,tidak pe
nneninot1996,mimpi
nneninot1996,jujur rindu sekali tonton bola
nneninot1996,ken coba begadang tapi tidak takut efek ngliyeng kemudi
nneninot1996,saya tidak tahu tapi mumed
nneninot1996,yang nglakuin yang tidak saya kenapa keren sekali iya tuhan
nneninot1996,biyen ws wanti ojo nganti lali
