username,tweet
devia_riskaa,saudara wanita itu cantik sekarang nang besok tidak ya saudara wanita sedih ayo semangat saudara wanita
devia_riskaa,sudah saudara wanita sukses tugas nya
devia_riskaa,mula laut cerita semoga iya semoga sampai
devia_riskaa,insya tuhan sakit
devia_riskaa,serius tante
devia_riskaa,cabut tante
devia_riskaa,beda tetap cinta
devia_riskaa,ayo wis gung alon balen bar ashaduala
devia_riskaa,woiya untuk ayo oke
devia_riskaa,anak smantisa ki nyanyi menikah
devia_riskaa,bahan anda nyerang psikis
devia_riskaa,golek pacar kono makane lho ra sama njaluke
devia_riskaa,nyanyi ulang tahun saya kw nyanyi nagih kado
devia_riskaa,moso milik lawa traktir kudune kw nyanyi traktir untuk ayo
devia_riskaa,terimakasih anda bos lawa sok an sibuk
devia_riskaa,dalam
devia_riskaa,ll jadi aman in milik anda suara til datang kembali sekitar
devia_riskaa,mepe gabah
devia_riskaa,itu oke tih nenek meh nang sama saya paham matahari sebentar kene
devia_riskaa,anak oke melu melu saja ilho
devia_riskaa,cingkimin
devia_riskaa,alexander kabar
devia_riskaa,hai lex
devia_riskaa,dia dia dia
devia_riskaa,ketoe ngono gung
devia_riskaa,semoga bantu saudara laki
devia_riskaa,rumah bisa saudara
devia_riskaa,yah saudara laki tidak
devia_riskaa,nambahin saudara
devia_riskaa,periksa keluar ini airbnb listings dari devia
devia_riskaa,lagi ini
devia_riskaa,juga kayak waktu muda guanteng pol
devia_riskaa,terimakasih nom
devia_riskaa,itu adalah
devia_riskaa,kyo pensil inul
devia_riskaa,bandeng presto
devia_riskaa,anda diam
devia_riskaa,yaudeh
devia_riskaa,syemangad tan
devia_riskaa,yoi
devia_riskaa,kodaline semua ingin
devia_riskaa,akan ajar anak saya
devia_riskaa,pergi publik sama kalau sudah menikah
devia_riskaa,ngintilan
devia_riskaa,siap
devia_riskaa,gosip apose neh ki gadis hamil tawa
devia_riskaa,po tampan ek nyl
devia_riskaa,sabar saudara laki sabar tawa
devia_riskaa,internasyenel hutan musik festival begitu saudara wanita lokasi bandung
devia_riskaa,sabar saudara laki tawa
devia_riskaa,hadu hadu coba ngeteh saya terus cerita ada
devia_riskaa,salonpas tidak saudara laki
devia_riskaa,pedih
devia_riskaa,gantungin ros
devia_riskaa,wisuda
devia_riskaa,membangakan
devia_riskaa,dagang kikir candu jok sepeda tuhan maha besar
devia_riskaa,ambyar lagu saudara laki ambyar
devia_riskaa,ada sbmptn saudara sainganya ribu
devia_riskaa,berat jujur
devia_riskaa,tawa makas saudara wanita shintya
devia_riskaa,amin manajemen kepariwisatan saudara wanita topik skripsi ambil strategi kembang malu
devia_riskaa,mantap betuls masih kuliah di stp nusa saudara wanita malu nyusun skripsi doa saudara wanita shin
devia_riskaa,keren magang apa saudara wanita
devia_riskaa,saudara wanita shin di menpar jadi salah fokus kemenparnya tawa
devia_riskaa,pikir saya sebentar riuh wakakakak anda semangat yak
devia_riskaa,telat beli tikete riuh tidak omong kosong pulang skripsi juga di ngko nenek pulang rumah ke jadi lupa skripsi tawa
devia_riskaa,semangat hampa rasa riuh tawa karena juga ya sepi
devia_riskaa,begitu belum riuh kuliah semester sih doa lancar skripsi tawa
devia_riskaa,kandani oke ton
devia_riskaa,terimakasih riuh maaf lahir batin lagi bola tidak omong kosong pulang tawa
devia_riskaa,gin rasa lebaran dari keluarga kata seperti opor ayam micin hambar bosque
devia_riskaa,wis suwi taruh kui taruh tawa wis neh
devia_riskaa,hayo yang mudik hati hati jalan semoga selamat setuju kumpul keluarga cemil ketupat opor sampai kenyang di simpen lebaran tahun
devia_riskaa,saya juga tidak tahu akar
devia_riskaa,tidak ek ayo
devia_riskaa,hidup anak rantau
devia_riskaa,sedih tidak iso
devia_riskaa,sudah sudah di temenin
devia_riskaa,ketawa lho
devia_riskaa,paham saudara laki
devia_riskaa,sudah sms kirim tidak sms balas konfirmasi ya
devia_riskaa,benar harus registrasi sim kartu telepon takut tipu info terima kasih
devia_riskaa,kadang saya hanya punya untuk agar itu pergi untuk agar itu gratis dan tidak pegang juga banyak karena itu bisa buat anda sakit jadi banyak
devia_riskaa,bahagia sederhana semua hak juga nikmat
devia_riskaa,hempas lagi
devia_riskaa,butuh obat tenang tugas kuliah
devia_riskaa,marah tidak hak
devia_riskaa,jijik anak bodoh
devia_riskaa,baik brarti nyanyi lupita tawa
devia_riskaa,sak eling sal tawa brarti nyanyi pikun
devia_riskaa,sedih tidak omong kosong
devia_riskaa,tidak omong kosong sebagai tawa peta yak
devia_riskaa,tawa sama er tawa
devia_riskaa,duwis jare tawa ayo makane pindah kuliah bola saja ajak wis
devia_riskaa,syudah tawa memang kon terus oke mbek kampus
devia_riskaa,hebat indonesia
devia_riskaa,siap ndan
devia_riskaa,siap tunggu untuk saya
devia_riskaa,ken saya ayo bola untuk nin tapi tuhan lain
devia_riskaa,tarawih tanpa keluarga
devia_riskaa,siap bos
devia_riskaa,tawa besok senin sudah kuliah perdana iya saya juga ken
devia_riskaa,juga rindu iya pulang besok desember br bisa pulang
devia_riskaa,bljrlah selagi yang sedang tidur selagi yang sedang utama mimpi selagi yang sedang harap
devia_riskaa,iyoh
devia_riskaa,gek tekan nin
devia_riskaa,tawa iove anda juga smea
devia_riskaa,weseteh iya upla terimakasih
devia_riskaa,nyla maaf lahir batin juga
devia_riskaa,kwe nyanyi meh maju nyanyi harus ngancani
devia_riskaa,tawa edan
devia_riskaa,tawa iya mbek kwe ayo
devia_riskaa,tawa kwe wi lho nin majang rai smea tok saya wis tk jamin menang saya
devia_riskaa,ayo gek tonton ki
devia_riskaa,mesti gek mantengi suci tempat main
devia_riskaa,tawa bukaen pesan langsung anda ran
devia_riskaa,pesan langsung saja py untuk saudara wanita cantik
devia_riskaa,ngono
devia_riskaa,tawa amin
devia_riskaa,lha ayo makane kuwi ran wis buat nyebar dewe oke saudara
devia_riskaa,bar lebaran ki apa ra buat kunjung keluarga ek saudara anak ki spo saja lek an ayo banyak anak warak
devia_riskaa,tawa tenane kae dian koyo ngono kae njipuk pend pkn edan nenek agustus ra iso ran tanggal suk ki wis rono
devia_riskaa,tompo tenan untuk anak kae ki oalah dian ki uksw ingin kumpul ki suwi ra ketemu enake kapan saudara
devia_riskaa,tebak yang untung brarti amin ayo ran kumpul malu
devia_riskaa,dia em pintar ra salah melbu terbang saya ran saudara
devia_riskaa,ayo insya tuhan tahun ran tapi dongake saja malu
devia_riskaa,oalah toh tawa iya ran
devia_riskaa,pirang tahun wi ran kuliahe tawa ayo mugo iso dolan
devia_riskaa,weseteh terbang oke bagaimana lha kapan ospek ran ning kono kuliah oke ran tidak dolan
devia_riskaa,st ki apa untuk ran tidak terbang tidak popo mungkin dal anda ncen ning yogyakarta
devia_riskaa,malu yogyakarta apa ek ran
devia_riskaa,syukur buk ning bola kw dewe ning ndi ran
devia_riskaa,kw nyanyi benci nyanyi mbok cokot tegel saya ran
devia_riskaa,sabar saudara wanita puasa
devia_riskaa,pikir mosok ngaku saja untuk lex
devia_riskaa,kuwi lho lex nyanyi rindu mbek kw ki bagus kode mbok peka misi
devia_riskaa,apa biasa saja anak bodoh
devia_riskaa,lak ra mutu elek
devia_riskaa,misi
devia_riskaa,mbok ben untuk lex kw nyanyi ribut
devia_riskaa,harus kecewa sudah
devia_riskaa,olha anak
devia_riskaa,aduh tk pikir melu saya mit
devia_riskaa,tawa memang bukber ning ndi mit
devia_riskaa,uwis saya saudara
devia_riskaa,dinda nyamari ayo anak saudara
devia_riskaa,tidak yang ngabarin mit tidak tahu
devia_riskaa,iyu mit
devia_riskaa,cieh kapan brangkat ayo breng malu
devia_riskaa,kw meh ning bola untuk mit
devia_riskaa,ngene ayo mergo kwe
devia_riskaa,ceramah riuh
devia_riskaa,ram ra gelem ngaku oke saudara
devia_riskaa,tidak celaka salah yang
devia_riskaa,tidak iso misi
devia_riskaa,tawa
devia_riskaa,olah kabeh salah saya
devia_riskaa,kandani oke ram ncen anak anak bodoh untuk mereka ki
devia_riskaa,iya in dowo masalahe
devia_riskaa,sak saudara wanita wis in
devia_riskaa,balas an apa neh untuk inka salah saya hnya peras saya
devia_riskaa,malesi pria untuk saya
devia_riskaa,halah
devia_riskaa,iya ram tawa
devia_riskaa,ra mutu nyla ki
devia_riskaa,bubar saya ayo
devia_riskaa,ayo wis untuk
devia_riskaa,dinda ki ngopo tok misi
devia_riskaa,saudara
devia_riskaa,tawa
devia_riskaa,iyok ret pria saya ram
devia_riskaa,ketoe iya ram ret omahe tapi ra ret daerahe tawa
devia_riskaa,foto profil untuk maksut anda kui bela ram ra sah sok kenal saya mbul misi
devia_riskaa,oalah tawa mbuh ek ram
devia_riskaa,ooh ning yogyakarta sekolah py ek ram nenek main terus ayo tidak jane
devia_riskaa,sesap
devia_riskaa,sekolah sekolah jepang tawa tidak juga ram
devia_riskaa,selamat ayo ram tawa panjang waktu tidak lihat oke saudara
devia_riskaa,weseteh kece pria saya ram kapan brangkat ksna jek ning salatiga ini habis lebaran brangkat
devia_riskaa,nti sekolah iya
devia_riskaa,iya ram kerja ning ndi ek jepang
devia_riskaa,sesap bola ram sekolah pariwisata
devia_riskaa,saudara syukur ram anda bagaimana
devia_riskaa,pagi ram
devia_riskaa,ngono ayo
devia_riskaa,oalah
devia_riskaa,harus menang oke bagaimana ra gelem kalah oke bagaimana
devia_riskaa,iso apa iso ngewangi saudara laki ngrakit pasar malame
devia_riskaa,ampun bicara seperti ket ada er gek rakit jare suk sabtu nenek tuhan mengijinkan pasar mlme dadi
devia_riskaa,ono apa untuk er tidak erti
devia_riskaa,apa untuk
devia_riskaa,sesap juga lia maki saya li
devia_riskaa,anak bodoh
devia_riskaa,cinta anda juga
