username,tweet
nopiynovi,kesal saat
nopiynovi,ingin eh peta tidak sengaja harap lewat
nopiynovi,selamat pagi saya saya
nopiynovi,gila dikomen budak yang susah pindah nyala sampai tahun tahun mantan
nopiynovi,siapa siapa pura pura lupa tapi memang malas ingat
nopiynovi,senang ulang tahun eja
nopiynovi,tuhan makhluk muncul
nopiynovi,kalau yang kemarin ada kini hilang sudah pikir positif dia sekarang sudah baru normal
nopiynovi,kasihan
nopiynovi,tangkap tiket dikirimin habis itu ditanyain mau di jalan jemput jam
nopiynovi,terkadang semua perihal yang tahan dalam adan
nopiynovi,ngecekin online whatsapp ny itu budak cinta gasih budak cinta tidak milik
nopiynovi,juni semoga ajaib ada di
nopiynovi,bagaimana sombong pamerin gelincir gaji hasil pamerin foto wisuda tidak bisa karena tunda corona
nopiynovi,banyak banyak malah cara porsi baik tiap itu yang beda
nopiynovi,indihome laju lambat kayak untuk tayo
nopiynovi,jam gin bom tidur karena pikir nasi padang iya tuhan
nopiynovi,senang ulang tahun gemar doa buat fanny
nopiynovi,kasi uang thr saja pakai drama basa basi nolak senang jujur dasar
nopiynovi,bom sah nama kalau lebaran tidak dapat tanya perihal
nopiynovi,banyak salah jauh banyak salah virus corona
nopiynovi,garap lur
nopiynovi,lebaran rumah kenal ibu tahun jadi kirim ya ibu peta tidak bisa lebaran rumah
nopiynovi,tidak baju yang semoga pacar
nopiynovi,bawan ken jatuhin cemil lantai agar latih bilang sayang
nopiynovi,syukur cari kembali
nopiynovi,sugeng dalu saudara laki
nopiynovi,cemil sahur kenyang seperti tidak cemil
nopiynovi,baik puasa selesai malam takbir balik mohon peta lahir bathin
nopiynovi,senang ulang tahun saya twitter
nopiynovi,lihat cicak terjun bebas kamar atas ac kasur sumpah benci dasar binatang
nopiynovi,sampai lupa hari libur kapan ya hari oke
nopiynovi,sampai detik tidak tahu nikmat tidur pagi bagaimana saya golong manusia yang paham tidur siang malam
nopiynovi,jaga jarak sudah jaga hati sudah
nopiynovi,benar benar rasa ambyar benar dengar berita duka pagi
nopiynovi,tikus pahala anda taq malu
nopiynovi,soktaw
nopiynovi,juang tengah corona bangun renovasi rumah
nopiynovi,badan rindu sama berat
nopiynovi,hahahahahahahaha
nopiynovi,selamat datang semoga mei milik
nopiynovi,tawa
nopiynovi,pikir ken lihat jerapah gin benar iya tuhan heran
nopiynovi,tutorial tips trik buat dia tinggal sesunguhnya bagaimana penasaran asli
nopiynovi,sahur subuh tidak tidur itu bagi berkah ramadhan ya
nopiynovi,cuma yang kalau cemil sahur lebih banding cemil tidak buka puasa
nopiynovi,malu tawa terimakasih fanny
nopiynovi,terimakasih alarm yang hasil bangun tunda
nopiynovi,yang bingung besok dibangunin sahur siapa saya ajar kasi tutorial pasang alarm yang dan
nopiynovi,bohong pura pura bahagia masuk kategori dosa gasih
nopiynovi,april selamat kartini
nopiynovi,kalau tidak bisa jaga hati jaga sehat lebih saat corona seperti gin
nopiynovi,tidak badan situasi seperti gin buat parno asli
nopiynovi,tidak mau pikir tetap pikir
nopiynovi,skenario tuhan sudah baik saya percaya
nopiynovi,tawa antu baik sikat skripsi ya
nopiynovi,tolong kalau bicara yang sopan anda tawa
nopiynovi,selamat siang lupa cemil karena dilupain gaenak
nopiynovi,sugeng enjing saudara laki
nopiynovi,dulu hingga sekarang virus corona malam minggu selalu rumah
nopiynovi,ngabisin batrai telepon sampai untuk main game masak cacing anak memang dasar
nopiynovi,gaperlu nerka saja tidak ad dan makna saudara laki
nopiynovi,kecapin dituangin kedondong ucapin selamat pagi
nopiynovi,bersin bersin kenapa ya
nopiynovi,wabah corona serang keong sudah dalam golong rumah terus gasih
nopiynovi,ketik bangku gereja bangku gereja kolom pesan salah cara hibur kasi
nopiynovi,semoga tidak tinggal di rumah tinggal dengan saya
nopiynovi,hehehehehehehehe gemar
nopiynovi,takut dosa takut corona
nopiynovi,coba diam
nopiynovi,cemil kenyang rebah buncit keluh
nopiynovi,terimakasih maret semoga april bisa lebih terimakasih lagi
nopiynovi,sibuk
nopiynovi,ya tawa
nopiynovi,corona merana asli
nopiynovi,penasaran pikir omong omong hilang
nopiynovi,memang sudah dan sering rumah karena corona suruh rumah tapi rasa beda
nopiynovi,semoga bisa semoga saya
nopiynovi,nyepi sepi hari
nopiynovi,tawa
nopiynovi,kaum rebah kaum bela lawan virus corona
nopiynovi,semoga benar sosial jarak karena mengangap tidak makanya jaga jarak
nopiynovi,iya tuhan receh
nopiynovi,asli kesal iya
nopiynovi,seperti situasi tahan ketawa sulit saya
nopiynovi,duka saudara laki
nopiynovi,kalau bosan bilang tidak hilang
nopiynovi,sering di hidup sabar semoga sehat
nopiynovi,diri karantina rasa malas mandi jadi
nopiynovi,wakil peras orang yang kena tingalin len
nopiynovi,ada sebar virus corona anjur jaga jarak ya jaga jarak dan jauh tahu tahu hilang
nopiynovi,sedia batas
nopiynovi,semoga corona virus yang ajak serius
nopiynovi,anda arti
nopiynovi,banyak misteri maksud hehehehehehehe
nopiynovi,tawa
nopiynovi,bapak guru
nopiynovi,semoga tidak dalam golong cendikiawan
nopiynovi,orang introvert sudah benar tengah sebar virus corona
nopiynovi,libur gara gara virus corona semua sibuk libur jalan mana
nopiynovi,terimakasih yang baik saya pernah sikap tidak baik terimakasih semoga jadi baik
nopiynovi,kesini sadar ingetin sendiri hidup perihal banyakin ikhlas syukur
nopiynovi,indihome banyak ini sengaja agar hubung agar diperhatin bagaimana sini coba bilang
nopiynovi,tawa siap tahun buat kabar yak
nopiynovi,sampai dajal turun untuk uji sidang anda kerabat
nopiynovi,takut manusia skripsi jaman ini
nopiynovi,kalau sudah buat langsung lihat kedewasan ny kerabat
nopiynovi,sadar
nopiynovi,tawa bukan tua
nopiynovi,orang tua kalau ngetik obrol lama ya tahu tahu yang obrol pendek singkat saja itu sesak tapi seperti penasaran di itu ngebayangin obrol panjang seperti isi surat kabar tidak
nopiynovi,problematika ngantuk tidak tidur sungguh benar ad
nopiynovi,karena pacar sangat sudah mainstream baik teman sangat juga
nopiynovi,utama cacing ujung kesal
nopiynovi,telinga kucing tinggi ya ja
nopiynovi,diucapin baik pagi senang hari libur itu bagaimana rasa
nopiynovi,saya maju ovo oleng
nopiynovi,tawa baca gin langsung tawa iya tuhan
nopiynovi,mungkin ke lain paham jahatin itu tidak
nopiynovi,kalau dari untuk saya
nopiynovi,valentine tidak repot kasi cokelat bunga ya tuhan kasi jodoh
nopiynovi,bagaimana rasa buka telepon bangun tidur terus ad notif selamat pagi penasaran
nopiynovi,semoga saat akan rasa ditanyain ini apa
nopiynovi,seperti gin ini curiga tes cpns tolak
nopiynovi,siklus pagi bangun tidur kerja revisi ngprint rumah dosen pulang sekarang niatin mandi
nopiynovi,hari kesan kalau ad drama kelahi ponakan umur tahun lawan tahun
nopiynovi,tahun pakai behel kali sariawan curiga efek ghibah
nopiynovi,terimakasih januari sudah sidang kemarin
nopiynovi,yang suka tebar janji manis itu waktu hamil ibu ngidam cemil permen karet atau bagaimana heran asli
nopiynovi,sidang kemarin pusing hari pusing yang tunda bagaimana ini
nopiynovi,yang dan dirasain saat bisa ini lakuin orang yang tidak pernah kita sadar
nopiynovi,bom apa tidak kan harap apa ke yang sadar
nopiynovi,tiktok jadi tontonanq buka stories
nopiynovi,arti tidak tapi yang inti saja tidak penting
nopiynovi,kenyang penuh maks sampai ngantuk iya tuhan bodoh
nopiynovi,seminggu
nopiynovi,selamat
nopiynovi,sekali
nopiynovi,bilang gladiresik madu bulan
nopiynovi,budak cinta ros
nopiynovi,memang sadis saudara wanita lama bahagia tenang
nopiynovi,masih git
nopiynovi,biaya inap cemil sana sudah ditangung ya omong omong
nopiynovi,gita sini lebaran rumah malu
nopiynovi,tiket mahal
nopiynovi,twitter tolong buat milik anda sihir pikir
nopiynovi,selamat ulang tahun kemal
nopiynovi,tiba h mesti kuat mental jiwa badan tanya basi basi ngeri keluarga
nopiynovi,salah modus tahu balik
nopiynovi,pulang bangkrut pulang rindu itu isi hati nasib pasang hubungan jarak jauh anak rantau efek tiket pesawat mahal
nopiynovi,saya
nopiynovi,ya
nopiynovi,bangun sahur pagi sponsor bukan karena alarm karena telepon celaka nimpa sendiri tepi dinding
nopiynovi,puasa hari ken bilang tidak ada hari lebaran
nopiynovi,oke
nopiynovi,doa semoga tular cepat sidang skripsi juga saudara laki
nopiynovi,tidak yang soal
nopiynovi,sudah sudah
nopiynovi,sengaja tweet sekarang agar habis jalan malam minguan tuhan basi
nopiynovi,tambah dulu ini saudara laki
nopiynovi,saudara laki liter saudara laki
nopiynovi,sudah pesan langsung
nopiynovi,krl hobyku
nopiynovi,tiap milik porsi kejut bangga laku masing bang
nopiynovi,hehehehehe
nopiynovi,tidak di pesan langsung buka lah
nopiynovi,buka toko buka hati saudara laki
nopiynovi,kalau jawab kasi hadiah tidak
nopiynovi,malas malas pasionq
nopiynovi,tidak tahu
nopiynovi,dilema malam lapar bingung mesti cemil yang ken cemil
nopiynovi,sudah
nopiynovi,kan dasar fakta
nopiynovi,gigit jari sebab cacing itu
nopiynovi,tanda gojek indonesia
nopiynovi,bom tidur diucapin baik malam halah
nopiynovi,langsung pesan langsung cepat
nopiynovi,tapir hehehehehe tapir
nopiynovi,naek ambil si sopir diam bahasa awal jemput sampai sekarang tengah jalan curiga ini anak limbad seperti
nopiynovi,telepon sepi ini
nopiynovi,minat
nopiynovi,minat audisi
nopiynovi,iya gandeng
nopiynovi,tidak
nopiynovi,hahahahahahaha
nopiynovi,lapar bingung mesti cemil itu benar benar buat lapar
nopiynovi,salam
