username,tweet
savirapu,tak ujung
savirapu,saudara wanita
savirapu,misi sayur sop cari nasgor
savirapu,benci yang cemil drama
savirapu,tolong irene
savirapu,ndas kutil
savirapu,bom tawa jumat balik niat
savirapu,banyak mau sekali bawang putih roti
savirapu,gumapsemida somonyim
savirapu,lafyu untuk itu bintang dan bulan tabrak
savirapu,sampai benar lupa naro pa nim itu habis habis niu
savirapu,tidak nyambung jokes ah sebuah
savirapu,monmap benar
savirapu,bar colok tapuk saja lambene
savirapu,sejuk
savirapu,someday someday
savirapu,lanjut tingkat ngebucin bahagia lihat minho bahagia behind itu tempat jadi tkem bareng uni pergi eun
savirapu,mati in punya anda senjata
savirapu,tawa sapa hayo
savirapu,yang tanya
savirapu,ada yang kenapa akun media sosial anda dinamain maryam seperti nama lengkap tidak ada maryam deh saya
savirapu,did itu lagi teman teman
savirapu,dua
savirapu,haiyo mulo ojo sama sebentar neraka tidak jerat hukum sebentar bapak
savirapu,lagi
savirapu,soal kadang orang tua mon maaf konservatif posisi memang posible di banding pengaruh terus kecewa imbas jadi beban buat orang tua kita juga utama bulan saya kerap rul
savirapu,tidak sendiri
savirapu,benci lihat muka orang yang angak
savirapu,huwa kabar sana rindu milik kamar tidak
savirapu,saya in tawa
savirapu,tunggu hiu muncul
savirapu,motivasi
savirapu,ingin jadi yang nya di dengar presiden
savirapu,oknum yang kait nutupin ini adalah manusia
savirapu,tim ngerokok
savirapu,bingung sekali
savirapu,mulai cari promosi tahan hidup lagi besok apa cemil abon sahaja hari
savirapu,jadi pwety gomawo artwork oleh
savirapu,benar tawa
savirapu,kati
savirapu,spoiler evriwer
savirapu,tunggu apa saudara
savirapu,antipeluru
savirapu,bensu lantai lantai lantai lantai lantai lantai lantai lantai ibu rum ibu made rahayu preksu saudara laki kobis wage sebutin sebutin
savirapu,suka kuah rendang nangka si
savirapu,tidak boleh tidak aman tidak salah punya anda diri untuk suatu cannot kontrol tetap kerja kita besar hari akan datang segera
savirapu,jadi buat sekarang terimakasih ibu
savirapu,saya ibu ajar saya itu harus hv itu berani untuk tarung untuk itu benar whoever saya urus dengan wherever itu adalah ive untuk hadap itu l saya in itu benar jalur benar posisi jadi brave tidak susut kembali
savirapu,tapi sudah matu jadi tidak jadi ajadeh
savirapu,seperti racun ya rab
savirapu,pakai sofel sampai jari tangan lupa sekali habis cemil sambal jilat sampai bersih sekali sekali pait getir benar lidah sudah jam hai
savirapu,obat nyamuk elektrik habis memang jadi musibah malam
savirapu,kira otak sekarang
savirapu,asdkfujdlsourbqudpeubqyrlwufirkwz
savirapu,tru sekali kalau ular lagi sleepover dikosanku
savirapu,lafyu
savirapu,tidak
savirapu,oalah dagang offline itu obrol dulu tawa tidak sadar
savirapu,dulu coba poin tidak tawa gapaham saya
savirapu,takut sekali buka whatsapp
savirapu,mode buat reksadana juga
savirapu,yang pakai aplikasi bibit inves reksadana
savirapu,tolong harus retweet
savirapu,alergi kafein jadi
savirapu,mod
savirapu,apa anak
savirapu,kutil kepala
savirapu,kemarin dapat info dari anak kos yogya tidak karantina kalau nunjukin hasil cepat uji yang negatif bajing adalah goin nyala sekarang plz
savirapu,itu pikir saya banyak itu dapat saya disini
savirapu,tuhan rek tulungi rek
savirapu,sudah sampai nyisa episode saja saudara laki tidak paham saya kosong otaku koshong
savirapu,niat tonton habis tkem selesai tawa
savirapu,tidak mksi yang sudah memberi tahu via pesan langsung ibu pm kenapa itu sudah disruh pm kenapa kalau cemil malam harus ikan merckedel tapi trnyta jawab beda itu cara bukan emaknya alias dopelgnger
savirapu,opini
savirapu,tetap pergi saudara laki nanti araseo
savirapu,pria kalau gadis trlu kuat suka yang lembut anak
savirapu,nyadar poster ada quotes liverpol tawa
savirapu,yang tawa
savirapu,truly rasa inspirasi motivated dan kati hari ini terimakasih anda
savirapu,terimakasih anda jer
savirapu,baca tweet lgs paham ya tuhan
savirapu,tumpah tawa
savirapu,favorit
savirapu,raya sedih two akhir episode dengan mendengarkan ost
savirapu,terkahir katy kasih tante sedih sekali sudah tutup usia tidak usia teman teman doa katy
savirapu,bayi nya bundeh bom kasih nama gadis pria
savirapu,keluarga bundeh nama kemet kucing adopsi ibu anda desa tapi memang behave seperti kucing ningrat pulang suka nempel sama orang rumah
savirapu,fleksibel juga ini nyingnying
savirapu,tidak hamil kali bundeh ini gadis yang jual mahal di pegang siapa sampai besar di gigit nama nyingnying bagaimana tidak punya ekor juga nurun dia
savirapu,pertama putri bundeh nama mundih sekarang lagi jarang rumah budak cinta sama pacar tidak cari lagi beduan kolong mobil
savirapu,episode keluarga kucing rumah nama bundeh sepuh tua surotos keluarga
savirapu,begini
savirapu,lama tonton apa
savirapu,yang pulang tidak paham tonton dari episode manpasikjeok itu suling atau apa anak yang suka utama yoyo
savirapu,tujuanya lee rim bawa sama dosa jae rep korea lagi tidak episode kenapa pm kenapa kgt tidak dgr ibu bukan ikan merkedel apa begitu nm ikanya lupa tapi cemil jajangmyeon
savirapu,benar itu mrk lintas dunia lintas waktu lee rim itu ngejar apas benar tidak lee akan memberi bunga terus bilang jalan waktu itu bagaimana
savirapu,sp tahu yang tonton tkem juga dengan sukarela bagi yang bingung slm benang tanya gaje
savirapu,lihat lanjut minggu sama lee akan
savirapu,eh bnr tidak
savirapu,gd takdir yang
savirapu,tidak slh juga tawa
savirapu,mung sisa sak episode
savirapu,takut sekali kalau
savirapu,pusing sekali mahamin manpasikjeok
savirapu,enak
savirapu,teman tapi saya
savirapu,benar hwa rasa anda tapi tidak apa apa ya asik kali
savirapu,tidak tahu kenapa ndah gadapet relasi esensi unggah dengan dalih nyemangatin tawa
savirapu,tawa ada yang pikir seperti
savirapu,nyelupin muka bak mandi habis takut sekali sampai tidak bisa tidur maleman
savirapu,manis malam
savirapu,congratulations
savirapu,apa sudah
savirapu,sudah tidur jail buka tren twitter eh muncul drama lee akan gulir tipis ujung buka dram
savirapu,solok pwt tidak
savirapu,wakakakak
savirapu,sudah putar hari
savirapu,ayo tutup lagu butuh orang yang admin yongi
savirapu,tawa tawa
savirapu,tidak del sebentar balas muantep del
savirapu,sekali malah
savirapu,iya tidak usah ngegas elah
savirapu,budak cinta anda
savirapu,jemput mau ngana rumah nan seperti
savirapu,saya andalas itu januari ya
savirapu,rumah cemil andalas kebondalem purwokerto lor purwokerto timur kebondalem jawa tengah kabupaten banyumas jawa tengah saya carin semoga bermanfat tawa
savirapu,kopi sampai mati
savirapu,mau tawa
savirapu,hindia besok kita
savirapu,semangat besok nyemangatin instagram sama twitter yang dia lagi hiatus jadi omong kosong lihat tawa
savirapu,tidak dekat lagi ken cemil
savirapu,benar adalah tidak penuh taruh kepercayan pada manusia gajah yang dosa tidak dekat sama saja bunuh pakai nanas hamil lagi memang tidak ada ahlaq
savirapu,kalau tuhan masih beda juang bareng tidak
savirapu,berkah saudara laki cemil ngebatin sebentar cemil ya pagi siang sore
savirapu,semoga yang kuat yang lancar depa amin
savirapu,jujur benar apresiasi yang lewat badai kadang tidak pos tidak lihat pasang maksud tidak mau memberi selamat tawa tapi memang gakuat pikir sama bati lagi lemah jadi peta sahabat
savirapu,selesai arti prioritas arti ada niat yang kuat untuk tuntas faktor yang bisa kontrol mari damai dengan sendiri adan kno ini juga shall lulus
savirapu,juga gedeg sekali uninstall instagram waktu bulan lalu apa lalu
savirapu,pada
savirapu,oiya tawa
savirapu,syukur benar
savirapu,admin pakai mic agar admin dengar kalau mau saldo ov lima ribu makas mingrab semoga tuhan anda rezeki yang lancar amin
savirapu,pengene mung gek ndang rampung saja
savirapu,aduh
savirapu,eoma jebal
savirapu,sore hidung sampai pipi sudah
savirapu,gigi potek lagi celaka telepon tidak sekali sudut
savirapu,buka ya suka jajan
savirapu,skripsi selesai wajah ambyar
savirapu,okur sayang
savirapu,untung dela bilang makas uni
savirapu,syukur habis lihat saldo mbanking sangat kuat bodoamat diskon rias sama rawat kulit besar juga
savirapu,rencana tes besok balik yogyakarta hari
savirapu,sumpah
savirapu,mura tapi apa iya beli
savirapu,galak sekali tapi kiyowo sekali
savirapu,aduh
savirapu,kondisi beda kalau sekarang ibu
savirapu,juga ingin sekali tidur cepat
savirapu,tawa takut ketemu orang si jujur saja
savirapu,yang gaberani bis
savirapu,tidak erti jalan hidup
savirapu,coba pusat helpdesk rumah sakit margono rsud bom yang sedia
savirapu,umum rumah sakit kah
savirapu,perlu baca benang
savirapu,jet uji cpr sahaja
savirapu,larange cepat uji rek
savirapu,kenapa cole sama lili bangkrut atas
savirapu,paman siwon kenapa tawa
savirapu,dulu itu koin tidak tawa
savirapu,tuhan syok
savirapu,ailuvpjk
savirapu,bagaimana makas riuh jadi mudah
savirapu,tawa bodoh tahun utama twitter tidak tahu bookmark
savirapu,solusi ingin simpan agar omong kosong buka tweet benang yang tapi malas retweet kirim pesan langsung akun
savirapu,terimakasih anda
savirapu,bingung sekali
savirapu,pencitran itu
savirapu,mutualku yang ambil kursus ielts cilacs ui
savirapu,sudah kali tonton yang malah banjir parah nang
savirapu,doa cara cinta hilang each dan tiap hari deep
