username,tweet
i_frankenstein,sepedane isun brompton jeh ang watir ibu nyanyi nyolong
i_frankenstein,sonoya mizino tingkat jepunya muka tidak saudara laki
i_frankenstein,nownes ada rencana buat dokumenter saudara laki jana ini
i_frankenstein,tingkat julidnya kelas apa ini tetangga bela bahas bahas christian rijanto nina kozok tawa
i_frankenstein,dan istri aju suaka ngatauan negara rahasya
i_frankenstein,tawa hati hati saudara
i_frankenstein,tidak mao dimsum mahal
i_frankenstein,mayan ini chist seling putri saud
i_frankenstein,brando
i_frankenstein,yang ngulum crut
i_frankenstein,mie ayam ngeunah sa dunia ada antapani waluya
i_frankenstein,sehat sehat anda saudara laki sana utama kos gadis
i_frankenstein,amandel ganti biji jae saudara laki
i_frankenstein,kira jae sial
i_frankenstein,ekshibis siskae versi lanang
i_frankenstein,jual edisi ini juta
i_frankenstein,si rumah angkat angkat saudara laki derajat seperti angkat
i_frankenstein,tidak bisa cukur seperti ariel noah
i_frankenstein,dendam banyak mau cumi cabai hijau imah babaturan bayar tuntas
i_frankenstein,itu desain desain buru misi
i_frankenstein,moal ajak gelut saudara laki
i_frankenstein,murangkalih pangkon
i_frankenstein,pemaen timnas garut bambang pameungpeuk
i_frankenstein,ocs ini juragan buku
i_frankenstein,pemaen bola suka cemil goreng paul risoles
i_frankenstein,ikan yang ada ingris salmon albarn
i_frankenstein,tawa tresna jr
i_frankenstein,usaha gebetan wasap
i_frankenstein,video mesum arap yang anda kirim pacar tahu
i_frankenstein,in couples dari mute saya bayar itu paylater buru buru uninstall aplikasi omong omong deactive rekening bagaimana yak basic data saya hilang
i_frankenstein,habis nelfon saya kayak saudara wanita saudara wanita telepon teman saya tolong ingetin temenya bayar paylater inti begitu eh kanjut sangkut paut sama teman saya dapat darimana data
i_frankenstein,tidak kasih jeda hantam saya saudara laki tidak pura pura tidak dengar jelas suara terimakasih langsung tutup memang suara anda dan putus putus sarminah
i_frankenstein,saya ditelfon saudara wanita saudara wanita langgan layan paylater saya angkat bilang saudara laki sudah celaka tempo bayar paylater traveloka tolong bayar saya responsif lingkar cahaya memang suara dan putus putus
i_frankenstein,aselik saya adalah hidup in tidak aman dunia saya heran dia tahu sosial basic info saya dapat data mana
i_frankenstein,saya pakai paylater sore tagih bayar eh rem sekali saudara wanita nagihnya sampai nelponin teman saya omong omong dapat mana sosial basic info saya takut tapi saya sudah bayar kalem cuy lalu uninstall soonest selamat tinggal
i_frankenstein,sudah malam ibu ngetwit
i_frankenstein,suara tidak ubah dulu pra
i_frankenstein,juga ngalamin puasa kelam diri saudara laki
i_frankenstein,sayang yang paling luka merah
i_frankenstein,cemil soto banjar banjar
i_frankenstein,tipikal kota panas
i_frankenstein,masaq pakai
i_frankenstein,jaman sampai dengan memang anderteker legeg loba ceta
i_frankenstein,seperti kevin tidak lari peristiwa saya vin lari lari kevin lari saudara laki run lari harus lari lari
i_frankenstein,saudara laki
i_frankenstein,kemarin cari benang bundir tri uang jerman tidak temu temu
i_frankenstein,jelasin fungsi kero kumis chist
i_frankenstein,gaji gaji samadenganan lemak
i_frankenstein,pucuk surat kota panas semoga
i_frankenstein,cc buntet pesantren
i_frankenstein,nyanyi dangdut suka es elvi suka es
i_frankenstein,ads wan
i_frankenstein,boleh udud tidak crut rokum sakaw begitu
i_frankenstein,ratus papar puluh mati topang ekonomi puruk sudah segera cing saladar dong euy
i_frankenstein,ada yang becandain wabah virus mana hilang pekerjan dapat warkop tukik rencana buka warung sendat
i_frankenstein,indeed
i_frankenstein,pacar
i_frankenstein,belum formasi ber
i_frankenstein,coba sebut baskara putra saudara wanita
i_frankenstein,anda sirkelmu
i_frankenstein,seperti famouz saudara laki lahir kembali
i_frankenstein,sampar tambun hedeh tempat jadi myuzik gin ya
i_frankenstein,saudara laki untuk wawuh kandang euy
i_frankenstein,di kos bisa ewi main mobail lejen
i_frankenstein,yang nongkrong sydwic ngapake masker
i_frankenstein,boca dermayu ged ning cerbon ngalih ning tangerang
i_frankenstein,konser batal tadi penganguran
i_frankenstein,buah arab buahlul
i_frankenstein,sambil udud difuh fuhin gorden tidak saudara
i_frankenstein,tae jam gin muncul timelime foto cemil lagi cemil nasi ini siap
i_frankenstein,nuhun sabandungeun
i_frankenstein,pulang indonesia chist
i_frankenstein,pekerjaan gusti nu agung
i_frankenstein,ini mantap ada asing alienya
i_frankenstein,momen cirambayku tinggal mati
i_frankenstein,bdsm
i_frankenstein,tawa benar muka anda
i_frankenstein,aktifitasku saat tinggal ciumbuleuit
i_frankenstein,bicara agronomi istri kasih sayang adalah buah capai fase hidup
i_frankenstein,malu
i_frankenstein,saudara saya ini teh
i_frankenstein,istirahat in cinta saudara laki
i_frankenstein,benar gi lagi kerja episode
i_frankenstein,sama tomo ngobrolin tempo lari lari belum pakai earpiece banjir jakarta sampai baca quotes mati sticker gitar toyong eyesun kakang sakit hilang itu saat istirahat in cinta saudara laki
i_frankenstein,malam ketemu utama ngobrol bareng pagi dapat kabar kakang drummer polyester duta mati dunia serang jantung tenang saudara laki
i_frankenstein,hai karolina disini
i_frankenstein,burjo kuningan detected
i_frankenstein,wilujeng sumping graham
i_frankenstein,hedpun hay en malu
i_frankenstein,indonesia traktir ya
i_frankenstein,kalau ngapunya alergi gatal biji harus coba cumi cabai hijau po
i_frankenstein,tidak
i_frankenstein,ya kota panas
i_frankenstein,tumben ini taneman tumbuh darat nama cirebon
i_frankenstein,kadu yang buat nyeri benci
i_frankenstein,sekali bawa begini jerman
i_frankenstein,kalau takut tular dosa lain chist
i_frankenstein,masya tuhan tonton netfix diharamin bir dihalalin dunya
i_frankenstein,saudara wanita gardujati bom ganti
i_frankenstein,tidak mie saudara laki
i_frankenstein,tegang foto
i_frankenstein,harga porsi tambah es jeruk tambah kerupuk rp
i_frankenstein,malam sen yamin manis spesial teman spesial sen yamin baso dua
i_frankenstein,depan pacar jualanya rumski lawas
i_frankenstein,yoih bakmi di jalan ancol iii pasar ancol
i_frankenstein,anda pada bakmi sekali lidah anda mesti coba bakmi
i_frankenstein,bubur saudara laki masih tidak chist
i_frankenstein,ajak ngbrils
i_frankenstein,buk gerai kebab hits kota panas
i_frankenstein,teman kota panas kirim foto demi konfirmasi yang seragam sftc saudara laki wisnu
i_frankenstein,cebok bersih baru pasang kopi mahal saudara wanita
i_frankenstein,wedang
i_frankenstein,vrom jepang jajar pasundan
i_frankenstein,gembira sekali kipas angin
i_frankenstein,yandi oeban
i_frankenstein,yang buat gaduh chist
i_frankenstein,wagelaseh saya jadi kromosom
i_frankenstein,peluk sini dudu
i_frankenstein,tulis dong jemski
i_frankenstein,myuzik scoring sih saudara lelah
i_frankenstein,pasang geuleuh geuleuh beranda ramai
i_frankenstein,punya akun ubah pasang pasang dunia kondang
i_frankenstein,rakyat
i_frankenstein,tidak frigi frigi pertama
i_frankenstein,orang ibu ngatauan di yurop
i_frankenstein,biji
i_frankenstein,fans ardhito marah marah
i_frankenstein,kenal tidak chist
i_frankenstein,whatsapp enak sekali suasana pagi aston vila mirip nada
i_frankenstein,khutbah jumat tentang rukun semoga rukun rukun apa kemelut sidang jumat mulia
i_frankenstein,tahun ya crutski
i_frankenstein,menangos
i_frankenstein,kilas medio dekade adalah nikmat ganti tahun pcs tonton mufi sampah makan bir kadaluarsa
i_frankenstein,pokok
i_frankenstein,tahun ada indonesia tidak
i_frankenstein,saha chist
i_frankenstein,di indonesia ini tunjuk direktur galak model begini
i_frankenstein,tidak tidak ini waktu nyonya
i_frankenstein,gila siang siang gin yang nawarin microsoft muka pro
i_frankenstein,usaha saudara laki
i_frankenstein,hidup tidak batas pinned obrol gitaris eyesun sedang sambi jual kopi botol
i_frankenstein,aji tahun semoga doa doa dijabah amin
i_frankenstein,latih tri kordinator urus publik bidang maslahat dunia
i_frankenstein,mual mual lihat pesan whatsap dari ratus nomor apakabar admin jabar quick tanggap
i_frankenstein,ngobrolin dunia perjurigan kali kangmas ngahuleng tarik
i_frankenstein,senam ibu taman lansia lagu remix entah apa teh senam gep grep
i_frankenstein,percaya dunia perjurigan asing percaya ibu
i_frankenstein,hareudmey enak buat mojok siang mendung ibu
i_frankenstein,kasi conto bil
i_frankenstein,disave dulu saudara wanita
i_frankenstein,such hidup bujang kota
i_frankenstein,tunggu saudara laki c saya t ngetwot hijrah
i_frankenstein,terus jakarta supratman tutup untuk berapa alas
i_frankenstein,ngamauan jajah itali saudara laki keren begitu
i_frankenstein,desah aksen sunda itu bagaimana tolong jlskn
i_frankenstein,google pixel anyar bagus tidak rekam desah
i_frankenstein,soreang ti lawang tidak ada rangsang ukhti rayu
i_frankenstein,saya berfikirnya sala film biru jepang
i_frankenstein,beberapa saya begitu
i_frankenstein,tiba tiba jadi sopir gofod alih alih dapat eksib tidak nganter apart
i_frankenstein,dieue sasatoan
i_frankenstein,bodoh
i_frankenstein,sayang ayah pis
i_frankenstein,waloni garis keras
i_frankenstein,teman dunia lokasi pos sosmednya ini bandara kertajati
i_frankenstein,lalak semuwa
i_frankenstein,liuk nada bawa tahun
i_frankenstein,tidak berekspektasi tinggi anda musim fans chelsea silah tertawa
i_frankenstein,lari putar takabur jalan diponegoro progo sheny binasih
i_frankenstein,memang alus pis chist
i_frankenstein,begr kadua
i_frankenstein,lumayan obat rindu kota panas omong omong depan bch harga ribu porsi
i_frankenstein,layar
i_frankenstein,anda saudara laki
i_frankenstein,tuhan tuhan
i_frankenstein,hanya negara kembang
i_frankenstein,kapal pesiar mewah akan layar hari
i_frankenstein,unpad tidak deret kampus layak etapi ciwi ciwi sekeloa bolela
i_frankenstein,ibu gadis kimp
i_frankenstein,kampus paling layak bandung itb ibu ngambil fsrd katanyamah
i_frankenstein,tolong tangan sidakep diamanken
i_frankenstein,muterin anak laki pablo
i_frankenstein,warga ciumbuleuit sedih kawasan bukan prioritas pln
i_frankenstein,rasa
i_frankenstein,kali gagal mufi mufi maraton gara gara website alat kelamin
i_frankenstein,kemarenan ketemu tari tari mahir kwrenz
i_frankenstein,anyeng buat benang tidak becus saya
i_frankenstein,motor teknologi rem mutakhir
i_frankenstein,hampura
i_frankenstein,utama
i_frankenstein,bagai putra zona
i_frankenstein,pemuda sukra wetan
i_frankenstein,jalan jakarta pantau normal ruas ruas jalan pusat bisnis mulai padat macet normal
