username,tweet
linggaralfi,kucing lindung
linggaralfi,pintu
linggaralfi,sampai kenal saudara wanita saudara wanita bakul bakso cuy
linggaralfi,cepat saya tidak kenal siapa smasa ei
linggaralfi,sebentar siap kalau saya semaput wkekeke
linggaralfi,ulas jujur ayo sit saya malah mules tidak coba coba wo chloe ting kalau belum
linggaralfi,bagaimana letak kere saudara laki tengah jalan sudah nang nang
linggaralfi,ikut wo chloe ting ulas lain saya pingsan mual keringetan tidak pingsan astaga anak bodoh
linggaralfi,cuma sih tidak teman polisi
linggaralfi,yang pelatuk kejut
linggaralfi,kurang adoh dolan
linggaralfi,gas la mumpung saya saudara laki kledung tawa
linggaralfi,mungkin cerca
linggaralfi,saudara apa renung rumah kalau yang pada di
linggaralfi,pasar entho hep tawa
linggaralfi,ayo besok nongkrong awokwowkok
linggaralfi,cuy posisi
linggaralfi,bleaching tetap pakai cultusia bagaimana tawa
linggaralfi,cuma yang suruh orang tua warnain rambut tidak pakai merk miranda cultusia murah permanen warna makin rambut mudah rusak uban
linggaralfi,nyoh
linggaralfi,satu orang henti ikuti saya otomatis periksa oleh
linggaralfi,siwarak si
linggaralfi,mantan calon pacar
linggaralfi,belum sudah boleh ini tawa
linggaralfi,tidak tahu tidak tahu serah
linggaralfi,rasa tidak asing
linggaralfi,bagaimana rambut jadi tawa
linggaralfi,tawar harga tinggi ambil awokwowkok
linggaralfi,korakora
linggaralfi,masya tabarakalah hutan negara gus
linggaralfi,rasa penasaran tg pakai saudara wanita tay tutup sudah
linggaralfi,dih sial menang mager daripada rindu
linggaralfi,benar omong omong
linggaralfi,salahe mancing
linggaralfi,kali coba seng murah untuk saudara laki
linggaralfi,tiba tiba hampir saya mantan
linggaralfi,ken
linggaralfi,ken nasgor solaria cemil murah menu solaria
linggaralfi,orang yang kemarin kemarin jalan jalan sekarang punya gejala positif tanya sudah tes belum ya tidak ya
linggaralfi,tidak bagi
linggaralfi,imut benar nama
linggaralfi,hilih saudara wanita omah ono sego
linggaralfi,gugling ya
linggaralfi,ada laris orang jawa
linggaralfi,satu orang ikut saya otomatis periksa oleh
linggaralfi,lanjur pw rumah
linggaralfi,kan
linggaralfi,kiro vionita seng podo jebul tongone tawa
linggaralfi,saudara pintar sekali uang jual masker untung tidak langsung habis beli gimbal es campur
linggaralfi,dompet ketinggalan tempat cemil habis luar kota ingetnya tidak sudah mau sampai
linggaralfi,yah tidak tahu pelosok saudara laki
linggaralfi,alfamart dekat dom semoga demak saudara laki
linggaralfi,kalian pikir kalau saat usah instansi yang wajib calon lamar harus negatif corona riwayat kesehatanya
linggaralfi,kenapa tidak dipangil yuni si
linggaralfi,tidak jadi rara
linggaralfi,fara memang hitz awokwowkok
linggaralfi,tuhkan orang ngeyel
linggaralfi,nyepeda sampai motor buka risiko sama
linggaralfi,lapar
linggaralfi,ganti nama lili
linggaralfi,tumpah sudah di hapus cupu
linggaralfi,nama sudah ganti rara tidak ada diba kita
linggaralfi,jah temenan diba
linggaralfi,sial saja punya alam seperti begitu
linggaralfi,kasih tunjuk
linggaralfi,tumpah tolong agar calon imam aman dia
linggaralfi,tan tidak saya isi pertama buat
linggaralfi,aerobik menit pagi papan detik sore hari tawa
linggaralfi,balas saudara
linggaralfi,senang otot tangan bentuk
linggaralfi,tidak salah cerca
linggaralfi,positif lur
linggaralfi,satu orang henti ikuti saya otomatis periksa oleh
linggaralfi,kenapa jomblo
linggaralfi,punya tidak ketemu bagaimana saudara
linggaralfi,orang bisa ketemu pacar
linggaralfi,sudah haji
linggaralfi,tolong teman manteman
linggaralfi,jual grup facebook ji tawa
linggaralfi,nyalon sini
linggaralfi,deh
linggaralfi,iya anak twitter maret ibu
linggaralfi,utama facebook nagih juga
linggaralfi,demak dit demak
linggaralfi,mashok
linggaralfi,senang ulang tahun
linggaralfi,farick aman hobi glundang glundung seperti telo
linggaralfi,sudah diba nongki nongki ya kalau jombs
linggaralfi,saya masuk yang nglunjak
linggaralfi,cerita kalau tidak apel yang bahas korban mati semoga karena corona banyak sekali tambah parah memang rahasia agar tidak panik eh malah nglunjak
linggaralfi,kalau tanda kasi kado
linggaralfi,lewat tanggal admin
linggaralfi,moh lelah louder louder tetap tidak dengar tawa
linggaralfi,laki laki perempuan sama boros cara beda masalah jenis kelamin pribadi sendiri
linggaralfi,ketemu tidak baru lulus sama
linggaralfi,pernah ketemu idham alfamart temangung malu duduk depan minum teh awokwowkok
linggaralfi,yang baca bukan tawa paham tidak basa krama
linggaralfi,kalau karetengah admin awokwowkok
linggaralfi,anda tahu dari selangkung
linggaralfi,astaga orang anak
linggaralfi,utama nintendo benar lebih asik mas awokwowkok
linggaralfi,sial desa halaman memang coco rebah
linggaralfi,tugas akhir janji tapi agar jaga jarak tawa
linggaralfi,tunggu kado
linggaralfi,selamat ulang tahun anak
linggaralfi,anda fahmia utama twitter tawa
linggaralfi,kerja tangan lelah jari kaki
linggaralfi,satu orang ikut saya dan satu orang henti ikuti saya otomatis periksa oleh
linggaralfi,palir ibu hajah
linggaralfi,hoh waktu malam lebih mantap
linggaralfi,tutup besok pagi buka
linggaralfi,semoga ini tugas akhir tawa
linggaralfi,teman teman pada tidak mau nyalon kan mampir kesini ghibah
linggaralfi,anda iya
linggaralfi,memang sekolah mana maniez
linggaralfi,aduh aduh
linggaralfi,lulus
linggaralfi,tidak sangon kn
linggaralfi,mayan dapat uang ini
linggaralfi,bisa
linggaralfi,ada orang keramas sekali
linggaralfi,orang ikut saya otomatis periksa oleh
linggaralfi,saja orang gejala sehat rapuh dalam
linggaralfi,apa adil senang kalau pakai atur buat putih kalau cahaya bonus tawa lama sama pakai dan benar benar ampuh
linggaralfi,memang saudara laki oky bagaimana kalau
linggaralfi,akan lee admin ho bicara basa indonesia tawa
linggaralfi,coco salur televisi lanjut tingkat
linggaralfi,owalah pantas
linggaralfi,ditayangin
linggaralfi,kan benar saja dubbing kalau drama korea tayang indosiar
linggaralfi,stockbit saudara
linggaralfi,apa nama cantik kalau tidak cantik nama
linggaralfi,coba ndas borok saja kalau tmg
linggaralfi,cemil
linggaralfi,baru ngetik kalimat sudah dikatain drama kasi
linggaralfi,sang dewi
linggaralfi,kene
linggaralfi,pono tutup
linggaralfi,tidak haram
linggaralfi,ulur waktu lama untuk temu cara tidak pribadi egois
linggaralfi,orang ikut saya otomatis periksa oleh
linggaralfi,craftingnya tidak sabar
linggaralfi,bom komplit wan tawa gasik
linggaralfi,utama hewan simpang terus bosan tidak utama mau apa
linggaralfi,diba memang dendam
linggaralfi,lingar memang hibur
linggaralfi,sesal kalau masuk grup sus awokwowkok
linggaralfi,tidak dimafin sus diba tawa
linggaralfi,saya minoritas
linggaralfi,buat siomay kyknya yang benar benar kentang kol telur rebus
linggaralfi,positif saudara wanita
linggaralfi,di tmg chatime
linggaralfi,spotify anda tidak premium awokwowkok
linggaralfi,tidak ada tweet yang pin memang tidak tweets yang
linggaralfi,tidak tahu anda anak instagram
linggaralfi,yang merah
linggaralfi,gin tidak tahu
linggaralfi,ibadah la
linggaralfi,gin
linggaralfi,lagi nabung ke surga ikut tidak
linggaralfi,drama jepun thailand bagus sama
linggaralfi,malas tonton drama korea buah maju
linggaralfi,po wani farick nantang
linggaralfi,seperti gin tidak
linggaralfi,siapa untuk siapa
linggaralfi,rewatch drama temu tamat
linggaralfi,susah kalau
linggaralfi,saudara subur
linggaralfi,tinggal nanem tempat dingin
linggaralfi,ini kasi saja
linggaralfi,saja
linggaralfi,untuk informasi anda rumah saya nandur stroberi
linggaralfi,sampai pangilan jadi uminah
linggaralfi,selamat ulang tahun biw
linggaralfi,agar yang tidak buat tweet aplot foto foto diri anda kasih hastag yang tren fit
linggaralfi,kalah cahaya
linggaralfi,hidup foya foya
linggaralfi,selamat ulang tahun saudara laki azk
linggaralfi,memang enak buang buang duid
linggaralfi,saya bilang mantan goals pacar goals
linggaralfi,kenapa mantan goals sekali
linggaralfi,bagi foto
linggaralfi,tanda
linggaralfi,siapa
linggaralfi,siapa diba pacar teman kelas sekali
linggaralfi,maaf
linggaralfi,mantan diba mudah datang mudah pergi
linggaralfi,tidak paham saudara
linggaralfi,tinggal pilih salah nya kalau tidak suka saya sering begitu tawa
linggaralfi,tumben dita kalau ngetwit benar
linggaralfi,bisa tidur
linggaralfi,iya kasi
linggaralfi,sampai nyewa kaset tonton keluarga
linggaralfi,anda anda yang peran
linggaralfi,anda ken jadi ratu karena tonton drama kolosal indosiar
linggaralfi,jaman jaman drama nakal cium sampai teman ken awat karena drama dan dia awat benar
