username,tweet
kasurlante,tawa terap sekretaris syopi
kasurlante,juga tidak sampai dengan beli sepatu tidak coba buat sepatu dibantuin jual terus elus paha dalam saya tidak pakai rok dia elus kulit paha ken berontak kasih tahu ibu tapi takut
kasurlante,saya tidak arah pulang kos ke rumah yup jadi posisi badan tutup jaket pakai celana dan helm motor tidak magrib pepet pria terus remes payudara kanan saya memang setan tidak mgrib salah saya yang motor magrib
kasurlante,lha itu bayi mamoth brojol besar bagaimana sik
kasurlante,ken julid teman yang suka pamerin pacar status whatsapp tahun tidak pacar tapi balikin diri apa gara saya iri tawa punya norak begitu cara saya dengan ngebucinin taneman ini kenapa
kasurlante,saya tidak arah pulang kos ke rumah yup jadi posisi badan tutup jaket pakai baju dan helm motor tidak magrib pepet pria terus remes kanan saya memang setan tidak mgrib salah saya yang t tidak tinggal rumah
kasurlante,pinfong
kasurlante,sudah isi saudara tapi gara kapasitas otak kecil memang nya sulit paham
kasurlante,kopikap untuk tentu
kasurlante,ajar jarak ini jadi permanen ajar jarak polos tapi hibrida model adaptasi teknologi pasti akan lagi nadiem rapat sama komisi dpr
kasurlante,kemarin tonton eh dokdes
kasurlante,mon peta saya akan tolong ganti apa bagaimana
kasurlante,jadi imut ingin kunyah mereka
kasurlante,kejut ini adalah apa butuh saudara wanita lihat seperti gin
kasurlante,obrol pria keingetnya mantan kalau bahas seperti gin dia lebih seru
kasurlante,tawa humoris
kasurlante,sakit sekali tidak tengorokan terus dada
kasurlante,sekali anak yang ngambek ajak ortunya tapi di itu sama waktu tidak berani marah
kasurlante,beli geprek teman cerita titik kali ketemu pacar ken pura tidak dengar tidak sopan
kasurlante,libur
kasurlante,lagi celaka cinta itu kadang nyebelin orang sekitar suka cerita pacar orang tidak ken dengar
kasurlante,saya umur
kasurlante,panci pangsit
kasurlante,jadi fungsi sudah tahu dari cuma tidak tahu fungsi
kasurlante,guru jas tidak sama sudah tua perut satu pak tengah lingkar sekarang sudah mati
kasurlante,miskin
kasurlante,saudara wanita lia tinggal memang viewnya bagus
kasurlante,hai semoga ketemu amin
kasurlante,ada karyawan pria si cangung kalau orang nyata dia saudara kelas sama obrol ngalor ngidul mulayan seru hibur pekerjaan yang suntuk
kasurlante,ayo
kasurlante,menemani ini bwang
kasurlante,jelas apa
kasurlante,pagi sudah bersliweran
kasurlante,tawa patimura lihat gemuk situ seingetku ajar sampai dengan beliau kurus
kasurlante,tiap hari adalah hanya yang lain hari untuk tahan
kasurlante,pantas peras tidak kenapa in tapi tep tanjung tahu memang malas se
kasurlante,selamat malam saudara laki tanya perhati penuh bagaimana cara bedain tidak paksa untuk banyak sama careless terima kasih
kasurlante,ngeblock nomor whatsapp bos tidak
kasurlante,ini tidak pakai tidak harus mengunakan produk mobile banking
kasurlante,dokter
kasurlante,guyon tapi tetap ngekek
kasurlante,rasa anda saudara wanita operasi desember kemarin kondisi nenek makin buruk tidak temenin beliau sempat bilang tidak pikir tugas kerjain hari puasa beliau mati tahu saya ken buat untuk beliau
kasurlante,suka journaling tidak saudara kasih tips konsisten untuk tulis
kasurlante,semoga yang datang hari yang belum temu dengan jodoh baik yang tuhan beri kuat sabar uji yang tuhan ikan
kasurlante,sekali buat skenario sinetron saya istri seperti pokok yang tidak jadi di nyata hidup saya pengirim
kasurlante,tidak ada khajatan ini kayak
kasurlante,mie rebis
kasurlante,tuhan itu hurts
kasurlante,tidak pengirim kena es dikit sakit
kasurlante,itu lagi coba untuk lupa itu lagi ingat anda
kasurlante,saya sudah terimakasih anda
kasurlante,jarak tentang pantas orang hubungan jarak jauh an bain cuma ketemu jam doang
kasurlante,jika hanya bisa lewat ini minggu
kasurlante,tidak perbarui bwang
kasurlante,kejut
kasurlante,jongkok
kasurlante,link tidak bisa saudara wanita
kasurlante,tidur jam
kasurlante,kayak semangat saudara wanita
kasurlante,semangat saudara wanita
kasurlante,terimakasih untuk ada sebagai jadi milik anda comics adalah awesome
kasurlante,bib
kasurlante,cangkir
kasurlante,sudah wondering bagaimana banyak toilet papers dia needs untuk buat itu benda baik kerja meskipun
kasurlante,tawa terimakasih salah orang yang baca lhoh
kasurlante,omong omong ngefolow dari folowernya rban kemarin ngecek rban sekarang sudah ribu
kasurlante,apa adalah celery benar rasa seperti
kasurlante,yang saya lakuin tidak buka telepon kasih waktu tidak menit sadar napas memberi afirmasi positif untuk hari itu
kasurlante,lagi info berita palsu grup keluarga
kasurlante,kalau habis buka hajar nasi yang ringan pengirim baik kasih buah lembut deh habis isya cemil
kasurlante,jokes teman sudah buat dalgoblok bom tawa
kasurlante,selamat siang saudara izin misal ktp domisili malang hilang kabupaten jepara alur pengurusanya terima kasih
kasurlante,jadi sedih
kasurlante,ken nimpuk muka tawa
kasurlante,sama sekali awesome
kasurlante,buat benang dong dokter
kasurlante,privat
kasurlante,tidak sadar kalau ajar tahap adl masa kuliah pikir lha ya kuliah tahap gin ajar semester telah sadar jadi saat sampai dengan sama
kasurlante,sekolah negeri internesyenel rumit
kasurlante,tawa humoris ini
kasurlante,di aplikasi ruru radio saudara
kasurlante,apa
kasurlante,tidak kuliah ini sudah ganti baju di kos rebah motor di kampus saking magernya tolong teman ngambil
kasurlante,sumpah sudah dari rumah buat jadi jam gara diri oleh
kasurlante,tahu dalam indomaret kopi an
kasurlante,tidak drama begitu
kasurlante,cobak duwe mobil apik gaji besar mesti iso nuku omongane tongo ibu
kasurlante,tidak onok mikrofon
kasurlante,sekali
kasurlante,kamar seperti istana yawla
kasurlante,bosan hari
kasurlante,cantik sekali
kasurlante,ajar online tentu yang buka gretongan mendengarkan pidato teachers guru tinggi yucup
kasurlante,olahraga baca buku lebih waktu untuk apa
kasurlante,baik pekerjaan sudah pada rumah
kasurlante,kenapa si tidur gelap gulita selalu pikir hantu muka persis tidak buka
kasurlante,parah memang kalau percaya dipraktikin memberi tahu percuma
kasurlante,kemarin di grup keluarga
kasurlante,wawawadadidaw
kasurlante,boleh
kasurlante,imbost sungguh helps saya poor imun sistem
kasurlante,sibuk tapi tidak hasil baik
kasurlante,acak taruh ngotor in beranda
kasurlante,sih seragam kreatif gemas
kasurlante,unduh inspigo podcast kira bagus
kasurlante,apa called sawang sawang
kasurlante,bisa punya itu untuk saya dosa
kasurlante,ini adalah jadi lucu
kasurlante,tadi tonton video humoris pacar tapi gilir diplay malah hilang cari tidak temu
kasurlante,itu tren tema meskipun
kasurlante,lhah apa
kasurlante,dia sudah dapat kalimat
kasurlante,saya ll lihat bagaimana banyak pages baca baca hari ini
kasurlante,kalau dijadin judul sinetron indosiar apa
kasurlante,boleh juga ini bisa baca bab buku dalam duduk halaman sudah ngantuk
kasurlante,lana del rey tawa kemarin rasa nyanyi jelek hafal lagu
kasurlante,detik sudah ken ngata in detik ken ngata in sendiri tawa
kasurlante,kalau tahu tidak apa apa admin
kasurlante,tahan pap tengah macet
kasurlante,selesai milik anda kerja enak utama telepon
kasurlante,radio
kasurlante,karena muka sudah nyolot
kasurlante,saya ibu adalah nyala itu tahap yaitu lain parents adalah asking tentang bagaimana banyak uang dia children bisa buat in mes untuk tunjuk mati mereka children gaji bacod anda
kasurlante,kevin itu acar
kasurlante,untuk puncak mati saya tidak sehat makan biasa ngremes mie goreng mentah
kasurlante,kamar tinggal seminggu debu senti
kasurlante,bagi bisa kenyang gara cemil smoothies
kasurlante,jam gin ngantuk tapi utama telepon gilir megang buku menit kantuk tidak tahan
kasurlante,buat konten
kasurlante,tuhan saya beli tas kanken
kasurlante,dimaskerin badan bang
kasurlante,poor orang kena seperti hujan
kasurlante,tidak soal kualitas sekolah kampus jenis ilmu sana saja sadar lingkung bentuk mereka
kasurlante,lembut ketrampilan alam organisasi prestasi akademik non akademik
kasurlante,tiap masuk jam pengirim kos jam sudah jalan jari kaki kos kampus langkah sampai
kasurlante,panggil keluar saya name itu weknd enak sekali
kasurlante,sekali
kasurlante,lucu ini
kasurlante,indi kopi senja saudara wanita
kasurlante,halina kawin robi cemas frustasi hafal sampai
kasurlante,pernah ketinggalan telepon kampus lacak pakai aplikasi dan benar memberi detail tahu disimpen dosbing tidak habis bimbing
kasurlante,ada lks latih sifat ayan tentu paham bisa dong
kasurlante,jadi rasa salah soal anak kelas sudah beban ajar
kasurlante,dokter kalau tidak kasih kerja rumah murid saya tidak mau ajar tangis
kasurlante,benar baca kaskus sudah sekali
kasurlante,waktu sore hilang saya sadar saya utama telepon auk
kasurlante,bekas saudara wanita
kasurlante,banyak mau apa sudah
kasurlante,terima kasih admin saya unduh
kasurlante,amit pengirim
kasurlante,omong omong tidak pakai sepatu begitu memang aman saudara gerakanya ringan sekali seperti
kasurlante,bukan otak saya dong ngeres
kasurlante,cium syariah
kasurlante,dosen begitu memang benar kasih terus sampai ikhlas
kasurlante,hati pulang malam
kasurlante,habib sudah memberi bocor amerika ini serang
kasurlante,klaim introvert
kasurlante,tidak tahu
kasurlante,itu akan tidak pernah jadi unfortunately
kasurlante,baik yakin dokdes ning negeri dodol tumblr
kasurlante,tidak apa apa untuk tentu saya maaf
kasurlante,kolektor tumblr tenan ini
kasurlante,maksutnya ini
kasurlante,tawa regane tidak sitik saudara wanita kango
kasurlante,tahu saudara laki buak hapemu begitu iya tidak sampai sama saiki ws ayo kira wis besar tidak uring anda
kasurlante,sial sudah jijik ras pula tawa
kasurlante,kenapa bawa rasa sial
kasurlante,benci hanya in kasus benda
kasurlante,reaksi mlongo lama diplay video tawa cermat uni duniawi
kasurlante,buat ayah saudara semoga beri sehat
kasurlante,sakura saudara
kasurlante,bagaimana bisa itu jadi
kasurlante,salin dari saya pikir memang jelek
kasurlante,bintik lihat bosan begitu tidak tahu berat
kasurlante,takut dari jadi kiri oleh saya lingkung
kasurlante,kalau sudah tabung sampai lagi kalau paksa bisa balikin
kasurlante,saudara cania pipi gemesh
kasurlante,duka bang tebe semoga keluarga tabah
kasurlante,saja beli organicup
kasurlante,tidak gosok itu saudara
kasurlante,tawa korban hafal
kasurlante,gasengaja baca begini solatku terima tidak e saya tidak solat
kasurlante,cupang
kasurlante,dia atas
kasurlante,itu bilang apa sudah telah juga far
