username,tweet
iffamee,anak peluk sini
iffamee,diam diam
iffamee,aduh aduh sa saja tulang ikan
iffamee,ogeb swasta yah mahal kalau murah negeri
iffamee,jelasin ki seperti uad
iffamee,nama celaka yah sakit kalau tidak ditangkep
iffamee,yang sulit celaka hati ketika celaka hati sakit
iffamee,laptop ubah fungsi komputer gin ini mati listrik sudah tidak pakai
iffamee,hai ngada ngada
iffamee,bangun gara gerah
iffamee,yah jam gin bom tidur
iffamee,peta ini kan memang ss handphone dia
iffamee,akan temu pasang saat sudah kata untuk hibur diri
iffamee,hai
iffamee,habis wisuda syok kalau teman kuliah sudah tidak kontak ngabarin menikah syok
iffamee,kera anda
iffamee,anda baca tidak sendiri saudara wanita
iffamee,paham sih
iffamee,kampus uad kampus uad
iffamee,dari tentu
iffamee,serius serius sekali
iffamee,kira ken dandan buat over
iffamee,pikir
iffamee,al asr al ikhlas
iffamee,coto
iffamee,yah habis nang itu bawa lapar
iffamee,orang kenapa anda siain
iffamee,bosan bosan bosan bosan bosan bosan bosan bosan bosan bosan bosan bosan bosan bosan bosan bosan bosan bosan bosan bosan bosan bosan bosan bosan bosan bosan bosan bosan bosan bosan bosan bosan bosan bosan bosan bosan bosan bosan bosan bosan bosan bosan bosan bosan bosan bosan bose
iffamee,suka nyimpen barang dalih tahu besok dipakai tahu tahu tidak dipakai
iffamee,suara sopan benar telinga lyn lapid
iffamee,citra
iffamee,permisi jung suk polisi nama drama yah
iffamee,hai anda did baik kerja
iffamee,tidak tidak dicekokin jauh akibat badan gel gel
iffamee,numpang ketawa
iffamee,tidak malu bisa hubung
iffamee,andai foto ktp edit foto ktp twitter
iffamee,dong entar lelah sekali
iffamee,pagi cukup produktif sampai makam raja raja habis itu mampir cemil soto
iffamee,rusak rusak
iffamee,kenapa sendiri imogiri
iffamee,halah halah
iffamee,ketika anda dengar ini lagu anda rasa seperti anda ve boyfriend adalah anda cc
iffamee,tawa
iffamee,syukur dosen bimbing tidak emosi
iffamee,tidak sampai ndlosor hai
iffamee,yang tidak gadis bawa motor hubung sekali
iffamee,lembut benar
iffamee,pria sampai cium tangan begitu
iffamee,yah yang tidak renang
iffamee,yah bisa tahan masuk belanjan keranjang sampai sampai sub total belanjan tapi tidak checkout checkout
iffamee,memang ini sama anak tidak buat kecewa tawa
iffamee,sudah sana pindah umy
iffamee,saya jadi gembira
iffamee,dicatet
iffamee,malas balas obrol lagi megang handphone
iffamee,seblak
iffamee,malah risih kalau tidak buka
iffamee,saya malu kalau tempat sampah pria tidak tahu
iffamee,sekali
iffamee,benar benar sedih anak laki sesuai layar name
iffamee,tidur siang ini
iffamee,benar benar yah taurus
iffamee,retweet
iffamee,rumit yah teman gblg
iffamee,semangat
iffamee,typing apa saya pikir untuk semua orang baca
iffamee,itazura na cium karya kaoru tada sudah di tonton ulang versi jepang korea taiwan thailand tetap versi favorit saya di versi jepang
iffamee,susah orang tinggal saya imogiri
iffamee,hubunganya sama seblak apa dajal
iffamee,ken seblak
iffamee,karena sudah mati kali yah aduh
iffamee,benar skripsi online ada bagus tidak ngabisin uang ngeprint tidak buang kertas lembar lembar
iffamee,agar tidak salah ketik sering baca ulang terus ngecek kali tetap ada hilang aduh
iffamee,kadang pikir buat basa basi agar tidak cangung
iffamee,diretwet agar ajar besok bikinin ponakan agar maenan
iffamee,juga tidak punya instagram kalau komentar pikir komentar tidak yah takut bilang sok akrab akhir akhir cuma nge seperti
iffamee,tidak ngesave nomor whatsap pasti pikir pikir saya akrab sampai ngesave nomor iya pikir lebih sekali tidak aman parah
iffamee,teliti dari publik relations desain grafis komunikasi internasional
iffamee,matin alarm jam
iffamee,saya ibu malas ngeladenin sumpah hidup drama
iffamee,catat selasa juni jam pm ikut
iffamee,main tembak an tetap saya neraka
iffamee,oleh itu cara ponakan mangil saya saudara wanita rasa muda dipangil tante
iffamee,kasi besok besok karaoke bareng yah
iffamee,kalau utama ponakan pokok kalah dia ucap saudara wanita ifa kalah yah yang menang selalu dapat peran neraka kadang ken egois menang tahu kalau kalah ngambek
iffamee,itu kenapa stopped menggunakan instagram
iffamee,ingat sendiri saya retweet
iffamee,semua karya coklat belum selesai baca
iffamee,ini kalau bareng tidak ada protes nyanyi lagu jepang
iffamee,lagu itu benar cuma yah
iffamee,bosan kerja skripsi kamar
iffamee,kenapa saya takut sekali mudik
iffamee,lagu pasti dinyanyin tidak karaoke duka satu oke batu wherever anda adalah satu oke batu rahasia cinta lagu kecil campur ken karaoke
iffamee,kalau tidak ramadhan suka lupa kalau puasa
iffamee,yah kalau suntik itu tegang sekali
iffamee,malam bicara besok cuci besok cuci pagi tidak cuci cuci sampai numpuk
iffamee,pikir skripsi tidak selesai selesai
iffamee,kejut
iffamee,malu humoris
iffamee,jenis cemil tambah kemangi mengugah selera cemil
iffamee,putus thr tahun buat tempat sampah ukulele doa semoga tetap istiqomah
iffamee,nikmat libur memposting libur tahun
iffamee,ken bakso bakar sainah
iffamee,sudah hajar
iffamee,tawa
iffamee,sepeda jungkir
iffamee,tidak kuliah luar kota itu tidak libur cuma nyimak grup whatsap alumni sekolah mau ngumpul sedih
iffamee,sudah pasrah
iffamee,tidak percaya
iffamee,rumit tinggal beli seragam doang
iffamee,tidak utama instagram
iffamee,kalau gin skripsi saya kabar
iffamee,ken cemil gudeg
iffamee,gudeg kali coba tidak suka manis coba tetap tidak suka saking lapernya cemil di meja cemil cuma gudeg tidak saya cemil nyata awal saya doyan gudeg
iffamee,kaum kaum takut doyan cerita horor rapat
iffamee,kalau sudah tidur tiba pikir hal bodoh pernah dilakuin
iffamee,kelas sampai dengan wah ingat tidak jaman cinta monyet
iffamee,semoga cepat pulih yah yogyakarta agar teman bisa yogyakarta bisa ngumpul
iffamee,ken mie goreng telur tengah matang saudara laki burjo dekat kampus
iffamee,sampai kelas handphone nokia xpresmusic pakai facebok an sudah saudara wanita sekali facebok rupiah
iffamee,ken miara kura kura sampai belum realisme
iffamee,bandel jadi yah
iffamee,sulit damai diri
iffamee,baca baca obrol nyata pernah akrab yah
iffamee,cela tidak yang lupa tidak sampai dengan tabrak motor antar rumah sakit tidak mau sekolah waktu tidak lagi rim rapor tetap sekolah jari kaki pincang saya kuat sekali sekarang lembek benar
iffamee,suka heran orang suka ceker ayam itu
iffamee,letak goalsnya sih
iffamee,hai
iffamee,soto sapi andal saya baik
iffamee,tape cemil favorit lebaran
iffamee,tenang dengar dengar ada musim
iffamee,tidak
iffamee,saya soto zainal bakso bakar di sunmor ugm sushi cerita pecel lele xt kotak soto ayam admin mie gaco mcflury mcd mau jalan jalan
iffamee,susah sekali nolak teman yak tidak saja begitu maksain buat nolak eh sesal
iffamee,ini episode rsud daftar putar
iffamee,punya sirup kalau tidak lebaran doang
iffamee,penting barang sampai
iffamee,pikir bahaya yah sampai ngerusak mental
iffamee,bisa
iffamee,orang yah pergi libur lagi pandemik gin
iffamee,buah putus sulit untuk mengunakan instagram
iffamee,anda tahu itu
iffamee,ho
iffamee,butuh duwit banyak
iffamee,yang kuliah butuh
iffamee,whatsapp sai sama kalau kenapa jurus cuping
iffamee,sudah besar tidak kasih thr yah tapi yaudahlah
iffamee,hubung ngambil jurus komunikasi buat rasa walaupun tidak spesifik sekali jurus fotografi jurus yang harus saya ambil
iffamee,pusat perbelanjan ramai benar yah tidak salah kalau apresiasi sendiri beli baju lebaran memang tidak tahu yah kalau beli online
iffamee,bagaimana yak
iffamee,tidak takut buat ciprat minyak
iffamee,begadang takut tidak bangun cemil sahur
iffamee,tidak biasa
iffamee,gara gara corona ini keluar bentar indomaret parno sekali
iffamee,lihat agak kecewa juga sama media indonesia seperti gin tidak cepat diberitain
iffamee,ohiya eon yah
iffamee,jam zuhur
iffamee,panggil nuna lebih tua jam
iffamee,haru
iffamee,percaya umur jamin kedewasan bisa umur tapi dengan kedewasan kalau ari noer jiwa kana tidak hilang usia milik tidak ayah semua butuh proses iring usia
iffamee,percaya kalau jodoh tuhan punya untuk
iffamee,celaka cinta tapi lebih sampai cemil hati sudah tahu dekat banyak gadis saja diharepin otak pakai cuma pakai peras doang rumit orang kalau sudah jatuh sejatoh jatohnya cinta jadi bodoh yah heran sudah malas
iffamee,yang beranta pola tidur bukan kamar peras
iffamee,nyanyi yakin
iffamee,balik kenapa ragu
iffamee,tunggu transferanya yah
iffamee,beda
iffamee,beda
iffamee,virus corona muncul buat perintah ajak tetap dulu saya tinggal rumah bisa hubung
iffamee,saudara laki humoris
iffamee,magang sekertaris anda tidak tawa
iffamee,tidak debat
iffamee,efek sosial jarak gin ini
iffamee,tidak yah kapan wisuda
iffamee,skripsi kalau tidak hadap untuk hadap bagaimana begitu
iffamee,tolong kalau ngeshare info itu periksa info valid tidak asal mencet tombol bagi senak dahi bias sekali kibas ini
iffamee,tutup sampai mei bingung sedih saudara wanita kampus tutup sampai tanggal seperti itu
iffamee,banyakin baca literasi informasi corona sumber agar tidak cemil berita palsu kali ngecek website sebar virus corona tambah wawas tahu sikap sih tapi tambah panik terus cemas juga
iffamee,juga ada tidak uji semester jarak rumah kampus malah lupa bawa kertas ujianya
iffamee,syapa tahu butuh ul
iffamee,sampai pun bom temu jawab
iffamee,daftar putar lagu tidak kn pamungkas lagu hari lagu tulus lagu negara humoris enau halusinasi feby pura pura lupa mahen murotal an cemil asal cemil nusa kalau dengar lagu jadi ingat tidak kn
