username,tweet
introperti,baca baca tweet spoiler itu raja saya sudah jerit jerit merinding hai
introperti,yah ki
introperti,bersih drama korea mana drama korea changwok aduh
introperti,avatar roku yak tawa
introperti,aduh gakuat
introperti,yawlo hai
introperti,kesal
introperti,main nyala spotify tapi benar tagih suka
introperti,nada anjaiy
introperti,suara angin
introperti,saudara wanita senja tim shubuh
introperti,wakakakakak
introperti,saya moana dari motu nui
introperti,suka
introperti,saudara wanita drama jongsuk indosiar film hyunbin transtuju sirna sudah karena bajing an anggota kelompok tawa
introperti,yang kemudi kalau cemil seblak ngeteh
introperti,wakakakakak
introperti,tapi kalau sudah selesai ibu bosan tawa
introperti,gin saya keluh
introperti,jadi sibuk kelelawar anjr
introperti,seperti gin sudah laba
introperti,dikumpulin besok tapi belum dikerjain sama sekali yawlo gin ya
introperti,saya baca senang gratis confused dan sepi di itu sama waktu tonight itu malam ketika saya lupa tentang itu deadlines
introperti,bisa
introperti,takitangkitang
introperti,dih anda tawa
introperti,sering sekali muncul beranda foto kamar estetik benang harga barang ken tapi bagaimana tetap saya demenya kamar lega yang tidak ada perabot agar gegulingan kepentok
introperti,jam gin pacar pacar main perang an suara tembak sudah seperti petas kondangan tidak renti hai
introperti,ter bagaimana duduk bagi
introperti,jugijagijugijagiju
introperti,tonton matanajwa yang lagi bahas baru normal blablabla terus tiba tiba pikir kalau seperti ya sebentar kalau
introperti,gandeng
introperti,untung tetangga masih balita
introperti,karena yang buat rindu sekolah atmosfir sekolah ajar kalau ajar rumah jadi tidak ada yang dikangenin
introperti,ter suka
introperti,kan benar
introperti,niat bapak
introperti,itu raja kekal raja saudara
introperti,gemas sekali saya ken nampol
introperti,anda tutup kisah cinta saat saya sayang sayang
introperti,seperti lihat hostnya
introperti,hai anda sudah sosial ajar in
introperti,gila ini yang ngetrit pintar taruh
introperti,belai besok tamat belai apa apa drama korea yang acara haha hahahahahahahahaha emaknya sapa ini
introperti,iyala anjr yang otak anda bagi
introperti,samlikum korban buaya
introperti,tidak tidak muka jarah
introperti,saya baca nada
introperti,temu yang rekap
introperti,temu tonton drama korea pusing taruh seperti bljr alat ukur
introperti,hari saya jajan lah
introperti,apa
introperti,tawa sekali astaga
introperti,habis nganter saudara bayar sbm terus saya tawarin lihat uin jadi yang rindu ngampus
introperti,rindu nyulam sudah
introperti,utama kegemesan pagi
introperti,sedih sekali ter merinding ter ambyar
introperti,pikir dri perspektif minho saya gel anjr jadi saudara laki angkut hanya
introperti,valid tidak
introperti,mimpi ngewarnain rambut astaga
introperti,kendali emosi
introperti,saut siul tidak yel yel ituloh saya ketawa hanya jadi tidak bisa tidur hai
introperti,yawlo brimob gin malming nyanyi teprok tawa sampai jam gin
introperti,edit latar belakang biru tempel samping foto buku menikah
introperti,ayo jung yang tatap acu yang gugup gugup aduh
introperti,uh pukpukpuk hughughug
introperti,sudah bulan tapi masih bom maklum apa yang serba jarak
introperti,iya ampun tolong lagi
introperti,buat malas buat baju bagus buat atas bersih
introperti,iyadeh serah saudara laki yang jual
introperti,ken na ri sudah
introperti,seperti itu dimples nyala itu corners dari itu senyum itu anda pakai peta saya mobil nyanyi saudara laki ri
introperti,telur kematengan
introperti,memang telur asin warna
introperti,untung hijau telur asin
introperti,suasana hati tidak suasana hati tetap cinta warna merah muda
introperti,kopi jalan pintas
introperti,online offline tetap gugup gugup hai
introperti,sial sudah tonton kekal raja merinding hanya bawa
introperti,kalau lagi haid bareng selesai
introperti,sama gadis res tawa
introperti,jelasin tidak apa
introperti,saudara anda tawarin sudah tawa
introperti,yak bagus saudara sampai hapal lagu apel brimob
introperti,ken retweet ribu
introperti,pekerjaan tiap malam kalau tidak tonton vlog saudara wanita git tonton televisi tunjuk masalah manusia yang saya tahu kalau tidak main game yang sama tes rpm asli panjang hidup rasa pintar tidak isi rpm doang
introperti,lahiya tidak sudah subuh
introperti,saja baru tonton vlog gitasav sekarang thx saudara wanita
introperti,genfm skitarnya eh saya salah balas malu tawa
introperti,dis yang sring rasa tidak umur kepala dwa
introperti,ya daftar putar lagu radio tengah malam enak tapi kadang suka tidak muncul tidak cari judul digugel
introperti,tidak suka sekali kalau sudah rasa seperti gin
introperti,pikir sekarang
introperti,songong ya lama tidak nyala centang biru pantas saja saja
introperti,kalau habis lihat foto kadang suka pikir saya kenapa begitu
introperti,ter ini sumber valid tidak ini
introperti,eh bagaimana
introperti,tidak tidak masjid doang sudah seperti jodoh
introperti,mantap sekarang zoom terenskripsi
introperti,kenapa seperti bau fanta koko pandan yang kemarin iya ini cat rasa buah buah ada hai tapi lama benar wangi buah
introperti,batuk buaji
introperti,sapa tahu ketemu calon swami
introperti,saja romeo simpan saya romeonya sudah anak istri punya lagu judul bunga ho ho ho
introperti,eh kenapa anda muncul sih
introperti,salah sekali minum kopi
introperti,rindu sepel astaga
introperti,sumpah karena vidio buat atas lathi saya parno tiap gulir beranda terus vidio
introperti,semangat
introperti,utama pianika jaman sampai dengan periksa
introperti,tawa
introperti,sudah dftr tawa cakep
introperti,makas sudah dingetin ci
introperti,memang saya doang yak yang butuh motipasi
introperti,masyaloh paman
introperti,mangtap
introperti,vagabond saudara
introperti,berapa minggu sempat titik tidak tahu apa tapi guna jadi senang hati isi kuisioner yang hingap dari bcan grup yang muncul status orang eh dapat dorprize dong tidak sbrp tapi saudara wanita sekali
introperti,masih pagi bicara brimob nyetelin lagu sempurna ed sheran tidak apa apa begitu daripada lagu apel
introperti,pusing kelelawar astaga pena copot pala tapi takut tidak bisa masang lagi
introperti,kenapa mana mimpi anda tidak tahu saya
introperti,monmap kalau diterusin uname di untag saudara laki saudara wanita agar tidak jadi orang
introperti,jam gin siap tunggu magrib
introperti,woah tolong film aduh
introperti,memang ngupasnya yang buat malas
introperti,apa apa si donal
introperti,tonton reaction buat bangga
introperti,anda buka praktek tawa
introperti,berat lewat
introperti,tanya tidak sudah bel pulang mobil dimusuhin kelas
introperti,minmip tidak bahas cinta bahas titik v doang sekian
introperti,misi saudara laki penguna setia titik v
introperti,baru normal kalau coronanya sudah benar hilang baru baru normal old normal umi
introperti,yang baru saya lihat iklanya bisa ular far dari rumah
introperti,transtv mantap sudah nayangin film
introperti,sekal nyala centang biru agar hidup warna
introperti,itu
introperti,kalau temu jurnal kabarin yak tawa
introperti,kalau mimpin itu yang rindu yang mimpin yang dimimpin
introperti,masa juga tidak tawa
introperti,tapi yaudahlahya
introperti,terus kenapa awet sekali riasanya saya habis cemil daging sudah beranta sekali muka sudah kaos bujur karena cuci piring
introperti,saya bingung sudah pagi orang pada lebaran pc kalau yang nyebutin nama brti bc an kenapa begitu tekun sekali ngechatin satu ke kontak tidak
introperti,omong omong langit saya pagi cantik sekali suka
introperti,kalau pikir dilema ya sisi jaga jarak selamat tapi sisi tidak mau ngelewatin solat raya yang tahun jadi haduh sholatnya pakai masker begitu apa engap orang
introperti,gumush sekali begitu lantai
introperti,manis kolang kaling
introperti,ayo ayo
introperti,mal aidin wal faizin selamat lebaran sobat sobat online saya semoga sehat
introperti,wakakakak hidup alice baca alis oiya maaf lahir batin ya saudara wanita
introperti,aduh terimakasih banyak sama lovey dovey sisy amin may kati juga tawa untung ibarat desir pasir padang tandus loh
introperti,karena yang tahan yang kuat tapi yang adaptasi buah highlight yang ngiang lama diskusi
introperti,fifth hormony kecil baik
introperti,asyiq selamat ulang tahun laras
introperti,tidak tahu kenapa saya syok padahal sudah makin gugup an kalau tonton breng pacar
introperti,aduh
introperti,dia tidak akan lihat itu tweet
introperti,ehe
introperti,dari dijejelin cerita rusuh besar jadi gin
introperti,tidak ada alasan lupa ultang tahun soal dingetin berita reformasi
introperti,yaloh pasti yang bahas ros
introperti,sumpah greget tawa sunda acan indonesia bom korea
introperti,wakakakak syal saya paham
introperti,syapa sangka momen saya rumah tiga lebih rumah itu nganter an bingkis lebaran
introperti,aduh kasi katara
introperti,tahan tahan
introperti,benar ang sempat berapa minguan belum boruto tapi tiba tiba hilang begitu
introperti,kue ituloh cita sekali pena cemil
introperti,nasi nasi
introperti,kan
introperti,tawon
introperti,tapi teletabis favorit beuh
introperti,sabar
introperti,tidak kartun bangsa sumpah sudah
introperti,hahahahahahahah tertaboq
introperti,over dan over fal
introperti,simpen tidak magrib hujat
introperti,namatin quran
introperti,kali bablas tidur nyata ada kulon syukur syekali
introperti,apa pantas saja
introperti,sama sama
introperti,tidak humoris sekali jam gin mules cuy ter saja magrib
introperti,benar sekali saya usaha tidak balas tidak bangun bodoamat lupa balas daripada salah balas
introperti,coban karena ikut kulon matkul ini selalu adan rebah tengah sadar yang tidak tidur tidak sadar kalau kulonya sudah selesai
introperti,yaloh cbd
introperti,ayo semangat ayo ciputat
introperti,salah sekali nge tes jam gin ngantuk pikir lebih apa
introperti,aduh rute mudik saya
introperti,panjangin agar seperti anak fisip umum
introperti,belai sudah libur pikir libur apa lebaran oiya tapi ada
introperti,peti masa peti
introperti,tapi paham tidak apa apa tidak apa apa
introperti,acak bagi tapi tidak rela
introperti,apa buka buka
introperti,aduh
introperti,yawlo kalah
introperti,psb tidak sabar bagianya
