username,tweet
ariefpopoh,pandemi hasil rakyat miskin dan banyak juga hasil anak anak muda berani wirausaha
ariefpopoh,tuhan swt tahu isi hati kita aduh dunia orang tua yang tahu isi hati anak ada walaupun anak curhat
ariefpopoh,cukup nyetel lagu suara dalam mall begini lagu saya menang bayang
ariefpopoh,punya sepeda jual lur hype soal
ariefpopoh,boleh ini
ariefpopoh,kalau tidak sama gusti dua tawa
ariefpopoh,tenang ini besok
ariefpopoh,gayo hijau putih
ariefpopoh,ayo puncak pondok gas saja ayo
ariefpopoh,ada roko
ariefpopoh,memang sudah jadwal habis jumat ayo kopi sama ngeroko
ariefpopoh,ini ibu hitam harimau kumbang mbah
ariefpopoh,terimakasih taruh
ariefpopoh,kartonyono
ariefpopoh,galih ratna ikat janji janji setia setia abadi
ariefpopoh,semangat galih ratna nerima anda apadanya
ariefpopoh,ukur grafik paman
ariefpopoh,defence cepat imbang kuasa
ariefpopoh,nur menikah
ariefpopoh,aduh ada coba hack akun goa untung tidak goa in
ariefpopoh,sesuai tanggal lahir mbah
ariefpopoh,bilang bodoh niat ngebantu bilang tapi bodoh
ariefpopoh,pernah ambil putus saat emosi ada ngambil putus bodoh
ariefpopoh,eh maaf niat ngejokes
ariefpopoh,lebaran jumat agung ya omong omong tuhan kelas ini congrats
ariefpopoh,pantun pztztz
ariefpopoh,ini lebaran minggu
ariefpopoh,robert patinson arif hidayah
ariefpopoh,trotoar dekat dekat melwod tidak yang jual takjil sepi benar
ariefpopoh,bayar
ariefpopoh,senor
ariefpopoh,kogil
ariefpopoh,foto profil adams indons
ariefpopoh,hiya hiya hiya
ariefpopoh,antem rai anda
ariefpopoh,sudah hidayah kecil
ariefpopoh,mantap rafael maitimo
ariefpopoh,ada tribut alm pakdhe didi ada bangku tonton santai
ariefpopoh,maspiah sudah tahu gadis ada saudara laki
ariefpopoh,yah
ariefpopoh,bukber
ariefpopoh,semoga kerja masa pandemi rumah lebih waktu pikir laku inovasi yang bisa buka lapang pekerjan teman
ariefpopoh,saya koreksi perilaku sikap sifat hampir tengah ramadhan agar belakang gaspol lagi malam ibadah lebih daripada
ariefpopoh,lihat dewa mangung nyala air dhani sudah wibawa panggung musik memang tidak di panggung politik
ariefpopoh,lihat anda saudara laki konser donasi hasil kumpul dan nikmat lagu panjenengan bawa selamat jalan saudara laki didi kempot
ariefpopoh,sobat ambyar ambyar tenanan ini
ariefpopoh,saudara laki didi kempot
ariefpopoh,ada hari ramadhan
ariefpopoh,terimakasih bang jabar
ariefpopoh,tanya bang kira anggar berapa bang
ariefpopoh,langkah bang warna dasar putih tiban abu
ariefpopoh,bang warna rambut apa nama bang
ariefpopoh,kalau derby mil enak nya internisti agar wakil daripada internazionale tawa
ariefpopoh,saya internisti sekali sampai ikutin gaya gratis tendang recoba istanbul rubah
ariefpopoh,congratulations bobol data tokopedia cari sekali besar kerja di usah
ariefpopoh,pasti arne hati sambil sholawatan dzikir
ariefpopoh,apa spam grup siram siram tanam shopee
ariefpopoh,cinta barang nd saudara wanita ini ini yang jual barang harga bawah pasar
ariefpopoh,daya masih utama dunia perang heroes
ariefpopoh,alip ba tugas akhir salur di youtube ini lihat mainin soundtrack raksasa buat bilang bagaimana kanan gitar kiri suling dewa memang
ariefpopoh,sore hujan tetes kandung rizki harum tanah kandung hidup baru tidak ketemu kita mati
ariefpopoh,bisa risalah hati dewa
ariefpopoh,seperti saat bukan orang banyak uang orang yang bisa ikhlas terima yang garis takdir dan untuk pikir buruk tuhan
ariefpopoh,jelang bulan tidak jalan sesuai rencana awal banyak yang korban bukan alas tidak syukur limpah rahmat rizki
ariefpopoh,ada suatu zona seperti kenal arah cinta kadang kalah hati darah
ariefpopoh,itu al shifa saya madurasa
ariefpopoh,goa bilangin toilet
ariefpopoh,yang naik pohon ngibarin bendera oi kalau bang iwan laku ngaku
ariefpopoh,saya lihat
ariefpopoh,hobi saudara buat konten di konten lain
ariefpopoh,oi sekali
ariefpopoh,sudah ulang ulang ya dari awal tidak
ariefpopoh,waktu anda saya utama gitar buah lagu nyanyi diri kemarin hanya lempar senyum pergi saja orang sayang
ariefpopoh,kira dilanjutin lirik
ariefpopoh,rindu betapa rindu hati tiada tahan untuk anda hobah
ariefpopoh,alahuma lakasumtu
ariefpopoh,ayo saudara wanita mobil lawas nanging moh ningalne budayane dewe nenek numpak ini lagu ne ayo ikhlasno senang asmara
ariefpopoh,beli
ariefpopoh,dia muslim bang
ariefpopoh,bolak buka ecomerce belanja online bolak buka mesan tiket online jadi godan bosan
ariefpopoh,habis ibadah lanjut ibadah saudara laki
ariefpopoh,senang hari berplat zh
ariefpopoh,nu mesti podo tangkai ini ldi
ariefpopoh,aduh ini gus cerah
ariefpopoh,ah ngegas dong
ariefpopoh,saya orang awam lihat keren si mandau
ariefpopoh,bahas mandau di video ayo sampit
ariefpopoh,aduh mandau seksi sekali saya pribadi cari mandau pe punyan tapi asli dayak sampit
ariefpopoh,perang sampit kagum suku dayak tidak hilang hormat saya suku madura karena saya tanah jawa lagi perang poso sensitif bahas lebih ke agama kalau tidak salah semoga yang benang
ariefpopoh,rumah anda tidak orang
ariefpopoh,metalica luntur untuk hitam
ariefpopoh,tindak mesti tidak kan bicara perlu tidak hidup cukup tidak lebih lebih buka puasa wajar tidak lebih lebih
ariefpopoh,kendali dan emosi itu sial susah sekali otak hati harus sinkron serius coba
ariefpopoh,preman pensiun lagi saya ikut dari musim ya seru
ariefpopoh,si jepri ya
ariefpopoh,hewan yang pasti di jalan kalau kos an sepi
ariefpopoh,marhaban
ariefpopoh,tidak hilang dada lobang untuk bersilahturahmi fisik
ariefpopoh,garing sekali mbah
ariefpopoh,ruang djancoek
ariefpopoh,idola langsung nyetok dus
ariefpopoh,bunuh raining darah
ariefpopoh,sudah babang tampan
ariefpopoh,lagu turut anda bagus apa
ariefpopoh,sexygoath muda lex pondok
ariefpopoh,sudah berita eh sekarang sekali bantu datang rumah telat bodoh
ariefpopoh,dunia perang heroes
ariefpopoh,ada minat ikan saya video pulau baru jabodetabek
ariefpopoh,kota mana
ariefpopoh,ayo ternakin
ariefpopoh,salah ada arti rumah
ariefpopoh,kalau biduan
ariefpopoh,buka warna warni badut saudara wanita
ariefpopoh,sb suka sekali
ariefpopoh,hormat luar nama sebut
ariefpopoh,sama
ariefpopoh,toplesnya bang jep
ariefpopoh,pengirim
ariefpopoh,silah
ariefpopoh,coba lihat
ariefpopoh,cemil beri variasi saudara laki senin kutu air warna keluar rabu cacing sutra volume badan jumat pelet pakan cupang niat piara kalau untuk pandang cukup cemil
ariefpopoh,kalau pribadi saudara laki ganti air minimal masuk cemil yang kali cemil hari sekali misal senin beri cemil beri cemil rabu habis cemil hari rabu saya ganti air
ariefpopoh,selamat malam semua utama gadis gadis apartemen kaos sablon bebe dada
ariefpopoh,bhangsat benar ini mobil
ariefpopoh,kejut rahayu
ariefpopoh,rumah saja pondok
ariefpopoh,jos
ariefpopoh,ibu dekat dekat dulu pondok ngilangin bosan karena kerja di rumah
ariefpopoh,memang selesai pandemi
ariefpopoh,mantap mil
ariefpopoh,yodeh ayo atur
ariefpopoh,kalau saya bima saya nganterin menteri tahan pulang desa
ariefpopoh,jadin saja sudah agar alamat
ariefpopoh,gas pondok
ariefpopoh,ayo pondok atur ngikut angkut pondok
ariefpopoh,pondok motor ayo pondok puncak
ariefpopoh,lembah kecil fredly mbah januari
ariefpopoh,mau rawan gaji juta
ariefpopoh,realitas
ariefpopoh,tidak pernah lupa
ariefpopoh,selamat pagi kaum suka keluh
ariefpopoh,lempar lur
ariefpopoh,isi daya mbah apa teh fast charging rayu saudara wanita
ariefpopoh,ingin rambut bapak ganjar pranowo
ariefpopoh,bisa tanda tanda saya lapar
ariefpopoh,sudah bangun tidur
ariefpopoh,in
ariefpopoh,tips konsisten
ariefpopoh,psikopat memang goa ibu
ariefpopoh,marsekal utama bang
ariefpopoh,ini kamis admin
ariefpopoh,lah pagi dengan tarik nafas dalam buang perlahan lahan kali
ariefpopoh,dom
ariefpopoh,sekarang motor nyambi cari gula beras mbah
ariefpopoh,olahraga dari rumah
ariefpopoh,semoga alpha blondy umur agar lihat langsung laku kalau konser di indonesia
ariefpopoh,tawa saudara laki
ariefpopoh,manfatin dekat orang cinta sayang dia suka anda anda suka dia tidak di pungkiri itu
ariefpopoh,kasih waktu lengang manfatin
ariefpopoh,bang ada corona anda kalau gereja wudhu tidak
ariefpopoh,dinding pos satpam banyak tulis nama nama stm pakai pilox tidak
ariefpopoh,bagai nilai siap nilai
ariefpopoh,goa pena seperti dari tirta beri tetap pakai jordan
ariefpopoh,pagi pagi bangun tiba pikir lintas punya tubuh dwayne johnson
ariefpopoh,masteng mbah
ariefpopoh,banyak pacquaiao lawan maywather
ariefpopoh,ra pilih mbah pilihane ra ono kereta
ariefpopoh,tidak begitu pengirim diskon kalau s sampai nya pengirim
ariefpopoh,akhir besok indoapril
ariefpopoh,alahumasholialasayidinamuhamad
ariefpopoh,ayo whatsap
ariefpopoh,aduh sayang ukur saya
ariefpopoh,ingin timbun tangan sanitizer
ariefpopoh,suwe tidak jamu
ariefpopoh,tako yaki
ariefpopoh,dari gia begini arti negeri sedang baik saja
ariefpopoh,jokes dari itu hari
ariefpopoh,aduh hari libur tidak taruh dinas ini
ariefpopoh,ini
ariefpopoh,syukur ada isi otaku buat dagang tidak rekrut goa desain sama marketing taruh
ariefpopoh,kaos adat bisa mes taruh saya mesen kaos tulis liverpol lawan corona
ariefpopoh,eh tidak orang yang komentar padahal gertak tawa
ariefpopoh,ayo jadi tim pantau mau apain ini anak kalau ketemu alamat tawa
