username,tweet
oziechonky,sisi kiri admin sisi kanan ibu disi conti
oziechonky,lihat kerja anies rk ganjar mudah nilai sudah uji saudara laki
oziechonky,takut hutang kumpul bawa tuhan
oziechonky,keren bang benar ini hari
oziechonky,gus
oziechonky,dokday multitalenta cocok pimpin depok
oziechonky,sayang ya saudara laki kalau gambaranya yang tarik jadi olahragawan
oziechonky,semoga jawa pos buat daftar untuk atlet nasional ya saudara laki
oziechonky,terimakasih saudara
oziechonky,saudara tahu harga tidak nuhun
oziechonky,beli saja saudara periksa merk delizia ariston kitchenart resmi toko tokopedia shopee jdid
oziechonky,saudara laki liga italia
oziechonky,penasaran lae punya selir ya
oziechonky,cc
oziechonky,memang beda admin krucil
oziechonky,keren
oziechonky,ngantri bang
oziechonky,di jalan cari streamingan rubah sudah
oziechonky,streaming itu
oziechonky,pendam
oziechonky,cocok pakai sarung gajah duduk
oziechonky,angka infografis ribu sudah jalan pacar uji saudara laki yang muka rk ribu orang tes pacar cepat uji benarkan jika saya salah
oziechonky,keren saudara laki rekrut bel lho
oziechonky,saudara wanita rexy habis foto presiden selebtwit eslen
oziechonky,semoga dilipatgandakan rejekinya saudara laki lebih yang tolong lupa jaga sehat
oziechonky,tidak bayang kalau benar seperti gin tawa
oziechonky,banyak masyarakat objektif pihak data fakta saudara laki semangat
oziechonky,di mil lumayan sayang tidak permanen
oziechonky,juang saudara laki
oziechonky,kaosne mundhut teng pundi kulo ingih purun
oziechonky,nyerah saudara laki harap hidayah mau dengar dapat ahli tangan pandemi ini
oziechonky,pandang buah desa zona purworejo
oziechonky,saudara laki
oziechonky,lapis paman
oziechonky,lapis kasih nyaring saudara laki tidak bisa pesan langsung
oziechonky,karyawan kantor swasta banyak harus telah kerja di rumah minggu karena berangapan ada wajib kerja di rumah libur karyawan perintah saudara laki
oziechonky,biasa saudara laki keren
oziechonky,saya coba sejak siang selalu muncul tulis server eror admin
oziechonky,admin daritadi tidak serah barang jual eror terima kasih
oziechonky,hormat para tenaga medis dokter semoga beri sehat kerja
oziechonky,segera bijak cegah tular virus corona warga warga ajar tiongkok korsel bapak cepat lebih baik
oziechonky,menu nusantara saudara wanita ken coba tumpeng
oziechonky,sekali karena alat pada
oziechonky,listrik jati asih mati apa admin ada tindak ini
oziechonky,nomor hilang belum catat nomor kartu admin hilang banjir
oziechonky,maaf admin kolom tangalnya tidak ganti sekali kartu kepesertan hilang cair e ktp admin
oziechonky,selamat siang admin kemarin bentuk antre layan eror padahal isi tanggal baik apa solusi admin terima kasih
oziechonky,ina lilah whatsapp ina ilaihi rojiun dukacita bang al fatihah
oziechonky,ada saudara
oziechonky,selamat saudara laki
oziechonky,kali sama admin tidak saran
oziechonky,admin tidak putar video twitter terima kasih
oziechonky,sehat bapak semoga kah umur
oziechonky,semoga mai tenang tidak sering busuk semoga momentum ke timnas
oziechonky,transaksi virtual rekening tokopedia eror mandiri online bisa soal
oziechonky,topup transfer virtual rekening via mandiri online eror admin tadi malam tidak terimakasih
oziechonky,kalau kuota bawah saudara wanita tidak lihat admin langsung saudara wanita
oziechonky,bagaimana pulsa utama potong parsel ada kali seperti terima kasih
oziechonky,pulsa potong kali saat aktif parsel kuning eror bagaimana bantuanya terimakasih
oziechonky,admin parsel tak batas ribu fup terimakasih
oziechonky,galak
oziechonky,bismillah doa bang terimakasih
oziechonky,begitu semangat dipantengin nice game terimakasih bruh
oziechonky,saya pesan langsung segera direspon admin
oziechonky,sampai saudara laki syam tarif mahal bumn lho dengan terimakasih
oziechonky,pulsa tiap sekali sedot bisa unreg bagaimana ini
oziechonky,sinyal jelek sekali jati asih belakang ganguan
oziechonky,foto guna banjir zona bekas benarkan jika saya salah
oziechonky,uang
oziechonky,canteng
oziechonky,selamat siang cara henti layan autodebet rekening terima kasih
oziechonky,bahaya pendeta calon ketua retweet lingkung rumah
oziechonky,semoga gaji rapel ini
oziechonky,pindah kompetitor akhir ex anak audit itu
oziechonky,pesan langsung banh agar lapor buat beken
oziechonky,semoga baik serta saudara laki amin
oziechonky,saudara laki maman saja
oziechonky,dokday baca pakdhe jenius politik percaya karena dokday iq begitu pandai yang sirat tawa
oziechonky,harap ada kalau dokday ke politik praktis emyu harap dokter penting tahan tawa
oziechonky,pakai madu malah dirubungin semut main ski bentol ada besok pagi gatal
oziechonky,saya coba main ski agar tampan dikit biat lembut seperti kulit bayi tawa terimakasih main ski
oziechonky,benar ampuh bersihin tidak main ski muka saya kusam kelelawar dulu susah
oziechonky,rap saudara laki hubung sekitar jati asih
oziechonky,cerdas pedoman bodoh selalu buat benar dokter sayang tweet dokday tidak di retweet tawa
oziechonky,sukses saudara laki semoga lancar niat
oziechonky,saudara laki maman keramas tidak penasaran
oziechonky,pro kontra perintah sebar berita palsu jerat hukum laku
oziechonky,saudara laki zen turun gunung selamat kembali
oziechonky,premium anggota ini alasan ajar anatomi tubuh dokter tawa
oziechonky,tunggu fr tangis
oziechonky,diri sekitar gedung dpr mpr dengan konsentrasi aksi tidak seru turun jokowi fokus orasi tolak ru akan sah dpr
oziechonky,tinggal aman
oziechonky,busi hadir
oziechonky,alam teman papua ptn umur beberapa tahun atas mahasiswa baru umum
oziechonky,saudara laki agar eksekusi program ramah anak lindung perempuan
oziechonky,saya pesan langsung admin direspon terima kasih
oziechonky,kapan di alamat kirim admin
oziechonky,admin selamat malam tanya parsel dengan tidak resi si sampai ya terima kasih
oziechonky,titip buat nakata ameri ichinose
oziechonky,titip
oziechonky,florentino perez mau bawa madrid nba saudara laki tahu lihat campazo nba
oziechonky,admin parsel tidak jb dalam proses ini ya parsel kirim dari grogol gelincir sudah hari gerak terima kasih
oziechonky,dokday idola
oziechonky,selamat jalan habibie sulit temu sosok pimpin bapak alahumaghfirlahu warhamhu wafihi wafu anhu terima kasih inspirasi anak bangsa terbang tenang habibie
oziechonky,batik korpri boleh saudara laki
oziechonky,salah beli voucher saldo ovo bisa direfund terima kasih
oziechonky,ini pusat resolusi admin
oziechonky,aju komplain pihak tokopedia agar bukti upa video sudah saya ungah linknya ya karena jual merespon terimakasih
oziechonky,amin saja memang
oziechonky,tidak sekali ambil komang
oziechonky,telat karena jor tidak masuk contra alir
oziechonky,sulit arti tidak harus semangat tahu jalan
oziechonky,nyanyi sabar
oziechonky,juga hal sama profesor yang hilang objektivitas karena fanatisme dan dari sibuk cari tanpa benar
oziechonky,tempat mbah nama marus
oziechonky,nv xix viii
oziechonky,yah bang
oziechonky,tidak direspon admin bagaimana batal
oziechonky,ya agar jual tanggap mes mau batal tidak karena proses saya mes kirim instan hari
oziechonky,bung paulus jalan pintas cepat undang swasta supaya bumn juga benah selalu menang rasa tidak salah
oziechonky,risiko saudara laki juga kerja tunda mati listrik keluh meperjuangkan hak menurut pendapat jujur saya
oziechonky,energi alternatif batubara tenaga nuklir efisien seperti ada proyek tunda karena dirut ketangkep sparepart tidak kebel sampai rusak
oziechonky,cabang jatibasih bisa hubung seperti sengaja
oziechonky,saudara laki maman anak vans
oziechonky,mantap momypreneur
oziechonky,teladan
oziechonky,saudara wanita
oziechonky,obrol gofar narasumber cair memang dalam latar narasumber puncak
oziechonky,orang paman kalau sudah lengkap benar realisme
oziechonky,auditor editor
oziechonky,kenapa pada utama game
oziechonky,apik saudara laki keren matur nuwun saudara laki izin tidak cetak kaos
oziechonky,izin simpan saudara wanita keren
oziechonky,helm rakyat tawa
oziechonky,cepat sembuh
oziechonky,ri didatengin anda
oziechonky,tonton sidang mk ada kuliah hukum ajar drama sampai ada datang acara lawak
oziechonky,global paman rekomendasi selernya paman
oziechonky,seru ini seperti daftar
oziechonky,baik
oziechonky,jujur lihat tweet sampeyan baru pikir ini benar gus
oziechonky,semangat dan sehat teh
oziechonky,ahli bubut
oziechonky,hayolo bang
oziechonky,memang bapuk saudara laki bagus luis mila tidak gaji
oziechonky,polisi tidak berani kayak paman
oziechonky,inalilahi whatsapp ina ilaihi rojiun semoga almarhum husnul khotimah al fatihah
oziechonky,wajib hadir ini
oziechonky,rumit pakai jasa bank sudah riba kenapa kaum sumbu pendek punya standar ganda
oziechonky,cedera achiles tahun pemulihanya
oziechonky,dalam olahraga harus sportif lawan luka baru nyata saudara laki maman suka keranjang
oziechonky,kings gontaganti manajemen saudara laki korban kd biasa sampai cedera demi support gsw kahwi
oziechonky,ceramah sensor saudara laki
oziechonky,cepat dulu saudara wanita peras
oziechonky,sejuk izin copas ayo saudara laki
oziechonky,suka mendengarkan suara jangkrik lebih saudara wanita kalau mendengarkan suara saudara wanita
oziechonky,cc
oziechonky,kenapa bisa registrasi anggota ya
oziechonky,masih yang teriak ekonomi sulit lha indonesia yang kenapa
oziechonky,saudara wanita tuna susila
oziechonky,pakai kawat bendrat
oziechonky,keren gus
oziechonky,semoga tuhan meridhoi dan keluarga sehat selamat lebaran
oziechonky,dong gus
oziechonky,lebaran galo
oziechonky,sikap sby tidak senang tidak bawa pilih politik kemudian silah pulang
oziechonky,kufur nikmat semoga kelak laknat
oziechonky,dukacita nya keluarga sby semoga kuat insya ani husnul khotimah
oziechonky,tapi kalau lebih senang dakwah literasi
oziechonky,saja sepupu saudara laki kante
oziechonky,sabar tekun buah hasil hormat
oziechonky,beli parsel rebu gb lelet saudara laki
oziechonky,salatiga ramah profesor
oziechonky,tanah saudara laki palmerah boleh
oziechonky,kenapa komplain tidak direspon
oziechonky,telepon tidak dimention tidak balas keluh pelang bagaimana
oziechonky,admin responsif keluh terima kasih
oziechonky,admin tidak responsif tidak resi tidak gera hari terima kasih
