username,tweet
lalenamanoban,senang ulang tahun semoga sehat penuh kebahagian
lalenamanoban,beli tidak sebentar sewa tawa
lalenamanoban,bandung biasa turun kilogram cikarang biasa kilogram bandung belum sampai sudah turun kilogram seperti bahagia di cikarang bagaimana
lalenamanoban,baik ide kalau beli tanya ibu bilang ac portabel
lalenamanoban,lama euy
lalenamanoban,begitu dong dil
lalenamanoban,dih kesal kelelawar kalau orang dihubungin susah sekali kayak lagi tinggal dunia paralel
lalenamanoban,saking cantik sampai simpan foto
lalenamanoban,umpan lambung teh nasi
lalenamanoban,lucu sekali tikus nirkabel habis baterai beli tikus nirkabel dikirain rusak habis tidak nyala tawa
lalenamanoban,kenapa
lalenamanoban,nu orang cimahi ge
lalenamanoban,tul
lalenamanoban,yawla saudara laki kenapa
lalenamanoban,desa halaman biyungku
lalenamanoban,saudara laki
lalenamanoban,sekali habis sesal tidak sudah ngantuk tiba sesak asam lambung kumat
lalenamanoban,sudah bangkar ini sudah baik seperti buldep ke cikarang tengok kacau beli nasi bebek tawa
lalenamanoban,aselinya kacau juga bocor sampai septitanknya ge rapuh tawa harus tengok itu imah
lalenamanoban,dipesantrenin mulut agar akhlak
lalenamanoban,fizi mulut
lalenamanoban,tim legenda hadir
lalenamanoban,besok dong lontong bom habis
lalenamanoban,buka
lalenamanoban,bisa lihat muka jaehyun sorot kamera jelas langsung performnya tinju keren sekali inkigayo
lalenamanoban,selamat lebaran teman teman mal aidzin wal faidzin maaf lahir batin
lalenamanoban,eh telah tinggal bandung berat badan turun kilogram
lalenamanoban,santi
lalenamanoban,besok lebaran bareng lee akan
lalenamanoban,plastik goreng
lalenamanoban,gara gara lampu merah
lalenamanoban,kalau ibu mikirnya junghwan itu diam baik keburu salip temenya
lalenamanoban,timjunghwan pundung
lalenamanoban,mimpin saudara laki
lalenamanoban,mimpi bagus sekali suka
lalenamanoban,hampers itu buat orok menit apa pampers meureun ibu telat anak
lalenamanoban,tidak ampuh ai wargana kalah kalaluar pasedek dek ibu harus support
lalenamanoban,apa
lalenamanoban,begitu nasi bebek
lalenamanoban,ih galak pis santi
lalenamanoban,ramal ibu bias sahur panggil ibadah dzuhur buka nasi padang tawa
lalenamanoban,pis
lalenamanoban,itu satu dan hanya begitu
lalenamanoban,baik bilang dosen pengirim teman licik sekali padahal niat sekali kasih snya dosen tidak apa neraka sekali habis temenya
lalenamanoban,untg ktawan sudah megap
lalenamanoban,video comeback snsd kondangan main ulang ulang satisfying sekali habis
lalenamanoban,humoris ini anak hasil cemil semangka
lalenamanoban,nama jeong tawa
lalenamanoban,aduh itu repsol euy
lalenamanoban,orang bisa tidur lampu dimatin
lalenamanoban,tolong jen gara gara lihat pasang tadi malam mimpi beli kacamata gentle raksasa
lalenamanoban,syukur hikmah tahun bulan ramadhan penuh rumah bareng keluarga telah tahun turut ramadhan cikarang harus bangun pagi buta masak sahur buka bareng keluarga lalu pergi lelah jeni
lalenamanoban,ridin nct mimpi enakeun keren euy
lalenamanoban,saya tidak alias kaocot
lalenamanoban,kieu kata orang pantas saja
lalenamanoban,uyuh
lalenamanoban,lavender
lalenamanoban,aselinyah
lalenamanoban,planet bekas pis nya
lalenamanoban,pandemi buat sakit kepala
lalenamanoban,pada sih
lalenamanoban,tetap aman dan sehat untuk anda teman teman
lalenamanoban,tidak admin pesan langsung
lalenamanoban,admin malam isi pulsa ribu pakai apa parsel data mati pulsa raib saat juga parah sekali
lalenamanoban,yang lain karantina masak chilaquiles apdet memang tidak buat ini belum
lalenamanoban,saja sudah lulus kadang suka tiba acak pikir sesal tidak ajar benar benar beberapa matkul ilmu dipakai sekali tidak yang kuliah semangat ajar
lalenamanoban,tidak menikah menikah dong sayah
lalenamanoban,ada dari wadaslintang desa halaman ibu
lalenamanoban,bang nyapres sini saya pilih saudara laki ya
lalenamanoban,ampun nu hijau teh diklanin nct pusing lihat
lalenamanoban,cakap tidur ini masker murah bagus harga yah uang sudah tempat sampah album nct bodoh amad masker sana pakai album
lalenamanoban,kenapa
lalenamanoban,tuhan syok
lalenamanoban,pesan langsung
lalenamanoban,slotnya ada kah
lalenamanoban,pekerjaan tanda
lalenamanoban,pasak tiang apa daya lebih besar pasak tidak diwaro
lalenamanoban,jaehyun wifenya sekali
lalenamanoban,asli
lalenamanoban,oiya ryujin sekali vibenya keren
lalenamanoban,tidak sengaja lihat cuplikanya iklan youtube eh ramai ve fallen untuk anda itu tawa efek ngakaknya kayak tidak tonton waikiki pertama
lalenamanoban,dalgona kopi itu apa
lalenamanoban,salah lirikna yang seperti mati lampu seyeng seperti mati lampu
lalenamanoban,nazar ibu juri da akademi euy
lalenamanoban,seperti mati lampu seyeng seperti mati lampu
lalenamanoban,ketika ini pandemi over dan tahan janji untuk myself itu akan habis seluruh hari in salon dan hari spa karena ini bajing pandemi makes saya cuci saya rambut every hari sudah pergi diluar untuk kerja dan sekarang saya rambut adalah such kacau
lalenamanoban,panik corona kurang in baca berita mute kait pandemi cal tidak sehat lambung saya sekarang kumat tawa santi ibu sudah sampai kayak batu tidak igd jari tidak tekuk rem kelelawar
lalenamanoban,pandemi buat jadi sering doa semoga ibu dan marini semok sehat dan selalu bisik untuk myself itu punya untuk lindung saya keluarga di semua costs
lalenamanoban,marahin san marahin
lalenamanoban,adalah saya hidup in dystopia
lalenamanoban,nomor nomor rasa
lalenamanoban,sayang myself tolong jadi kuat karena anda adalah itu satu siapa bisa rely nyala regards saya
lalenamanoban,oiya tawa sekarang rin
lalenamanoban,pasar sederhana rin tutup kata orang
lalenamanoban,amin doa itu sama benda untuk anda juga
lalenamanoban,rakyat mulia cemil raja mulia rakyat raja
lalenamanoban,malas
lalenamanoban,lelah sekali panas panas benarkan posisi parabola cukup cabut colokin kabel decoder doang
lalenamanoban,sampai tangan jari kaki bola tidak rasa
lalenamanoban,kayak afa itu infj bawel dekat sama dia doang tawa
lalenamanoban,nanah
lalenamanoban,tidak
lalenamanoban,pada sih ini
lalenamanoban,lnjut ngmil kwaci
lalenamanoban,tahu sekali anak kos misquenya itu
lalenamanoban,malu sekali pagi jalan cikarang isi godiebag lebih beban tumpah mie ayam bawang mie goreng murudul sampai tidak pungut pungutin di belah ngeliatin begitu malu
lalenamanoban,modus tawa
lalenamanoban,nobu ramen dekat lampu merah gerlong
lalenamanoban,dia knows apa dia doing sebagai selalu
lalenamanoban,ya jaman sama anda sampai dengan
lalenamanoban,kenapa beli gula putih susah sekali minimarket habis halah mau kopi ini teman teman tidak pira gula
lalenamanoban,saudara wanita pulang pulang hareng tidak kira
lalenamanoban,senang ulang tahun marini fadjriyati semoga umur kepala makin stabil emosi cepat lulus agar kalau sudah bisa traktir kado habis gaji bulan kunci
lalenamanoban,sudah
lalenamanoban,asal datang saja telat tidak sakit sakit bada
lalenamanoban,baik telat salah
lalenamanoban,boleh
lalenamanoban,sekali
lalenamanoban,suami dia jadi tangungan tua diri
lalenamanoban,ge tidak paham
lalenamanoban,ros admin ros
lalenamanoban,pikir
lalenamanoban,aduh
lalenamanoban,sudah lelah cari masker
lalenamanoban,admin terimakasih hiburanya
lalenamanoban,sesap
lalenamanoban,sudah cuci tangan cuci muka bahkan sapu rawat kulit wajah basuh tangan pakai astringen
lalenamanoban,pedrosa
lalenamanoban,hidup tahun dia sampai tidak pakai fasilitas ojek online
lalenamanoban,manga leueut meja telolet telolet
lalenamanoban,suka mahir sudah pensiun
lalenamanoban,nescafe
lalenamanoban,yawla tidak sabar tunggu blackpink comeback
lalenamanoban,betul terimakasih anda saudara wanita
lalenamanoban,tidak kaca
lalenamanoban,tidak hari ini
lalenamanoban,tahun dia cerita lalu cerita
lalenamanoban,quotenya persis baik tidak ujian sampai ngulang sp tidak tonton motogp sepang
lalenamanoban,itu cincin versi jepang tonton menit henti tengah tengah susah tidur
lalenamanoban,oiyha punya ayo utama ayo
lalenamanoban,hubung goal zamanya
lalenamanoban,ribu rupiah
lalenamanoban,agar pengirim tidak tidak aman malah ceplos
lalenamanoban,ge umur suka tonton film animasi
lalenamanoban,takut pura pura mati
lalenamanoban,prestasi ini bunuh ekor lintah pakai garam
lalenamanoban,adegan renang kolam renang ada ah
lalenamanoban,wajar
lalenamanoban,ini neraka lho kalau kecoa
lalenamanoban,kejut almamater
lalenamanoban,tawa lagi
lalenamanoban,ken tidur
lalenamanoban,gin otak sudah kontaminasi polusi pabrik nyak
lalenamanoban,bisa pikir kesitu
lalenamanoban,offline ibu agar ngajaran heula telepon displayna kalau offline teh biasana niat beli telepon apa jukujuk beli telepon nu kena bujuk rayu salesna
lalenamanoban,iya tuhan syok dikirain akun anonim itu
lalenamanoban,saja ayo tidak pedas minyak yang dulu
lalenamanoban,humoris humoris sekali
lalenamanoban,bilang tidak hal tidak dilakuin orang bisa satisfying ya
lalenamanoban,kalyan kangkung
lalenamanoban,saya tanya
lalenamanoban,hd
lalenamanoban,kecewa saya kalyan titiq
lalenamanoban,tidak puyo beli
lalenamanoban,cinta tepuk belah tangan
lalenamanoban,kayak tahun turut pasang
lalenamanoban,valentine ini tahun anda baca ranjau santiyunian dan anda whom akan jadi milik anda via
lalenamanoban,oiyha baik ide
lalenamanoban,promonya sekali cuy kalau pasang beli ibu
lalenamanoban,tidur teman teman
lalenamanoban,ambil hikmah bahwa tidak yang mau kita
lalenamanoban,tidak saya suka pakai angkutan umum kalau titik tujuanya dilewatin ibu tarif murah tidak pikir lelah lelah tidak nyetir motor tinggal duduk buka kacana deuh sepoi sepoi
lalenamanoban,etdah
lalenamanoban,lain lalak gatal ken jawap ajar kecuali mun lalakina ge sarua tidak ngaji
lalenamanoban,saudara laki lucu rindu
lalenamanoban,goblin hotel del luna
lalenamanoban,baju jang manusia wol kutil beda toko teman teman
lalenamanoban,pernah beli pengirim baju di online toko instagram nama
lalenamanoban,tiap mes bakmi gem tidak zonk alias hanya pengirim
lalenamanoban,saudara laki
lalenamanoban,selalu butuh taylor cepat old songs ketika saya gelisah comes ajaib lagu lagu
lalenamanoban,teh panas
lalenamanoban,asa suka benar lelah jadi
lalenamanoban,suara
lalenamanoban,andal kalau kulit habis bakar sinar matahari
lalenamanoban,iya
lalenamanoban,aduh
lalenamanoban,si
