username,tweet
alaaini1,saking sayange
alaaini1,bangun bangun nang peras memang tidak bisa dibohongin padahal sudah bilang diri tidak mau khawatir malah bawa mimpi
alaaini1,stiker lucu saya sampai
alaaini1,untuku yang sedanh butuh kuat
alaaini1,zary ala yang aneh sering malu umum selalu sandar bukan nasihat baik ketika sulit akan jadi dengar baik
alaaini1,ada pulang lelah serah ingat
alaaini1,hancur lebih hancur
alaaini1,huwa antusias
alaaini1,dosen sayang yang tugas dikumpulin tidak sudah dikumpulin baca tidak
alaaini1,sayang sekali akun twitter yang sudah dari tahun
alaaini1,saat gabung twitter ingat
alaaini1,sampah talkin apa buat anda rasa tentang saya
alaaini1,ini tawa
alaaini1,ini serius serah kalau balik lah
alaaini1,saudara buka pesan langsung tanya tanya
alaaini1,sama sama memang gamain utama keren lagu lagu sub satu tidak dar sub satu sama yang stan
alaaini1,mimpi adalah dari keping yang terima tidak bangun saya sampai apa yang dingin waktu agar badan jiwa hilang dasar waktu gelap lagi paksa pakai kacamata hitam
alaaini1,hancur dalam waktu jadi hanya dari mimpi buah petik tidak rendam di redam tenggelam sisih keping selesai inti
alaaini1,tidak debat kol goreng dabes
alaaini1,sulit definisi inti tidak mau
alaaini1,seperti tepat tahu yang usia sudah dewasa masih ken ke kecil sadar lihat
alaaini1,ya tidak suka begitu dewasa
alaaini1,tidak mau tahun tidak
alaaini1,pening pala pening
alaaini1,lebaran tahun buat atas dikit yang lihat segaban tapi masih sama alis ternotice semua memang tidak punya alis saya
alaaini1,itu kenapa ken kuliah terus ken bagi legislatif tapi politik tidak mudah utama ular tangga lur
alaaini1,duain itu saya capslock agar mati
alaaini1,selalu ketika hidup baik saja ada hal yang datang ini siklus
alaaini1,kalimat persis tidak tadi malam tonton tawa juga hal
alaaini1,ken in surat tera pecah rekor muri asli muak sejak sama begini
alaaini1,mantan bisa kasar sekali mimpi senak dahi ken tepok
alaaini1,jin ingin ke itu akan orang sendiri sulit itu
alaaini1,lelah
alaaini1,tolong isi terimakasih
alaaini1,sakit
alaaini1,nyeri perut elah
alaaini1,nyer perut elah
alaaini1,saya baca kalau tidur begadang bisa anemia benar tidak
alaaini1,keras cari malah tidak dapat harus laku arus yang sulit kendali tenggelam tidak
alaaini1,kenapa kalau dipendem jawab muncul kayak kemarin tanya tanya kalau tidur jam doang dalam jangka efek terus mendengarkan podcast eh bisa anemia
alaaini1,puasa lupa mon peta
alaaini1,bajing saya hidup
alaaini1,sensi orang yang nuntut balas obrol cepat kalau atau bilang fast responsif bagaimana apa penting sebut giat pada saat kalau fastrespon jelas balas ini riweh ujan
alaaini1,dipangil wali kelas karena bolos
alaaini1,diri improvment psikologi filsafat politik
alaaini1,ini buka tiba duduk ngelamun ingat nang teriak teriak sial orang tua susah diungkapin inti peras otaku hantam realita
alaaini1,tahan lak tahan
alaaini1,tawa
alaaini1,saya lupa pikir dia henti bulan
alaaini1,spoiler waspada asli benci sekali drama yang buat sudzon ini tarik bagaimana mereka ngalihin perhati agar tidak pikir tawa reapet buat emosi elah saya bulan tidak ada bunuh itu sudah selesai
alaaini1,persona tebal
alaaini1,saudara tajam silet
alaaini1,lapar ngemil kenyang tidak bisa tidur isi kuisioner surat nang gamod relaksasi tidak bisa tidur siklus
alaaini1,harap akan jadi itu satu akan selalu jadi disini kalau susah percaya tetap yang harap satu rumah bagi tidak jelas kebahagian sedih maupun titik rendah
alaaini1,cerita tonton youtube raditya dika yang utama itu sims ketemu playstore unduh mainin sampai tidak sadar sudah jam gin kenapa tidak mau utama game sudah lanjur sudah tawa
alaaini1,tawa sampai keselek tawa
alaaini1,nang mimpi sahabat masuk rumah sakit asli
alaaini1,foto tua tawa
alaaini1,ken tiba telepon anda ini
alaaini1,cerdas ngehargain gadis peduli mudah
alaaini1,bisa sembuh biarin kondisi kendali
alaaini1,tidak mau minum obat sampai tahun anda bisa buat itu
alaaini1,tidak boleh sedih tambah sakit lak tidak mau ngejalanin obat tahun
alaaini1,suruh dokter janji diri belum tidur besok apa jadi baca buku nanda terimakasih dokter kalau sembuh bilang terimakasih terus semoga tidak kumat ya dokter malu saya semangat ngejalanin tahun obat tawa
alaaini1,pantas kemarin mimpin pikir terus lagi sakit harap anda baca in baik kondisi
alaaini1,harap
alaaini1,saudara tanya ini agak ot ketika nafas hembus panjang hirup logika input ouput
alaaini1,bosan sekali asli tidak buat rasa sekali
alaaini1,inya motif
alaaini1,permasalahanya ravio kata kritisi perintah kenapa sampai barang bukti yang tuduhanya curi minimarket yang baca prestasi pekerjan yang saya beri gaji yang banyak lalu bajing
alaaini1,kata dosen harus tenaga medis yang legislatif benah atur tenaga medis dasar sudut pandang
alaaini1,dosen dosen cerita atur tenaga medis adil macam belum saya pribadi gangerti masalah benar tapi ada cerita saya paham letak tidak adil
alaaini1,baru saja habis rewatch terus nang nang
alaaini1,juga bilang fakgirl saking teman pria
alaaini1,kalau tanya saya udsh tahap bunuh saya tahap coban bunuh sudah telan obat dari dosis tahu saudara
alaaini1,gapeduli ngehujat mau bilang diri diagnose punya bukti mau ngasihanin mingir itu tidak tolong saya butuhin semangat dengar hanya itu adalah itu keras untuk semua dari anda
alaaini1,bisa ngelamun dari hasil tes depresi tengah kira baik saya fine dengan saya diri tidak bisa anda bayang itu hari ini dengan berani ungkapin di twitter
alaaini1,itu tidak mudah cuy kalau ingat itu masih ken nang siksa seminggu garagara obat tubuh butuh sesuai sakit benar benar sakit sampai gasangup pergi kuliah
alaaini1,teman teman syok tahu depresi itu tidak mudah untuk jelas tapi psikiater sampai tanya siap dengar diagnosanya saking saking datang duduk nang nang jam
alaaini1,derita depresi tahun baru sadar tidak usia tahun di rujuk psikiater saya kerap terima komentar ibadah yang rajin dulu itu tidak tolong anymore tolong kalau bilang begitu diam
alaaini1,drama buat sudzon hanya ini
alaaini1,ribut drama korea itu dunia dari meni pasang twomc ribut drama korea reapet itu tahun kalau twomc greget cerita anda dimainin alur bawa sudzon hanya tawa
alaaini1,silinder bisa hubung
alaaini1,pantas laptop ngelag hanya
alaaini1,ada lebih selain doa doa kita juli
alaaini1,saudara saudara mau dong bisa hafal begitu bagaimana ya
alaaini1,polines sial tawa
alaaini1,mimpi anda hanya heran saya
alaaini1,kulon rodo edan tawa
alaaini1,ncen saudara laki bagaimana ki obate apa
alaaini1,akan anda menikah saya saya akan nolak jelas ayo menikah
alaaini1,buat sujon hanya ini drama asli sampai lelah habis tidak habis pikir nyata lelah benar seru tawa
alaaini1,ingat teman teman kelas yang ngapakers tawa
alaaini1,tolong comeback bayi hanya hilang anda kurus fab hantu
alaaini1,benar benar kayak lirik lagu buka folder komputer isi foto dia baru saya begitu pikir baru sebentar foto tempat sudah mendengarkan lagu gagal pindah nyala terimakasih ya terimakasih
alaaini1,maaf lagu anda sadar kalau saya belum pindah nyala benar benar rindu orang
alaaini1,episode lawak
alaaini1,lawak pol iya tuhan
alaaini1,masih marah ya nama sudah dimarahin jadi gugup sampai dong trauma dosen gila tawa
alaaini1,untuk informasi anda dosen itu sudah tua benar benar junjung tinggi etika ketrampilan otak kenang tidak uji praktek dimarahin dosen kelas semua gugup gugup saudara laki itu suruh ngulang akhir
alaaini1,sesal semester tidak benar benar ajar jadi semester ajar ekstra
alaaini1,bisa cerna komunikasi manajemen selamat pasien tawa manajemen selamat pasien contoh mudah ajar apd
alaaini1,antara yang buat gila sekali patologi dude kenapa gabungin ilmu anatomi fisiologi cari kerusakanya inti ajar sakit tidak semester sangat nyala anatomi fisiologi
alaaini1,rasa sekali semester butuh baca buku baca jurnal kerja tugas tugas saya nyala sekali biokimia mikrobiologi sama
alaaini1,semester yang gila matkulnya kdm ii biokimia dokumentasi kep farmakologi komunikasi mikrobiologi patologi manajemen selamat pasien
alaaini1,kalau malas malas sekali banyak teman yang bilang gin itu kalau baca anda itu malas malu tiru teman teman
alaaini1,kadang tidak baca begitu nemuin tarik baca jurnal kadang begitu pokok anak kalau sudah penasaran susah henti kecuali otak sudah lelah
alaaini1,ibu mapin anak
alaaini1,untuk informasi anda nyala sekali matkul ipa ipanya kalau kerja perlu baca sekali lama selesai gilir kewarganegaran etika awat hukes cepat pol selesai tawa
alaaini1,kalau tidak ada matkul agama indonesia dulu cuma saya
alaaini1,fisika biologi yang gangerti sampai karena dosen jarang dan dasar saya malas ajar tawa
alaaini1,etika hukes salah favorit ajar unya dikit tentang rumah sakit tenaga medis dulu begitu tapi kalau sudah kasus senang jawab dasar
alaaini1,konsep dasar keperawatn kdk ini buat otak agak gila tawa sudah kayak filsafat cuy ajar sejarah paradigma dulu
alaaini1,butuh dasar manusia kdm yang saya gangerti apa tidak praktek paham yang dilakuin awat euy ajar contoh mudah suntik suntik
alaaini1,anatomi fisiologi tahu apa ajar tubuh cara kerjanyaintinya benarkan jika saya salah mahasiswa awat abal abal
alaaini1,krs ini karena basic saya awat semester ajar anatomi fisiologi butuh dasar manusia konsep dasar awat etika awat hukum sehat fisika biologi doang yang ingat tawa
alaaini1,semester dapat kelas yang bar bar mulut anak tajam tajam benar hobi ghibah di grup kelas padat saudara laki saling dukung sama peduli sama
alaaini1,diri yang amburadul rak karuan benar tidak cocok gambar awat yang lembut dulu peta gadis agak berandal sampai teman yang gapercaya kuliah awat tawa
alaaini1,ketrima bingung tidak bisa tidur maleman pikir ambil tidak tanya orang tua suruh ambil saya suruh pikir siap tidak hubung nyawa manusia
alaaini1,dulu jail daftar kampus negri yang tri lho sangat bahagia ortuku restu kampus tidak jauh
alaaini1,tidak deng canda mau cerita agar kenang dede lup
alaaini1,lelah sudah begitu
alaaini1,kekeh tugas dadi edan cil
alaaini1,terimakasih dosen patofis buat pintar tidak bisa pale jurnal satu buku ini jawab soal hitung baca buku jurnal pusing utama gus
alaaini1,manusia yang pernah lelah saudara laki tawa
alaaini1,lelah sudah salah ketik
alaaini1,bentar
alaaini1,eh salah ketik bentat
alaaini1,bentat cari posisi rebah enak
alaaini1,mahasiswa awat benang
alaaini1,ditanyain itu saudara laki
alaaini1,kesal saudara laki
alaaini1,jam pagi mantengin laptop sampai jam sore sampai lupa sudah cemil bom
alaaini1,tidak usah pindah buang muka sudah
alaaini1,syukur tidak cantik yang tidak ngeshare hal yang rugi bahaya lain
alaaini1,susah susah kuliah sehat ada senak ngeshare sehat dasar riset kesal
alaaini1,ilmu ibu titin kalau yang bicara steril asli cuma bersih sensi ibu terimakasih ibu
alaaini1,mon peta sadar saya bagaimana tempat singah doang anda
alaaini1,ujan kuliah offline bodoh online bodoh
alaaini1,saya senam jantung hari senin ibu dosen
alaaini1,astaga bahagia atas derit lain
alaaini1,karena saya gila tidak ada pria yang sama saya sudah titik
alaaini1,rindu saya pernah ngango tinggi tumit ning kelas sial anak wedok iso betah ngangone ayo hai hai pria kenapa pakai tinggi tumit
alaaini1,dokter
alaaini1,cinta saudara laki
alaaini1,astaga tidak mau ketawa
alaaini1,sungkem bos
alaaini1,ayo la
alaaini1,cowoku pegang pegang
alaaini1,cepat sehat saya tahu ngejalanin awat rutin sampai bulan tahun tahun tidak akan mudah anda sembuh tidak lelah hari minum obat semangat
alaaini1,beranda isi selamat lolos snmptn daku bosan mati jenak tidak sirik saya sudah kuliah
alaaini1,awat jt
alaaini1,juraganfilm casa dramaqu info dramacute begitu lupa
alaaini1,kena butuh boyfriend sudah lihat vincent ricardo
alaaini1,terimakasih semangat
alaaini1,ada disemarang sudah kesana pesan langsung saya ya
alaaini1,mahasisws awat bingung prakteknua bagaimana
alaaini1,in bosan sekali asli
alaaini1,tolong kalau mati mati saja nyusahin lain nularin tenaga medis sudah lelah sampai yang gugur bantu masyarakat kayak gin
alaaini1,almarhum pakde
alaaini1,mau ulang kali tetap ketawa
alaaini1,ken ngechat dokter
alaaini1,permisi mau
alaaini1,tidak begitu bambang
alaaini1,ini minum obat dengan dosis lipat mon peta dokter malu
alaaini1,benci saya diri
alaaini1,sungguh ingin untuk mati
alaaini1,tidak bodoh
alaaini1,ketawa
alaaini1,tolong dokter
alaaini1,gosah halusinasi sakit
alaaini1,drama anda saya iseh nyala pergi sudah entuk neh saudara laki saudara laki tidak joss tenan calon imam
alaaini1,sedih
alaaini1,sudah klarifikasi yang buat video gasah cerewet
alaaini1,rindu tidur obat rindu tidur nyenyak obat rindu bangun modnya bagus obat
alaaini1,tidak tahu deh ikut senyum
alaaini1,saya tahu
alaaini1,kesal kesal kesal sekali bajing sama mon peta emosi
alaaini1,agar saya ketawain
alaaini1,tenten
alaaini1,obrol saya bilang april sapu saya blok iya toilet
alaaini1,tidur sana bilang suka tidak
alaaini1,buluk buluk buluk buluk
alaaini1,gadis kentang diri sapa yang
alaaini1,tidur belum suka lawak
alaaini1,mimpi
alaaini1,mundur saudara laki tidak suka
alaaini1,titip lapak
alaaini1,sumpah sumpah gngerti tawa itu gasengaja bosan begitu dapat teman tonton haikyu ini tagih tonton sampai yang nyala pergi
alaaini1,gulir guntur tawa
alaaini1,tidak tahu nishinoya keren sekali favorit sekali sampai
alaaini1,hilih sedih ki saudara laki
alaaini1,jomblo kentang seperti mana yang
