username,tweet
ikhwaaaaann,tahu tidak beda sama nabi musa
ikhwaaaaann,admin jalan kaliurang anda dusun nglanjaran sardonoharjo ngaglik mati listrik
ikhwaaaaann,halah adus ra adus ayo podo saja
ikhwaaaaann,ngombe banyu hangat mandek le pikir lebih gletak hpne
ikhwaaaaann,mawar ribu tangkai
ikhwaaaaann,urip gur pis sambate sik ping pirang
ikhwaaaaann,anak gembala
ikhwaaaaann,coba bapak ayo
ikhwaaaaann,angkat tangan dia turun tangan
ikhwaaaaann,cik saudara
ikhwaaaaann,tinggal nang kos mbuh siram apa tidak
ikhwaaaaann,buat mutah paku
ikhwaaaaann,sudah nenek lombok tuku bibit kangkung beli biji
ikhwaaaaann,nandur lombok sama kangkung tawa
ikhwaaaaann,ingetnya waktu masih saya tahu itu nongol
ikhwaaaaann,ngiang lagu kui sampai dong
ikhwaaaaann,sik lali ini
ikhwaaaaann,nyanyi waktu masih tidak ayo tawa
ikhwaaaaann,ini mbiyen cok sporteran dbl ra ayo
ikhwaaaaann,pelan ini
ikhwaaaaann,st tiktok
ikhwaaaaann,wkwkwkwj
ikhwaaaaann,ini anak bram brame ramai
ikhwaaaaann,besok pagi pokok lari syarat laku
ikhwaaaaann,almond
ikhwaaaaann,nya bangung dari jam pagi
ikhwaaaaann,dokter ayah bayi
ikhwaaaaann,rindu samcan aduh pai ini
ikhwaaaaann,teman menemani temenya lahir hamidun cela tidak tahu bapak keluarga juga tidak sama dokter diucapin selamat nang tidak adzanin ini anak
ikhwaaaaann,klen bagaimana aman
ikhwaaaaann,beton
ikhwaaaaann,baca rep saja kenapa
ikhwaaaaann,ada eh
ikhwaaaaann,yang sampai buat utasanya hayo tawa
ikhwaaaaann,punya bcl kira bcl
ikhwaaaaann,jam gin ruang tengah backsoundnya menang asli sinetron sih
ikhwaaaaann,selamat naik tuhan kristus gbu
ikhwaaaaann,tidak ikut kembali sama artis sato
ikhwaaaaann,bibir balsem korek rokok
ikhwaaaaann,baik cor gonaku sisih duwur ibu sik gur tatanan watu
ikhwaaaaann,dal omahku kabar njung cuma doang lebar
ikhwaaaaann,kokap luih ekstrim saya seperti deh nyetir
ikhwaaaaann,dibilangin mudik ckckck
ikhwaaaaann,kokap siseh ngendi ini
ikhwaaaaann,faldi ayas awanys bima dihe rahmat omih izal diar mala rama indah inra gebe mika adi
ikhwaaaaann,masak enak ada micin negara
ikhwaaaaann,teh
ikhwaaaaann,misa toilet baptis komuni kenapa seko cawan
ikhwaaaaann,sudah seperti aji
ikhwaaaaann,obat ancene micin
ikhwaaaaann,kemarin teman komuni dapat buat piala begitu
ikhwaaaaann,wis daripada soyo banyak dosa
ikhwaaaaann,tidak masih rapet coba
ikhwaaaaann,lupa saya itu mabuk kemarin
ikhwaaaaann,sekali koyone nenek disikan minta peta
ikhwaaaaann,ayo nang belah sak sloki
ikhwaaaaann,mawas mungkin kita akan generasi kuat
ikhwaaaaann,kawan imunity saudara sik kuat terus urip sik ra kuat wis wasalam
ikhwaaaaann,saya mandi pantas seperti gatal begitu
ikhwaaaaann,nenek angur jamu pai
ikhwaaaaann,nona
ikhwaaaaann,mosok tidak ya
ikhwaaaaann,nama inan ayo saudara wanita saja
ikhwaaaaann,sudah seperti gin tidak nyapu belakang meja temu tidak tahu gadis yang bobok bareng
ikhwaaaaann,nang kosanku sudah seperti apotek pasetamol obat maag obat anti mual obat diare obat anti nyeri
ikhwaaaaann,cangkir sb pernah nama inan
ikhwaaaaann,pernah temu rambut jengkal bawah kasur kos tidak satu gadis masuk kamar
ikhwaaaaann,benar kawan imunity bagaimana yang hujan burjo sampai kos bisa demam
ikhwaaaaann,sik hambok pikir menikah ki
ikhwaaaaann,apa ton twitter ngungkuli ponakan raiso tinggal
ikhwaaaaann,siapa
ikhwaaaaann,upah di surga
ikhwaaaaann,senang sunday
ikhwaaaaann,mutualan seyeng
ikhwaaaaann,kui
ikhwaaaaann,smada tidak ki matematika horor
ikhwaaaaann,iyoi sumpah ini bahaya asline
ikhwaaaaann,saudara saudara laki bahasa korea
ikhwaaaaann,mesti foto saudara bah sepi begitu tidak boleh tawaf gara corona
ikhwaaaaann,tuhan bangsa
ikhwaaaaann,minoritas ibu apa
ikhwaaaaann,isi kulkas gur es batu sama banyu putih
ikhwaaaaann,kucing warna item cokelat putih
ikhwaaaaann,berat berat
ikhwaaaaann,kembang ton
ikhwaaaaann,katolik anda
ikhwaaaaann,baca entah anda katolik protestan ortodok tetap kristen
ikhwaaaaann,ini yang jomblo itu daftar geh
ikhwaaaaann,memang kan
ikhwaaaaann,anda
ikhwaaaaann,peta tidak akhlak
ikhwaaaaann,puasa
ikhwaaaaann,direndem minyak tanah elus
ikhwaaaaann,anak tidak tahu
ikhwaaaaann,aduh susah
ikhwaaaaann,woh anda paham ya
ikhwaaaaann,woh paham suara notif langsung semua setuju
ikhwaaaaann,jakardah mcd sarinah yogyakarta upnormal gejayan yang paham
ikhwaaaaann,juang berantas bodoh
ikhwaaaaann,pai
ikhwaaaaann,tidak ayo
ikhwaaaaann,mcd jombor ningal janji
ikhwaaaaann,fcnya badai
ikhwaaaaann,mbok tenan udu sumpah
ikhwaaaaann,lapor ke lebih yogyakarta
ikhwaaaaann,cari shopee ada
ikhwaaaaann,saya lagi hits bukan ya
ikhwaaaaann,suara hai seko kokap tidak krungu apa
ikhwaaaaann,sik tanggal saudara laki natal melu lebaran melu tawa
ikhwaaaaann,kan raya tanggal merah
ikhwaaaaann,terimakasih njung
ikhwaaaaann,nenek jogjane pojok kulon wis cerak purworejo hari pp nyang blereng bola blereng apa ra minus engko
ikhwaaaaann,julidnya tidak sahur saudara
ikhwaaaaann,semoga tuhan meridhoi ui amin
ikhwaaaaann,sudah
ikhwaaaaann,ingat akan cari pasang padan nenek koe putus tidak tidak
ikhwaaaaann,pernah yang wkwkwkwkwkw
ikhwaaaaann,halah sik gandeng tangan saja kandas
ikhwaaaaann,lihat itu pegang tangan tawa kalau banyak pengang
ikhwaaaaann,bar kui lali wis dowo sekali tawa bapak pena pegang tangan
ikhwaaaaann,agung misteri iman
ikhwaaaaann,krincing gong mesti koe moco teks misa ayo
ikhwaaaaann,piala darah darah janji dan kekal lali tawa
ikhwaaaaann,hai saudara laki alkohol tetap iso diombe mbok gae cerita mabuk anyar ayo
ikhwaaaaann,selamat natal dedek jbu
ikhwaaaaann,mabruk milad sayidina ini adalah ibn maryam binti imran
ikhwaaaaann,utama juga
ikhwaaaaann,isi memang beli komdom ngecer biji ckckck
ikhwaaaaann,murah malu
ikhwaaaaann,ban ajak peluk
ikhwaaaaann,loh memang sudah tidak
ikhwaaaaann,rumangsamu gae status golek pacar mergo ngopo ayo mergo konten edan po bagus tidak payu
ikhwaaaaann,bantu teman kamar damar utama tapi tidak sampai kalau ambil tolong dibalikin
ikhwaaaaann,suara tidak bagus
ikhwaaaaann,serius ini si
ikhwaaaaann,haduh siapa ini
ikhwaaaaann,ini apa
ikhwaaaaann,lupa ayat saudara wanita mari semua letih lesu beban berat akan kelegan tikar
ikhwaaaaann,lali ngon malah
ikhwaaaaann,susuk nyata hasil
ikhwaaaaann,saudara laki banyak mau ndusel
ikhwaaaaann,cari sugih masang susuk
ikhwaaaaann,catur dharma juta semoga tuhan meridoi ui amin
ikhwaaaaann,cerita hijau gur gae pamer nenek bar ngetod kari pacare ton tawa
ikhwaaaaann,tuhan bapak tuhan putra tuhan roh kudus tidak jelas bisa terima iman eaeaea
ikhwaaaaann,malam jumat kliwon tidak yang ngajakin cari sugih kah
ikhwaaaaann,wates ra ibu sik ngejak dolan po bosan
ikhwaaaaann,tato doa
ikhwaaaaann,berkat buat tanda salib apa kalau gin ibu
ikhwaaaaann,nadhom saudara nyanyi tawa
ikhwaaaaann,saat gabung twitter ingat
ikhwaaaaann,mobil sampai selesai ngaji saudara wanita
ikhwaaaaann,tolong lali
ikhwaaaaann,abdaubismilahi warohmani
ikhwaaaaann,ini materi sekolah minggu besok gus
ikhwaaaaann,rindu sungai jiwa rindu engkau
ikhwaaaaann,seperti alfa indonesia dekat tidak bisa eaeaea
ikhwaaaaann,walah menikah tidak gereja ijih iso pegat
ikhwaaaaann,teko ayah ayo nenek iso luih ayo seko manten wedok agar sesal anda anda huahahaha sakramen bisikin sama
ikhwaaaaann,tidak jadi wkekw
ikhwaaaaann,sabtu sore gereja admin agar tidak lihat jomblo minimal jalan
ikhwaaaaann,desember raya maulid ini adalah admin
ikhwaaaaann,sudah banyak buang tisu
ikhwaaaaann,titip sendal saudara laki ter ambil kalau panas neraka
ikhwaaaaann,berkat
ikhwaaaaann,saya gendut kalau habis cemil boker ros
ikhwaaaaann,buka sudah dapat
ikhwaaaaann,kalau cerita jalan jadi anak tuhan yang baca tidak
ikhwaaaaann,tidak apa apa santai
ikhwaaaaann,tidak apa apa buang saudara pakai itu
ikhwaaaaann,sumpah gara saya pesan langsung pada link
ikhwaaaaann,baca kesal agama ngo dolan
ikhwaaaaann,pacar ngejak gering
ikhwaaaaann,mon maaf bintang laut tidak otak
ikhwaaaaann,di tolak sekali
ikhwaaaaann,paham saya sedikit cerdas trik
ikhwaaaaann,tahu tahu sambungin eh
ikhwaaaaann,peras untuk eaeaeaeaea
ikhwaaaaann,koe gaje eh tawa
ikhwaaaaann,apa rin astaga
ikhwaaaaann,paman bantu retweet
ikhwaaaaann,anak indimie
ikhwaaaaann,buka po neh ayo habis gaji lah mes ikan kod yogyakarta barang insya besok jumat buka po neh mes ya
ikhwaaaaann,ecie balon makin limpah
ikhwaaaaann,sumpah ini kamar saya tadi pagi bangun gara muka ada yang niupin kipas mati guling saya baring yang narik begitu elah
ikhwaaaaann,hai merem kenapa
ikhwaaaaann,hikmah tidur tidak ke ganjur hujan gin
ikhwaaaaann,beri saya link
ikhwaaaaann,teman iya mungkin
ikhwaaaaann,tidak bapak juga admin saat bilang tuhan bawa pacar ini tuhan restu habis putus
ikhwaaaaann,tolong turun link lagi hitz
ikhwaaaaann,katolik tidak sudah di teks misa
ikhwaaaaann,bar wapres jalan
ikhwaaaaann,dalam makin enak boom
ikhwaaaaann,jam sih sudah bahas bacol
ikhwaaaaann,buat henset cakap iso analis
