username,tweet
yaelahir,satu orang ikut saya otomatis periksa oleh
yaelahir,boros boros saya ngedecor ulang tapi ter tinggal
yaelahir,dek
yaelahir,satu orang ikut saya dan satu orang henti ikuti saya otomatis periksa oleh
yaelahir,sunda dari tentu
yaelahir,gemas sekali saya baca maha teh
yaelahir,seperti tahu saudara wanita tawa dds kah
yaelahir,ada keliling indonesia ajak fiersa gunung nolak karena parno uler apa galucu taruh yak
yaelahir,diandukin jugasi tapi tidak gin tidak cepol heu
yaelahir,satu orang ikut saya otomatis periksa oleh
yaelahir,nanaonan
yaelahir,benar ada lain juga kobe bahasa sunda itu kobe kokolot begog
yaelahir,sudah batas
yaelahir,tawa adokh peta tawa
yaelahir,keren coba segera
yaelahir,tolong tolong saudara wanita sar kalau habis ashar kesana kalau omong kosong tahan dulu ke toilet aduh rawan sekali
yaelahir,oke catat saudara laki senganya minimal dapur tidak boleh sekali cuci yang disimpen pokok harus sekali langsung cuci kesan kalau tidak langsung jorok rumah rumah
yaelahir,kelelawar sudah
yaelahir,uwow saudara wanita sudah jadi anak codingers tawa
yaelahir,satu orang henti ikuti saya otomatis periksa oleh
yaelahir,amat sakit haid bulan adeaja drama
yaelahir,satu orang ikut saya otomatis periksa oleh
yaelahir,ckckck kenapa sik
yaelahir,orang henti ikuti saya otomatis periksa oleh
yaelahir,ketawa saudara wanita pia gurih sekali dokh
yaelahir,tidak ngelewatin jembatan cirahong beuh degdegan pol
yaelahir,mirip sik saudara
yaelahir,satu orang ikut saya dan orang henti ikuti saya otomatis periksa oleh
yaelahir,ketawa saudara enzy dunia
yaelahir,iyak benar
yaelahir,pengunan saya ini adalah ciri yang tamak tidak mau kalah
yaelahir,orang henti ikuti saya otomatis periksa oleh
yaelahir,itu saya punya telah nyala twitter untuk tahun sejak apr via
yaelahir,buat anda ingat ketika anda gabung twitter buat uwow sudah taon agak likaliku yeu
yaelahir,juga tawa
yaelahir,adokh motivator meureun
yaelahir,saya hadir
yaelahir,minggu jam gin pulang teraweh
yaelahir,takut kalau centang aktif dimedsos lah
yaelahir,naufal tampan sekali parah
yaelahir,tawa
yaelahir,satu selamat duls nyak vuj sukseus ros sampai
yaelahir,jokes itu
yaelahir,teriak teriak dongkol apa turun skr baca pushup ratus coi sampai ngilu lutut
yaelahir,iii sumpah gedek sekali sama orang yang ngmgnya rasa benar tidak mau kalah
yaelahir,banyak mau sate senayan kopi kenang
yaelahir,sekali
yaelahir,bukti pisces memang baikbaik iya
yaelahir,tawa bar harus kondisi yang hijau ter tidak gerak tahan dikit deh ter nyantol hati
yaelahir,tuhan anda
yaelahir,adokh
yaelahir,eh taon si september belum di bagaimana sih ir taon maksud
yaelahir,playfest taon arti tidak akan paman lembah kecil lagiy tangis
yaelahir,tonight tunjuk malam buat mellow
yaelahir,ayo langsung desember tidak 
yaelahir,syok
yaelahir,memang vuj tangis rajin mandin saja tidak lewat video koentji tahan tahan belanja
yaelahir,gemas rumah sofah
yaelahir,sudah pulang ini suamik kerja eheheh masak ayam hainam salmon mentai shirataki besok kirakira masak iya baik
yaelahir,hadeuh
yaelahir,rindu
yaelahir,kasi anak jaman skr tidak omong kosong rasa cpt an cari guru minta tanda tangan
yaelahir,hoho padahal cuma pena konsul muka an doangsi teh omong kosong ya kirakira syukur bisa karantina buat muka jadi hadu hadu hft
yaelahir,lagi ngumpul sama kluarga tetiba yang ngusul buat lomba pidato hadiah jt inti kluarga mobil ban betul mahnin eh yang nyuru pidato coba bayang tidak itu hahk kualat memang yang suruh
yaelahir,dokter spk kalau musim gin buka tidak yak khawatir ter datang mala dsuru lagi um
yaelahir,saya ve semua telah tunggu untuk baba
yaelahir,ganti masa sebagai orang intern telkom pakai provider laen bagaimana itu
yaelahir,satu orang ikut saya dan orang henti ikuti saya otomatis periksa oleh
yaelahir,wei tolong benar sekali saya sebagai orang yang omong kosong cemil potong ayam dada paha doang kalau dapat itu baik mundur gama
yaelahir,solusi agar tidak tidur habis subuh terus obat tidur c orang tidur sampai iya saya bagaimana
yaelahir,saya sudah pernah lihat yang baju putih daerah gd skitar gsg untuk informasi anda kurang tahu jugasi manusia atau tapi iya mungkin kalau manusia apa dekat jndela skitar jam an ya lucu yang geretgeret kursi sering dengar bagaimana tapi buat penasaran buka malah takot
yaelahir,ini ini
yaelahir,tidak hadir saudara laki saudara telkom ehe cerita horor yang asrama
yaelahir,syukur posisi selesai sholat isya saudara laki keburu ambil wudhu blkg belum baca benang ngeri sgt
yaelahir,klasik nyentrik
yaelahir,donee cui naha ceutik yeu gasik
yaelahir,syip kenapa saya dapetna tak batas wngkul tangis
yaelahir,coba tonton in itu tinggi rumput netflix tangis ramai buat degdegan bagaimana kalau omong kosong ntonya bedua bcs akhir yang buat mual saya gituw benarkan jika saya salah xx
yaelahir,tawa seru
yaelahir,ini sudah dtnton tangis ayo nyusul ayo
yaelahir,tidak satu
yaelahir,hidup needs ikut through buat commitment dan ikut through
yaelahir,benci itu terasa seperti selamat tinggal kno havent posted apa pun lately tapi nyala ini hari decided untuk coba delete sampai nyaring keluar semua tentang saya tweets itu might punya singgung atau sakit lain indirectly tolong maaf saya sampai terimakasih
yaelahir,tawa gakuat
yaelahir,wadow
yaelahir,kebal disemangatin terus tawa
yaelahir,pusing pusing gemas fik gemas jadi air mele karena perih punggung jadi keriting badan jadi sempoyongan
yaelahir,konten sekali gin agar naik miris
yaelahir,untung tidak kasi doyan cemil manis dia
yaelahir,gemesh iii
yaelahir,vape mele sudah tawa
yaelahir,kata kaca
yaelahir,sangat pis harus saudara tasik
yaelahir,saudara gadis ben brasa aman begitu hidup huehue
yaelahir,bisa sekali ini aktifin pesawat terbang mode tawa
yaelahir,cakep adeknya baik
yaelahir,terus pikir hal memang sudah mesti yah
yaelahir,cilung mirip papeda ibu malu
yaelahir,banyak berita buruk
yaelahir,tidak paling sulit
yaelahir,gila gilan rasa lelah dikit biasa situ doa orangtua kerja syukur
yaelahir,manga kaki kaki
yaelahir,ayo dong
yaelahir,zonk sekali dapat oyo
yaelahir,yap merasakanya
yaelahir,nat nit nut pala habis keujanan
yaelahir,sekale
yaelahir,lagi banyak mau inap pods huehue tapi sayang kalau cuma bdo
yaelahir,tawa ancor tawa tolonk
yaelahir,seperti anak rantau saudara laki pulang desa dengar lagu mellow ingat
yaelahir,ayo saudara wanita mahalin lagi h orgorg kemarin buka tokopedia gece sekali heran
yaelahir,sikit itu jari kaki sekat takde jari kaki tidak turun
yaelahir,ke anak smanda euy skr ibu
yaelahir,saudara wanita kuat yah kagum
yaelahir,baca pakai nada dara arafah wkakakak
yaelahir,bibu gabeda jauhla kita malu
yaelahir,mana kalau kircon
yaelahir,tawa tidak keitung
yaelahir,virtual dimsum
yaelahir,closefriend tawa
yaelahir,tol panjang sisteur
yaelahir,sekutyt etapi hujan saudara wanita
yaelahir,pun tentu realisme penuh saudara wanita
yaelahir,aci tampan kurang teh coba melipir baso aci saudara laki jay euh pokok mantul hihiw
yaelahir,najis teman saya
yaelahir,sabiantama kenapa sekali pandang
yaelahir,ada semoga tahan sampai
yaelahir,sudah hasil tidak keran igs pipel mg yey saya
yaelahir,sesal baca sampai selese
yaelahir,anak coding sekali ini saudara laki
yaelahir,ah kalau tidak dia
yaelahir,cemil jam gin doamat daripada mati kelaperan iya
yaelahir,hwapiy tahun ulang tahun sayang nci semoga dapat lebih tua dapat happier yap tidak sedih hopefully semua adalah getting bter sampai lebih baik
yaelahir,salah tidur habis maghrib jam gin melek mau tidur jam weiy
yaelahir,teman kelas saya tawa
yaelahir,yang dberikan waktu tuhan tuk brsama orang yang kalian sayang brsyukur sampai bangakan mereka belum lambat sudah perna merasakanya sampai hilang ayah adalah pedih yang sgt sakit tidak lupa juga jaga sholat walaupun bukan orang
yaelahir,kurang obat memang teman ajak tersebut jam gin
yaelahir,dingin kelelawar ada kutub
yaelahir,kenapa yah kalau pulang bawa suka bersin hanya flu hanya lemah ir tidak suka
yaelahir,rindoe
yaelahir,maaf sudah tidak sangat hormat sama yang baju coklat
yaelahir,naha semester
yaelahir,tenanq ayah juga sami sampai minggu h
yaelahir,dimana ayo libur
yaelahir,kayak saya yang tidak giur harbolnas anak tidak doyan blnja online shop heu
yaelahir,tuhan anda sangat sehat wkakakak lucu
yaelahir,kejut atas juga
yaelahir,rem yah orang jaman sekarang buat fac atau ndac buat ngesen
yaelahir,inti suka rendah kita tidak akan tahu tuhan angkat derajat
yaelahir,semoga sabar lebih amarahnya
yaelahir,ayo kuat ayo panci
yaelahir,apasik bil uname ampun garetek
yaelahir,et tidak sudah keburu dilogout juga yey jadi tidak ada notif seliwer
yaelahir,sementara tidak dulu buka instagram hihiw tahan ir tahan
yaelahir,bilas muka gosok gigi tidak lupa evaluasi
yaelahir,jadi cerewet
yaelahir,bright
yaelahir,alohu panas atulah awa teh em pis ibu tangis
yaelahir,berapa inspirasi in da masa depan tolong ter jodoh ayo buat begini brg kejut
yaelahir,dia ini asli tidak boqis boqis tawa
yaelahir,golong orang kalau lapar baik tidak cemil atau baik puasa daripada keluar mandi tawa walaupun ambil deliv gerbang harus senganya lihat segar
yaelahir,amin perkara itumah mudah yang nebelin dulu rekening sama isi dompet
yaelahir,sudah dong ayo kerjain ayo agar cepat dapat uang ayo
yaelahir,apa enak pis heu telkom mh skripsi buat jurnal yang beda teh kalau buat jurnal tidak usah sidang kalau buat cuma presentasi konferensi menit aza tangis
yaelahir,kan memang dong skripswet ibu tep justru kan tahun aeh teh maha tawa
yaelahir,pik mirip kayak ngepublikasin kertas anti sidang begitu
yaelahir,macam begitu agar buat orang greget sampai geger tawa
yaelahir,sadar menu arsip instagram bagi yang lagi slek sama pasanganya
yaelahir,saya dengan saudara wanita nana
yaelahir,eh bagaimana saya salah iya
yaelahir,atulah baik tidak usah kenal segala kalau begitu tangis
yaelahir,karena pernah posisi hafal tidak teh ciri proses dewasa kata orang benarkan jika saya salah
yaelahir,ayo ayo mumpung saudara laki belum sampai tahap ayo hindar ayo bisa
yaelahir,hidup dunia sendiri makhluk lain dukung tuhan uji baik dan kuat jalan hidup
yaelahir,percaya drama korea ramai loh
yaelahir,karena yogyakarta istimewa dijujani anzay
yaelahir,lelep ibu peta banung segera teh banung sahur abige eh
yaelahir,kenapa sekali sakit tulang punggung mungkin ini tunjuk tua
yaelahir,skak tikar
yaelahir,sudah benar memang kalau lagi hujan deras terus seduh mie
yaelahir,saya
yaelahir,wakakak kenapa jo j mau diupgradein yang memang apa
yaelahir,iya ampun saudara laki aktif saja tawa lewat jo lupain jadi pjg gin bahasa ampun
yaelahir,yeh tidak begitu sudah diupdate loh em set gelap mode coba
yaelahir,ituloh yang depan pga tapi pikir sih memang semua rotkus atau rotbak memang asam tawa yang beda baik atau tidak
yaelahir,terimakasih jo tapi tetap tidak bisa tawa
yaelahir,ih sumpah ada cium bau kaki
yaelahir,cuma saya doang beli rotbar roti kukus rasa bau asam begitu
yaelahir,tahu kalau baubau perphotograpy an tawa omong omong kemarin sudah download yang versi trcamera tapi tidak bisa dinstal tangis dong jo link download yang gcam tolong malu
yaelahir,jo pakai gcamera tidak sih
yaelahir,butuh pergi pijat
yaelahir,bararade kode
yaelahir,ben tawa
yaelahir,kalong ibu asli tidur jam set an ini bangun
yaelahir,kenapa malam sampai subuh segar benar gilir siang sore kantuk ampun heran
yaelahir,merah dimsum dipatiukur saudara wanita memang itu dimsum juara malu
