username,tweet
silvihoroni,anak uya kuya kali kalau susah tidur tinggal yah bakarin tisu saya susah tidur ini anda lelap
silvihoroni,kayak virus ikut bandara
silvihoroni,asik ajak antem seperti utama teka teki pakai logika kompromi tidak pernah kasar mintain saja terbaiq
silvihoroni,lawan terimakasih perangkat skincareku
silvihoroni,sekala humoris sekali
silvihoroni,tawa sial
silvihoroni,maaf lahir batin bebqu
silvihoroni,tawa
silvihoroni,tawa
silvihoroni,pikir latih jadi motivasi cemil malam ini tawa
silvihoroni,tawa bagaimana kurus tidak ada yang apalage gendud pikir
silvihoroni,ngantuk tapi perut lapar jamin tidak bisa tidur cemil ini tuhan takut gendud tapi ken cemil
silvihoroni,jadi tunggu dia virus pikir
silvihoroni,humoris kasmaran seperti anak remaja tawa
silvihoroni,kadang teman saja yang tidak suka lihat bahagia
silvihoroni,brownies saya lihat youtube saudara platingnya yang koda tawa
silvihoroni,versi medan saudara laki tawa
silvihoroni,wagelaseh semua lee tae cakep jijik
silvihoroni,kalau suka kucing jadi pcrku kalau tidak suka kucing temenan tapi kalau anti kucing neraka sama kucing baik kita tidak jadi teman tawa
silvihoroni,juga pernah saudara laki antem sama gebetan karena lagi cemil pinggir jalan ada kucing yang datang ndusel saudara nah sepak kucing marah saya jauhin sampai tidak pernah balas chatnya sedih sekali saya lihat kucing jahatin begitu
silvihoroni,jam gin lapar ken cemil takut lihat pipi
silvihoroni,tangan capri gatal
silvihoroni,sampai episode jamin tadi ini karena kesal
silvihoroni,episode sudah epik ken nabok lakiknya selingkuh lakiknya sama teman pakai kulit duren kulit landak
silvihoroni,seminggu
silvihoroni,lucu
silvihoroni,anti lihat teman gadis ngambek sama teman cewenya manja sekali sudah anda tidak samain kayak pacar anda yang bujuk sayang maaf iya salah hai teman anda gadis ngimpi kalau digituin
silvihoroni,karena laki saja ngilangin teman yang dari semua bareng bodoh
silvihoroni,yang antem sama pacaranya marah sama aneh manusia
silvihoroni,juga tidak pulang medan habis dari jakarta kemarin semprot halaman rumah baju koper cuci padahal pulang habis cuci
silvihoroni,tangan gatal sekali ken masak masih jadi odp rumah tangis
silvihoroni,hati seperti peri fisik seperti wonder wanita
silvihoroni,kalah kadang tanjung
silvihoroni,bisa tahan emosi ngeredam egoisme tapi orang diam buat semena sama orang yang tidak paham dibaikin
silvihoroni,minum
silvihoroni,syukur sayang eh bagaimana anda
silvihoroni,ketika anda ldran tidak ketemu tidak boleh saya ikut teyus
silvihoroni,kemarin ken geser siang agar bangun siang nyata tetap masuk pagi tapi pulang malam badan tanjung tapi timbang syukur
silvihoroni,bangun pagi harus masak saudara yang kuliah pagi semua cemil pergi kuliah tinggal wisma gilir cuci piring cuci baju pikir jam padahal geser siang jam tapi karena suluh jadi cepat masuk
silvihoroni,sama iya
silvihoroni,dek maaf saudara ketawain ganiat anda tapi humoris natural sekali tawa
silvihoroni,mental anak indonesia hancur sekali anak sudah ngeras hebat dengan nyakiti teman dengan bullying pakai keras sedih lihat
silvihoroni,tetkadang lain akan dia hak penuh hidup
silvihoroni,tidak paham lihat gubernur minangkabau ini kenapa indonesia kenapa padang
silvihoroni,humoris sebentar kalau anak bila tawa
silvihoroni,buruk getar padahal detik tawa
silvihoroni,seperti ris tapi seru bawa motor santai jadi basah kuyup nang tawa
silvihoroni,bawa motor nang hujan an tawa aneh sekali
silvihoroni,yang salah jika anda orang tersebut anda bahagia terlalu paksa anda tolak ukur bahagia dia tapi anda sadar tentu bahagia anda
silvihoroni,bahagia tanggung tidak beban lain anda bahagia beda konteks lihat orang bahagia anda bahagia
silvihoroni,aneh jika lain alas anda bahagia
silvihoroni,ayahable dia ekspresi muka yang begitu
silvihoroni,malu kalau keluh tanjung
silvihoroni,juga dublg ngegas abistu ngomongnya kasar padahal bek hati
silvihoroni,tidak bisa ajar bilang tidak bisa nolak kalau yang tolong saja tolong tapi tidak pernah ditolongin gin kelelawar hidup
silvihoroni,kalau lagi dalam sulit biasa bantu lah tidak yang bantu tidak ada yang bantu
silvihoroni,iya bicara kasar intonasi tinggi tapi bek hati ini tawa
silvihoroni,malah takut in pintu kamar gedor kencang dia lari kamar bodoh tidak kuta saya sama teman kalau bicara kencang suara wih baya sudah kita cakap seperti begadoh iya
silvihoroni,susah cari laki yang jadi pasang diskusi dalam hal tidak gegabah tidak pakai emosi pikir
silvihoroni,laki baik tidak keras kepala tidak terlalu lembek kalau atur laki kehilan fungsi pimpin tapi jadi pimpin yang mendengarkan pasang jalan tidak
silvihoroni,tidak sudah ngikut malas taruh sama yang begitu kalau bkg tidak itu harus blabla tidak yang blabla yang anda itu gin pilih kosa yang juga jadi sejuk dengernya ikhlas
silvihoroni,sih sama laki yang diri tidak keras kepala dengar tapi tidak ngih
silvihoroni,matila anda bang lupa anda gadis samping tawa
silvihoroni,kecil bayi ingin untuk main hujan hujan pergi jauh
silvihoroni,laki malas
silvihoroni,akan lega dengan peluk
silvihoroni,tetangga belah nutup pintu kamar tidak selo
silvihoroni,bhaiq teng tawa
silvihoroni,rem
silvihoroni,tukang beli kaset drama korea tular tawa eh omong omong gigi taring leng cakep iya muka gagah begitu tawa
silvihoroni,baru tahu dulu tahu anak pita jadi anak indie nikmat senja kopi drama korea tawa
silvihoroni,tuhan udak tonton drama korea tawa
silvihoroni,nama silvi neneng dasar bambank
silvihoroni,iya saudara wanita maksain
silvihoroni,malas cerita
silvihoroni,saudara wanita nang saudara wanita memang nama neneng z
silvihoroni,blokir kapok anda bambank
silvihoroni,kesal laki gamodal tuhan berani ini maksain pulaktu
silvihoroni,jaman sekarangmasih saja laki matre manfatin doang malesin
silvihoroni,saat gabung twitter ingat
silvihoroni,modboster tidak lagi tanjung anu
silvihoroni,masya tuhan beby
silvihoroni,tidak ada uang ini beby tawa
silvihoroni,amin timakaci udak alis
silvihoroni,amin maci beby ayaflu itu eh omong omong foto jerawat lihat besar
silvihoroni,kamar aneh langkah dari toilet dapat sinyal wifi tidak toilet gadapet tawa tidak boleh nongkrong pegang telepon pi
silvihoroni,astaga
silvihoroni,bagaimana pipi bakpau sama dua kali lipat chin mau hilang kalau pekerjaan ngmil
silvihoroni,keseltu tidak sudah sikat gigi masih ken ngemil
silvihoroni,chatnya dipublish orgnya tidak tawa
silvihoroni,tuhan ngintip ya tawa
silvihoroni,tidak bisa tonton film cuma modal streaming indoxi
silvihoroni,lihat
silvihoroni,terimakasih apa mangat skripsi apa
silvihoroni,macam sudah kali lupa senin pkpa ini sudah cerita anak tawa
silvihoroni,cuma uji hidup saya uji hidup ujan uji osce uji kompre kasus ajar minggu ukai mangatla pi
silvihoroni,skor toefl skor mobile legenda sama pubg tawa
silvihoroni,andai mudah hafal itu gin
silvihoroni,lagi ujan tidak boleh pikir yang tawa saja mikirinya wisuda tawa
silvihoroni,hadiah desember ya kemarin malu
silvihoroni,banyak belum saya pada
silvihoroni,squishy gumas
silvihoroni,ken yang seperti gin tuhan
silvihoroni,dengar yang vrsi pria ayah anak saya judul lamar dadak ken lamar tawa
silvihoroni,tawa bah tawa
silvihoroni,desember sambut tidak khawatir tingkat hari
silvihoroni,malam saya rindu rindu yang tapi semesta izin temu
silvihoroni,sih tidak orang yang tegas kalau hitam hitam kalau putih putih abu tolong bukan anak sama
silvihoroni,dinikahin enak peluk cium tidak dinikahin
silvihoroni,gaberani tanya karena kayak tidak akan apa
silvihoroni,banyak tanya yang jawab
silvihoroni,mau belawan
silvihoroni,cepat senin tidak sebentar selasa rabu eh ke padang pikir
silvihoroni,sulit saudara laki
silvihoroni,syukur
silvihoroni,tidak padang sebentar kalau pulang ken ketemu sebuah c sebentar ken cemil sebuah c sudah sampai medan ken rumah malas mau sama ibu cemil masakan ibu
silvihoroni,tidak kembali kesana tarung sesunguhnya ketika kembali
silvihoroni,untuk ke kota sita apa yang punya hati
silvihoroni,uji selesai yang tunda
silvihoroni,mulai pkpa gabung sama teman yang masya kagum takut kayak tidak nyambung sama saya
silvihoroni,mana tinggal di kamar kos yang besar tim hore
silvihoroni,desember awal akhir
silvihoroni,ken
silvihoroni,mie ayam amigos
silvihoroni,tanda kalau jodoh mudah pasti lancar telah usaha tapi kalau tidak jodoh anda usaha gimanapun tetap ada halanganya
silvihoroni,hati memang buka manatau entar yang terus tetap berfikir keluar pergi meningalkan
silvihoroni,tuhan tahu yang di hati
silvihoroni,sama guling tawa
silvihoroni,mobil kesal saudara laki uninstal tawa
silvihoroni,lucuk
silvihoroni,etapi belawan panas bagaimana yak angek bana belawan kenapa tawa
silvihoroni,memang yang enak rumah
silvihoroni,sudah sampai rumah tidur sama ibu dasar bayik besar
silvihoroni,maksud mbanya following
silvihoroni,kalau benar tidak ngambek tidak tahu kalau gadis yang tawa
silvihoroni,yap jadi satpam jam kalau memang niat selingkuh tetap selingkuh ya dibebasin kalau nyamanya sama kemnapun pergi cari
silvihoroni,cinta menikah sehat
silvihoroni,tidak ikut malah kalau lagi sama temenya tidak telepon bilang saja kalau sudah rumah telfonan tidak mau ganggu ini waktu bareng temenmu dunia bukan harus saya
silvihoroni,cemil terfav sama tangis
silvihoroni,tawa tulah smlm saya vc saudara saya apa
silvihoroni,sudah kan jam gin sudah tidur nyonya apa
silvihoroni,tidak ada teman vc pikir
silvihoroni,kamar ber tidak ada tugas teman yang vcin tiap malam seperti utama pubg sama emel ajade pikir
silvihoroni,kenang dalam waktu jalan dan saya sendiri tatap hanya bayang
silvihoroni,ada yang pedih pada hilang
silvihoroni,cinta menikah indah lucu
silvihoroni,bayik kalau besar ngambeknya bagaimana tawa
silvihoroni,ikhlas yang baik mungkin lain saya
silvihoroni,lagu prolog ii adjie santosoputro kunto aji
silvihoroni,lagu seperti tulang nadin amizah
silvihoroni,baik anda jaga diri
silvihoroni,ikat rela tidak untuk
silvihoroni,sendu rindu kelabu
silvihoroni,saya tidak tahu maksud datang saya ibu percaya
silvihoroni,masya ponakan onlineku
silvihoroni,limbah medis tatacara buang yang dan tempat bagaimana saksi sampai laku musnah ada berita acara atur permenkes tapi tega buang sembarang sedih saya yang anak
silvihoroni,tuhan pilih baik yang kita butuh
silvihoroni,kalau diah tidak iya tawa
silvihoroni,sudah tidak sanggup pikir yel yel anak sampai dengan
silvihoroni,agar semesta pilih
silvihoroni,ciyin ponakan onlinequw
silvihoroni,belum kecewa belum
silvihoroni,memang sudah porsi waktu sudah ditentuin
silvihoroni,tidak ada yang tangis tidak ada yang sali
silvihoroni,sakitya pikir
silvihoroni,lama suka sama womanizer ini bagaimana hati saya tangis
silvihoroni,dikau womanizer
silvihoroni,ken pulang
silvihoroni,ken ikan sambal ibu
silvihoroni,ken lup tmpt ibu nizam
silvihoroni,ken roti tebu yang kota
silvihoroni,ken bihun goreng saudara ijah
silvihoroni,ken kwetiau saudara ijah
silvihoroni,ken nasi uduk yang jalan riau
silvihoroni,ken sate madura simpang singkong
silvihoroni,ken bakwan pakai kuah mie rebus
silvihoroni,ken gila buryam depan eshmun
silvihoroni,laki kalau sudah ganepati janji ibu susah baik cari nepati janji ajadeh janji dia utama bagaimana entar sama pi
silvihoroni,tidak ada yang laki pikir
silvihoroni,baju besar celana besar kaliatan gemuk
silvihoroni,manada aris silvikan bilang anak sultan
silvihoroni,tahun baru pulang
