username,tweet
ovilsp,tidak ajak huw
ovilsp,heran sekali kenapa pada bilang budak cinta
ovilsp,jadi kamar mandi
ovilsp,tidak tahu dari z
ovilsp,ingin dekor kamar seperti orang
ovilsp,hayo cepat uji lil
ovilsp,geprek zaitun
ovilsp,akirnya hijau lagi sekian ndekem rumah
ovilsp,buka lihat
ovilsp,rindu jajan jajan tolonk
ovilsp,betol ayo ibu suci langsung kua
ovilsp,takut kualat sekali tolong
ovilsp,amu sab
ovilsp,telinga bom
ovilsp,anginya kencang sekali
ovilsp,zahra kasarung
ovilsp,mutung
ovilsp,pusing
ovilsp,kenapa kucing yang ini meong terus
ovilsp,agar tidak bodoh lagi
ovilsp,lihat orang cemil rendang lapernya tular sekali
ovilsp,enak
ovilsp,ingin minum boba hari
ovilsp,ini isi cemil tidur drama korea
ovilsp,grup keluarga nanyanya besok vidcal pakai sedih sekali bawah
ovilsp,lebaran ini anak sedih
ovilsp,sedih lebaran rumah doang
ovilsp,mager ya tuhan
ovilsp,mokel
ovilsp,tidak maafin
ovilsp,dingin
ovilsp,tonton sampai episode terus bosan tawa jujur frik saya
ovilsp,gasabar corona selesai terus pantai
ovilsp,mie rebus tolong
ovilsp,bisa ngetwit budak cinta tahun
ovilsp,benar nged tawa
ovilsp,ngechatnya jujur saya rem
ovilsp,kukut
ovilsp,pusing tidak tahu jawab
ovilsp,ditanyain skripsi destia ingin beku
ovilsp,ingin kerang jam gin
ovilsp,anda benar selesai tidak otp
ovilsp,gaktau tawa tapi sekali kenapa padahal enak
ovilsp,bagaimana cerita kucing takut kedatengan kucing padahal lebih besar
ovilsp,ingin olahraga lagi tapi mager sekali tidak bisa
ovilsp,gtw kenapa semangat sekali mau sahur
ovilsp,knpsih knpsih
ovilsp,jeda dari jaman kn saya patah lelah sedih sekali padahal awet sejarah
ovilsp,tawa banguntapan sagan putar ringroad iya tok
ovilsp,dosa itu luas dari banguntapan sampai godean
ovilsp,sedih tidak bisa sunsetan blkg rumah lagi
ovilsp,kalau buka kenyang
ovilsp,main memang pria gemini tawa
ovilsp,utama sama gdun gin ini jdnya
ovilsp,cemil pedas sih tapi tidak kuat
ovilsp,tawa tidak marah begitu synk
ovilsp,uji sabar lelah
ovilsp,tinggal ngegame
ovilsp,tolong aqila ikut scnd akun saudara sarah
ovilsp,hadu bingung
ovilsp,frik sekali malas temenan
ovilsp,anda tidak muring memang
ovilsp,kenapa begitu
ovilsp,besok puasa uwuwuw
ovilsp,pokok habis mau tonton konser
ovilsp,idih sok tanjung
ovilsp,bentar lagi ramadhan coba
ovilsp,malas tidak
ovilsp,tahu dibolehin
ovilsp,sudah kenapa sama sapi
ovilsp,ingin ngobrol langsung tidak telepon doank
ovilsp,jalan jalan lagi ayo
ovilsp,anyeong haseyo eon
ovilsp,ingin ngobrol pakai bahasa korea agar seperti drama
ovilsp,sayang sekali sama alfamart samping rumah
ovilsp,juga tonton darah tinggi
ovilsp,tonton drama pusing hidup
ovilsp,langsung lapar lihat
ovilsp,rindu teman teman saya
ovilsp,bentar lagi puasa tapi sedih kalau tidak bisa buber
ovilsp,ingin tonton drama tapi tidak tdur
ovilsp,muasaksih
ovilsp,ken jalan jalan paham tidak
ovilsp,hujan ujanan itu niat memang
ovilsp,hujan ujanan ya agar tidak bosan
ovilsp,seru sekali putar putar yogyakarta
ovilsp,tonton drama isi cemil yang lapar hanya
ovilsp,anggur uang baru mobil wkakaka
ovilsp,sj godan tonton drama korea
ovilsp,jujur tidak bul
ovilsp,benar cuma pasrah atau ikut orang padahal tidak tahu
ovilsp,kalau tidak barenganya tidak bisa dari pogung
ovilsp,menang
ovilsp,apa kira drama korea budak cinta seperti
ovilsp,saya tonton vagabond cepat tolong ayo pindah nyala dari cloy
ovilsp,sumuknya kacau
ovilsp,sudah habis ide apa
ovilsp,cloy gemey sekali
ovilsp,cemil tidak sudah sudah
ovilsp,indihome banyak tidak da akhlak
ovilsp,tawa pakai marah loh
ovilsp,saya
ovilsp,knpsih akhir srg tidur tidak magrib pusink
ovilsp,tumben rumah dingin
ovilsp,dingin ingin tayamum solatnya
ovilsp,kenapa sih kamar beranta padahal damar hari
ovilsp,tolong jiwa sudah gatenang
ovilsp,tonton drama korea halusinasi
ovilsp,pikir ken cemil pakai saja pusing anda saya itu
ovilsp,lari kejar depan
ovilsp,marahin riuh
ovilsp,omong orang
ovilsp,cemil yh
ovilsp,dari kemarin tonton cloy sekarang sudah selesai jadi sedih ingin lagi
ovilsp,tonton cloy sampai seperti orang gila
ovilsp,gigi bolong
ovilsp,tonton cloy tapi tapi banyak beban tapi banyak yang penting
ovilsp,sampai ketemu lagi tahun
ovilsp,semoga tidak diabetes ngabisin pai susu sebox
ovilsp,tuhan tengeng
ovilsp,ebi sekali astaga
ovilsp,boleh cemil seblak hari
ovilsp,cemil seblak yang tidak pedesnya bisa sakit perut gin
ovilsp,saya memang kutuk
ovilsp,pikir takuds
ovilsp,yang ingin boba yang ken in sarah boba terus smsm cr digofod tapi sarah dapat habis
ovilsp,selamat kuningan jung ayo
ovilsp,tanggal tua
ovilsp,ingin drakoran
ovilsp,seperti monyet
ovilsp,ada tenaga alias lemas sekali nangisz
ovilsp,astaga tidak maramara
ovilsp,pernah seperti gin sama tidak nyalip diteriakin itu ninda salam
ovilsp,godan cemil sama tidur waktu hujan itu benerbener
ovilsp,tidak suka lapar malam malam
ovilsp,aduh jadi malu
ovilsp,em rindu ya anda
ovilsp,dosa tidak kalau ini agenda cuma tidur cemil tidur youtube an cemil tidur lagi
ovilsp,tadi malam nabrak dinding rumah sampai pada lelah jadi tidak bisa alasan kalau yang tabrak
ovilsp,bosan juga tidak kuliah
ovilsp,tawa nang
ovilsp,astaga jam gin ngantuk
ovilsp,cedi tinggal saudara pulang
ovilsp,jompo sekali habis mutermuter mall tanjung yaoloh
ovilsp,kenapa tidak motivasi sekali apa
ovilsp,siksa karena bau duren
ovilsp,sekali bingung
ovilsp,kirakira suka tidak
ovilsp,anak online
ovilsp,lelah sekali pagipagi kejar kucing
ovilsp,memang tiada tanpa cemil cilok
ovilsp,tangis tapi gadpt tiket
ovilsp,yang jual tiket hindia gaksih
ovilsp,lagi suka sekali baca zodiak tawa
ovilsp,begitu
ovilsp,hala bohong
ovilsp,banyak mau es buah
ovilsp,ken sekali benar tonton kunto aji
ovilsp,knpsih kucing suka loncat takut
ovilsp,orang pulang suka hindar kalau masalah
ovilsp,uang paman
ovilsp,tidak yang berat rindu saudara dil
ovilsp,ada masalah
ovilsp,januari cpt sekali cuy kacaw
ovilsp,tonton sudah persis baskara kalau nyanyi
ovilsp,tonton ardhito memang buat bahagia
ovilsp,tapi kenapa tidak ketemu
ovilsp,ritwit sekali
ovilsp,kalau anda brengsek tidak saudara
ovilsp,cemangat amay
ovilsp,cerita omong kosong kalau
ovilsp,apa
ovilsp,hari lho der pulang tidak babak bur
ovilsp,ayo beli gratis admin akakak
ovilsp,senang sekali habis eskrim
ovilsp,lucuk sekali knpseh
ovilsp,ken buat taman bunga
ovilsp,muncul asep tandatanda kiamat
ovilsp,tampar keras dari teman semoga tanam dalam otak hati batin jiwa tubuh amin
ovilsp,cinta sekali sama sate kambing
ovilsp,ngetiknya paragraf istirahat sampai besoq
ovilsp,tawa ayo cemil sate ratu
ovilsp,h tidak boleh sirik
ovilsp,saya multitasking skripsi tiktokan ngapalin lagu hindia revelgigs sama
ovilsp,motivasi agar tidak mager
ovilsp,sekarang senin tidak ada nyebelin nyebelin
ovilsp,gumuy
ovilsp,panas nerbener
ovilsp,peras waktu jalan tadi ngantuk tapi sampai rumah kenapa melek sekali giniseh
ovilsp,skripshit adalah panggil
ovilsp,sudah bukan rencana tautaunya tidak sesuai pikir
ovilsp,buka jurnal dikit ngantok
ovilsp,lapar terus itu ya
ovilsp,tiktok alih dunia saya
ovilsp,tadi malam tidur jam utama tiktok awaw aduh
ovilsp,pagi sampai detik yang laku cemil cemil
ovilsp,jengukin sarah monyet
