username,tweet
hawaariyy,djdjdj
hawaariyy,jdjsisj
hawaariyy,dhdhsjs
hawaariyy,kenapa pengirim
hawaariyy,bermingu mode tidur
hawaariyy,bisa pria tutup turun laptop layak
hawaariyy,ken nanti sama di surga kalimat tenang sampai sama nasihat
hawaariyy,kasih ajar diri lihat orang ada atau khilaf agar tidak banyak tambah dosa
hawaariyy,memang itu diniatin lihat sekali khilaf habis hujat lalu sedih kecewa tidak minat buat baik
hawaariyy,nila titik rusak susu belanga peribahasa mungkin kita lupa
hawaariyy,henti itu stigma saya tidak bisa sungguh henti itu jika itu actors adalah masih di sana proving apa masyarakat percaya
hawaariyy,tidak sadar yang generalisasi yang stigma masyarakat
hawaariyy,begitu saya lihat gadis nakal malam kamar pria jorok
hawaariyy,saya tidak suka apa kati jenis kelamin gadis keluar malam jadi gadis nakal pria itu malas kamar jorok sekali
hawaariyy,stigma tetap sampai yang bahan stigmatisasi hilang
hawaariyy,tidak suka konte arti tidak suka
hawaariyy,lah pronun
hawaariyy,kelas sudah keren sop hua ketemu ibu ken lama kyknya sibuk sekali
hawaariyy,saya pikir
hawaariyy,kalau kasih saran ubah yang bagus
hawaariyy,suka apa sayang yang komentar mereka terima anda apa
hawaariyy,sekarang bingung ubah yang ideal bagaimana
hawaariyy,bisa rasa sayang amarah
hawaariyy,bersih following sop gils sop sini keren
hawaariyy,selamat sukses shof keren sekali gils
hawaariyy,ribut
hawaariyy,nyamanya teman
hawaariyy,kasar kasar dan orangtua orangtua
hawaariyy,hago ayo
hawaariyy,teman teman yang metro yang minat lembar topeng ariul pc beli set isi varian saja jamin asli ini ambil metro
hawaariyy,buat rencana malam pokok besok saya harus olahraga sok besok
hawaariyy,tunggu datang yang tidak harap
hawaariyy,itu naskah batu itu dunia asik sekali didengerin ajar
hawaariyy,pikir ini mau ujan nyala hago hanya
hawaariyy,umum juli saya sini ucap syukur akan cukup tunjuk benar syukur saya rasa saat dan satu yang saya ingat rencana tuhan indah
hawaariyy,saya ceritain ceroboh telah saya kuliah jalan tahun tawa ibu saya melotot
hawaariyy,waktu awas di bangku saya ambil ljk saya lihat kertas saya saya salah buletin nmr uji h syukur syukur sekali waktu pena nang
hawaariyy,masih saya ingat sekali waktu sbmptn waktu saya duduk depan waktu soal selesai saya laku periksa biodata tidak yang salah ulang saya periksa tidak yang salah
hawaariyy,sbmptn kali saya tidak ditemenin ibu saya satu sahabat saya juga juang aduh ingat sekali uji saya f geografi ugm tidak telat minep inap dekat tawa humoris kalau dingat
hawaariyy,sudah chose unpad sebagai saya pertama pilih khawatir ibu bilang banyakin doa saudara semoga lolos saudara intensif bimbel mulai bulan sbmptn
hawaariyy,ikhlas ibu rela anak nekad pilih unpad saya tidak pikir unpad sekali unpad saya tahu waktu sosialisasi sama tiba begitu tarik sih program gratis malu
hawaariyy,saya bisa ya jadi psikolog ibu ambil lamar di alas saya pilih psikologi benar satu saya suka tentang manusia utama pribadi dan saya tarik
hawaariyy,unpad unpad unpad anda salam unpad besar heboh karena pilih saya psikologi unpad ibu syok psikologi jadi nanti saudara
hawaariyy,disaranin ibu rata hasil untuk untuk pilih uns unsoed unila yang saya bukan ledak debat
hawaariyy,sempat cekcok orang tua utama ibu karena tidak jadi pilih ugm pasgrade besar sekali malu umur untuk sekali nembus angka karena pasgrade unpad besar minat tahun ribu an
hawaariyy,ingat tanya bapak inten yk ambil kuliah dokter ugm sama buk sbmptn tanggal april tiba ken unpad
hawaariyy,cita cita ken kuliah ugm
hawaariyy,saya tidur siang malam malah ngantuk awal mer
hawaariyy,mesti musnah tipe pria yang suka cerewet v
hawaariyy,kadang suka pikir suka koar koar tweet calon jodoh sana sama
hawaariyy,salah yang pagi ceria lihat tumbuh
hawaariyy,sudah baik tutorin buat dimsum
hawaariyy,sayang kopi syukur tahan ngantuk sampai pagi badan lemas ke
hawaariyy,ntah bilang pondok sesak cerewet
hawaariyy,pria yang tinggal makin cakep idola korea
hawaariyy,tidak balas begitu mul
hawaariyy,lihat layar telepon mobil bayang aduh domba hago
hawaariyy,benar usia usia butuh semangat hidup
hawaariyy,agar jeli satu yang bab lancar kopi
hawaariyy,tweet baru saja curhatan teman
hawaariyy,saja waktu rasa simpan dalam saya anda masih nikmat ngobrolin saja seperti saya used untuk buat
hawaariyy,lihat dari reisa semangat
hawaariyy,kasih emot yang
hawaariyy,utama segi enam tarung kalah hanya
hawaariyy,anda rindu bukan lain yang
hawaariyy,baca isi hati wanita baca buku hanya covernya saja kata
hawaariyy,tidak lihat telur ngangur
hawaariyy,nd gelombang mengembirakan kali jadi tegang
hawaariyy,nd gelombang corona bukan sempat ya
hawaariyy,butuh waktu hingha untuk gejala hitung telah baru normal semoga tidak nd gelombang
hawaariyy,guten morgen
hawaariyy,saya berterimakasih dari semua
hawaariyy,anda adalah bagi dari itu jalan allah has given untuk saya
hawaariyy,anda adalah itu alas kenapa sudah tidak semangat untuk punya hubung dengan orang jadi normal dan netral untuk mereka
hawaariyy,akan tidak pernah sesal untuk temu saya sebagai sekarang saya karena dari anda
hawaariyy,akan hidup dengan senang hati dengan saya keluarga cinta itu manusia sebagai saya husband cinta saya children tapi anda saya doa akan selalu jadi dengan anda sampai anda temu itu bahagia dan menikah dengan yang lain gadis
hawaariyy,selamanya anda adalah khusus untuk saya bahkan ketika saya dengan yang lain manusia
hawaariyy,kata itu tidak bisa jadi spilled keluar dari saya mulut tidak pernah hanya allah dan tahu itu punya an kosong baik tempat dalam saya jantung untuk anda whom wanted untuk jadi dengan untuk itu istirahat dari saya nafas
hawaariyy,kata desak dari relung
hawaariyy,surga bukan huni jadi undang anda untuk ikut saya di sana amin
hawaariyy,tidak kalimat manis doa dia anda bahagia
hawaariyy,bagaimana tidak nagih
hawaariyy,uji
hawaariyy,sayang saya selesai ujan tidur ya
hawaariyy,ajar ala saya ajar menit begitu ngegame menit imbang
hawaariyy,iklan shopi spotifv keren
hawaariyy,memang salah laki laki cuci piring nyetrika baju nyapu ngepel
hawaariyy,sekian jadwal tidur ubah tadi malam tidur normal jam bangun jam eh jam pagi tidur sampai jam podo saja
hawaariyy,mendengarkan berita televisi presenternya bilang eh tidak
hawaariyy,kalau masak mesti percaya lha bagaimana malu an ik
hawaariyy,main maenanya
hawaariyy,bagaimana sabar kulit dimsum perfectly cocok isi dimsum agar dimsumnya cantik
hawaariyy,euy fa mal aidin walfaizin yuhu
hawaariyy,uji
hawaariyy,mantap zenius syukur sekali bareng zenius awal sama tahun lulus sama sekarang saya disini sukses zenius ajar konsep mata ajar
hawaariyy,ajar resolusi ibu guru harus target jangka pendek tengah panjang
hawaariyy,bismillah rezeki nomplok di malam tabik
hawaariyy,malam hujan isyarat tidak utama petas
hawaariyy,minta kurang sujud
hawaariyy,ada tahun rumit seru syukur tahun tuhan cipta mungkin ini ada alam ajar seru bismillah saya siap
hawaariyy,periksa ibu
hawaariyy,mantap bisa satu bagaimana sikap thd orangtua saudara itu wi tetap bagaimana dia treats anda
hawaariyy,mie goreng sampai saat goreng jalapeno
hawaariyy,sudah ijah dalil dari qur an sunah kita ikut guru dalil bawa karena gelar jadi si guru berani kasih dalil halal tonton roti sobek paha girlgroup silah
hawaariyy,cont rugi di dunia di akhirat demikian adalah rugi nyata qs al hajj
hawaariyy,manusia orang sembah tuhan ada di tepi kebaji ia adan iman jika ia timpa suatu bencana ia cont
hawaariyy,tahu sebut sebut anak guru cuma alas tidak benar benar guru cari guru mau apa kata kita dalil al quran pilih untung syariat pilih sesuai peras tat prasmanan
hawaariyy,hafidzoh hobi shalawatan tidak ganti haluan juga hafidz justru murtad agama islam tidak kan ikut
hawaariyy,benang siapa oleh fuadhnaim ratus anak guru tidak kpop an bukan acu ulama dengan dalil shahih larang pilih guru yang tanpa dalil
hawaariyy,balik oke pop oke pop hanya buah nama bukan pada nama karena bawa saji kalau alir musik yang kriteria yang sama sama nya
hawaariyy,syirik syirik cuma sembah patung sembah matahari kaleng plastik tetap syirik konteks dua cinta tuhan
hawaariyy,kenapa islam agama lengkap sempurna rasululah ajar konteks kita hingga laku
hawaariyy,mainin kompor bahaya maksud fisik kompor tapi bahaya api jadi arti kompor larang besok atraksi debus api ungun kerak neraka bahaya
hawaariyy,konteks oleh fuadhnaim hari kata utama pisau bahaya maksud bukan pisau tapi bahaya benda tajam tidak simpul pisau larang golok arit silet aman
hawaariyy,ps budak cinta budak cinta hamba abdun budak
hawaariyy,yak pilih pilih syariat tuhan silah pilih coba coba kalau tidak suka salahin guru eyak pilih pilih
hawaariyy,cont rugi di dunia di akhirat demikian adalah rugi nyata qs al hajj
hawaariyy,manusia orang sembah tuhan ada di tepi kebaji ia adan dan jika ia timpa oleh suatu bencana ia belakang lanjut
hawaariyy,arab ngadain konser itu arab ngadain konser
hawaariyy,anda humoris suruh kerudung syar arab suruh anti eljibiti kan arab suruh jaga tonton kan arab suruh jaga hormat ini kan bukan arab
hawaariyy,hanya hamba tuhan budak tuhan syariat tuhan standar itu mulia itu bahagia
hawaariyy,jadi samain dengan umat racun asas hidup cinta buta fakta busuk depan pun saja cari faedah selubung
hawaariyy,budak cinta arabia raja mulia juga budak cinta pop skandal apa tetap bela bukan juga budak cinta indonesia sok sok an nusantara pancasila
hawaariyy,saudi buah negara pimpin orang raja manusia punya peluang dosa
hawaariyy,muslim tidak cinta buta kecuali tuhan hanya saudi ngundang pop arti halal status
hawaariyy,budak cinta oleh fuadhnaim
hawaariyy,cc fuadhnaim
hawaariyy,palestine cc fuadhnaim
hawaariyy,mereka ingin untuk milik sendiri apa uyghur has
hawaariyy,couldnt
hawaariyy,tawa
hawaariyy,sol risol
hawaariyy,keren
hawaariyy,ganti jadi cemil cemil yang hitz enak murah malu
hawaariyy,da inti ibu harga pelang harga lain anda harga ibu tinggi kes lebay ini selamat malam
hawaariyy,panas piring penuh wadah juga penuh alhasil nasi mesti comot sedikit
hawaariyy,sudah wadah tidak sekali naruh nasi geser waktu nyendok nasi
hawaariyy,cemil salah diri fodcourt moen moen nama berat ungah cuit tapi kecewa begitu nasi taruh wadah somay pempek nasi daging sapi taruh atas wadah putih mirip ya kucing
hawaariyy,mari rendah hati tunduk kepala jenak doa eyang alahumaghfirlaha warhamha whatsapp afiha whatsapp fuanha amin
hawaariyy,semoga para pemuda muslim jadi eyang kemudian sampai dunia islam rahmat semesta alam
hawaariyy,eyang tunjuk dunia muslim mampu tunduk dunia dunia hanya dalam gengaman dalam hati
hawaariyy,sesunguhnya baik manusia ia bermanfat orang
hawaariyy,ikat muslim dengan lain tali iman ada kalimat indah doa eyang semoga juang ingin baik manusia buah surga
hawaariyy,satu dari itu signs dari cushing syndrome bulan hadap foto dari google
hawaariyy,jogjakarta di jawa tengah
hawaariyy,tulis kesan jadi saudara fasil para mahasiswa baru unyuk bawah
hawaariyy,ide bagus
hawaariyy,diam saya hingga sadar bumbu mie goreng gelas campur air panas
hawaariyy,doa bukan memberitahu tuhan saja hajat keingininanmu tuhan mahatau doa adalah bentuk penghambanmu tuhan
hawaariyy,malang bandung malang kasihan sendiri
hawaariyy,takut takut takut takut saat dipangil peran anda dunia
hawaariyy,takut karena takut mampu bertangung
hawaariyy,takut jujur orang karena sendiri beri jujur
hawaariyy,takut dapat khawatir akan adil
hawaariyy,takut jadi pimpin orang
hawaariyy,takut jadi jabat salah posisi suatu organisasi
hawaariyy,wah
hawaariyy,rendang
hawaariyy,rasa kebahagian lolos sbmptn terimakasih sudah sahabat juang tahun
hawaariyy,sibuk pikir menikah muda lupa mati muda dasar
hawaariyy,tuhan does tidak biaya soul except dengan itu within ini adalah kapasitas tuhan akan beban manusia kesangupanya qs al baqarah
hawaariyy,babat habis bukti anak bodoh an meretwet foto foto unfaedah sejak
hawaariyy,tanda tanda jaman jaman edan banyak keluar dari fitrah indah benar cipta pasang laki laki perempuan
hawaariyy,gera mungkin akan henti ilmu mampu bantu benteng adalah ilmu agama satu yang penting minta tolong tuhan jauh segala bentuk kedzaliman
hawaariyy,sedih kesal takut campur aduk peras lihat iklan di utube unfortunately couldnt pilih tidak untuk lihat ini ad tidak seperti lain ads siapa knows kenapa
hawaariyy,paham kalau siapa tuhan terus cari anda temu
hawaariyy,tuhan cipta manual buku bagaimana hidup sesuai setuju penciptanmu serah mengunakan sesuai atur ada mau saja
hawaariyy,smartphone bagai yang anda mau bagai ganjelan pintu nguleg sambal saja tapi bukan tujuanya smartphone cipta
hawaariyy,cipta setuju akhir analogi buah smartphone anda beli alat elektronik ada manual buku buat bagaimana anda mengunakan smartphone sama hidup
hawaariyy,anda tahu tuhan yang tuhan anda saya ketuhananya sembah dia buat ya itu semua yang tuhan
hawaariyy,saja tidak mampu bukti ketidakberadan tuhan anda tuntut mereka bukti rad tuhan tetap paham
hawaariyy,jelas sesuatu sendiri kecuali yang cipta tuhan bukti tuhan ada kita ada coba bukti tanya tanya ini akan siklus tidak ujung
hawaariyy,tanya hantar kepada yang definisi hidup ada dunia siapa yang cipta lupa teori teori yang benara tanya yah nama teori
hawaariyy,kami butuh lain pulang
hawaariyy,yup mereka ajar kita
hawaariyy,itu dicurhatin hasil sama nyerah sudah kayak cerita punya saya
hawaariyy,kayak suruh pendam cha bicara orang yang diceritain malah jadi yang curhat bilang seperti itu doang ini lho gin gin blablabla
hawaariyy,sama ya ajak ke malang
hawaariyy,kayak baki
hawaariyy,nyambung anda
hawaariyy,barakalahu fi umrik alni
hawaariyy,memang benar baki
hawaariyy,sayang mimpi saudara wanita
hawaariyy,alni tahun
hawaariyy,baki rasa
hawaariyy,akhir sampai sudah sofbolnya saya bisa sesal
hawaariyy,ide bagus
hawaariyy,mimpi disalamin latih latih maaf lahir batin saya hati kira nawarin drilling
hawaariyy,mimpi ngeliatin utama sofbol sambil saya ken tapi malu bicara
hawaariyy,kita sesuatu besar syukur masih nafas ini sudah rezeki biasa
hawaariyy,ayo kalian huni nangor datang susah cari cemil tutup sudah libur
hawaariyy,ayo ayo
hawaariyy,tidak
hawaariyy,ngemention kapan
hawaariyy,pikir pikir jalan lpg joging pakai bis kira butuh waktu kan ingin yogyakarta
