username,tweet
gustianarii,gilir tidak uang webinar wastana haikal
gustianarii,poster film seri
gustianarii,aneh sekali sudah orangorang tawa
gustianarii,dipakai beli kuota saudara laki
gustianarii,saya bingung di dunia paralel bagaimana konsep waktu jelas
gustianarii,lucu karakter
gustianarii,terimakasih ngi
gustianarii,tahu graha lukis artlinx toko shopee
gustianarii,bagus musim saja wap memang sampai saja
gustianarii,teman teman pada tugas diri ngurus promosi
gustianarii,tetap tonton karena nangung kalau mau tonton baik sampai musim
gustianarii,di potkes sayang
gustianarii,tanah liat jensen in musim adalah ganggu sekali
gustianarii,proyek sos keren sekali james mai
gustianarii,tuhan tidak ken ps ken nintendo alih
gustianarii,saudara
gustianarii,sudah tonton begitu wap
gustianarii,gebetanku bibi ayah teman adalah ibu alias lupa hubung karakter
gustianarii,aksesibilitas twitter bisa
gustianarii,dih sudah tidak terang biru begitu bajing
gustianarii,selesai episode tanjung sial tanah liat
gustianarii,cinta anda two ghosts tanda dari itu times jatuh
gustianarii,siapa adalah anda nyasar fodfes
gustianarii,pikir his potensi adalah kinda seperti namtarn
gustianarii,sebagai panjang sebagai saya masih gantung keluar itu enough tawa
gustianarii,kena sungguh peduli jika anda seperti saya atau tidak
gustianarii,itu pikir pengirim
gustianarii,album bts kendi
gustianarii,ken tidak tapi penasaran karena seri tamat musim
gustianarii,nila untuk tonton tidak tapi musim kalau tidak tonton kentang
gustianarii,leo matahari dekat kepala pantas gerah hanya kanker kasi bocor
gustianarii,apa ini tri nyogok gratis saudara wanita saya parsel balik lingkar cahaya
gustianarii,ilustrator kali ikut instagram itu
gustianarii,tawa tahu fanbase
gustianarii,itu komentar
gustianarii,streaming apa pagi pagi admin
gustianarii,saudara wanita jam tidak apa apa admin ganti sudah pindah ini smartfren
gustianarii,look di itu tren halaman tri indonesia
gustianarii,tolong tri apa sudah parsel jam gin sampai jam
gustianarii,kuota tri gb hari harga tidak apa apa elah tapi bagi jam gin
gustianarii,kamernya fizi bagus upin ipin
gustianarii,tahun
gustianarii,dmnya pakai robot sial peras yang
gustianarii,cinta fathia nyala every peron
gustianarii,kakanya nanon seri blacklist
gustianarii,ketik gugel spotify guru tinggi pengirim
gustianarii,tuhan ken beli uniqlo bilie eilish takashi murakami
gustianarii,akhir karakter utama bingung yang tonton anjrt
gustianarii,ost itu shipper humoris saudara wanita
gustianarii,interstellar siap main satu
gustianarii,wakil indonesia jal tawa
gustianarii,naik tolong ajak kekeyi asia naik yang langsung tiktok mobil tren
gustianarii,hanya realised itu dia adalah puimek terimakasih
gustianarii,adalah itu baru karakter itu gadis besides nanon
gustianarii,karantina stories nadao bangkok tarik
gustianarii,romancenya maksa admin
gustianarii,kena tahu apa ingin jika saya sama sekali jujur
gustianarii,yang diskon gratis ongkir murah yang sudah tidak pikir interface tapi shopee berat banding toped
gustianarii,akhir tahun tayang lama anjg
gustianarii,air
gustianarii,kalau karakter film pakai produk apel bukan neraka
gustianarii,gin
gustianarii,kan agar bahan lanjutanya tawa
gustianarii,yang musim itu martha iya yang pakai bola kubus
gustianarii,martha ini jonas alam semesta cepetan rilis
gustianarii,ken ghibli redraw
gustianarii,terimakasih jum
gustianarii,terimakasih wapa
gustianarii,lagi anjg
gustianarii,pegang milik anda nafas hitung untuk puluh anda kena butuh untuk bawa itu semua
gustianarii,maaf jbjb asus tipe ya kalau tahu
gustianarii,tawa humoris sekali
gustianarii,tonton kali yak musim
gustianarii,sic mundus creatus est
gustianarii,bagus apalagi lucut versionya sial enak strange tanah favorit
gustianarii,interstellar
gustianarii,gambar telah ujian bajing
gustianarii,rasa dekat sekali karakter dan itu trailer terlihat janji
gustianarii,bagus sekali nang tidak tembak rumah indonesia pis bentukanya
gustianarii,gelap
gustianarii,flis radit buat lagi sama ngabuburit ngalor ngidul
gustianarii,sudah tidak saudara laki tidak itu east itu komentar sarseh breakout
gustianarii,teleport
gustianarii,film pengirim saya harga kalau tidak salah
gustianarii,tidak debat seri gm keren segi tahun tunggu itu bakat wisuda
gustianarii,fathia izati kalau konten yang bagus saya froyonion
gustianarii,tawa replynya
gustianarii,saya
gustianarii,tutup sunflower sejuk
gustianarii,ujian online tidak asik tidak melar deadlinenya
gustianarii,alec benjamin air air mancur
gustianarii,lowkey seri teotfw akhir nangung sial polisi mana keburu kabur
gustianarii,dorong dj sahur
gustianarii,deserves lagi aku
gustianarii,sial kira ini seri lebih dari musim harus sudah sampai musim doang sedih hai
gustianarii,sudah tidak lanjut
gustianarii,dong admin
gustianarii,instagram doang yang akun lebih aktif akun
gustianarii,ini adalah saya kenapa saya masih bangun
gustianarii,iya tuhan punya anda saya favorit juga
gustianarii,okedeh tidak saya blok
gustianarii,saya blok
gustianarii,langsung in hologram dengan anda
gustianarii,utama colour buta instagram cuma sampai tawa
gustianarii,eh ini sudah mei bersih buat indonesian pilih hadiah tidak
gustianarii,ada yang bicara
gustianarii,sial indonesia ini bedain akting nyata hidup tidak bodoh
gustianarii,bang
gustianarii,jadi ingat film seperti
gustianarii,album anak krow conan abu
gustianarii,naik sungguh paham orang siapa bisa mampu tiket concerts seperti saya
gustianarii,semoga unggah di youtube alias tidur tidak brian buat kalah sidang
gustianarii,max taman saeroyi
gustianarii,tidak lihat saudara laki
gustianarii,episode sudah ke konflik humoris sekali lihat mucikari sama mitra ketemu tapi tidak tahu sama
gustianarii,bagus koh
gustianarii,apa jika itu dunia menang tikung saya cara
gustianarii,episode bayang geun jadi itaewon tidak sudah tidak karena beda sekali karakter tawa
gustianarii,seri mingir
gustianarii,hai semua
gustianarii,kalau masang sampai dengan tapi laptop apa nila itu
gustianarii,ngetik asik tawa
gustianarii,gaya gambar lihat nama authornya
gustianarii,conan abu
gustianarii,film tapi seri gelap sampai cari silsilah keluarga
gustianarii,ketika wanted untuk coba gambar digital tangan getar
gustianarii,kena mulai sekarang tapi sedih versi
gustianarii,colab
gustianarii,yang pedas enak
gustianarii,tarik napas tenang bajing
gustianarii,alir demam mimpi oleh mxmton
gustianarii,masuk tolong tawa colab sapa seperti maia
gustianarii,saya butuh colab
gustianarii,itu dunia tidak sempurna tapi itu tidak itu buruk
gustianarii,blacklist primily
gustianarii,strangers dari neraka karena episode
gustianarii,hela belum sama thor benarkan jika saya salah
gustianarii,harap saya buat itu untuk itu lain sisi
gustianarii,syuting tidak jadi karena pandemi pengirim jadi tayang tahun
gustianarii,pokemon pengirim kalau kirby ibu raja
gustianarii,kalau film ruwet pakai indonesia
gustianarii,hai selamat tinggal ibu lesgo
gustianarii,telah listening untuk ini lagu over dan over bcs dari tiktok
gustianarii,namtarn sampai
gustianarii,tidak mudah percaya pengirim
gustianarii,maklum pertama waktu
gustianarii,gelap
gustianarii,kalau waktu tonton seri gelap begitu seri netflix yang sudah saya tonton
gustianarii,orang datang dan pergi itu semua itu sama
gustianarii,engsubnya seminggu habis nyala air
gustianarii,itu bakat rahasia seven saya jadi tahu gmtv
gustianarii,ve gotta temu cara untuk buat ini rasa oke
gustianarii,hanya discovered berapa musik thx spotify
gustianarii,mati seperti tapi hidup dalam pikir tokoh utama
gustianarii,bisa anda gambar putar
gustianarii,twitter sampai tiktok begitu instagram
gustianarii,cavetown
gustianarii,sudah such tipu untuk tetap nyala chasing sudah tidak apa apa hebat
gustianarii,rapot
gustianarii,bagus sekali sial
gustianarii,buruk jenius sucksed saudara dari itu tahun
gustianarii,proyek itu seri
gustianarii,saya in tonton semua
gustianarii,kasi pengirim ratu dik begitu
gustianarii,lucrecia ander
gustianarii,google pengirim silsilah keluarga
gustianarii,harap ini akan dapat engsub
gustianarii,ini musim friendzone buat gmtv
gustianarii,lulus
gustianarii,benar
gustianarii,sial susah suka sekali dua seri
gustianarii,wonder litle hilang sinar matahari
gustianarii,mudah jelas
gustianarii,ken tonton tembak tembak di bioskop
gustianarii,seperti
gustianarii,google btch salah ketik
gustianarii,tidak satu raditya dika jalan jalan pakai gpogle bumi
gustianarii,bagus oke kuno
gustianarii,itu bakat blacklist romancenya ngeri maksa
gustianarii,bagaimana bisa anda hilang seseorang anda ve tidak pernah selamat cause butuh anda sekarang tapi kena tahu anda belum saya baru lagu bangsa
gustianarii,senang old tahun saudara dari itu tahun homestay
gustianarii,peras doang memang rasa cepat sudah kamis saja
gustianarii,marmut merah jambu
gustianarii,kanjeng ratu
gustianarii,minimalism adalah budhist filsafat itu tentang letting pergi film pindah nyala hidup minimal visual sungguh estetik buang barang mudah karena memori
gustianarii,ajar tidak seperti yang disebutin benar benar ngebantu danbam
gustianarii,bajing keren sekali
gustianarii,okja ayun kids ekstrim kerja
gustianarii,hela
gustianarii,bagus sedih juga akhir
gustianarii,anda bisa tidak pernah jadi sendiri karena anda punya milik anda diri tapi kadang selalu jadi sendiri kinda kills anda dalam dan milik anda itu satu siapa did itu rasa attacked tolong
gustianarii,saya tidak oke dengan ini orang asing sesuatu uang heist itaewon kelas untuk semua itu boys ps masih cinta anda raja
gustianarii,kasihan kasihan aduh kasihan
