username,tweet
asriyahasry,malu
asriyahasry,humoris sekali tawa
asriyahasry,luberger teh tawa
asriyahasry,nona
asriyahasry,hari sabtu belum akad besok ayo mes
asriyahasry,mau bakso
asriyahasry,itu bisa sangat sesuai sama tawa
asriyahasry,gadis manis tat agama
asriyahasry,pergi makan saya gojek tawa
asriyahasry,saudara ririn saya kemarin habis cemil burger sekali blabalabala saya saudara buka telepon mes gojek memang racun saudara ririn
asriyahasry,sabar
asriyahasry,besit sopir pergi mobil bilang takut bawa tumpang ke rumah sakit dari rumah sakit pegawai rumah sakit untung drivernya tidak tanya kerja tapi saya rasa salah sih semoga senantiasa sehat
asriyahasry,yi sekali
asriyahasry,agar sama
asriyahasry,santi cantik sekali ini selamat sangat
asriyahasry,tawa
asriyahasry,selamat tempuh hidup dan suami semoga keluarga sakinah mawadah warahmah sobat kuliah soldout satu
asriyahasry,doa siap mental pikir mau bah tawa
asriyahasry,yay
asriyahasry,orang ragu virus corona
asriyahasry,banyak yang bilang akan kerja rumah sakit tidak akan fokus bisnis
asriyahasry,harus yang malesan buka optik online
asriyahasry,syukur terimakasih orang yang tidak pelit ilmu ilmu marketing dengan senang hati bagi semoga sehat
asriyahasry,tuhan cipta agar orang orang lain bahagia
asriyahasry,indosat tidak bosan ganguan hanya
asriyahasry,wanita rasa hidup normal normal tanpa beban pikir psikologis yang pikir hidup
asriyahasry,lelucon sopir truk
asriyahasry,coba pakai tangga nada baca tawa
asriyahasry,saya anda tawa
asriyahasry,saudara wanita kalau koreksi kacamata atau
asriyahasry,saudara yaya tahun buat benang
asriyahasry,amin terimakasih indah
asriyahasry,terimakasih
asriyahasry,cielah tawa
asriyahasry,gemas
asriyahasry,cinta cocokologi
asriyahasry,tenang dan aa menikah masih alas elak tanya menikah ini ibu bapak saja tidak tanya saudara saya tanya hanya malu
asriyahasry,ini lingkung hidup dunia itu saya cocok sekolah cintawana wanasari harus cinta lingkung tawa apansihcah
asriyahasry,tidak mau tua takut suruh cepat menikah
asriyahasry,yang normal pikir hidup
asriyahasry,kemarin buat rekening yayasan gakeburu susah cari waktu aa sibuk padahal kerja di rumah kerja lumayan
asriyahasry,syukur domisili saya yang memang paham begini sunda asli tukang
asriyahasry,yay
asriyahasry,amin mimi rindu
asriyahasry,tawa suhu
asriyahasry,astaga lupa
asriyahasry,saya pilih tanggal yang ada waktu sudah
asriyahasry,tangan gel utama game hanya
asriyahasry,warna merah muda humoris
asriyahasry,semoga tahun ya
asriyahasry,saya minggu nyala twitter mentions balasan lihat milik anda dengan
asriyahasry,sholat ied ini jamah ashfi naila nadiya rumah imam ashfi dia bagus bacan daripada tawa
asriyahasry,tidak sel jaga nya tawa
asriyahasry,seperti tahun saat karawang tawa
asriyahasry,osel mal aidzin walfaidzin maaf lahir batin juga
asriyahasry,syukur
asriyahasry,tadi sudah bilang ibu tidak usah pasar iedul fitri ini cemil sudah di rumah
asriyahasry,dekat desa saya sudah yang positif ibu awal tidak mau sholat ied luar rumah kita yakin tidak akan luar saat raya idul fitri makin tetangga kerja tinggal di jabodetabek lolos mudik
asriyahasry,terimakasih
asriyahasry,tawa belum foto bagus
asriyahasry,fotoin saudara wanita nadiya bareng ashfi tawa
asriyahasry,taudah itu tulis besar sekali da kalau sudah nekatmsh begitu
asriyahasry,sama dokter suruh batal aneh aneh sih ini
asriyahasry,di rumah sakit dokter tidak akan memberi surat sehat kondisi ini tiba datang pasien anamnesa ngeluhnya meriang tidak ke ruang dokter minta surat sehat memang lagi situasi seperti gin orang nekat
asriyahasry,akhir banyak sekali masuk grup spam telegram sudah lapor saja yang masuk ke grup spam lain
asriyahasry,tanjung benar harus semangat
asriyahasry,dekat kos sudah ini susah sekali cari tukang nasi goreng mau nasi goreng harus grabfod
asriyahasry,tawa nya kalau kalau beli buku tempat sampah itu kalau hal agak susah
asriyahasry,iya lupa tamat
asriyahasry,cari baju anak ibu dosen jam
asriyahasry,untung thr cair tawa
asriyahasry,eh ralat ken seperti agar memberi hampers unik teman tiap tahu
asriyahasry,ken teman seperti agar dapat hampers unik tahu tawa
asriyahasry,tawa insya ya di banjaran okedeh
asriyahasry,ayo insya
asriyahasry,tawa ingat hanya
asriyahasry,ingat materi condong nahwu shorof begitu gajago tidak ulang dapat nilai saya boro boro
asriyahasry,waktu mts ulang bahasa arab saya ngapalin ringan tsana bilang tidak usah ngapalin mudah bahasa arab ibu saya nurut malah ngobrol dia
asriyahasry,ayo ketemu
asriyahasry,teh ola sehat ya
asriyahasry,teh ola ini tawa terimakasih teh olaku sayang
asriyahasry,ken nostalgia sama belum beliau pergi mesir sudah lulus
asriyahasry,ini mie goreng aceh belum cemil pagi gapuasa tapi perut tidak bisa ajak kompromi
asriyahasry,tawa masih kenapa ganti nama
asriyahasry,eh cerita mukbang mie masak baru suap sudah kenyang memang tidak cocok mubang
asriyahasry,tidak tahu ganti kemenag tidak matansa tawa
asriyahasry,hay fit dede alumni mts tawa
asriyahasry,tidak waktu sekolah suka sangka kalau nama itu surat kabar
asriyahasry,lembut lemah lembut
asriyahasry,telusur muasal nama rislah kamus idris al marbawi
asriyahasry,ayo sekolah mtsn tasikmalaya testimoni saudara wanita tsana alumni mts sekarang kuliah mesir
asriyahasry,daftar bacan ini saring sebar beli buku gus lain
asriyahasry,pasien tawa
asriyahasry,lihat grup kelas bahas saja pusing tawa tidak suasana hati ajar cemil
asriyahasry,besok clt hari
asriyahasry,kita biggest fans ini minggu soto sawah terimakasih anda via
asriyahasry,saudara saudara saudara alm saudara saudara saudara saudara
asriyahasry,benar manga bukan manga tawa
asriyahasry,sama universitas mangalore universitas alias manga lur
asriyahasry,tawa
asriyahasry,makam jodoh pasti kalau pelamin walahualam
asriyahasry,jodoh akan entah pelamin makam walahualam
asriyahasry,peras rajin buka twitter ketinggalan info siapa bilang ini kiamat
asriyahasry,uhuy lancar hari tehtamy
asriyahasry,xlain pux stok bodrenya tidak saya lagi flu
asriyahasry,saklarx belah
asriyahasry,rindu ret ken coba malang sampai surabaya entah tiap kereta paling suka pemandanganya
asriyahasry,tukang cukur tampan tawa
asriyahasry,pagi pagi dapat kabar duka
asriyahasry,tawa
asriyahasry,untung sudah tidak sadar tuhan
asriyahasry,tsana sahabat sudah uji tingkat saja tengah pandemi corona seperti gin sahabat akan sandang gelar lc lancar tsan anak mungil cintawana
asriyahasry,saya minggu nyala twitter mentions suka balasan lihat milik anda dengan
asriyahasry,tawa sama champaign lagi viral instagram
asriyahasry,ini adalah itu most jenis orang ve pernah known tawa
asriyahasry,saya minggu nyala twitter mentions seperti balasan lihat milik anda dengan
asriyahasry,tuhan sudah tahun ndah
asriyahasry,bengong
asriyahasry,ashfi saudara tawa
asriyahasry,jumat malam nadiya bilang saudara wanita itu seperti pantas menikah saudara wanita tambah umur tidak tahu tawa dia bilang kalau fahmi teh ashfi sudah bayang kalau menikah kalau saudara wanita sekarang saya tidak bisa bayangin bagaimana saya
asriyahasry,video putar kenapa yakin kecoa
asriyahasry,bapak bapak suka malu kalau cisondari ada menak banyak ajar cisondari sekarang cisondari saja desa lain
asriyahasry,peningalan lain stasiun cisondari ada dekat puskesmas pasirjambu smpn pasirjambu itu kenapa nama jalan zona jadi jalan stasiun cisondari
asriyahasry,salah ikon sejarah ciwidey jembatan rel kereta tahun kereta guling bawa beban yang sangat berat
asriyahasry,terimakasih aa nganterin saudara yang siang akhir saya tidak jadi siang
asriyahasry,saudara saya anak pesantren baru pegang telepon intens akhir karena sekolah rumah baru buat twitter kita janji saling ikut
asriyahasry,keren
asriyahasry,yang donasi buat hewan dampak corona kebun binatang tidak
asriyahasry,kasi binatang bonbin dampak corona kasih jadi sekali
asriyahasry,baju syukur pakai hari raya ada tidak apa ada baju baru ya
asriyahasry,ini gambar sangat mahal abstrak
asriyahasry,akan mahasiswa ut saat
asriyahasry,tukang cireng isi rumah sakit teh
asriyahasry,pagi semangat gedung intan seberang
asriyahasry,zayn malik gigi hadid kalau anak nama malik al hadad semoga anak sholeh anak
asriyahasry,itu bupati klaten suka pajang foto nama mana tawa
asriyahasry,gara gara bupati tempel stiker bantu bupati klaten tangan sanitizer bantu kemensos
asriyahasry,beli rissole nyata isi seblak
asriyahasry,iya tawa untung tidak belanja indomaret gasmin tawa
asriyahasry,nama ganti stroberi cidewey
asriyahasry,corona amerika sudah juta
asriyahasry,untuk informasi anda masker antis sudah harga normal indomaret
asriyahasry,teh ola ya selamat puasa
asriyahasry,amin teh ola
asriyahasry,enak kalau tinggal bareng teh ola pintar masak tawa
asriyahasry,syukur bangun
asriyahasry,eh tawa tiap rakat baca al ikhlas al tsar
asriyahasry,eh tidak bayi seperti
asriyahasry,padahal belum sekalipun botak ini
asriyahasry,lasik lasik ods ods saudara silah
asriyahasry,ken coba botak plontos kata ibu tidak boleh
asriyahasry,tawa amin
asriyahasry,si anak kos bingung buka puasa akhir buat mie goreng daging yang mudah tawa
asriyahasry,sahur bareng keluarga via video panggil naila cemberut saudara tidak pulang tawa
asriyahasry,teman jual ribu kilo
asriyahasry,nawaitu shauma jam shahri ramadhan hadzihis sanah taqlidan fardhan lilah tala
asriyahasry,ada
asriyahasry,tawa
asriyahasry,inti ibu jelasin ke pasien kalau memang tidak boleh tindak dulu ibu pasti paham
asriyahasry,subuh subuh ibu nelpon protes keliling dokter gigi ciwidey cabut gigi saudara saya tidak bisa kasih obat mereka tidak jelasin tidak cabut gigi akhir jelasin kalau musim pandemi larang dari gigi praktek tindak
asriyahasry,pada sekolah cijerah cerita ajar silat zona cigondewah telah dewasa beliau jarang guna jurus jurus silat tingkat paling tinggi silat sabar
asriyahasry,kakek ayah silat kejawen sering bilang abah jampang asal zona jampang beliau ajar silat zona banten
asriyahasry,memang
asriyahasry,orang cuti lebaran saya tidak akan cuti
asriyahasry,saya minggu nyala twitter mentions suka baru ikut balasan lihat milik anda dengan
asriyahasry,rencana tidak akan pulang baru tidak sadar suka otentikasi hpku kalau tidak otentikasi gaji tidak
asriyahasry,teh ola memang gadis kuat
asriyahasry,pikir
asriyahasry,hikmah tiap coban tuhan swt ikan sekarang masih coba mari ajar selalu sabar ikhtiar berdo haqul yaqin tuhan swt semangat tidak putus ada
asriyahasry,teman sudah mahir sulap
asriyahasry,serius cepat hilang jerawat
asriyahasry,amin sehat ratu
asriyahasry,pantas jerawat
asriyahasry,corona cepat pergi
asriyahasry,tawa lupa tekan benar
asriyahasry,tidak usah masak air dispenser pintu prize seminar lanjutin pantunya
asriyahasry,cakep
asriyahasry,saudara wanita anis baik sana semangat
asriyahasry,adalah buah bentuk syukur tidak telepon saya simpan tawa
asriyahasry,maaf teman teman ini receh balas dosen bingung gabiasa canda ini lagi halusinasi jadi maklum
asriyahasry,tanjung habis minum kopi
asriyahasry,sehat
asriyahasry,tidur ndah
asriyahasry,lembah kecil ramah memang artis ramah
asriyahasry,sudah atur look kena saya saya mejam jenak
asriyahasry,saya minggu nyala twitter mentions baru ikut balasan lihat milik anda dengan
asriyahasry,seperti itu yang osel cantik
asriyahasry,masya
asriyahasry,rislah di rumah tidak badan
asriyahasry,tawa tidak bukan ajar
asriyahasry,harus ajar fisika optik saya lupa
asriyahasry,saya minggu nyala twitter suka lihat milik anda dengan
