username,tweet
bestchrysalis,tadi saya begitu
bestchrysalis,tidak ada minat sekali bljr mandat
bestchrysalis,nmax mundur
bestchrysalis,mao murah unmul iya tawa
bestchrysalis,peduli hai
bestchrysalis,malas sekali tidak besok uasx pagi buta
bestchrysalis,lah boba
bestchrysalis,untung ganisa buat
bestchrysalis,sudah semoga lancar penelitianya
bestchrysalis,ayam geprek smada sih
bestchrysalis,haduh memang suka cupang lucu
bestchrysalis,kita tukar
bestchrysalis,ayo tmntmn yang ada luar rumah olahraga mau dan dar kopi cantik tidak lupa pakai masker sengaknya cuma kecil yang kita lakuin ngejaga yang kerja luar rumah
bestchrysalis,gausa beting
bestchrysalis,gantung kalau ken jalan tidak ajak teman kalau ken jalan sama teman ya ajak
bestchrysalis,ken es kopi susu pandan xxi
bestchrysalis,teman teman saranin drama korea film
bestchrysalis,buat akun os lagi tidak bingung malas ngumpulin total ikut loh
bestchrysalis,tidak ada besok sudah ujan tidak paham sistem informasi sial
bestchrysalis,tidak kalian itu sudah beli dan biasa terus karena yang ulas jadi ken beli dan harap lebih baik
bestchrysalis,apa nyesal sama putus yang saya sendiri pikir
bestchrysalis,benar kata orang iri lihat kebahagian orang karena tidak pernah tahu yang ambil dia
bestchrysalis,kompak dulu
bestchrysalis,hebat yang gaya kalau photobox sama doix jaman jahiliyah coba photobox belum gesek kartux sudah tawa sekali kaku akhirx tidak jadi
bestchrysalis,sumpah ini dilema sekali sampai tidak bisa tidur
bestchrysalis,kalau salah anda yang lakuin langsung maaf
bestchrysalis,semoga songhwa ikjun layar iya tuhan
bestchrysalis,jail sekali jual sabun tiktok sampai sudah jual keren memang tmntm onlineku
bestchrysalis,putih muka daripada tangan dikomenin tidak putih dikomenin salah terus anjg
bestchrysalis,maranu
bestchrysalis,lemas sakit sekali perut saya habis cemil ayam neraka
bestchrysalis,asli banar rintang jae hyun sama ji su
bestchrysalis,rasa sabar lagi sial ngiang lagux
bestchrysalis,baik sayang rumit kalau bareng sih
bestchrysalis,meganshop coba
bestchrysalis,alam
bestchrysalis,kt gprnh begini jink
bestchrysalis,tempat sampah spotify premium netflix ehehe
bestchrysalis,padahal bisa pesan ya
bestchrysalis,anda tidak
bestchrysalis,adalah jadi ken
bestchrysalis,seblak suki ini seperti batas hai kalau telat mes dikit sudah jual benci
bestchrysalis,rendang paling tidak ada obat
bestchrysalis,rendang ayam pop gulai telur balado peyek udang daun singkong kerupuk kulit dikuahin perkedel sial mukbang alias enak hai
bestchrysalis,cari cimory pokokx
bestchrysalis,shopenya
bestchrysalis,kadang suka bingung saya suka tulis buku hari tawa
bestchrysalis,gadoin mayox salad lala pakai kurma yakult beku tawa manusia aneh
bestchrysalis,tawa kacau anda
bestchrysalis,tidak tahu malah suka bgtbgtbgt cemil buan
bestchrysalis,karena lihat sgnya arief muh jadi pena cemil lontong sayur
bestchrysalis,hosplay rep favorito
bestchrysalis,mari kt bocor tidak tahu
bestchrysalis,pena sekali jalan tangis astaga
bestchrysalis,memang ampuh endorse online shop begitu daripada selebgram
bestchrysalis,ngurus mes yang belum sampai pusing sudah hedeh
bestchrysalis,dan sekarang super acne serum saya sudah habis sedih
bestchrysalis,kiwi angur durian jijik
bestchrysalis,nutri dorong yang kopi
bestchrysalis,sebuah sampai lah
bestchrysalis,psingx saya mbaca dasar kaum willy
bestchrysalis,samarinda ayo cinta luciene
bestchrysalis,samarinda
bestchrysalis,ayo
bestchrysalis,saya tidak racun shopee sekarang racun zalora sial
bestchrysalis,jancu
bestchrysalis,tiba tiba pikir kalau kuliah seperti pikir malas sekali tidak sudah lupa carax sapa teman kampus saya kalau tidak sebentar dijulidin
bestchrysalis,mau nang buat pikir kacau sial
bestchrysalis,ibu ngechatx tidak lebaran doang tawa
bestchrysalis,tangis
bestchrysalis,banyak mau naspad kwetiaw saat
bestchrysalis,memang mesti usaha malu
bestchrysalis,kalau manasin gausa tinggal ditunguin di dapur main telepon tidak apa apa tidak sampai teledor rugi orang
bestchrysalis,brem
bestchrysalis,apaoun saudara saya kesal sekali nutup pintu tidak pernah benar
bestchrysalis,iya tuhan heran
bestchrysalis,cemil pecel sama asuh agar sehat
bestchrysalis,cemil nasi padang terus
bestchrysalis,kira doang yang rasa gin
bestchrysalis,makas
bestchrysalis,saudara laki yang kemarin ini
bestchrysalis,rindu pacar
bestchrysalis,mlz sekali
bestchrysalis,bosan sekali jadi manusia ingin udara
bestchrysalis,manis kalau saya
bestchrysalis,baik
bestchrysalis,bio
bestchrysalis,pagi pagi sudah masalah astaga tuhan padahal tidak ada rayu pria orang
bestchrysalis,apa hancur gin tidak akan nyobanyoba buat
bestchrysalis,br tahu sekarang cerita garis lihat begitu kalau nge lihat um
bestchrysalis,padahal gbkl saya dengeri juga emgx anda sapa bambank
bestchrysalis,utama instagram dikit juga pos biji cerita instagram sudah dikomenin sama orang gila hedeh
bestchrysalis,bosan sekali sumpah
bestchrysalis,lihat si
bestchrysalis,eh gamesti taunini tawa
bestchrysalis,tahun saudara
bestchrysalis,kalau jujur nti nyakitin tidak jujur bedosa
bestchrysalis,semangat lucu kalau malas pakai jasa tugas saudara
bestchrysalis,taman bo gusi wamil
bestchrysalis,capex saya sama orang gila
bestchrysalis,kasi nilai cef
bestchrysalis,uha
bestchrysalis,mudah tekan
bestchrysalis,ini tidak seperti crita atau film yang sedisedi
bestchrysalis,mente
bestchrysalis,brightening dan cahaya serum restock cepat tolong
bestchrysalis,banyak sedikit tidak apa apa penting mau saling bantu ringan
bestchrysalis,hai bingung mau kwetiaw naspad kalau duaduax sebentar habis pikir
bestchrysalis,rindu sama yang suka mendengarkan keluh kesah saya tidak mau sesal
bestchrysalis,gila
bestchrysalis,malas sekali tugas
bestchrysalis,suka gd kelas
bestchrysalis,iya tuhan ngiler kalau lihat hokben
bestchrysalis,tabung
bestchrysalis,mie ayam saudara
bestchrysalis,tidur nyenyak ajasi
bestchrysalis,naspad banyak mau saya saat
bestchrysalis,jujur sayang taruh sama drama cok
bestchrysalis,saudara
bestchrysalis,valid
bestchrysalis,nti lbaran br mafan
bestchrysalis,anda mau plakorin saya
bestchrysalis,tiba tiba pikir sebentar kalau kuliah terus bertemu tmntmn cangung tidak kan taruh tidak ketemu
bestchrysalis,kuliahx tidak pakai zoom saudara tawa
bestchrysalis,tidur bentar lagi kuliah
bestchrysalis,cocok untuku ibu
bestchrysalis,psikopat anda
bestchrysalis,sampai texas cfc sayang sekali
bestchrysalis,pinterx valid sekali lulus mit cuk
bestchrysalis,hedeh malas sekali kerja tgs
bestchrysalis,cba peras orang yang suka mkn kulit
bestchrysalis,tunggu piscok sore tidak mau marah ya gabkin piscokx juga
bestchrysalis,gadapat kompas astaga capex juang gaprnh
bestchrysalis,kalau tonton drama korea rela begadang kalau kerja tugas berat mata
bestchrysalis,cocwit sekali drama ketika saya cinta blooms
bestchrysalis,hai
bestchrysalis,ya libur padahal sudah tengah puasa
bestchrysalis,yang kondisi tanjung yang orang muyak saya
bestchrysalis,nguras energi sekali tuhan malas sekali
bestchrysalis,tanjung sekali ngadepin orang yang marahmarah
bestchrysalis,sudah tidak benci da kyung kesini makin seperti setan
bestchrysalis,ken ke korea
bestchrysalis,harusx libur hrini kenapa saya tapi kuliah
bestchrysalis,monangis lamax metil tidak mau tugas tidak mau
bestchrysalis,sumpah lucu
bestchrysalis,benerbener tidak sampai hati sekali baca lihat video
bestchrysalis,astaga bodoh orang tidak ubah mg ada satu dunia tahu alias langsung instagram mrasa tidak mau salah ros
bestchrysalis,perencanan yang
bestchrysalis,jadwal ujan itu lama tapi hai angkat sudah ngebut sekali
bestchrysalis,tanjung sekali bosan sekali hidup kuliah tugas drama korea ulang
bestchrysalis,semangat saudara
bestchrysalis,kesal lucu tonton
bestchrysalis,bhaik saudara laki
bestchrysalis,pikir hai
bestchrysalis,keren gadis yang sudah selingkuh tapi omong kosong tahan sama cowox
bestchrysalis,tunisia
bestchrysalis,asli dosen kasih tugas sekali kirakira periksa tidak
bestchrysalis,drama
bestchrysalis,kompak
bestchrysalis,ayo
bestchrysalis,aduh malu sekali
bestchrysalis,pikir
bestchrysalis,lee admin ho tampan benar
bestchrysalis,lama sekali lagi sadarx
bestchrysalis,kalau sekarang btlbtl saja cuman pikir kebodoan saya saja
bestchrysalis,kenapa dulu itu bodoh sekali
bestchrysalis,kita
bestchrysalis,gila rasa
bestchrysalis,kalau berani seperti gin kampus langsung telepon dekan
bestchrysalis,tidak bisul
bestchrysalis,rindu kamo iya
bestchrysalis,bhaik tidak debat
bestchrysalis,bingung sekali tidak tiap beli takjil
bestchrysalis,biasax cuman hari sakit sudah hari saja sakitx
bestchrysalis,pmbhong
bestchrysalis,tidak suka saya dikacangin
bestchrysalis,matkul tugas iya tuhan
bestchrysalis,rindu bgtbgtbgt
bestchrysalis,sagu keju ndah
bestchrysalis,anda juga suhu
bestchrysalis,sehat untuk dosen kasih contoh mudah soal susah
bestchrysalis,mbanking tapi btn rumit jrg dipakai
bestchrysalis,sesal kenapa gapake mbanking ajasih kalau pakai makin boros
bestchrysalis,pakai zoom tapi gausa masuk
bestchrysalis,uji mg sabar
bestchrysalis,ingin tgr tidak agar buka puasa pakai podang hari
bestchrysalis,hai selamat tinggal ibu langit kastil itu raja
