username,tweet
ana_ot,periksa pesan langsung
ana_ot,polisi tahu ngobrol tidak dalam bagaimana paman pakai kacamata tembus pandang
ana_ot,harga emas fluktuatif sekali rugi kalau shopee dana cair butuh waktu
ana_ot,masyarakat jadi paranoid banyak berita palsu yang edar dokter
ana_ot,saya itu penasaran dengan jst tapi tidak
ana_ot,seperti masih pakai pupuk
ana_ot,saya tidak bahas terorisme teori banyak pikir ingin memanfatkan umat islam tidak mungkin dia rela kelola rumah yatim yang ribu anak yatim
ana_ot,tepat framing bapak mardigu sekarang lebih hanya framing larang tulisan data kadang harus pandang dari sudut agar wawas lebih luas
ana_ot,coba runut tulisan dari kenal tulisan saya pikir sesuatu dari sisi hanya buah fanatik
ana_ot,saya sudah whatsapp belum ikut atas
ana_ot,benar heran orang yang kenal bapak mardigu sekarang sudah framing saya beliau ulasanya tarik fakta data asal bicara doang bacan buku banyak literasinya tinggi yang utara sumber
ana_ot,paten bapak
ana_ot,benar ibu dokter komplain dokter pln tunjuk tagih pakai seblmnya hitung bedan kwh yang pakai
ana_ot,dokter syukur sudah kurang pengunan antibiotik paten anak ke obat alami dan sehat syukur lebih baik dari yang tiap sakit bidznilah
ana_ot,mesti pilih kunyit afghanistan bukti yang
ana_ot,periksa pesan langsung
ana_ot,keren tulisan
ana_ot,tidak saudara wanita saya sampai dengan tahun an sudah cilok yang tusuk nanti celup saos kecap sekarang recycle cemil lampau
ana_ot,motor ini kejut
ana_ot,cilok saudara wanita
ana_ot,ay pakai token
ana_ot,bang kalau meteranya pakai token tidak naik beda pasca bayar rada rumit ngitungnya sejak lockdown kemarin psb mksdnya
ana_ot,tidak seperti hanya kasus generalisasi nyata banyak rumah sakit yang colaps soal uang coronanya pasien yang pun
ana_ot,salah kalau belum cair bgmn operasional rumah sakit
ana_ot,lha cair
ana_ot,tahu bang
ana_ot,keluarga cemara dokter
ana_ot,sampai dengan sudah bubur ketan saudara wanita semangkok omong omong tahun sih
ana_ot,tonton acara tvri
ana_ot,gram
ana_ot,tidak lelah dokter kerja tidak begitu tidak cemil
ana_ot,sifat tanam kayak kunyit tidak di indonesia
ana_ot,rumah sakit orang seperti dokter
ana_ot,wahahaha
ana_ot,kira haji negara yang ngongkosin
ana_ot,tolong terjemah
ana_ot,amerika yang menang tetap pro lgbt bang
ana_ot,bicara ir
ana_ot,buka paman
ana_ot,lapar da
ana_ot,kurikulum tidak istilah tinggal kelas bang jack
ana_ot,kejut
ana_ot,sisa tidak akal ken sekali dengan begini kecuali beliau penjara kemarin sudah tahun
ana_ot,rebounded lebih padat
ana_ot,rusuh
ana_ot,bosman pandang dari sisi ekonomi bang mksdnya langkah yang ambil bangsa di tengah dagang perang kemarin bacan beliau banyak tidak sanding seperti saya ikut bosman
ana_ot,iya folowernya oke
ana_ot,aish bang kalau unggah kasih harga daftar
ana_ot,bang nasi bakar urap begitu seperti
ana_ot,ingat rumus tidak uni komputer sekolah hitung pakai jari
ana_ot,iyes benar uni
ana_ot,mie kremes uni
ana_ot,semua kerja profesor mungkin lebih mudah urus kebykan kerbau ajak jalan terus cemil sekitar lewat
ana_ot,maju seperti profesor
ana_ot,ketika matkul indrawi integrasi teori plastisitas otak fungsi otak yang rusak ganti otak yang itu relevan tidak profesor
ana_ot,lemak seperti orang sumatra lebih suka ternak kerbau profesor daripada sapi saya tinggal tapanuli penasaran dengan ini
ana_ot,saudara wanita dapat versi ova drmana linknya tidak
ana_ot,agar kedengaranya bagus
ana_ot,eits saya pikir tahun masih tahun
ana_ot,memang sih kan dana partai tetap dari anggota simpatisanya
ana_ot,pks punya hutang fahri hamzah
ana_ot,retweet saya bapak sampai dengan inpres
ana_ot,catat bang jack terimakasih
ana_ot,bang jack kenapa cina ambisi ekspansi wilayah wilayah sudah tampung duduk
ana_ot,bengkel bumi bapak
ana_ot,kalau rakyat butuh mudah cari cemil uni
ana_ot,yang alm kakek saya bohong
ana_ot,saja warna merah muda
ana_ot,alm kakek saya saksi sejarah beliau cerita kejam pki blitar sampai sungai warna merah
ana_ot,yang usia tahun ajar tanam ternak profesor
ana_ot,sudah lanjur gertak bang jawab argumen data tidak di label dengan
ana_ot,sepakat saya sudah beliau tulisan tarik pandang dari sisi
ana_ot,dokter terapi perilaku pakai harga hukum dengan konsisten kan tidak
ana_ot,pakai sayur godog uni selamat lebaran uni taqobalalahu mina whatsapp minkum
ana_ot,ken memberi kunyit bunga ungu tidak dari bahan alami low efek samping
ana_ot,pesan langsung saya di baca admin
ana_ot,ini mumpung lemon murah
ana_ot,hai teman saya yang suntik vit untuk mutih kulit putih saudara wanita ginjal entah mungkin saking
ana_ot,kejut baik pakai madu kunyit saudara wanita
ana_ot,buka vit ini yang buat kulit putih
ana_ot,yang beli bang
ana_ot,dokter antivirus yang sekarang sudah bukti untuk corona
ana_ot,sila periksa pesan langsung admin tunggu jawab saya telepon panggil pusat tidak masuk barang jebak jakarta seminguan
ana_ot,mungkin beliau yang beli
ana_ot,coba campur madu trigonanya dengan kunyit anak yang sakit demam tinggi amandel bengkak syukur bidznilah sudah
ana_ot,banyak riset kunyit profesor saya baca ncbi pubmed ajp saya simpan google drive saya
ana_ot,saya bisa inbox profesor
ana_ot,profesor sebut saya obat herbal belum jawab dengar kunyit profesor di avicena jurnal phytomedicine sudah sejak ribu tahun yang dan ini saya konsumsi syukur kualitas tidur saya lebih
ana_ot,belum admin
ana_ot,kapan pesan langsung saya balas admin
ana_ot,admin pesan langsung saya di balas
ana_ot,profesor dengar kunyit
ana_ot,waha slowrespon ini
ana_ot,sekali
ana_ot,tunggu saudara belum kabar
ana_ot,kurva beda saudara indonesia bukit bukit disamain
ana_ot,terus tonton tivi tetangga saudara wanita
ana_ot,buat benang saya ken ajar
ana_ot,instagram banyak artis endorse gratis sekarang di twitter seleb tweet sering retweet dagang umkm
ana_ot,gambar generasi muda sekarang dokter miris cari idola tanda orang tua hilang kontrol seperti kerja rumah saya ibu
ana_ot,pesan langsung saya di balas admin
ana_ot,pesan langsung saya baca tunggu jawab
ana_ot,putin iqnya bang beda
ana_ot,atas dan turun nama judi saya saudara laki sisi soal kepercayan konsumen yang luntur byknya produk palsu tipu konsumen lebih hati sama pakai endorse
ana_ot,endorse gratis pantengin twitter instagram sekarang musim endorse gratis manfatkan
ana_ot,saya sudah mati saudara laki sekarang musim endorse gratis lumayan low biaya kalau yang beli rezeki facebook ads macam judi kalau tidak tidak data lanjut uang banyak tawa
ana_ot,tapi tidak sampai seperti itu boncosnya balik jual santai dari mulut mulut
ana_ot,buka kurma jantan betina
ana_ot,dari buka begitu ibu dokter masalah negeri solusi konser
ana_ot,bang wajar antar negara maju ekspor
ana_ot,baca sampai selesai saudara laki
ana_ot,krisis pangan depan profesor jateng zona sudah kering padahal masih hujan deras
ana_ot,dokter kalau ruam kulit juga permanen
ana_ot,iya bang kerajan romawi resep kunyit bubonic wabah tidak nyambung sama tapak
ana_ot,saudara wanita daun kelor berapa saudara wanita takaranya banding pohon semangkok
ana_ot,sinusitis coba kunyit pagi sore insya tuhan tiap minum mengunakan dosis helai kunyit lupa ditambahin madu lemon agar segar testimoninya
ana_ot,dengar mardigu profesor beliau buat analisa kesam plandemic
ana_ot,sensor fesbuk
ana_ot,ya
ana_ot,ingat saya kuliah profesor dapat materi kilas als masih tidak tahu
ana_ot,tidak linknya itu sudah hapus youtube
ana_ot,youtube tidak profesor edar whatsapp saya inbox tidak karena menit
ana_ot,profesor sudah film dari judy mikovits judul plandemic
ana_ot,amin tuhan
ana_ot,seperti hiv profesor
ana_ot,pakai garam saudara laki tahu saya cemil waktu
ana_ot,amin
ana_ot,kalau duduk iya saudara wanita samping
ana_ot,buat keripik pisang saudara wanita ngirisnya di wajan oreng
ana_ot,kembang swedia bagaimana saudara wanita tekan laju naik signifikan
ana_ot,batuk bang
ana_ot,bicara revisi
ana_ot,apa tidak bedain hak wajib
ana_ot,foto bulan yang ya
ana_ot,dengan yang kah
ana_ot,titip bang siap madu sialang riau ribu kilogram kunyit susu segar asli cisarua ribu liter
ana_ot,saya heran bang tengah himpitan ekonomi wabah banyak puja
ana_ot,ruwet ruwet ruwet
ana_ot,minum kunyit saudara wanita sore malam sudah ngantuk sekali
ana_ot,terpal ibu fleksibel buat ukuranya yang bahas tadi efisiensi efisien pakai terpal kecuali untuk baik looking
ana_ot,terpal fleksibel buat ukur saya
ana_ot,saya sudah coba ternak lele terpal drum plastik lele enak yang di terpal kenapa memang terpal murah kali meter ribu kalau kayu bebas beli kayu bekas ember mahal
ana_ot,ada yang tanya seperti jawab mereka masak sampai matang
ana_ot,debat teori cetak padi
ana_ot,tidak di tangepin saudara wanita tugas begitu seperti eksibisionis ditangepin bahagia cuekin sudah
ana_ot,simak profesor
ana_ot,kalian gosip yang alami waham tidak titik temu tanggap seperti eksibisionis bahagia sudah
ana_ot,bismillah siap madu asli sialang riau harga ribu kilogram juga kunyit afghanistan lokasi ciputat gratis ongkir jabodetabek
ana_ot,sekolah yang cara pribadi ada konflik memang bagus pusat seperti muhamadiyah
ana_ot,beda marketnya saudara laki sekolah muhamadiyah yang murah ada
ana_ot,tulisan pakai cina bang kalau bilang tidak impor jamu kita baca komposisi
ana_ot,tanah jual tidak ecer paman
ana_ot,oke saya ibu tidak paham
ana_ot,cc
ana_ot,yang beda uang uni drmana yang dari kemensos yang mungkin dana pribadi
ana_ot,kejut
ana_ot,dokter nyata hilang bisa sudah bersih tidak risiko tular
ana_ot,hutang sudah mengunung
ana_ot,benar
ana_ot,bang foto jari kaki
ana_ot,terang tohok bang baik uang putar umkm akan serap tenaga
ana_ot,bungkus tidak cemil plastik cukup
ana_ot,keluarga prabowo sedikit yang kamera
ana_ot,kan humoris nyalahin bang
ana_ot,tidak bahan baku dari indonesia
ana_ot,saudara laki saya butuh tidak telepon jelas senjata nomor saudara wanita silvi bisa hubung
ana_ot,saudara laki kanker rutin minum buat imun antinflamasi badan kenapa
ana_ot,sudah lasik mungkin
ana_ot,saudara laki saya kirim kunyit pesan langsung alamat kalau kenan
ana_ot,bismillah siap kunyit afganistan madu sialang riau whatsapp
ana_ot,kemas sultan gram
ana_ot,admin saat wabah ini jual rumah sulit padahal harga sudah bawah pasar mgkinkah harga properti alami reset
ana_ot,itu akhir dari dagang perang adalah itu awal dari militer perang
ana_ot,yang ken buat imun dorong siap kunyit madu hutan sialang ribu kilogram hubung
ana_ot,dokter coba kunyit dokter antioksidan antinflamasi antibakteri sifat uretik sudah teliti untuk hiv
ana_ot,masya tuhan barakalahu fikum
ana_ot,profesor kalau begitu ke obat alam profesor yang low efek samping lagipula trial
ana_ot,oke profesor terimakasih
ana_ot,profesor dar jika corona didentikan hiv dengan teliti profesor bisa kait
ana_ot,loh kan negara tersantuy mdhan dengan begitu imun tingkat
ana_ot,dia salah yang nglepasin
ana_ot,salah tetanganya mimpi
ana_ot,lokal kayak panen raya kalau lemon kalifornia yang lokal air ribu kilo
ana_ot,saudara wanita posisi ciputat dipingir jalan kilo ribu
ana_ot,ini jadi bantu pangan susu gizi
ana_ot,sari lemon saudara wanita lemon murah
ana_ot,kalau beli terus lagi tidak ya
ana_ot,pada mudik bang
ana_ot,butuh profesor sudah mudik data teman zona angka mudik sudah ribu bgmn tidak mudik dijakarta phk bayar kontra usaha susah biaya hidup tinggi
