username,tweet
pelangikecilll,cepat pulang
pelangikecilll,bagaimana bisa seseorang ambil pictures effortlessly estetik
pelangikecilll,salah ketik zkdkskekska
pelangikecilll,kenapa twitter tidak ada fitur edit tweet
pelangikecilll,debut asek
pelangikecilll,buset
pelangikecilll,yang lihat anya doang
pelangikecilll,orang kenapa pada konsisten olahraga begitu sik
pelangikecilll,disanguin micin xixixixi
pelangikecilll,tapi kalau saya yang gambar jdnya jelek
pelangikecilll,sobat jompo rapat
pelangikecilll,bukan boneka anda rayu rayu
pelangikecilll,gemar tolong timbang coba kos
pelangikecilll,ahahahahaha
pelangikecilll,ras ninu ninu
pelangikecilll,samyangers
pelangikecilll,senang ulang tahun tisu semoga sehat bahagia syelalu copaste ibu sekali
pelangikecilll,matahari
pelangikecilll,tangis asik bangay tidak ada mayat kecoak
pelangikecilll,mie ayam geprek
pelangikecilll,ahahahahaha iya ampun peta hening bang roy
pelangikecilll,beuh utama acara diajakin utama abc kukuh agi tidak jam minat
pelangikecilll,kilas balik jaman sama dodol sekali beli buku mahal tapi tidak perna bawa berat kalau bawa ujung tinggal kolong meja sampai hilang ajar heboh buat minjem buku huwkakwkakaka
pelangikecilll,senang ulang tahun chika semoga sehat dan mudah urusanya
pelangikecilll,hobi adalah quotes
pelangikecilll,meminimalisir malu orang
pelangikecilll,terus putar minggu depan
pelangikecilll,cakep benar
pelangikecilll,rasa wagu tauk sudah memang benar solero
pelangikecilll,syukur hilal sudah muncul
pelangikecilll,tidak apa apa tanda cepat besar
pelangikecilll,koe rak iso mlayu
pelangikecilll,takut ada dibisikin tidak bahasa jawanya
pelangikecilll,retweet brgkali tidak balik kos rajin
pelangikecilll,admin gojek
pelangikecilll,sudah mei
pelangikecilll,aduh obrol risdak
pelangikecilll,rawat suami kucing
pelangikecilll,utama gemas rumah
pelangikecilll,pek geprek geprek geprek bensu
pelangikecilll,whatsapp pulang mau ngambil uang atm ucak
pelangikecilll,tapi ingin
pelangikecilll,buka puasa pakai bubur dengar wagu
pelangikecilll,tahu lahir
pelangikecilll,tul sekali
pelangikecilll,hal memang cuma di yaudahlahya in
pelangikecilll,kesal sekali sumpah ngiang terus telinga
pelangikecilll,hai bnrn biru trnyata huakakakak malu kenapa saya halusinasi
pelangikecilll,di sana adalah butterflies in saya tummy
pelangikecilll,kalau ada powerbank akan butuh primer
pelangikecilll,tidak ragu bahwa memang ragu
pelangikecilll,tidak heran
pelangikecilll,puncak most used emoji
pelangikecilll,semangat atika
pelangikecilll,congratulations rainuy semoga urusanya mudah
pelangikecilll,neraka sekali markonah baik una saya
pelangikecilll,una fans kleb
pelangikecilll,harus pakai kosmos wadesta hai ucul bangay
pelangikecilll,una bicara seperti mergokin orang puasa mimik esteh siang yak hayo hayo hayo
pelangikecilll,saya lihat una
pelangikecilll,lagi langkah
pelangikecilll,arne upin ipin botak
pelangikecilll,beli baju mikirnya tidak sudah dapat putus kenapa sudah soldout benar pikir lebih kills anda kadang
pelangikecilll,hanya buah kamuflase semua cemil sehat
pelangikecilll,saya dengernya dentum rindu saudara
pelangikecilll,ayah minum es teh pakai chia benih ngataw fungsi
pelangikecilll,dengar ve
pelangikecilll,tawa cakep waktu sistur
pelangikecilll,kalau kos kelaperan lah gedor kamar nomor dibikinin terang
pelangikecilll,astaga sudah rumah susun neraka
pelangikecilll,otaku beku
pelangikecilll,izin saudara
pelangikecilll,tambahin sheila nyala langsung
pelangikecilll,dengar boleh saudara wanita angi
pelangikecilll,rindu diskusi mau cemil siang pakai padahal jam
pelangikecilll,semangat bela saudara wanita boleh tidak sampai lena pikir depan penting
pelangikecilll,fantastic beasts sama
pelangikecilll,niat refresh otak tonton leptopnya beristighfar
pelangikecilll,sabar uji saat buka leptop alias hai ini leptop banyak
pelangikecilll,mati saudara laki
pelangikecilll,mati listrik sering sekali
pelangikecilll,tiap bangun sahur
pelangikecilll,kalau kasi uang mau tidak mau dedline
pelangikecilll,tidak deadliner saudara dan saudara
pelangikecilll,keren sekali sanggup hari pergi subuh pulang isya lebih pilih laju ngekos atau kontrak jarak rumah kantor hats mati
pelangikecilll,pelihara tidak gigi hal mustahil
pelangikecilll,fufufufuf
pelangikecilll,bisa agar penistan nyamnyam
pelangikecilll,saya bebek kuning memang ucul
pelangikecilll,ban tanda tangan guru
pelangikecilll,yang duku iya
pelangikecilll,jadi lupa pintu sama toilet
pelangikecilll,lihat saudara wanita kasir cs bank rindu ngantor jajahahajajaj
pelangikecilll,tangis
pelangikecilll,leptopnya mleduk
pelangikecilll,jadi saudara wanita malaikat halusinasi dini
pelangikecilll,harus bahwa pernah halusinasi bas bi deska
pelangikecilll,bas bintang
pelangikecilll,tweet yang buat langkah tidak bisa bobok
pelangikecilll,ayo nam kumpul modal
pelangikecilll,karantina bulan pikir
pelangikecilll,kuat tidak kuat kuat
pelangikecilll,rip saya baterai sehat
pelangikecilll,ketika sudah milik anda manusia lagu dilema masa
pelangikecilll,gatal sekali memang kalau tidak dibersihin dalam tahan takut lagi sakit saudara wanita telinga tidak lupa tetap dibersihin pakai bayi minyak
pelangikecilll,memang dibilangin kapas buds tidak anjur buat telinga infeksi justru ndorong kotoranya lebih dalam saat ucap tidak untuk kapas buds
pelangikecilll,dulu tidak sreg kan kalau telinga jorok sering sekali bersihin telinga pakai kapas buds korek begitu itu bengkak
pelangikecilll,tidak sama sakit telinga sampai tidak tidur tidak cemil saking sakit diperiksain tht ada bengkak sering ngorek telinga
pelangikecilll,whatsapp benar sekali
pelangikecilll,sejuk sekali rumah pohon kalau pagi dengar ayam kukuruyuk
pelangikecilll,diskon everywhere tapi tidak minat lihat tapi sayang itu bagaimana
pelangikecilll,tidak pernah henti mimpi
pelangikecilll,rindu otak tidak pakai otak
pelangikecilll,mie ayam colot gas sekali
pelangikecilll,kerja di rumah kerja di rumah tetap pikir hari libur
pelangikecilll,sudah bahas ilmiah korelasi sakit kepala teh hangat ya
pelangikecilll,kasi semangat ya semangay almong
pelangikecilll,semangay nadnad
pelangikecilll,buang kuota percuma
pelangikecilll,tinggal tunggu pangeranya ini wakwkwkwk
pelangikecilll,begini rasa rapunzel hari
pelangikecilll,ini karantina buat saya rasa seperti hamster menggunakan hamster roda
pelangikecilll,gumball aneh tapi saya tertawa hahwhahjqka tawa
pelangikecilll,anak suruh sholat waktu dapat uang alias pikir duniawi baik baik
pelangikecilll,kaum yang kalau temu selalu karena bahagia tua
pelangikecilll,bajing adalah dis
pelangikecilll,huahahaha nutupnya ngintip
pelangikecilll,look lagi seperti anak nyala itu daripada carrot
pelangikecilll,tidak buat kembung
pelangikecilll,kalau bolak terus mendoan
pelangikecilll,hobi sekali bolak buka kulkas isi tidak ubah
pelangikecilll,admin kalau yang email lgsung balas admin tidak tumpuk
pelangikecilll,tumpah tumpah tumpah
pelangikecilll,emosi ujung sakit hati
pelangikecilll,anda dan selalu salah
pelangikecilll,tidak bisa tunggu untuk dalam keluar kejut
pelangikecilll,diskusi via popup jam sudah pikir cemil siang wakwkakak
pelangikecilll,bulet buluk
pelangikecilll,martabak keju
pelangikecilll,minggu rumah buka bersih tambah buluk
pelangikecilll,ini video shows saya apa punya untuk buat sekarang
pelangikecilll,tunggu threadnya saudara
pelangikecilll,kalau akurat nov wakawkwkwk
pelangikecilll,malpraktek adalah nyata
pelangikecilll,uninstall garis pasang telegram
pelangikecilll,tingkat nyaman selimut tingkat keluar londri
pelangikecilll,hama hampunan mahasiswa
pelangikecilll,tidak yang ngambil twitter saudara wanita
pelangikecilll,waktu para casper liar
pelangikecilll,dari tentu bisa tidur in everywhere tidur adalah pergi od wakwhewjkakakwk
pelangikecilll,ingat alam akhir beli saudara wanita
pelangikecilll,matahari mahir sama jaman saudara laki baca watpad sampai
pelangikecilll,sudah seperti di kantor bom
pelangikecilll,kutuk itu sudah hanya pendek waktu tapi bagaimana bisa ini maksud banyak
pelangikecilll,wakakaka kring kring
pelangikecilll,kamisyu
pelangikecilll,abelsocialdistancing
pelangikecilll,bismaniac garis keras
pelangikecilll,kan sudah ken cium bau parfum bioskop
pelangikecilll,rindu strolling sekitar dengan tidak tuju
pelangikecilll,hv pernah rasa jadi acak dan semua butuh adalah untuk bicara untuk seseorang semua hari panjang
pelangikecilll,tepat
pelangikecilll,huwakakakakakwakwakak
pelangikecilll,hanya baca baca berapa artikel tentang apa adalah jadi sekarang dan boom itu dunia adalah liar gila kejut
pelangikecilll,bahaya sebentar gamao turun
pelangikecilll,sudah sadar umur ya nop
pelangikecilll,adalah ini itu tanda itu saya tulang adalah getting old
pelangikecilll,duduk kereta tengah jam sudah pegal
pelangikecilll,neraka adalah kosong semua itu devils adalah disini
pelangikecilll,tawa saudara laki heri
pelangikecilll,itu dunia adalah getting lebih buruk
pelangikecilll,ingin
pelangikecilll,inuy
pelangikecilll,candiroto hua ingat yowang
pelangikecilll,bantal nama bantal
pelangikecilll,bisa hubung
pelangikecilll,butuh pandu buku tentang bagaimana untuk urus dengan perfectionist
pelangikecilll,jadi sherina alias gereget aduh gereget
pelangikecilll,ini contoh nya
pelangikecilll,tanda ikat batin bentuk
pelangikecilll,seperti cemil gabus saudara wanita
pelangikecilll,jaman ngekos tidak kuliah pasu nyam nyam jejer rapi rak tuhan untung sudah tobat
pelangikecilll,refilnya pakai handrub kantor
pelangikecilll,hai iya tuhan iya tuhan iya tuhan nyam nyam gula nasi mantap tapi cemil cuma meses biskuit
pelangikecilll,saat saya sayang antisku
pelangikecilll,kadang deptalk jadi dalam milik anda pikir between anda dan diri sendiri itu oke panggil itu selftalking
pelangikecilll,beranda sekarang video meyong
pelangikecilll,contoh yang dari tidak aman pikir lebih
pelangikecilll,tidak hadir pagi
pelangikecilll,astaga mari minum moun oya
pelangikecilll,sebagai panjang sebagai anda tetap itu in positif pikir anda tetap rethinking tentang semua happens in milik anda hidup apa pergi nyala sekitar anda jadi itu anda yang able untuk ajar dari itu jadi wiser dan lebih baik
pelangikecilll,jadi an over pikir adalah necessary kadang
pelangikecilll,songs played di ini adalah finest hmwakjakaka
pelangikecilll,saya tubuh tidak pernah telah ini weak dan lelah mudah
pelangikecilll,fisik getting weaker
