username,tweet
indahastikas,ceu benar ken buka wo
indahastikas,sampai malam malam buat mini taman eh dospempun dapetnya dosen taneman
indahastikas,perbarui kondisi taman tanam onlineku dengan selamat banyak layu tanam hias besar biji ini harus beli online batu koral kurang dana harga lumayan lelah bisa terapi
indahastikas,yah tidak tahu tidak merhatin nama nasi bebek ibu anis
indahastikas,nasi bebek di pahlawan revolusi flyover arah tikar lengket tidak
indahastikas,saudara saya tidak buat langsung kirim virtual rekening shopee
indahastikas,juta dari periksa sampai lahir mantap
indahastikas,kemarin ken cemil ala ala dcost mau cemil ramen kenya cemil taichan kayak disenayan jadi besok coba hokben ya
indahastikas,kata kuliah seperti ambil saya keluar
indahastikas,iya bkbn sangat laki laki minimal tahun
indahastikas,tidak logo osisnya cay
indahastikas,aduh cukup sedih saat suasana hati awal saya ken malu agar tidak tekan
indahastikas,cepat sekali lelah ngosngosan ketawa doang
indahastikas,jadi tengah masih tunggu tanemanya datang beli taneman bogor kayak bekas tidak batu koral saja rombak kali semoga hasil semoga tangan dingin rawat tanam
indahastikas,kolaborasi
indahastikas,pernah kirim barang di bayar geng tidak percaya suruh pesan e dagang tetap kep minimal dp tidak cepat dia dapat
indahastikas,bahan bahan tanam beli shopee tokopedia tukang malas nganter saudara laki tanam taman memang tidak saya rawat takut kadal cicak semoga minggu jadi semoga taneman tidak layu buat jnt
indahastikas,jumat kemarin ken sekali buat taman tidak deng masiki kerja saya mandor tidak ken tanam ada batu koral kayak kuliah ada matkul tanam desain ini
indahastikas,hamil lagi rajin ibu rajin sekali sampai gel lagi malas sudah malesnya ketulungan
indahastikas,hai agar makin akrab kenal sama
indahastikas,yah tidak takut ibu
indahastikas,ken cemil mie ayam buat bungkus nasi bekas buat plastik
indahastikas,ini ngurusnya repots online tapi tidak kasih
indahastikas,admin pindah ktp bagaimana jakarta luar
indahastikas,iya
indahastikas,admin urus pindah sampai ktp bagaimana
indahastikas,kita dokter
indahastikas,rindu buka antre sudah
indahastikas,tidak pulang partime saudara laki nasgor tanya lulus smk mana saya bilang tunggu hasil uji ptn bilang yah saudara wanita tidak harap tidak bisa anak saja tidak nyata saya lulus saya beli nasgornya saya pamer haha
indahastikas,beda ncef ibu kita remah peyek komplain suruh restart sampai gel
indahastikas,inap favorit lagi bosan sudah murah diskon
indahastikas,ki buka whatsapp
indahastikas,rindu kesana
indahastikas,coba bakwan pontianak rekomendasi dan jasa titip saudara sekali saudara luff
indahastikas,ramai sekali tidak bayang ramenya mall
indahastikas,tanggal sudah buka saya tahan untuk kesana masih rada rem begitu tidak baru normal baru normal inu
indahastikas,renang nyelem pokok smb pandemi sudah ngidam smb sampai sekarang anda mau duduk begitu sudah
indahastikas,nich benci benar cemil nasi sudah
indahastikas,bekas saudara
indahastikas,murah modal glowingnya tidak sampai oke minta pacar bilang sayang dibayarin malu
indahastikas,benci taruh tidak padahal sudah ngebayangin cemil pagi agar manis
indahastikas,sedih baru tadi malam beli sudah ngidam ngidam cemil pagi eh seperti gin
indahastikas,helow helow parsel masih nyangkut bekas ada yang tanggal bagaimana ini dibalikin bilang alamat tidak
indahastikas,dokter ki klinik agar atas cepat sembuh sobatkuh
indahastikas,getok pala mak
indahastikas,jne kelapa gading ini buka sampai jamberapa admin
indahastikas,ada ngegerecokin aduh tidak bisa tunggu
indahastikas,sudah pikir cemil sahur buat hari tidak puasa ikut sahur sahur ini tutup ikan asin ketemu sahur tahun
indahastikas,goreng kacang cokelat halus blander ulek tumis bawang putih cabai telah halus masuk kacang kasih air gula merah garam enak lada semua aduk aduk sampai minyak cicipin mantap
indahastikas,kue kering
indahastikas,butuh pakai di bela bain sampai gin gilir butuh cemil bilang tidak uang butuh bantu sampai sana sini kenapasik
indahastikas,dapat motor waktu itu banyak pacar packing sen megang laptop lapar nelp mangndut pacar hasil resepsi
indahastikas,lucu tidak bisa tipu
indahastikas,coba tujuanya bongkar sombong manta teman saya suka sekali buat cerita ganti mobil velg suka pesan langsung kesombonganya saya ss cari foto eh dapat pinterest saya tunjukin saya ketawain saya blok
indahastikas,yah putra bagaimana usaha
indahastikas,saya dapat keuwuan
indahastikas,pantas encouk dede bnya kali lipat pikir harus diet tantedok bagaimana
indahastikas,hayuk saya ken galaksi itu sama nama ehtapi beda benci
indahastikas,aduh tahan tahan benar ceu ken sekali
indahastikas,sudah cemil
indahastikas,bangun gara gara kepingin bolen
indahastikas,hai ajak ribut tenang loh ya
indahastikas,bersih buat ambyar
indahastikas,coba rasa parah rekomendasi titip saudara juga jual sosis solo sekali yang buka jasa titip sunter
indahastikas,hidup tidak tenang ya ada teman lihat tidur laporin
indahastikas,ken ketemu ferdian ken ketok pala takut itu pala kopong dengkul saudara wanita
indahastikas,gemez rindu rindu rindu hati
indahastikas,tonton konser didi kempot waktu hamil lagi mual mual tiket sudah beli dapat izin suami orang tua dikit susah bekel minyak angin air jahe syukur dapat yang duduk dan tidak umpel umpelan bisa goyang
indahastikas,mau ajak dede tonton konser pakde sudah lahir tidak hamil sudah tonton dalam perut
indahastikas,iya ampun ken pintar ajar online tahu data
indahastikas,coba euy edmodo apa kenapa juga edmodo
indahastikas,yang beku
indahastikas,lahir sudah saya fitnah yak penting dede kenyang ibu senang
indahastikas,sudah sahur jam lapar jam gin ken mie ayam maafin saudara
indahastikas,seminggu lalu pagi pagi dapat tlp ngabarin itu saya tidak percaya ngabarin suka boong saya suruh periksa saya hubung ce pina ce nita tidak responsif saya pesan langsung temenya ce pina ngekos rumah nyata benar
indahastikas,ve belum ke rumah anda ada mimpi tidak ke mimpi doa jadi jalan hubung ve
indahastikas,ngulet dedenya puasa nich tidak paksa kalau tidak kuat sudah buka sudah batal tawa mana sajah lihat lelah
indahastikas,rasa ibu saya tahun tahun ramadhan bangun awal masak bangunin sahur rasa itu
indahastikas,tidak cay buat itu
indahastikas,bekas saudara
indahastikas,belum wabah landa sempat bilang suamik cuti tidak puasa tidak buka puasa sendiri rumah eh benar kasih rumah sampai puasa ibu
indahastikas,ajak puasa saudara ajak bolong
indahastikas,syukur aktif sekali nendang nendang seminggu lalu periksa bekaseh nich saya kesunter sunter
indahastikas,amin amin terimakasih selaw
indahastikas,amin amin teh
indahastikas,bras
indahastikas,selesai saya bahagia orang teman saya sudah bahagia
indahastikas,bagaimana saya tidak bangga anda keren anda itu ve ibu sudah tidak sakit anda sudah tidak lelah ngurus ibu anda tidak bilang lelah sebentar anak saya saya ceritain hebat tante itu
indahastikas,kiw terimakasih iya kikiduyulopmi
indahastikas,terimakasih hati
indahastikas,tengkyu ceu
indahastikas,mimpi ya buruk sekali mimpi saya
indahastikas,pria begitu lah suami ngegame saya ngambek tambah game sampai saya mau cemil tidak habis cemil ngegame
indahastikas,saya boleh sedih sobat sudah bahagia sedih lihat sedih
indahastikas,anda sama elis ketemu tidak megang telepon lupa foto bareng tidak sudah pulang engeh grup kita tidak foto tidak buat snapgram kita tidak stok foto ganti profil grup
indahastikas,tidak sangka secepet ditingalin yang hadir tahun hidup tiba ningalin pamit hampa sekali
indahastikas,gin hilang sahabat sudah tahun bareng sedih sekali elah ve
indahastikas,waduw suami kacamata pikir dia
indahastikas,tidak yang tapi bras beda
indahastikas,bras
indahastikas,coba periksa banyak anda cemil ini
indahastikas,buat pasang instagram sudah encouk ini punggung tadi siang tidur masak dulu skripsi laptop pagi sampai malam kuat memang saat jadi lemah hidup jadi yang kuat
indahastikas,buat beli sangpisang mangkok saya ternakopi
indahastikas,bersih benar baju menemani cay rokok kopi depan rumah
indahastikas,angep lagi invis
indahastikas,baru minggu tapi luar rumah
indahastikas,daku nikmat rumah sejak lulus kuliah tawa beda rumah saja
indahastikas,agar tidak bosan nguplek dapur basrenh
indahastikas,tiap rumah ini suasana beda bosan
indahastikas,sudah bosan teman teman tiap juga rumah
indahastikas,saya tidak cocok masak manis manis buat martabak manis jadi pancong
indahastikas,siung bawang merah siung bawang putih ruas kencur buah kemiri cabai suka hati porsi diblander di uleg rasa kasih garam kaldu bubuk gula agar merah kasih bubuk cabai bon cabai
indahastikas,gulir jelajah instagram temu foto menikah lembah kecil fredly istri pikir keren sekali luar ruang begitu jail baca komentar eh temu komentar busuk seperti gin
indahastikas,hancur sekali bras tidak lagu nyanyin jodie
indahastikas,lihat vincent nang tangis
indahastikas,mari zum kelas
indahastikas,dospemku beliau skripsi sangat kece tekan batin sih sudah buham kece baca akun
indahastikas,dong bakteri seperti gin
indahastikas,saya rumah
indahastikas,yah sambil nang ngetiknya begitu sih mau diungkapin jarang jarang buat begini saja lihat perintah gitulah saya sedih pokok
indahastikas,cuma sih buat sedih lihat ini sedih saudara laki jual sepi beli ojek sepi pelang tidak obat puskesmas klinik rumah sakit tidak parah padahal obat tidak parah masa obat parah mau kapan
indahastikas,saya ken lihat anak anak keliling bawa bedug saat takbir pawai obor nyambut ramadhan grup sudah ramai ngebahas pawai obor ini sepi sekali ken cemil ketupat ibu
indahastikas,rindu suasana saat puasa muslim nonmuslim rindu suasana puasa tiap sore cari jajan sih survei teman teman saya nonmuslim suka cari jajan
indahastikas,ngebayangin tidak kita sore sore tidak cari goreng kerupuk kuning sambal kacang lontong meski buat tapi goreng pakai sambal kacang beli saat puasa itu beda
indahastikas,ada nasi telur buat nasi goreng mie goreng tahan kenapa ayo sama ngebantu singkir virus kata dokter tirta kalau bisa ikut selesai mei mei lebaran
indahastikas,karantina ayo memang berat kalau gin tidak selesai belum karantina retweet rw data warga benar benar keluar cari nafkah perintah ft kitabisa kasih beras sembako keluarga
indahastikas,saudara teman coba pesan langsung ignya
indahastikas,ini teman di instagram
indahastikas,gumush
indahastikas,tahan saya lelah
indahastikas,empal gentong bubur cirebon gejrot langsung asal ken gejrot awal hamil tahan tahan karena mau ke cirebon yaudahlah cari galaxi nanti sudah cari jajan
indahastikas,gagal cirebon sudah ngelist jajan saja akhir kembali dana
indahastikas,lagi ki saja gigitin cemil hanya pada gembul gembul
indahastikas,sudah sudah buat promonya tawa
indahastikas,ini masak pikir mau masak tangis
indahastikas,aduh tidak masak jajan kalau jajan dede tidak jajan
indahastikas,cocok
indahastikas,ada digigitin itu mereka
indahastikas,gara gara anda teriak saya syok malam malam setan biadab
indahastikas,bisa kirim tunggu bermingu minggu
indahastikas,sudah pindahin masing ya sesuai itungan
indahastikas,pakai zoom ayo saya memberi peta hijau tiyni mindahin tali toga bagaimana
indahastikas,saya mauk
indahastikas,tonton air netes tiap sore lihat berita angka terus
indahastikas,zona sudah sepi tambah adan sedih masih lihat anak anak lompat pintu gerbang mergokin anak ambil angur ngintip tetangga gibah cepat sehat cepat selesai
indahastikas,nyidam kalau gin tidak turut
indahastikas,mudah tidak dimandin jemur kasih cemil kasih minum ganti kayu
indahastikas,tidak tahu hamil tiba lahir kalau tahu saya kasih susu prenagen saya yak di sumbangin ini banyak sudah kayak nernak
indahastikas,hamsterku lahir kemarin saat banjir lahiranya saat virus corona
indahastikas,juara memang kiki
indahastikas,mau beliau
indahastikas,ken orang seperti punya inap begitu saya ubah buat rumah sakit dada
indahastikas,saya buat jilbab item sih
indahastikas,hri oke bras coba itu
indahastikas,diturup bras campur bras sesuai keras sayur boxnya ya tidak apa satu bagus saya kadang campur kacang sama buncis
indahastikas,kangkung bayam tapi tidak sefresh saat beli cabai digituin juga tapi taruh bawang putih kupas banyak bawang putih mahal siung
indahastikas,sayur sop sayur asam dk bisa bras taruh kotak bening begitu dialasin tisu cemil kasar sayur tidak di cuci kalau di cuci di ringin sampai tidak air saya bisa seminggu
indahastikas,tidak sekali sudah saya enek dengernya saudara saya masuk lah drama bosan drama begitu begitu hanya di cengin diemin sudah tidak ditangepin ketawain
indahastikas,baik undur sudah tiada kayak begitu tidak ngebayangin bagaimana ki sabar kalian kali ada edar lagi
indahastikas,baik undur sudah wisuda ijazah duluan gila sudah bayar mahal mahal semester tidak wisuda buat pamer foto apa tapi buat tua itu ken lihat acara kayak gituan
indahastikas,jari kaki anda cay habis nendang
indahastikas,coba hidup cay hidup saja tambah jadi tidak bosan
indahastikas,sambal mknya ya menang mahal omong omong bebek bkb
indahastikas,khayal ibu
indahastikas,niat begitu anak saya jadi atlet renang
indahastikas,sebentar anak saya lahir sudah saya ajak berendem biarin masiki mompa kucurin air masak air agar serasa rendam air panas
indahastikas,tawa kayak saya yang aneh ngebayangin berendem cemil popmie begitu
indahastikas,akhir lagi panas sekali lelah ini sore hujan deras sekali
indahastikas,habis gerah sekali ki berendem sekali kayak
indahastikas,bekas panas benar ken renang malas ramai ken beli saja sayang saudara saudara ngidam aneh aneh benar
indahastikas,ngeladenin kayak begitu tidak habis ki saya ibu bodoh yang acara jalan serta kerna jadi dekat senior tidak sungkan negor buat anda saya
indahastikas,aduh ibu anak tidak perhati ngegosip ya saya
indahastikas,saya tidak engeh ki ada otak itu acara penuh serta luar gimanapun tidak peduli media saya tidak itu lirik tidak
indahastikas,tidak tahu bras sekali tidak baca satu yang kosong
indahastikas,matkul kacau sampai buat acara angkat tidak puasa buat sertif bolak waru sertif dan banyk tidak ngambil banyak itu rumah saya sertifnya
indahastikas,mulai saya obrol grup seperti komentar akhir teman teman saya bosan komentar yang komentar teman kelas pendikar matkul pling gila buat tidak tidur
indahastikas,semester sekali untung ingat lulus facebook sampai buat grup komentar cepat cepetan begitu tidak tanya
indahastikas,nang tonton
indahastikas,teh coco periksa
indahastikas,aduh itu terimakasih kalaupun niat seperti ganti kmpus
indahastikas,buat unj periksa bagaimana
indahastikas,bekas
indahastikas,alam sunda kalau ken cemil lalap cocol sambal puas cari alam sunda karena sudah pindah bekas jalan pekayon jati asih kayak gin di jakarta seperti ada di tanah saudara laki bogor cianjur
indahastikas,aduh gemez sedih
indahastikas,harga masker harga tangan sanitizer harga tangan cuci terus harga jahe naik
indahastikas,itu minta tempat sampah tas ck kan saya buat tas miniso
indahastikas,pilih tidak sayang kalu begitu
indahastikas,hai kalian promosi asik cemil renang sensasi begitu yang ngurus surat mudah inap
indahastikas,pena tidur unj kasur lumayan
indahastikas,saya praktek ini ikut tidak
indahastikas,banjir rumah jalan berapa kali sedih saya
indahastikas,warung bude doang daksin mentok mentok bakso pakde
indahastikas,sekarang lapar
indahastikas,bangun jam tengah tidak tidur ken bersihin kamar mandi baru selesai kenapa rajinya pagi buta
indahastikas,maki maki apalagi sama datang cakep sudah masih saja seperti gin sering dikerjain
indahastikas,suara tipu itu sudah kali dan suara tidak ubah
indahastikas,kenapa gemez lihat yelyel ftku
