username,tweet
haluhaluclubbb,umat saya paham hubung kontak orang langanan
haluhaluclubbb,takut tenan balas mprop
haluhaluclubbb,astaga ralat akune nyanyi tidak iso baru normal kyok harus sekolah teh ini tawa
haluhaluclubbb,wis bogor saja
haluhaluclubbb,solusine khilafah
haluhaluclubbb,astaga boleh kekeselen emosi apa mergo bisa ekspres sekesel pye saja dingo emosi barang ayo saja
haluhaluclubbb,dosen tidak luput salah
haluhaluclubbb,kejut kejut
haluhaluclubbb,woiya tidak pikir ndue oven ndek omah
haluhaluclubbb,hightech
haluhaluclubbb,sampai tempat sampah turun tangan tandane sudah telad
haluhaluclubbb,monmap nyontoni bom ngandani
haluhaluclubbb,ini anda balas
haluhaluclubbb,asli xi ipa hijrah xi ipa ben tidak dadi tidak hadir tawa astaga
haluhaluclubbb,alon alon cekat ceket jare
haluhaluclubbb,ahad pon sore
haluhaluclubbb,syukur tidak misuh masio geger ngisor hpne mletek sbwah proges
haluhaluclubbb,simpen dulu saja nti
haluhaluclubbb,everbloming bisa hubung
haluhaluclubbb,begini lagi sistem didik pesantren sistem didik depan kalau lirboyo
haluhaluclubbb,njajal ndelok pye adaptasi
haluhaluclubbb,kapok kon ngo tuit anyar
haluhaluclubbb,repot repot sekolah adalah seluang luang waktu anda milik
haluhaluclubbb,tamat
haluhaluclubbb,misuh
haluhaluclubbb,ini utas misuh semoga bermanfat
haluhaluclubbb,mugi mari ngene ndang tulis
haluhaluclubbb,selesai karya tulis saat posisi sekolah ketika sudah lulus engkau sulit temu waktu hanya dar baca buku
haluhaluclubbb,gila ini penting pencitran tawa
haluhaluclubbb,boleh sudah paham ojo ndadak leren dikandani jare sudah paham tidak lakon ayo ngunu kui nyanyi arane paham miturut jowo biyen kui
haluhaluclubbb,tandur pari
haluhaluclubbb,rasa konsentrasi fokus saat ramai sepi arif umat tentu stabil harmoni alam
haluhaluclubbb,arab istilah topo ing sepi di jawa milik macam salah yaitu topo ing ramai topo ing sepi
haluhaluclubbb,yang didawuhkan caknun temu goa hira anda masing engkau hidup lebih bijaksana sikap hidup
haluhaluclubbb,barangkali begitu engkau kembali diri lebih lagi
haluhaluclubbb,diri bosan jenuh hidup mblakraklah tualang anda tengah masyarakat jalan jari kaki ada pasar tempat anda sekali temu rasa derit umat
haluhaluclubbb,ingat cerita bapak mardigu
haluhaluclubbb,waktu repot tidak nutut tiba
haluhaluclubbb,kapan tulis pikir umat semoga lekas dan selesai semoga berkah
haluhaluclubbb,semoga berkah
haluhaluclubbb,alfatihah
haluhaluclubbb,tidak kleru akun
haluhaluclubbb,ini maksud
haluhaluclubbb,tidak ndue balesan nge oknum ahli botani seni sudah ben trah ra jateng ra gayeng
haluhaluclubbb,contoh ekstrem yang ajar cak biarawati hina antara hina lisan cukup ludah
haluhaluclubbb,ingat yang hujat karya apa nama manusia kalau sudah pribadi palu tangan kiri arit tangan kanan ajar leluhur jawa harga jauh penting skripsi loh loh
haluhaluclubbb,biasa sibuk tanggap bahas banyak proyek umat mangkrak gara personalia an bahas hal yang tidak perlu maka itu
haluhaluclubbb,tambah takut oknum kui iso isone nyalahno ekonomi sama politik
haluhaluclubbb,eling waspodo
haluhaluclubbb,kapan oknum peduli alam proges skripsi tidak tahu mau peduli
haluhaluclubbb,enek nyanyi royokan saudara laki
haluhaluclubbb,segawon
haluhaluclubbb,maulidul tuhan
haluhaluclubbb,woh iya iku halaqoh omong omong iku msldnejsvankagwyurirpwna sensored
haluhaluclubbb,lha mbok kiro neg ngereply ke deteksi ngunu edan po pye
haluhaluclubbb,o trah waktu tuhan cara semesta dukung nanti momentum dan kita siap
haluhaluclubbb,ayo tidak paham iku siapa
haluhaluclubbb,klasemen bahas sdm ahli bidang
haluhaluclubbb,tidak nutut
haluhaluclubbb,kenapa ridwan aneh
haluhaluclubbb,ust qo
haluhaluclubbb,asyhadu
haluhaluclubbb,cik tenan ra nutut pikir
haluhaluclubbb,cik mosok enek beras haram
haluhaluclubbb,sayang itu ristiawan
haluhaluclubbb,halaman orang jatah halaman sudah orang lumayan sudah kenek rego ribu ongkir buku ribu biaya buku ribu syukur kacek adoh pol sama sayap ribu
haluhaluclubbb,yen ini tuhan uwes tidak definisi tidak nutut
haluhaluclubbb,siap budalne
haluhaluclubbb,loh bapak mardigu sudah ngandani lek nyetak uang harus bas proyek produktif swf lha ini cetak suasana hati bas proyek umat anda lak podo intine tawa
haluhaluclubbb,astaga suasana hati bas proyek tawa
haluhaluclubbb,sesap budal
haluhaluclubbb,tidak urus terbit siapa penting isbn tawa
haluhaluclubbb,baik ini saja sudah karek golek menungso ne
haluhaluclubbb,yen resmi si
haluhaluclubbb,toilet cetak satus regane ewu sudah budal saja gas tawa proyek anyar
haluhaluclubbb,kadiv kastrad loh kui
haluhaluclubbb,tolong tesis ndang buka golek proyek anyar anda lha ayo bagaimana tawa
haluhaluclubbb,perlu melu sugarcane seni ben kyok anak kae dikomen saturnus
haluhaluclubbb,itu lanjut generasi wali tandur
haluhaluclubbb,tidak nutut nyanyi komentar kenapa florida
haluhaluclubbb,strategi kiamat
haluhaluclubbb,syukur jiwa selamat aptx
haluhaluclubbb,pantas saja hidup jek ambek jantung jedag jedug jek ngetwet mbarang oalah
haluhaluclubbb,oiya sudah onok tahun tidak tonton conan awloh jati
haluhaluclubbb,hightech
haluhaluclubbb,astaga dosa tas tuku sate sego goreng terus tidak entek pis jatah bumbu dapur sasi
haluhaluclubbb,jasik tenan ngo akun admin wanine
haluhaluclubbb,saja periksa
haluhaluclubbb,rituit tanda mampu
haluhaluclubbb,syukur tobat arek semoga semi tuhan terima amal ibadah
haluhaluclubbb,sebentar ngawe tor acara minggu pon sebentar
haluhaluclubbb,sebentar daftar ndek kene saja banyak eram mpane tesis tesis rev tesis revisi teman teman tesis bismillah mugo tesis baik ini sudah msi tenan
haluhaluclubbb,monmap saudara laki nu normal
haluhaluclubbb,ini tersangkane pantas saja enek saudara wanita saudara wanita nyanyi ikut asw tenan tidak ra cetho babar pis
haluhaluclubbb,bapak
haluhaluclubbb,astaga salah copas
haluhaluclubbb,sudah tugas akhir saitik sebentar santri saitik saja bengung arep ewon
haluhaluclubbb,oiyo ayo neg nikmat iku selamat begitu neg coban trah ra genah tenan arek kui selametan iku identik doa tolak balak syukur identik doa puji karunia selamat coban ini cocok
haluhaluclubbb,tidak
haluhaluclubbb,kadang muncul takut karena yang takut kutip ra cehto
haluhaluclubbb,sudah iya saja sudah kalah saiki ben
haluhaluclubbb,coban apa teh ini gusti
haluhaluclubbb,muni kenek arti sopir
haluhaluclubbb,sbwah cerita orang
haluhaluclubbb,wadulan saiki anak kae kolaps bar ujan dino sebtu
haluhaluclubbb,muni ndue cetak arti kenek ingat
haluhaluclubbb,astaga sudzonku benar trah enek tidak benar nyata
haluhaluclubbb,omong omong ndue cetak ndek omah
haluhaluclubbb,hai iku skolah saudara laki irfan hati saja koe bar dimention sayap tobat
haluhaluclubbb,oalah rampung ujan pantas
haluhaluclubbb,sebentar lha mbok kiro tulis sayap cetho ayo tidak
haluhaluclubbb,pena tulis bab bab ra
haluhaluclubbb,tuku buku gawe buku
haluhaluclubbb,anak tidak ken
haluhaluclubbb,dia manusia
haluhaluclubbb,saya ralat syukur
haluhaluclubbb,monmap tidak ikut semi tuhan semoga tuhan ampun saya
haluhaluclubbb,monmap saya ralat
haluhaluclubbb,semi tuhan
haluhaluclubbb,kayak lali boleh ndue akun
haluhaluclubbb,sudah dadi materine wis narsum
haluhaluclubbb,senyum saat
haluhaluclubbb,lagu kebangsan insan asrama ipb
haluhaluclubbb,ibu doktor sudah dadi buku dewe neg bidikmisi sampai pmdsu
haluhaluclubbb,budalne arep topik ini
haluhaluclubbb,kontributor doktor bieb botanis seni kejawen
haluhaluclubbb,hasil bahtsul masail khilafah
haluhaluclubbb,lohlohloh banyak agama kan besar masuk surga pintu saja
haluhaluclubbb,tidak tidak lagu mars yang lirik saya negeri astaga doktrin organisasi saya negeri pada tuhan
haluhaluclubbb,pye awmu tidak minat viral
haluhaluclubbb,tidak apa apa repot tapi tolong kulo nyuwun bantu tidak sadar gusti ngurusi ambek sama edar darah saja tidak iso mosok ate nyanyi reno
haluhaluclubbb,astaga tidak wayah bosan ayo guabut tenan kadong repot pikir masya
haluhaluclubbb,konsumsi pribadi
haluhaluclubbb,jane rencana muleh ki arep mbenakne sampel sesuk tinggal kirim lha dha
haluhaluclubbb,tunggu hasil penelitianya
haluhaluclubbb,haru
haluhaluclubbb,ya dimention saudara laki irfan
haluhaluclubbb,ndelok film ini langsung keling anak kae
haluhaluclubbb,apa mimi inc
haluhaluclubbb,cenil teman
haluhaluclubbb,abana
haluhaluclubbb,untung seni
haluhaluclubbb,monmap anak manusia unggul rohani tinggi intelektual
haluhaluclubbb,nyanyi pancasialis jare
haluhaluclubbb,tolong cangkemnya kondisi mbiyen daptar arpega barang ayo biji mepet nol koma
haluhaluclubbb,tobat
haluhaluclubbb,daya juang hayat derit lebih daripada senang
haluhaluclubbb,usaha dan temu momentum
haluhaluclubbb,astaga rasuk jin kmnu
haluhaluclubbb,saya yang salah paham kmnu kmnu skripsi disertasi dia seni bebas bebas makna siapa yang nikmat
haluhaluclubbb,stan
haluhaluclubbb,gara
haluhaluclubbb,manusia
haluhaluclubbb,wakaf pondok pesantren kmnu ipb salur bank bri kode bank bank mandiri kode bank dan global inspirasi nusantara lengkap narahubung zimamul adli
haluhaluclubbb,akan moderator saya nasrul fatah ceo hebat tani indonesia alumni kmnu ipb gratis buku jihad ekonomi pena
haluhaluclubbb,link google penuh bicara moh ghozali dewan penasehan hipsi ceo nujek amir sama ruf kiat filantrophy nu direktur pp lazisnu pbnu
haluhaluclubbb,sebab dalam rangka mengugah semangat kemadirian ekonomi masyarakat himpun alumni kmnu ipb sembah semangat nahdlatut tujar dorong mandiri ekonomi masyarakat acra akan diselengarakan sabtu juni
haluhaluclubbb,webinar seri himpun alumni kmnu ipb mandiri ekonomi salah mandiri bangsa semangat tega mandiri ekonomi masyarakat jadi perlu terus tingkat
haluhaluclubbb,pondok coret diarani paham alir apa teh ini
haluhaluclubbb,tidak paham tolong tolong dijelasne anak kae
haluhaluclubbb,tahun pangah saja
haluhaluclubbb,jadi erti banyak tua yang sukses adan belum lebih keman anak tidak susah payah
haluhaluclubbb,untung ndek whatsapp sitok sudah mari ngene boleh enek grup tidak diguwak ndek nomor sitok saja
haluhaluclubbb,sebut nama tuhan maha asih maha sayang
haluhaluclubbb,rit ktm ton metu jt
haluhaluclubbb,kaliuni kw
haluhaluclubbb,penting utara
haluhaluclubbb,tidak nutut warga twitter dilebokne kibas
haluhaluclubbb,syukur lobi
haluhaluclubbb,benar uastagfirulah
haluhaluclubbb,sebentar golek berita
haluhaluclubbb,cik whatsapp kenapa anda astaga
haluhaluclubbb,ndang tobat
haluhaluclubbb,klik tangkap gulir ss samsung
haluhaluclubbb,akhlakles karimah
haluhaluclubbb,astaga lageg paham carane ss duowo
haluhaluclubbb,ini enek sesat sejarah ini gawat
haluhaluclubbb,nyandi arek ini kenapa tidak hadir
haluhaluclubbb,syukur berkah berkah
haluhaluclubbb,kesambet demit
haluhaluclubbb,anak kae ayo lali neg turun dieng teko jabal rahmah
haluhaluclubbb,cik kleru nglike jalan anak kae rek
haluhaluclubbb,gambar wakil deskripsi
haluhaluclubbb,mobil koperasi
haluhaluclubbb,mugo berkah
haluhaluclubbb,ini loh anak enek rpal menowo bingung
haluhaluclubbb,jasik tenan iso ngetuit ngunu kui kesambet thr ini kayak menowo luih ngo lomba lomba teh organisasi oke kui
