username,tweet
slvdys,vagabond
slvdys,kata yang buat modku hari
slvdys,berani pegang kecoak pegang kucing
slvdys,tim tidak mau rugi tetes
slvdys,lahir tua di rumah sakit parah saya tidak paham apa
slvdys,benar umur tidak jamin pola pikir tawa lawak
slvdys,orang orang ke makin nglamak
slvdys,ibu tidak tahu kalau anak sombong tawa
slvdys,tawa tiwas bangun jam
slvdys,gasido
slvdys,cloy itaewon kelas
slvdys,gin teman teman sayang saya tidak bedan tapi ada baik kalau dapat pikir matang dalam sekian terima kasih selamat belanja indomar
slvdys,ciye anggota keluarga
slvdys,kepercayan titik
slvdys,raja twom
slvdys,terus kenapa kalau anda sini
slvdys,tidak saudara dulinan hati
slvdys,areke tidak dulinan ngenean
slvdys,sakjane bagaimana ya saudara em anu
slvdys,pacarmya
slvdys,seru juga ngeliatin orang tidak lagi tidak pakai kacamata salting eh peta peta
slvdys,cari atensi
slvdys,pinochio
slvdys,tidak tidak butuh kenapa serius
slvdys,terlalu nyaman rumah
slvdys,tidak frenzon rumit
slvdys,teman ciwi hahahahahahahahaha tidak jadi frenzon
slvdys,lebih suka orang acak suka teman owkay
slvdys,sudah ingin kge
slvdys,benci atur konstruksi sosial harus hormat orang yang tidak untuk hormat masyarakat ajar untuk hormat yang tua malu
slvdys,pimpin tidak jadi pimpin yak orang backstage
slvdys,arep nyasaki arek tugas akhir nyasaki alang alang saudara wanita
slvdys,gadue arek terus harus nyasaki spo jal
slvdys,nge silakan
slvdys,wos
slvdys,saking telepon tiba tiba dipinjem rasya sampai tidak tidak sadar kalau buat igs
slvdys,semoga dar harap ibu
slvdys,cha dal geon
slvdys,ingetin tidak boleh ritwit ritwit
slvdys,bagaimana ini
slvdys,vagabond
slvdys,dongman aera
slvdys,kalau pantanganya tidak boleh cemil pedas insya diturutin kalau tidak kopi gelud hayuk
slvdys,jung hae in
slvdys,pinochio
slvdys,selamat ultang tahun harap semua itu terbaik sayang asek twiternya balon
slvdys,ada lagi perang dingin
slvdys,aduh jadi malu saya
slvdys,mks
slvdys,lagi ksl sekali orang si rasya suka kirim guna itu orang apas sekali begitu anda timingnya
slvdys,sungguh
slvdys,cuma didatengin orang tapi adan rumah gemeternya sampai jempol jempol tangan
slvdys,agresip cuy
slvdys,gel ngetike
slvdys,susah sekali asw misahin urus pribadi urus organisasi
slvdys,teman belum tahap di mana nyaman cerita ke anda
slvdys,hai anda saya bkal obrol simpan ke anda pakai nomor saya engklah kenan disave syukur tidak tidak peduli
slvdys,jadi ini em tidak jadi mks
slvdys,si jadi sbnrny tunggu hri minggu gais
slvdys,gtw kenapa sprtinya tunggu esok sekali da pa karena hari libur
slvdys,iya
slvdys,kombinasi ac mobil aroma kuah bakso tidak sekali
slvdys,admin info zona juanda banjir tidak
slvdys,bacyot
slvdys,admin periksa pesan langsung tolong
slvdys,admin periksa pesan langsung tolong
slvdys,kenapa saya diketawain tidak bilang besar
slvdys,selamat lebaran iya sudah kumapin
slvdys,di itu akhir kalah tradisi hala mbo
slvdys,nyamuk sini tak lihat sekali sudah
slvdys,pastel
slvdys,tidak harap banyak
slvdys,admin periksa pesan langsung tolong
slvdys,ngumbule lak ambek iku saja nyanyi nyambung ambek cerito ayo arek iku saja tidak glm diarani forum dalam forum pegang saya bir saudara wanita
slvdys,beku dumbo aladin itu singa raja maleficent main cerita
slvdys,gais gais enak sekali jinja enak bawang putih roti ala dedin
slvdys,klepon
slvdys,yang cemil yang plastik
slvdys,gitasav gitasav gitasav
slvdys,supirnya oke
slvdys,choi saja ra anda bukan kenapa manusia tidak takut jalan cerita
slvdys,ote ote
slvdys,opmie
slvdys,sak bahagia
slvdys,five kaki apart
slvdys,tengkyu saudara
slvdys,coban kita mungkin takdir tuhan
slvdys,oke
slvdys,resmi
slvdys,rindu anda
slvdys,bukane sudah
slvdys,kyoke tidak tidak suwi bar konfirmasi lsg dikei tugas eneh ngarai poso sayap khusyu
slvdys,ngumpulin niat
slvdys,tiwas saudara gopoh njaluk tulis tangan saudara wanita upaya
slvdys,ini mhs nyanyi ajar dosen selalu bnar tidak kurang ajar kan
slvdys,jeda kasih tugas konfirmasi salah kirim menit kurleb menit kerja ngebut sudah serah tugas gataunya tugas ndajadi hahahahahahahahahahahaha
slvdys,dari ini untuk ini
slvdys,kesyel ngeyelnya
slvdys,ada yang larang tadarus ada yang larang tarawih saja sementara ramadan tahun laku rumah karena tuhan adalah selalu oleh kita sisi
slvdys,khatam
slvdys,tidak ngefolo saya sindir twitnya asw
slvdys,jam gin bau mie goreng
slvdys,dora whts hewan look seperti somebody cat dora iya catfish karepmu dor
slvdys,alpukat
slvdys,benar
slvdys,humoris
slvdys,laf ayo ayo laf mie saya adalah senang keluarga
slvdys,benci fakta kalau rindu benci fakta kalau jadi canggung
slvdys,butuh saya elsa hansaplast
slvdys,belum tidur gaiz
slvdys,pegang saya cola
slvdys,lemah klean dibangunin dong yang ngebangunin orang rumah
slvdys,yang mulai buat cerita wasap instagram kode bangunin sahur cung
slvdys,beda
slvdys,temenan saudara gae kenang an iku
slvdys,pilih rindu nenek ngeretwet tweet onok tulisane retweet
slvdys,saya buat mie
slvdys,habis coba buat potato cheese stik ibu
slvdys,ingin tidur baru saja bangun
slvdys,bagaimana bagaimana mantapz
slvdys,yak lihat yang episode
slvdys,dimana
slvdys,whahahahahahahaha
slvdys,saya
slvdys,tjerdas proses copas opas tugas perlu tidak ganti nama aju doang
slvdys,tidak sopan saudara saudara
slvdys,boleh juga agar imbang
slvdys,gita savitri
slvdys,pamer bojo
slvdys,snape
slvdys,micu lak
slvdys,burung hantu
slvdys,serba online seperti gin buat cepat lelah saya mata tahan lagi
slvdys,anda
slvdys,lelah bolak kamar mandi
slvdys,onok arek apik nglamak
slvdys,sesal hai ngerem cemil karena insekyur lihat timbang sekarang celana kedodoran
slvdys,tonton drama kalau pria lebih muda per cwenya bagaimana begitu
slvdys,lekas
slvdys,jam madep leptop kejut halaman
slvdys,pandang candu ciyusan konotasi denotasi
slvdys,bangun tidur yang bangunin tugas malu tidak ding canda
slvdys,sudah gaiz goa nyerah itu doesn kerja memang dasar bebal
slvdys,ini adalah keras untuk saya untuk ucap saya cemburu dari itu cara look happier tanpa saya hahahahaq peta gaiszs
slvdys,saya cemburu dari itu hujan tidak ding
slvdys,bagaimana baik kuliah online atau kuliah oflen
slvdys,menu ini nasi hangat telur dadar kerupuk sambal udang tepung iya tuhan sekali
slvdys,cemil pakai pecel sayur kubis kecambah peyek udang tepung sekali trnyata sial saya yang sudah tidak cemil menu seperti gin
slvdys,selamat
slvdys,astaga admin syok
slvdys,biasa tahan tahan tidak teriak
slvdys,tidak pintar tidak bodoh
slvdys,kampus fasilitas sehat lengkap universitas itu
slvdys,malas pikir
slvdys,kendali penuh cahaya saya pasti jalan terang tulus cahaya
slvdys,tukar jiwa
slvdys,saya tidak akhir lagu windu
slvdys,lembah kecil fredly ft tulus nyanyin aduh rayu
slvdys,tidak paham yang akhir sesuai harap mana tidak sesuai harap jalan jalan jalan
slvdys,baju hujan apa sayang baru saja ganti pikir mandi disik ngunu belum ketemu anda
slvdys,tidak mau dipikirin agar itu alir
slvdys,yatuhan
slvdys,tidak panik arti sepele didik diri sendiri dan jadi bijaksana panik akan semua runyam
slvdys,masih sesak tawa tuhan ingin pindah nyala
slvdys,seperti harus periksa tulang
slvdys,harga harga harga tidak tahu yang mereka korban hnya beri waktu tenaga materi kita
slvdys,gigit patah kunyah sadar kalau puasa
slvdys,tidak ubah smpai sekarang
slvdys,antara percaya tidak percaya
slvdys,jujur tidak kuat
slvdys,kurus
slvdys,percaya tidak kalau hri saya ultang tahun tidak sudah
slvdys,juwet
slvdys,mau suka atau tidak suka
slvdys,lucu
slvdys,terkadang anda harap kadang ada
slvdys,maaf jenuh
slvdys,sudah ya
slvdys,bangun set karena lapar sudah diminumin air putih tapi saja tidak bisa tidur lagi
slvdys,trnyata orang yang pnasaran ingin tahu sama orang yang positif pertama kasus in indonesia saya peduli mereka mana rumah nyebarin data pribadi buka ndaboleh ya
slvdys,kemarin sudah ingin hasil hasil dan reuni balik tapi trnyata iptvku tidak chanelnya sudah tidur eh kbngun hari tidak buka twt sudah tren saja saudara wanita sekali nikmatin sedih orang syukur tidak jadi tonton tidur trnyata memang pling benar
slvdys,pipi gigit nyamuk gais
slvdys,dia tidak
slvdys,apa waktu tenaga yang sudah kasih itu layak harga sakit bor tidak harga
slvdys,kita sambat semester
