username,tweet
dyeah13,apa makes saya gembira untuk besok adalah la liga tanding
dyeah13,beli tidak sayang
dyeah13,kejut saya tawa
dyeah13,yoi benar tawa padahal belum coba ngira
dyeah13,vii tidak tahu kalau seleksi seperti yang tidak nge tanda yang tidak ikut
dyeah13,hanya kota anak laki born sampai besar in south detroit
dyeah13,takut
dyeah13,pikir kyknya atur agar tidak di tanda
dyeah13,tawa ish kesal
dyeah13,atau
dyeah13,tidak menit nge tweet php temu linknya menit ngantuk syukur menang
dyeah13,di php in link streaming
dyeah13,mana cari link streaming madrid sekarang bingung cari
dyeah13,apa atas
dyeah13,ini dimasakin sop isi bakso wortel cemil panas pakai sambal terasi campur sop sampai nasi panas masya mantap
dyeah13,ini malu terimakasih anda sayang benar ultang tahun saya aniv bts bareng yuhu
dyeah13,begah tawa
dyeah13,anda komentar tidak sayang
dyeah13,ken inap ajak sobi saya kali jelajah yogyakarta tinggal tempat yang terlihat nyaman
dyeah13,balons bentar tidak di profil saya
dyeah13,terimakasih anda banci amin tuhan amin insya
dyeah13,hilang anda sampai madrid
dyeah13,mangat geng
dyeah13,bom lihat brompton eh tidak kemarin jogging dasar kamp favorit saya lihat brompton parkir syok tawa
dyeah13,tawa paham
dyeah13,percaya sama tawa
dyeah13,saja tawa agar catat
dyeah13,ji rabiah ei
dyeah13,mau apa tawa sial gaya sekali saya
dyeah13,ji rabiah saudara
dyeah13,oalah pantas saja latih alfredo stfano
dyeah13,saudara requirements seperti ya ada alam sebagai konten tulis salah majalah
dyeah13,tidak aman jas kalau tidak
dyeah13,saya sudah amat gereget tanah liat sampai
dyeah13,tawa malu ucap
dyeah13,saya benci sekali sampai sampai sama ajar jas tidak gulung
dyeah13,kadang benci diri tidak marah sama
dyeah13,tawa
dyeah13,tadi saya pikir celana saudara laki dilipet tidak lihat motif celana sampai tas pakai memang tawa terus saudara laki pic begitu malu
dyeah13,saudara laki divisi atlet villages sampai services tawa saudara laki bukan kaos biru bagaimana malu
dyeah13,divisi saudara laki ag malu
dyeah13,baru saja cemil lapar sekali
dyeah13,kenapa ya
dyeah13,luncur itu takes two untuk tango iya
dyeah13,tawa
dyeah13,kenapa saya ketawa
dyeah13,nice
dyeah13,baca repliesnya seru dapat wawas
dyeah13,rindu sekali tahun asi games
dyeah13,tawa
dyeah13,oke nasi doang gakpapa
dyeah13,ayo nanti tidak ketemu lomba yang lama
dyeah13,asam memang cemil gakbisa buru sakit perut
dyeah13,juga lapar sekarang padahal jam habis cemil
dyeah13,sudah buru indonesia saudara laki temenin buat suket duduk
dyeah13,lelah sekali goa baca obrol tugas
dyeah13,sampai nila itu saya beli tahun juga tidak mesti karena malas sampai mahal
dyeah13,ly tawa
dyeah13,bisa tunggu
dyeah13,ken beli sepeda
dyeah13,besok adalah june iya tuhan dios mio es junio
dyeah13,sempat lupa judul drama tawa bom selesai tonton seperti malas sekali ngelarin sempat tidak percaya tempat jadi seperti sih
dyeah13,apa itu
dyeah13,saja yang tanya kira frame doang untung tahu cermin
dyeah13,telinga pengeng disumpelin earphone hanya daritadi
dyeah13,lihat rajin periksa web instagram begitu ya saudara wanita tahu kalau usaha buka internship
dyeah13,iya tuhan sebut anda masuk skrip fizi yang salah
dyeah13,kejut ajar saya
dyeah13,begitu kalau sekarang magang sana bagaimana saudara wanita malu
dyeah13,ambil program magang mana saudara wanita kalau tahu malu
dyeah13,judul nit
dyeah13,tahu benar
dyeah13,iya karena bom coba soto yang tawa
dyeah13,senang ulang tahun dia jadi cantik
dyeah13,sayang
dyeah13,yang episode kemarin iya tuhan saya tonton saya tahu tidak akhlak memang anda fizi untung dingetin surat
dyeah13,soto banjar
dyeah13,tawa sumpah bude saya begini
dyeah13,salah hanya
dyeah13,sudah buka teman teman saya lihat tawa mie ayam taman amir belah es kelapa enak jbjb
dyeah13,rani punya hebat waktu dengan milik anda loved ones
dyeah13,gils saya fave chef
dyeah13,senang eid mubarak semua orang maaf lahir sampai batin
dyeah13,yay terimakasih allah
dyeah13,di twitter tahu produk sudah beda produsen
dyeah13,kejut
dyeah13,tuhan lemas baca
dyeah13,ini gadis akan jadi saya tidak saya anak kadang kerja orang gakbisa tahan ketawa
dyeah13,tokyo layang
dyeah13,gublu sekali bule bule benang wakakak
dyeah13,tuhan saudara laki owi
dyeah13,saya belum tonton tawa lihat ulas puti agak ragu tonton
dyeah13,tidak populer dapat
dyeah13,kalau lihat yang sekali jadi seperti
dyeah13,tidak tahu nang ketawa lihat ss
dyeah13,kalau lihat tweet gublu recently tweet gadis bisa masak blahblahblah
dyeah13,jojoba jomblo jomblo acara bodoamat
dyeah13,senang ulang tahun te deseo anda mejor jadi baik untuk lihat anda kembali in latih
dyeah13,pikir banyak
dyeah13,juga betah
dyeah13,keren taruh akting terus awalanya saya sebuah bara bara dingding
dyeah13,iya
dyeah13,bom utama mcd sarinah tangis ken sana belum officially tidak buka anymore tj sampai malam tidak operasional kudet saya
dyeah13,bom lihat yang
dyeah13,tidak suka ini sama manusia model ketawain lah tawa
dyeah13,didi kempot idola ibu saya ibu suka sekali main lagu saya fansnya ikut sedih
dyeah13,hilang anda
dyeah13,gara habis tonton seks ed tidak baca novel bahasa ingris otak saya suara baca baca itu novel in british aksen
dyeah13,sudah lihat
dyeah13,maloe
dyeah13,tahan untuk tidak ngeplak teman anda bcs mereka baca jadi stopid atau gaya an adalah suatu
dyeah13,gara habis gosip mall senior kampus eh pagi bangun habis mimpi utama gi tidak lagi mimpi
dyeah13,di sana adalah ini khusus suasana in ramadhan itu tanpa doing apa pun saya ve sudah rasa senang
dyeah13,ayo tambien
dyeah13,sudah watched itu old movies rekomendasi adalah oke omong omong
dyeah13,tidak belum malu apa tentang barat romcom drama
dyeah13,kenapa perut saya sekarang payah cemil sambal sekarang besok mules
dyeah13,tawa karma sebagai segera sebagai possible
dyeah13,wakakak pikir ya mancing mania
dyeah13,ingat ini hanya karena itu dunia orang sekitar anda laku anda buruk doesn maksud anda bisa laku lain seperti shiz juga baik matters
dyeah13,sikap perlahan ubah gils sejak sentil orang yang berani nasehatin saya kira tidak satu has pernah tell dia itu dia treats orang seperti shiz semua ini waktu
dyeah13,awal datang madrid sampai sekarang saya suka dia sebagai orang rindu chicharito madrid
dyeah13,oalah tawa fast responsif saya malah yang fast rep akun yang myxl yang myxlcare tidak lihat balesan sebut
dyeah13,saya bom pesan langsung sudah pesan langsung duluan tawa pemeliharan sistem ter
dyeah13,kenapa tadi malam akses saya xl gin ya periksa via gakbisa
dyeah13,iya bagaimana any rekomendasi dari baik romcom drama movies
dyeah13,beli saudara wanita berapa malu
dyeah13,beda dapat lalu pikir semua orang agrees itu itu film adalah jadi baik malu
dyeah13,kenapa itu baik
dyeah13,jam gin sudah lapar itu apa padahal buka normal tidak dikit
dyeah13,tidak debat sekali ibu es cendol untuk hidup
dyeah13,santai
dyeah13,lelah sekali saudara laki seperti
dyeah13,in itu akhir hanya saya tahu apa saya ingin sampai apa terbaik untuk kita
dyeah13,mental sehat adalah jadi penting
dyeah13,ada lemah sekali fien
dyeah13,terimakasih sudah rangkum
dyeah13,teh ini ketinggalan
dyeah13,adalah datang syukur
dyeah13,cantik tidak akhlak tawa hade
dyeah13,memang tubir saja ini tawa
dyeah13,gemar proyek konser jb
dyeah13,tawa tos
dyeah13,oalah tahu berapa fien konser
dyeah13,baik untung
dyeah13,oalah webnya fien saya di twitter livestreamnya livestream youtube begitu
dyeah13,tawa usia celah itu kalau ya begitu
dyeah13,tonton mana fien
dyeah13,buat orang yang dicurhatin tapi ngeread doang anjc tawa
dyeah13,marah tawa ken ngeluapin di tweet saya apus boleh
dyeah13,humor
dyeah13,setia
dyeah13,itu iker eres mie idolo
dyeah13,adalah semua waktu favorit adalah fave juga
dyeah13,telah doing ini sejak ini tahun temu indomar yang gratis parking agak dari rumah tetap datengin
dyeah13,pasifik tempat
dyeah13,saya bisa bilang senang libur alih alih feliz pascua
dyeah13,rumah
dyeah13,teen bom tonton hade tonton daftar saya benar
dyeah13,tonton bagaimana untuk beli teman karena shin seung ho
dyeah13,malam dunia selalu cinta friday
dyeah13,senang ulang tahun untuk milik anda ibu semua itu terbaik
dyeah13,pikir bedak
dyeah13,ken beli bibir colour eh beranda lihat langsung cari reviewnya youtube boleh juga
dyeah13,seperti kalau tidak twitter hidup saya hampa sekali habis instagram saya jarang buka haha
dyeah13,tetap baik diri sendiri set tinggi standards dan agar mereka penuh anda atas di sana tidak pernah tetap
dyeah13,memang lho kalau sekolah kantin jual pagi
dyeah13,saya rindu sekali utama madrid tolong
dyeah13,pi
dyeah13,uang uang uang dan bangga
dyeah13,bajing ketawa
dyeah13,apa itu
dyeah13,ini juga shall lalu semoga ini cepat ya tuhan rindu adan normal virus
dyeah13,tentu
dyeah13,tawa
dyeah13,bahasa spanish sub eng balik huaha
dyeah13,kayak yang mati saudara tonton video cuplikanya oalah lihat tidak sabar tonton tawa
dyeah13,hua saudara wanita saudara belum tonton s aduh tahu spoiler dikit
dyeah13,apa iya tuhan tahu
dyeah13,rindu sama rindu kuliah
dyeah13,iyanih mie tawa
dyeah13,hola apa taruh
dyeah13,tawa sudah tidak tahu kabar pacar
dyeah13,begitu saudara tawa memang rumit sekali elite mau s kata
dyeah13,lelah utama instagram tawa
dyeah13,karena lempar elite kece sekali tidak saudara terus akting bagus
dyeah13,wujud mie
dyeah13,pikir
dyeah13,pantas saja masih yang ya
dyeah13,nenangin sendiri agar tidak panik tidak mudah tidak tambah panik baca tweets negatif nakutin
