username,tweet
dzakyhaidar__,gudang senjata tawa
dzakyhaidar__,baca bagus
dzakyhaidar__,tawa
dzakyhaidar__,sendiri tentu garis waktu kita sesuatu baru hal baru belum baik
dzakyhaidar__,akhir sendiri sampai masih pada titik titik yang sama
dzakyhaidar__,alex ret manusia dari itu tanding ronaldo tidak kasih nendang
dzakyhaidar__,napoli
dzakyhaidar__,aguero
dzakyhaidar__,timnas kalau utama saja mbah
dzakyhaidar__,akan bayern waktu
dzakyhaidar__,kalau yogurt heavenlyblush
dzakyhaidar__,dia akan bayern saat
dzakyhaidar__,kasi fans ipul yang tidak bisa lihat tim kesayanganya konvoi juara televisi biasa cuman tonton gratis di tvri
dzakyhaidar__,sih nel tawa
dzakyhaidar__,karena tidak potong lahir cara aktivitas dia tidak buat kuku potong scr alamiah
dzakyhaidar__,ketika anda punya untuk buka milik anda laptop diluar milik anda kantor jam bcs di sana sebuah trouble in produksi
dzakyhaidar__,sanksi sosial tunggu ini kecuali tetanganya ikut tidak tahu
dzakyhaidar__,kan bawa sim surat izin cinta
dzakyhaidar__,hari senin jalan lancar ada wekendmu bahagia
dzakyhaidar__,kalau parkir motor kemvil ada ke dimensi beda
dzakyhaidar__,sabar ibu
dzakyhaidar__,muncul beberapa di beranda tetap tawa
dzakyhaidar__,bar ini klarifikasi ning podcast dedy
dzakyhaidar__,saya tadi malam baru saja kumpul beberapa teman kuliah yang bahas adl tg konyol waktu kuliah sampai suka duka di korporat tidak bahas nyerempet gaji jabat masing sudah paham kumpul sambung silaturahmi mainin gengsi
dzakyhaidar__,aduh saudara laki tidak serius serius ini facebok
dzakyhaidar__,hiya hiya hiya
dzakyhaidar__,ronaldo immobile luka
dzakyhaidar__,nyanyi sayap buat pitpitan nganti kerumun nutupi sak ndalan ndalan nyanyi sayap sudah buat ngebaki malioboro teh saiki nambahe mono sayap sayap sudah tahu raono balas meh dino kelakar mung tambah
dzakyhaidar__,tawa siapa lho emange
dzakyhaidar__,otak benar benar keluar dari itu kotak tawa anak juga apa sampai pikir
dzakyhaidar__,waktu puasa ken itu buka puasa cemil porsi sudah dari dasar manusya
dzakyhaidar__,karena masih bisa menang itu perdana menteri liga
dzakyhaidar__,ke pelatuk hidup serius
dzakyhaidar__,gils surabaya sudah pergi dan zona padahal tinggi tinggi kasus positif
dzakyhaidar__,kan cuma aktor sutradara bebas
dzakyhaidar__,juga teman kayak gin ulas ala ala begitu
dzakyhaidar__,saat transisi baru normal harus periksa adalah kesiap fasilitas sehat pusat perbelanjan biadab
dzakyhaidar__,mangkat jam riuh tawa
dzakyhaidar__,selesai urus masing selesai itu puncak prioritas masih tentang diri sendiri
dzakyhaidar__,tidak apa apa kalau tidak sibuk kabar
dzakyhaidar__,habis apa coba kirim tawa
dzakyhaidar__,ngefans
dzakyhaidar__,tawa tawa
dzakyhaidar__,deep condolance
dzakyhaidar__,kayake karena olahraga luar ruang yang disaranin tidak kayak gin itu nyepeda langsung pada latah ngikut cenderung tawa
dzakyhaidar__,sungguh itu saya masuk pada itu
dzakyhaidar__,coba diniatin paling tidak sampai bawa mimpi sepeda lak benar ken
dzakyhaidar__,lokasi dimana saudara laki nama
dzakyhaidar__,baru normal toko sepeda laris pada nyadar olahraga
dzakyhaidar__,tawa gils gils tidak paham
dzakyhaidar__,tawa
dzakyhaidar__,salah rekrut fergie unik ia gabung anda usia karir utama sepakbola justru putus karena gabung tim tepat
dzakyhaidar__,dan mostly pada pasang rata rata lulus kampus puncak indonesia bahkan artis artis lulus kampus ln bisa ada tidak aman
dzakyhaidar__,iya mau jalur buat tingkat yang pikir akses stasiun untuk saat saja seperti itu kelihatanya bisa normalisasi rumah rumah semi permanen sekitar untuk lebar jalan sampai akses
dzakyhaidar__,bagaimana trav
dzakyhaidar__,fakboy dini
dzakyhaidar__,izin curi
dzakyhaidar__,dia punya hati nurani jadi cuman ambil jatah libur buat nenangin pikir
dzakyhaidar__,sial acara ngeprank
dzakyhaidar__,oke
dzakyhaidar__,gubernur memang bagus
dzakyhaidar__,tidak beda kenapa saudara laki abad kalau hitung kasar juga
dzakyhaidar__,masuk acara tiktokan kali agar ke pelatuk
dzakyhaidar__,tapi kevin masih nyala his gairah untuk nikmat itu lagu
dzakyhaidar__,indonesia urus nomor
dzakyhaidar__,mashok ligina sudah kiblat sepakbola eropa
dzakyhaidar__,kemarin lebaran libur panjang hari libur mei juni kemarin tahan tidak buka laptop sekali
dzakyhaidar__,kalau buka laptop jatohnya buka buka aju pekerjaan masih pakai tools buat akses perbarui info
dzakyhaidar__,masih kualitas waktu diri walaupun optimal baca butuh libur tidak buka laptop sekali panjang hari libur kemarin
dzakyhaidar__,kemarin libur lebaran lalu kemarin libur panjang hari libur lahir pancasila tetap bawa laptop kos tidak buka sekali pakai tools lain laptop perbarui info kalau buka laptop malah pegang pekerjaan
dzakyhaidar__,balik bambang
dzakyhaidar__,ini po wok
dzakyhaidar__,setia sampai sabar tunggu memang padahal buat si kalau masak suka digabungin satu kalau yang datang duluan terus sen bakmi goreng cuman habis itu telah ada yang datang sen nasi goreng yang dibuatin nasi goreng
dzakyhaidar__,isih banyak ning bogor ki
dzakyhaidar__,ashiup tawa
dzakyhaidar__,reporter sekarang ngeliput tidak ngebayangin dia pakai sekarang seperti bagaimana
dzakyhaidar__,jalan tikus saudara laki
dzakyhaidar__,tawa
dzakyhaidar__,saya nyala dasar sekolah tonton doraemon nyala sunday pagi juga saya ketika sudah had kerja masih tonton doraemon nyala sunday pagi
dzakyhaidar__,orang sekarang butuh var untuk periksa ini
dzakyhaidar__,kondisi oksigen jam pagi sudah tidak clear banding range jam matahari sudah naik olahraga dengan papar sinar matahari beberapa waktu akan mudah lelah ban oksigen dengan lain yang olahraga
dzakyhaidar__,cuma saya kita mulai olahraga jam pagi apalagi rencana luar rumah beberapa yang jadi lihat
dzakyhaidar__,baru rumah olahraga jam pagi ya fine fine karena juga pagi kalau hari libur pada pilih bangun siang biasa
dzakyhaidar__,anda bisa dorong milik anda batas nyala itu emas jam panjang run minimal juga tidak ada lelah sudah
dzakyhaidar__,juga oksigen masuk dalam tubuh bisa optimal banyak kontaminasi karbondioksida sumber oksigen
dzakyhaidar__,waktu tubuh lebih kerja hidrasi kulit mengoksigenasi darah jam kondisi oksigen di ruang buka bersih biasa belum aktivitas kendaran motor yang buat polusi
dzakyhaidar__,saya emas jam orang yang rutin olahraga pagi ada jam
dzakyhaidar__,in itu baru normal haji umroh wajib uji pacar kuliah ln wajib uji pacar bisnis jalan ln wajib uji pacar libur jalan ln wajib uji pacar
dzakyhaidar__,fans garis keras sejak
dzakyhaidar__,dia boleh tubuh lukis
dzakyhaidar__,masih tanya kenapa baca tolong cuman baik imam si makmum sama erti kondisi kalau
dzakyhaidar__,tahu tidak
dzakyhaidar__,ugm
dzakyhaidar__,tawa sabar ibu niat tadi ajak tertawa tapi lihat penuh video justru tidak ketawa sedih kenapa ada tawa
dzakyhaidar__,warga maksud
dzakyhaidar__,tidak akhlak memang anak acara
dzakyhaidar__,kun fayakun saudara laki hendak
dzakyhaidar__,ubah bagaimana
dzakyhaidar__,hai padahal jatim naik lho tawa
dzakyhaidar__,kalau
dzakyhaidar__,dwight yorke andy cole teddy sheringham gunar solskjaer kuartet legenda
dzakyhaidar__,sih tidak kampanye doang
dzakyhaidar__,fizi
dzakyhaidar__,tawa sampai lebaran tahun ketawa kalau bangjo pingit
dzakyhaidar__,epl malu
dzakyhaidar__,jadi tren ada bel juga ya
dzakyhaidar__,hanya sederhana benda kalau mompain mompain larang belakang jadi ribu kasih ribu tidak buat rugi kalau beli bensin selesai disi majuin motor tempat yang lega tutup tangki sampai masuk uang situ
dzakyhaidar__,sudah paham koyo ngono tiap tahun isih saja tuku
dzakyhaidar__,lha begitu tawa
dzakyhaidar__,biggest ampo in sampai oleh mes
dzakyhaidar__,epl hanya sederhana pikir
dzakyhaidar__,dia hanya di ini tahun
dzakyhaidar__,tonton film itu flu lumayan thriller saat pandemi rebak orang infeksi tidak sembuh dikumpulin satu karantina tidak selamat langsung musnah
dzakyhaidar__,terima kasih dalam ini hidup anak kos jamin dapat bingkis klien kantor dikirimin cemil teman kantor dikirimin cemil ibu kos
dzakyhaidar__,anak terna tertawa komentar komentar
dzakyhaidar__,throwback five tahun lalu
dzakyhaidar__,inzaghi tidak butuh untuk mahir benar manusia in itu benar moments
dzakyhaidar__,masjid al itihad pagi laksana sholat id jamah jarak pemda bogor letak pinggir jalan utama yang notabene jadi pusat perintah kab bogor benar lengah dari awas
dzakyhaidar__,barakalah
dzakyhaidar__,akhir benar tidak puasa ramadan tidak ada bukber tidak apa apa sudah coba tahun walaupun dengan alas tidak terima pada inti fokus ibadah yang lebih intens presisten di tahun insya tuhan
dzakyhaidar__,zlatan pindah barca antar juara champions zlatan pindah mil barca juara champions ada kutu hanya
dzakyhaidar__,playing korban
dzakyhaidar__,bahasa janji manis jajah jaman sekarang
dzakyhaidar__,coba ngundang maudy ayunda begitu belva devara juga deh inti sosok yang inspirasi dunia didik pacar bisa kejar cita cita membangakan indonesia iya mungkin konten anda menikah menikah hanya kasih cemil pakai janji manis memang kenyang
dzakyhaidar__,tumbuh dengan kawan kebal
dzakyhaidar__,ashiup
dzakyhaidar__,nikmat hidup
dzakyhaidar__,sabar ibu
dzakyhaidar__,orang konfirmasi positif corona tanggal mei banyak ini underrated
dzakyhaidar__,tadi malam hujan angin jemur teras kos ambruk sampai cuma nyelametin baju baju doang pagi bangun lihat kondisi jemur diri normal terima kasih bapak kos yang hati
dzakyhaidar__,anak ujung kandang mingir cerca
dzakyhaidar__,iya
dzakyhaidar__,ini ajar gih tawa
dzakyhaidar__,netizen media sosial belah memang tidak akhlak
dzakyhaidar__,jam cabut sial tawa
dzakyhaidar__,cuaca bogor masih sulit tebak hari cerah hari hujan angin alahuma shayiban nafi an
dzakyhaidar__,gobs
dzakyhaidar__,ke masya tuhan
dzakyhaidar__,tawa
dzakyhaidar__,izin curi canda saudara
dzakyhaidar__,mudik lebaran
dzakyhaidar__,humoris kambing
dzakyhaidar__,sengaja simpan cuti lampias saat sudah normal
dzakyhaidar__,oleh tipikal yogyakarta bakpia
dzakyhaidar__,malam ganjil ramadan mari maksimal
dzakyhaidar__,takdir hidup negara berflower
dzakyhaidar__,sabar ibu tidak mudik
dzakyhaidar__,ke barakalah
dzakyhaidar__,syok
dzakyhaidar__,sudah ningalin instagram tepat lihat konten konten kayak begitu drama juga tidak cara tidak langsung memang jadi racun twitter rasa gratis tidak keras asa sudah lama utama twitter akan paham
dzakyhaidar__,izin curi canda saudara laki
dzakyhaidar__,ke ke akhir ramadan waktu flies jadi fast
dzakyhaidar__,asiyaph
dzakyhaidar__,kobutri legenda
dzakyhaidar__,tawa mau tanya yakin di indonesia lihat sekali sudah berita palsu di cina juga bukit seperti bahkan memang extrem
dzakyhaidar__,tega twitter akun maudy ayunda verifikasi
dzakyhaidar__,beli sepatu online beli kemeja online beli jersey bola online beli bmw online
dzakyhaidar__,definisi jual tinggal sholat daganganya tetap yang tunggu yang beli sabar kalau rezeki tidak
dzakyhaidar__,buka puasa hari semoga terus mudah
dzakyhaidar__,presiden tri ini memang
dzakyhaidar__,tawa tawa kucing nyala api
dzakyhaidar__,pergi pagi pulang lebih awal luang waktu istirahat sebentar buka puasa efektif kondisi tubuh
dzakyhaidar__,oke
dzakyhaidar__,sabar ibu
dzakyhaidar__,hehehehe puasa
dzakyhaidar__,peh tawa
dzakyhaidar__,saja saya tawa
dzakyhaidar__,sus sus susanti badminton ayo
dzakyhaidar__,al fatihah kagem pakdhe
dzakyhaidar__,tuhan ambyar
dzakyhaidar__,e e e ayam ayam ayam
dzakyhaidar__,shinji kagawa
dzakyhaidar__,efisien waktu mungkin jam saat kantor tugas untuk buat sudah deadline yang bisa dibesokin inti set prioritas banding prioritas
dzakyhaidar__,masih lumayan tugas untuk buat mesti tapi memang baik saat jam
dzakyhaidar__,sugesti bawa pekerjan sudah kos benar walaupun kemarin panjang hari libur laptop sekali tidak sentuh
dzakyhaidar__,forlan
dzakyhaidar__,avatar jurasic dunia jurasic dunia fallen raja itu takdir dari itu geram skyfal spectre
dzakyhaidar__,bias belanja niat beli sampai lokasi lihat diskon sampai lokasi yang beli akhir over anggar
dzakyhaidar__,sahur sholat ngaji rebah beberes cuci iflix ulang
dzakyhaidar__,kucing kerja geser
dzakyhaidar__,tidak cocok
dzakyhaidar__,ngakbisa
dzakyhaidar__,mulai padahal tawa
dzakyhaidar__,bogor cara kurang kerumun saat pandemi turun hujan tiap sore jelang buka puasa
dzakyhaidar__,nasi kulit juara jadi juara menu buka puasa
