username,tweet
virraaa_,kiro intinyo itu tambah kapasitas jalan itu opsi betul
virraaa_,tidak ajar mk lalu lintas teknik kayak diajarin kalau macet ngatasinya mesti atur volume lintas kendara itu lebar jala benar tidak apa saya halusinasi pakpolnya benar
virraaa_,hanya terbit lorong waktu
virraaa_,kasus takde boyfriend kire kera bagi tekan
virraaa_,tawa iya tuhan hilang ini game
virraaa_,tawa itu bukan saya baik
virraaa_,sadar malam saya lupa bentuk jangkrik
virraaa_,baik kalau tidak ya sudah tidak saja begitu
virraaa_,tidak sebagai mudah sebagai itu sounds
virraaa_,kilas lihat fuyunghai bik kayak mudah tidak coba masak jatohnya telur dadar untung tolong saos
virraaa_,shrek harga nunjukin agar paham kalau pamer
virraaa_,pacar kirim whatsapp tidak pakai pikir saya pusing ngejelasin ibu
virraaa_,tidak kayak begitu pohon pisang
virraaa_,ini hukum saya tadah canda curi
virraaa_,izin curi canda
virraaa_,tawa benar sudah buat contek mager an
virraaa_,saya jantung breaks untuk itu duka keluarga
virraaa_,semangat ranel
virraaa_,semester catat binder pisah in mk pakai batas ke bawa buku catat isi campur aduk mk untung punya teman rajin baik yang bisa dipinjemin catetan tidak uji
virraaa_,tawa jarang catat statika mekban gara cabut
virraaa_,pikir ya kalau malas banyak pikir negatif kayak gagal begitu sampai rasa tidak nyaman gerak tidak tiru sara sehat
virraaa_,sama disini
virraaa_,may jadi anda butuh untuk maaf diri sendiri kecil lagi enough untuk beri diri sendiri gratis ruang untuk breathe itu sudah keras sebagai itu adalah anda kena punya untuk buat itu lebih keras untuk diri sendiri
virraaa_,halaman rumah anda ibu apa sapu pagi sapu sore jorok orang pohon galo
virraaa_,itumah ujung saya melipir rumah doang
virraaa_,mudah silat lidah dick
virraaa_,ken swis tidak yang ngajakin
virraaa_,kayak anda ayo teluk kalau hilang kontrol bawanyo ken tawur
virraaa_,tengah kotak saya doang
virraaa_,jelas tidak suruh sebutin hukum archimedes contoh aplikasi
virraaa_,in
virraaa_,yaudahlah ujung juga saya bisa ngejulitin twitter
virraaa_,ini hilang kontrol jail sekali habis pekerjaan luar sore lihat koko martabak langanan tidak sama sudah buka diputerin sambil pikir melipir
virraaa_,sakit olahraga memang gin kalau sudah henti mulai susah tawa
virraaa_,tapi benci saya malah diencourage begitu loh demi uang
virraaa_,tahu stis sudah poltek
virraaa_,tahu itu milik anda bisnis needs untuk tetap lari tapi encouraging orang untuk makan malam in in groups instead dari ambil jauh in ini corona situasi untuk diskon adalah yang lain benda
virraaa_,mellow begitu scrolling homepage facebok temu begini iya tuhan mobil tawa geli sekali
virraaa_,saudara wanita tunggu saudara laki kurir pintu standby telepon bagaimana
virraaa_,gakpernah rasa lelah telah curhat
virraaa_,hanya terbit diri blaming konsekuensi
virraaa_,dirjen bina marga dirjen cipta karya dirjen sumber daya air dirjen rumah dirjen bina konstruksi dirjen pembiayan infrastruktur pekerjan umum rumah badan kembang infrastruktur wilayah badan kembang sdm
virraaa_,tawa apo tin
virraaa_,iya ampun tidak lihat notif syok kira jadwal
virraaa_,cakep si shrek minder
virraaa_,akrab nian fatin samo dosen cak kawan dewek
virraaa_,hanya terbit komitmen batas
virraaa_,duka cita ayo dek inalilahiwainailaihiraji ujian nasional semoga beliau baik di sisi tuhan amin kuat ayo dek
virraaa_,lelah
virraaa_,hanya terbit antar
virraaa_,minjemin buku teman buku saya ken baca apa memang saya minjem dih aduh ya seperti saya pinjemin orang tapi saya lupa dalam hati ngebatin mati anda
virraaa_,tim lipat buku
virraaa_,segan
virraaa_,iya ampun salah sekali lihat begini
virraaa_,tidur jam set bangun set
virraaa_,ini sekali ibu cemil kebab cocol pakai cuko pempek
virraaa_,takut
virraaa_,periksa ji kalau buka susulin gek tawa
virraaa_,tawa gin doang saya nyengir
virraaa_,tawa iya kualitas oke tapi hargo affordable tetap tidak
virraaa_,sih ribut nanyo online shop waktu itu pengirimanyo susah mels kareno untuk jugo resmi indonesia ayo mereka mesti sedia luar sebenernyo kalau anak cari biso temu hargonyo amsyong nian
virraaa_,mano iya
virraaa_,parah susah nian cari untuk ken nyubo pc apa ribut stoknyo dengar somethinc jugo bagus dev apolagi niacinamidenyo
virraaa_,saudara laki
virraaa_,overthink dan tanpa pikir di itu sama waktu
virraaa_,tawa tidak hakim buku oleh ini adalah tutup dick
virraaa_,di sana baca juga banyak apa jika pikir in saya pikir
virraaa_,ken muterin gramed ngebukain plastik buku agar ngintip isi dalam mondar mandir depan rak sama akhir beli buku sama tidak direncanain tidak pergi rumah
virraaa_,cari kufu jer
virraaa_,orang lihat dan paham sesuatu beda hidup under itu sama langit dan alam semesta doesn buat anda lihat itu dunia in itu sama gambar rather daripada lihat itu pictures pisah combining itu pictures dan lihat mereka sama sekali might jadi lebih baik pilih
virraaa_,kalau beban takutnyo jadi liar teluk cak
virraaa_,kena bahkan paham myself jadi kenapa ganggu coba untuk buat seseorang else does
virraaa_,asa seperti punya jadi banyak untuk tell belum zero desire in berita apa pun
virraaa_,saban mak saya bilang tekwan
virraaa_,ke buang beban hidup mels kalau tawa panjang rambut berat beban hidupqu
virraaa_,potong dewek mels
virraaa_,rasa tidak apa apa suatu rasa suatu tidak apa apa baik
virraaa_,pukpukpuk
virraaa_,mau sanding pelamin
virraaa_,ibu angkat
virraaa_,sapa ajak sapa pacar doyan sushi teman teman makanya pakai tangan kalau tidak mesti disuapin tolak ajar pakai sumpit
virraaa_,restoran sushi jual ikan mentah tidak memang orang jepang sehat gara cemil ikan mentah penasaran ken sashimi sudah ayo cemil hai ibu gakenak ikanya lembut dingin begitu ajak ibu cemil sini lagi
virraaa_,skenario lain masak panekuk pisang havermut apa itu panekuk havermut walah ibu ibu masak ho nama lempeng bukan panekuk lempeng panekuk ibu nama lempeng lengos
virraaa_,sama ayo cemil suki sudah kan apa suki mana waktu cemil ramean kuah masak oh bakso
virraaa_,tawa pikir sih
virraaa_,jadi sendiri adalah tidak scary di semua untuk saya jadi sepi adalah
virraaa_,namo sebut apa saya tidak akhlak tidak
virraaa_,tahan dilema pagi
virraaa_,terimakasih aulia kenal pada bawang cincin cfc
virraaa_,bawang cincin cfc available sih
virraaa_,silakan riuh
virraaa_,wih tawa kapan sekali saya masakin benar kuat tidak anda
virraaa_,senang jadi inspirasi isi libur yang super sibuk
virraaa_,sukses ini caknyo
virraaa_,lupa nanti bisnis brownies sama an
virraaa_,tawa biasonyo nida cemil banyakla nasi lauknyo upil dick soalnyo buntu dio biasonyo sejak sukses ini la beda memang
virraaa_,gila gila anda buat amat buat jual ya
virraaa_,tunggu cak tahun arti dek biso cemil flip burger lingau
virraaa_,serandom tiba ken burger
virraaa_,selamat coba
virraaa_,arus suasana hati ken sibuk tanjung rebah
virraaa_,tunggu recok saudara wanita
virraaa_,pertama rilis sudah taro mylist bom sempat tonton sampai kayak segera tonton waktu
virraaa_,sudah sekali tidak baca conan kenapa hilang minat baca komik tonton anime tahun tapi kalau versi novel gin semangat ken beli
virraaa_,yang lain catat semoga akhir agar gakada lup masuk garam gula sekaligus tahap sambil dirasain sudah tidak belum cemil pakai nasi memang buat lebih asin tidak digadoin tetap nendang
virraaa_,sesap tawa tunggu recreatenyo ras
virraaa_,tawa bandinginyo pokoknyo embun
virraaa_,butuh waktu lebih bayar ini
virraaa_,hutang apo
virraaa_,cumi ke wajan sering aduk agar tidak mledos masak tidak kelam agar cuminya tidak karet
virraaa_,ralat proporsi cabai hijau cabai merah bukan
virraaa_,lagi cabai pakai segar kalau pakai cabai sudah tidak segar nanti pahit alam
virraaa_,tidak repot curi kasih senang hati
virraaa_,kalau recreate bingung cari cumi asin kualitas mana pesan langsung pesan kirim seluruh indonesia palembang yang di lingau bisa sekali harga sesuai kualitas pokok
virraaa_,comebacknya yah tawa
virraaa_,tawa tunggu recreatenya saudara wanita
virraaa_,iya lup kalau ken warna merah koda ditambahin sambal tumis langkah kalau tidak gakpapa opsional
virraaa_,sudah tidak hutang resep kan
virraaa_,bawang cabai mulai layu susut cumi asin dalam wajan api telah air masak cumi ubah warna seluruh air uap masuk garam gula koreksi
virraaa_,minyak panas bawang merah cabai api supaya bawang tidak bawang goreng masak lama bawang cabai layu aduk sekal halus terasi bakar ke wajan
virraaa_,kupas cuci bawang merah hingga bersih iris tipis tipis cuci cabai hingga bersih iris serong ukur panas wajan tuang minyak
virraaa_,langkah masak cumi asin cor air didih sekitar menit sampai lembut potong bagi seperti cincin cuci air dingin hingga bersih
virraaa_,resep tumis bawang cumi asin oleh instagram
virraaa_,ujung akan lihat yang niat yang tidak
virraaa_,ini bodoh besar nama koar koar siap baru normal kan
virraaa_,tawa jadi keras
virraaa_,penjara playbook
virraaa_,gula intake tidak kontrol hadir lapis kojo maksuba lapis legit keliling
virraaa_,bukber online hitung tidak
virraaa_,selamat lebaran tanah rantau embun semoga cepat pulang
virraaa_,maaf lahir batin jugo ayo na selamat lebaran
virraaa_,kalau bentuk gin rasa keju anda cemil tidak
virraaa_,senang eid yuza semoga cepat pulang
virraaa_,senang eid masbay maaf lahir batin ayo
virraaa_,senang eid mie maaf lahir batin yow
virraaa_,selamat lebaran seperti maaf lahir batin
virraaa_,senang eid el fitr teman teman pun semoga selalu syukur semoga beri nikmat lebaran lebaran di yang lebih dari ini
virraaa_,gulai anam kuah ketupat tipikal zona
virraaa_,penting ketemu
virraaa_,eh belum itu tanya paling adalah masih ada lanjut tidak untuk vira
virraaa_,ramadhan tahun ada bagaimana hal akan disedihin dikangenin apa lagi hal beri tuhan akan disyukurin
virraaa_,tahun syukur kasih nebus yang disedihin ramadhan tahun kemarin sudah tidak pulang lingau inidan benar penuh rumah tidak ketemu di
virraaa_,teringat tahun baru pulang lingau tidak akhir puasa sampai lingau sudah jam an malam sempat bersih bentar langsung nyusulin teman ktn habis bukber
virraaa_,srek curi canda ya
virraaa_,teori kalau anda korea ini benar
virraaa_,lowkey
virraaa_,bulan
virraaa_,ikhsan bagaimana skripsi
virraaa_,jam kali jalan saya pp
virraaa_,kinda rasa buruk tontowi pensiun bisa dapat gelar matches tapi masih dia adalah hebat main siapa pantas banyak dari hormat dan support
virraaa_,gakpapa bukan skb lama
virraaa_,saja saya duluan ini itj sisa saya inap rumah anda ada bau saya
virraaa_,tawa sudah tidak ketemu saja deketan jadwal
virraaa_,ubah situasi saat mulai ketar tir tunggu jadwal uji kayak tidak lagi
virraaa_,in saja ajar dikit sekali istirahat
virraaa_,tawa saya utama ios tuhan sampai lelah tunggu cari tidak selesai bentuk rumah saja uang dikit
virraaa_,oke
virraaa_,kaged tidak anda
virraaa_,oke
virraaa_,bomat
virraaa_,studies untuk minutes alright selesai bab lemme ambil quick peek di bagaimana saya sims doing dan lalu dapat kembali untuk yang lain bab opens itu sims doing semua sortir dari quests yang lain quests datang yang lain hari passed
virraaa_,apa
virraaa_,langanan bimbing bukit
virraaa_,tawa main sims freplay seru buat rumah lebih ada
virraaa_,utama game pakai mod itu memang sekali iya tuhan ngeskip cari suka hati biasa cari suka ngeskip saya gara kelam
virraaa_,mapin ya
virraaa_,benda kesal dunia tahun an
virraaa_,tanyo dasar laen baik
virraaa_,skandal sipil layo benang
virraaa_,anda punya andil sokong macet jadi
virraaa_,kayak memang tidak ada bakat bakar coba bakar grasa grusu heboh saja selip
virraaa_,in
virraaa_,iya bagi yang kurang sreg apolagi sayangnyo apa diceritoin selamo tahun dio mano ngapoin
virraaa_,gantung ingin tidak
virraaa_,endingnyo realistis setidaknyo masalah selesai semua pindah nyala hidupnyo
virraaa_,benar
virraaa_,susah daftar yudisium
virraaa_,hari ngeributin orang tidak amat tidak lelah
virraaa_,akhir tonton pagi
virraaa_,betis cenat cenut sudah kayak habis lari marathon
virraaa_,tawa biadab tawa
virraaa_,iyain
virraaa_,tidak ada ngefans nasi padang fisip itu sekali paru iya
virraaa_,tonton episode sama episode besok hari ya
virraaa_,tidak pernah telah nyala satu itu pikir dari pergi ramai sekian orang dalam jalan scares saya
virraaa_,tidak la semester pucuk mindset itu syukur penting apa ngulang
virraaa_,tawa mamang sabda
virraaa_,baca balas erti
virraaa_,tawa sudah mes grabfod
virraaa_,peh tot ajar bareng tawa
virraaa_,masake dio biso apa
virraaa_,bikinke video tutorialnyo tiktok ang
virraaa_,beda merk beda ayo tawa astaga tahu
virraaa_,oke gek periksa tidak anak nyubi terimakasih dep
virraaa_,tawa lum temu tukang martabak samping indomaret lingau saudara laki
