username,tweet
aiuchida,cie yang sudah muncul anda
aiuchida,sungguh benci itu asa ketika orang buat saya kuatir
aiuchida,impulsif
aiuchida,sudah buka hati nez
aiuchida,dilema
aiuchida,terimakasih bang yang rajin ucap semoga sehat sukses sekalu
aiuchida,selamat ulang tahun kembar
aiuchida,kasih masuk fkg bel
aiuchida,tahun saya ya
aiuchida,peras tanggal sekarang sudah tanggal ajar hanya tidak ada ganti hari
aiuchida,canda yang itu
aiuchida,kelam ajar tidak sadar sudah juni
aiuchida,bantu aqu qaqa
aiuchida,kalau kayak saudara laki yang mulai ajak racunin
aiuchida,watched mereka video dapat saya jadi sedih bagaimana ryan tidak bisa pegang his asa dari kalah dan bagaimana sylvia coba untuk pegang dia asa dengan sengit look ini adalah keras tapi mereka hanya ingin untuk jadi manusia
aiuchida,pikir di sana might jadi kuat pasang seperti ryan dan sylia sebagai menikah pasang dan busines pasang tapi mereka hanya tidak bisa jadi together cause alot dari tekan itu sparks hanya gone ini adalah keras hanya jadi benar orang salah kondisi
aiuchida,salah bentuk aging jadi mudah lupa
aiuchida,sungguh sesal bagaimana banyak plates dari lontong raya consumed dan juga cokies dan sirup
aiuchida,saja tidak bisa rasa saya kaki aduh litak litak litak
aiuchida,jadi ve telah coba ini emi pukul dan baik sungguh support saya untuk beli saya sedia untuk itu dan dia juga ucap seperti ketika peopke ingin untuk coba keras mereka look cahaya juga anda
aiuchida,saya baca semua in ini saudara wanita
aiuchida,anjur mie kopi saat sama tidak fokus tidak sakit salah masuk bubuk
aiuchida,teman olahraga malam
aiuchida,kalau tidak keter boneng yang aneh tawa
aiuchida,juga saya terus untuk dorong pangkat
aiuchida,seminggu keluar koas baru rumit
aiuchida,itu asa ketika gastritis serang dan anda tidak bisa dapat keluar dari itu tempat tidur
aiuchida,kucing pakai gin gigit sampai koyak
aiuchida,may tuhan kati kita dengan bahagia dan rahmat kita rumah dengan warmth dan damai harap semua orang aman dari corona dan ini siapa derita dari itu akan recover segera
aiuchida,sebentar ngaku tidak uang cemil ada uang baju lebaran hahahahahaha
aiuchida,throwback hari raya nyendokin cemil saudara laki buatin minum saudara laki nyediain yang saudara laki dulu tahun inem istirahat semua
aiuchida,tawa tep
aiuchida,jumpa puncak indonesia mobil kutik
aiuchida,periode minggu puasa periode minggu puasa pikir benar jadi
aiuchida,sekian malas masak eh suruh yang saya tidak baca baca kue raya
aiuchida,relax saudara wanita breathe
aiuchida,couldnt tidur akhir malam karena dari itu heavy thunders anda tinggal dan tenang saya turun untuk jatuh tidur
aiuchida,sudah pensiun tawa
aiuchida,tidak ucap anda tahu saya ketika tidak bahkan bicara untuk anda tentang saya pribadi barang tidak hakim hanya tidak
aiuchida,saya khas ambivert orang saya oke untuk jadi friends dengan anyone dan saya oke untuk habis saya waktu jadi sendiri itu benda adalah tidak bicara tentang saya pribadi hidup atau saya masalah untuk orang jika tell ini untuk anda anda harus jadi khusus orang untuk saya
aiuchida,anda baca irreplaceable
aiuchida,ketika anda sudah temu itu satu siapa sungguh paham anda sungguh peduli untuk anda dan sungguh cinta anda tetap dia harta dia
aiuchida,masyarakat bandal perintah bebal pandemi isolasi panjang
aiuchida,dilema guru online murid ngegas nilai rendah nilai latih ulang uji rendah tugas tidak ngumpul sabar tuhan
aiuchida,le sen grabfod mia ayam harga ribu saudara laki grabnya nganter pakai mobil
aiuchida,admin ada kirim pesan langsung tolong kindly periksa terimakasih anda
aiuchida,baik tanggap
aiuchida,ada modus tipu ngecal sok kenal dari suara sudah tidak kenal terus matin anda tidak panggil atau sms baik tipu
aiuchida,tidak dapat puasa
aiuchida,nyimak
aiuchida,beri anda berapa hacks untuk semua cari keluar di sana
aiuchida,ramah modus beda tipis jijik
aiuchida,anak
aiuchida,nempelin wallpaper yang amat butuh sabar
aiuchida,untung ajar tidak gin
aiuchida,lanjut klinik tidak tahu bayar pasien pakai
aiuchida,habis jadi banyak nyala saya kamar renovasi itu akan jadi nila itu akan buat ini boks bayi comfy sekali elus dada
aiuchida,anda produktif dorong pangkat
aiuchida,calon istri jaman sekarang bisa nukang
aiuchida,kira renov kamar mudah cepat kayak youtube oh
aiuchida,zonk
aiuchida,seminggu pasca renovasi kamar litak badan litak
aiuchida,anda punya tidak ide bagaimana banyak anda maksud untuk saya
aiuchida,sayang seseorang siapa tinggal dengan saya terimakasih anda untuk staying
aiuchida,butuh lewat cemil untuk nyeri berat lambung butuh beban pikir untuk nyeri fisik mental
aiuchida,game bel
aiuchida,sayang orang tolong tidak abai itu orang siapa sungguh cinta anda dan peduli untuk anda unconditionally ini adalah keras untuk temu seseorang siapa benar
aiuchida,lalu tahu semua butuh in saya hidup
aiuchida,kalau maag bagaimana opname coba rumah sakit
aiuchida,baru benda untuk tekan mati
aiuchida,ketika milik anda old hancur texting anda apa
aiuchida,lama libur saya game
aiuchida,currently installing saya old games goals tamatin game yang sudah bengkalai sibuk
aiuchida,anda marathon kdrama des
aiuchida,le pikir presentasi online besok poof muncul jerawat
aiuchida,hakim saya ketika anda baca sempurna
aiuchida,nyata akhir mes
aiuchida,tidak tega lihat positif dapat mes rezeki doa
aiuchida,cemil siang maag kumat ini penting mes
aiuchida,kasi orang yang tidak tinggal rumah bahkan mereka ingin mereka hanya tidak bisa
aiuchida,di least bisa buat baik dan bagi positif suasana
aiuchida,bikinin kopi sebentar pikir yang aneh kalau kasih yang segel
aiuchida,begitu cemil saya kasih saudara laki grabnya jajan yang rumah bubur instan kopi sachet aqua tidak foto begitu nerima semua bisa lihat sudah his senyum dan besar terimakasih anda
aiuchida,demi cari cemil jam gin kasi saudara laki grabnya
aiuchida,dan in itu akhir itu doesnt masalah meskipun orang masih pikir saya itu jahat bagaimana
aiuchida,saya sungguh hebat in making miscommunication in orang bicara dengan
aiuchida,dan tidak makan unfinish tasks problems apa bisa jadi lebih buruk
aiuchida,ketika milik anda gastritis datang in itu salah waktu
aiuchida,selesai desinfektan jalan hujan deras
aiuchida,dorong pangkat ros
aiuchida,masa diri karantina jam tidur tidak efektif normal jam sekarang jam
aiuchida,pukpuk
aiuchida,saya untuk saya kiddos
aiuchida,persegi adalah da terbaik
aiuchida,saya in cara acak tweet tidak penting sesuatu saya in cara acak baca baca acak orang tweets dan idgaf dekat tab
aiuchida,kenapa diam baca
aiuchida,tiket beli ya
aiuchida,baik benda comes untuk itu siapa tahu bagaimana untuk buat itu anda baca nila itu tunggu
aiuchida,tahap orthodontic dengan itu most co op sabar
aiuchida,darah adalah merah cyanosis adalah biru dapat tachycardia ketika pikir dari anda
aiuchida,satu dari banci senang hari
aiuchida,ajar dari alam ajar dari itu pro cc hendryrusdy nialubis rumah sakit mitra sejati
aiuchida,itu kapasitas dari ajar adalah hadiah itu mampu untuk ajar adalah ketrampilan dan itu rela untuk ajar adalah pilih ve telah ajar banyak dari drg gostryaldica anda sungguh ajar saya apa untuk
aiuchida,cinta bisa jadi obtained dengan perhati cared dengan sacrifice anda siapa selalu ingat itu komunikasi adalah itu cara untuk maintain cinta untuk tinggal waras in itu keras hidup
aiuchida,tahap lisan operasi dengan ayah sebagai itu sabar siapa tidak pernah sabar
aiuchida,pasuk fase lebih orang kapan menikah kapan lulus
aiuchida,operasi celah bibir langit langit mulut ft drg hendry rusdy sp banyak mau rumah sakit bhayangkara tk ii medan
aiuchida,anda baca nila itu tunggu
aiuchida,wishing anda senang dan kati days
aiuchida,syawal minus
aiuchida,syawal
aiuchida,tahap lisan obat
aiuchida,tahap periodontics fkg usu
aiuchida,matahari kissed dan sunflower
aiuchida,dec unofficially fkg usu
aiuchida,seni adalah bebas jadi able untuk tikung sesuatu most orang lihat sebagai lurus garis
aiuchida,sama chrie oreo
aiuchida,anda baca rumah dimana ini jantung adalah
aiuchida,ekspresi dikatain irithel menang kulit doang dude anda baca pergi untuk sesal itu
aiuchida,sekarang tahu itu cara lihat anda
aiuchida,belum debar cara scary
aiuchida,syawal dan
aiuchida,welcoming adulthood
aiuchida,arus suasana hati
aiuchida,reuni
aiuchida,semua dan lagi
aiuchida,surrounded dengan gembira assisted dengan legendaries dan epik combacks
aiuchida,butuh lagi daripada libur pantai pandan sibolga
aiuchida,itu sunah jumat malam tim panjang
aiuchida,hari akhir hari in bagan kota dan ini adalah saya akhir candi
aiuchida,hari exploring bagan kota unjung berapa temples yaitu tidak
aiuchida,hari exploring chauk htet gyi klenteng itu reclining budha
aiuchida,hari exploring shwedagon klenteng karaweik aula dan kandawgyi
aiuchida,hari favourite makan sejak moved dari dimana tinggal dan didnt pergi banyak akan pos saya
aiuchida,hari exploring st mary katedral itu mahabandula taman dan bogyoke aung san pasar dapat
aiuchida,hari dapat sempat untuk unjung sule klenteng yangon myanmar sule klenteng
aiuchida,patah hati
aiuchida,lihat anda ketika anda lihat saya
aiuchida,lihat anda ketika anda lihat saya
aiuchida,itu hadap ketika lihat anda makan
aiuchida,pergi disko grup diskusi kelompok picu grup picu
aiuchida,usu panah buka universitas sumatera utara
aiuchida,kelas stambuk tahun dan masih counting
aiuchida,kn pasu laburaq
aiuchida,tambah video untuk daftar putar brushing dengan kawat gigi bagaimana untuk sikat gigi
aiuchida,november suluh sehat gigi mulut sikat
aiuchida,ukm panah atc usu proudly saji usu panah buka
aiuchida,di sana akan jadi waktu ketika anda harus agar pergi karena itu has rencana
aiuchida,saudara laki kecil sampai besar fkg usu
aiuchida,tim hore maaf yang tidak tanda sudah batas
aiuchida,bringing itu bagi dari itu aek natas labura
aiuchida,kamis jumat agustus akhir hari akhir malam ini adalah telah
aiuchida,rabu jumat agustus perlomban agustus edisi
aiuchida,suka video hitung mundur asi games
aiuchida,senin rabu agustus punya anda tahun ed sdn terang dusun terang
aiuchida,minggu agustus ketika anda baca in cinta dengan itu lihat bagi dusun terang
aiuchida,rabu jumat agustus ajar suluh sehat sdn kongsi enam
aiuchida,senin juli pemeriksan sehat gratis kerjasama
aiuchida,sabtu agustus went kembali lagi balik truk
aiuchida,kamis juli suluh cuci tangan pakai sabun admin
aiuchida,rabu juli ketika anda baca in cinta dengan itu lihat dusun
aiuchida,total jelajah jl mwl anda aek natas labuh batu utara aek
aiuchida,suluh sehat gigi mulut admin terang camat
aiuchida,suluh sehat gigi mulut admin terang camat
aiuchida,kn tim labuh batu utara aek natas labura
aiuchida,sibolga kota sibolga
aiuchida,khas sarap nyala hari mati anggap masih suasana lebar an
aiuchida,bapak angels
aiuchida,eid mubarak syawal
aiuchida,kelas lekuk mates ballroom istana koki
aiuchida,iya tuhan saya jadi maaf bang harap anda semua itu terbaik may anda punya hebat hidup
aiuchida,satu dari saya terbaik hari dengan buket dengan jenis dari flowers stands untuk days in minggu cozy warm
aiuchida,terimakasih untuk selalu ingat saya ulang tahun bang
aiuchida,tidak lengkap saling lengkap
aiuchida,kondangan orang hitz jaman sama tawa
aiuchida,pendek tapi counted
aiuchida,turned pada saya waifu popuri dari panen bulan kembali untuk alam
aiuchida,saya stunning dengan tears penuh denture
aiuchida,bonding dengan saudara wanita tapi beda spesies
aiuchida,witing tresno jalar soko kulino
aiuchida,prosto laboratorium dengan siti wahyuni drg mdsc
aiuchida,gtc jembatan
aiuchida,ketemu baibai
aiuchida,biadab tanpa batas cc yuri saya aykmts
aiuchida,ketika itu brighter daripada milik anda masa depan
aiuchida,ketika anda tidak bisa jadi itu centre dari itu cahaya anda bisa masih jadi itu bagi dari itu
aiuchida,prosthodontic satu uji laboratorium dental fkg usu
aiuchida,suka video apa happens during jantung serang krishna sudhir
aiuchida,judul picu bunyi klik saat cemil pasien perempuan umur tahun
aiuchida,origami cinta surat pst selipin nama saudara laki ya kantongin hati
aiuchida,sidik jari lukis created oleh saya recalling saya old ketrampilan s kalau unidentified kasih
aiuchida,anda bisa jadi itu sweetest orang tapi di sana akan selalu orang siapa benci anda tidak masalah bagaimana baik
aiuchida,dunia tanpa orang asing itu regale internasional konvensi centre
aiuchida,satu dari saya terbaik sahabat yaitu adalah cara juga rumit untuk gambar hanya seperti saya mungkin itu kenapa saya fit
aiuchida,rumah buat utama kucing
aiuchida,culik saudara
