username,tweet
elidoff,ukur kosakata bahasa indonesia bagaimana anda
elidoff,radiohead nirvana warna merah muda floyd metalica ratu
elidoff,panasin kebab beku lemah kelelawar iman
elidoff,dekat rumah ketangkep dese nyamar tukang kebab
elidoff,tuhan ngepit ngetutke bendi seko kobar sampai manah
elidoff,iya untuk dulu manah flyover pulang nyebrang rel agas
elidoff,hitam sabbath
elidoff,terpotek baca repliesnya ajar kalau bicara tidak waton njeplak
elidoff,yakale buat teliti terus obat minyak kayu putih
elidoff,tetap simpan sampai pakai itu percik gembira
elidoff,tidak masuk hati omong bodoh mau bicara tapi yang ini buat sakit hati
elidoff,dari mulut
elidoff,ken peluk aurel
elidoff,anda juara edit raisa
elidoff,sik
elidoff,kayak tidak iya
elidoff,es teh soto gading solo
elidoff,semoga samawa sampai besok tren tema
elidoff,maaf buka tidak empati ini humoris sekali
elidoff,saudara pop tidak mode polisi yang oke pakai sampai makeupnya
elidoff,sesal lihat sampai kayak lee wok orang asing dari neraka
elidoff,tim ular tim rusa
elidoff,syukur saudara wanita sampai lega itu motor rezeki sampai milik selamat tidak in sama rampok
elidoff,kenapa
elidoff,sih user model kayak gin
elidoff,kecil disounding kalau mie kerupuk tidak gizi
elidoff,jawa sobat pergi ke gym saya chinese trainernya arab
elidoff,paman dolit
elidoff,baca tidur sampai saat antre
elidoff,mau tanya juga
elidoff,ngopo ngetag
elidoff,saudara nova cantik ngetwit saya
elidoff,kalau pasar saya baca jual balas testimoni bahasa rude saya badan tidak beli
elidoff,suka sekali benang rumah warm sampai homey
elidoff,suka sekali sampai ikut instagram
elidoff,gayeng
elidoff,balurin badan
elidoff,nenek malas buat boreh saja
elidoff,baik lantai pel air tetes minyak sereh nyamuk mingat
elidoff,asep pentol kayak efek panggung
elidoff,tidak tom holand ji chang wok agar balas
elidoff,dapat itu warna anda fit most adalah biru nyala apa warna adalah milik anda soulmark
elidoff,hansol dapat murung dan sekarang hanya tahu itu minimalist tested positif untuk corona
elidoff,kalau sedih tinggal miring baca tenane
elidoff,kayak artes
elidoff,ngango gagang sendok garpu dadi mudah
elidoff,nenek itu nenek
elidoff,balas sesuai aplikasi bos
elidoff,ken renang
elidoff,juga suka toped belanja browser pakai kode promosi sopi mesti pasang sudah malas duluan
elidoff,enid bylton baca tidak henti tamat rela ngabisin uang saku nyewa buku buku
elidoff,masak cuci piring tidak jahit tidak kenapa apa baik bisa tonton film dulu
elidoff,java basuki padang mbulan
elidoff,tahu kalau manfatnya sekali kalau muria suka beli sampai nyemilin
elidoff,itu tidak baru sampai tidak normal either
elidoff,pusing
elidoff,tidak
elidoff,hempas lagi
elidoff,padahal berat kilogram latih gym kurus kurus obesitas
elidoff,tuhan sekali tahun
elidoff,kali nilapke anak anak bukber akan agar nilapke halal bihalal dsj iya tuhan ini buat saya jadi gelisah
elidoff,kail
elidoff,edano
elidoff,masih di tab suka baru saja lihat isi puji kasi
elidoff,tiba pikir keluarga duaransel pandemi mana mereka nomaden harap mereka adalah aman
elidoff,sekali kalau cemil solo nyanyi sak piring isine pating tlekenik
elidoff,ikut waikiki terus tidak sabar tunggu episode saya tonton musim nyata lucu
elidoff,tidak baik rangin minum manis lebih mudah
elidoff,bang iwan fals adalah sumber derit
elidoff,sudah idul fitri tidak beli baju lebaran
elidoff,pusing sekali sampai muntah pikir orang solo
elidoff,bagaimana memberi tahu orang rumah tidak buka rumah
elidoff,kemarin lihat rumah mt selamat idul fitri yang ngetwit
elidoff,bahkan masak doesn percik gembira anymore
elidoff,lantai
elidoff,untunge kancaku cedak raneng nyanyi covidiot
elidoff,pandemi pantau adan teman teman solo status whatsapp tapi henti pertama khawatir sekali lama pusing cuy lihat masih kumpul kumpul tidak masker
elidoff,tanjung harus topi topi
elidoff,benar ini ingat
elidoff,ra mudik rapopo
elidoff,terimakasih
elidoff,pasien moewardi yang corona itu ikut seminar riba bogor nenek dekat rumah gugus gowa mudik jakarta aduh
elidoff,pantau status teman teman tetangga buat ubyek rewang mogleng mogleng ra buat masker saudara wanita apa solo bebas corona
elidoff,ayo tvri tayangin atau buat ulang acara
elidoff,peniti jarum pentul
elidoff,dulu tidak inap vila muara sungai maron pacitan pantai ngiroboyo
elidoff,pastel isi bihun saya syok sekali tidak cemil solo tidak yang nipu kayak begitu
elidoff,kainya sejuk mana saudara
elidoff,konser slipknot asia dibatalin mereka nyanyi masker
elidoff,sih jabat jabat pada nyanyi
elidoff,bola sudah
elidoff,cantik sekali cocok pakai baju dayak kalau bola sudah belum
elidoff,teman tinggal jerman sana presidenya ilmuwan semua kebijakanya dasar ilmu kumpul kumpul dari saja denda euro
elidoff,buat syok nam jo hyuk sampai lee ji hon
elidoff,tawa
elidoff,ownernya saudara iya
elidoff,adalah itu mangga
elidoff,buka tabung kan sudah xpresi yak
elidoff,dan tidak apa apa else matters
elidoff,novel permen permen sampai komik jepang sebut
elidoff,grafik bhutan unik
elidoff,saya identitas revealed
elidoff,template makernya saya ketinggalan
elidoff,benci sekali laki model celaka budak
elidoff,kalau solo popeye ayam laki ya
elidoff,itu dunia dari meni
elidoff,sabun bilas ulang
elidoff,lewat hidup
elidoff,buat ramadhan ya tuhan ilah hamba tenang lapang hati
elidoff,mereka adalah hanya envy dia haters akan jadi benci
elidoff,dulu tidak gofod
elidoff,malas saudara wanita saudara wanita ning notosuman saja ditatake
elidoff,gong ayo ketawa sampai nang ini
elidoff,rindu mendengarkan umum kayak gin argo lawu argo dwipanga
elidoff,oo cakep saudara warna bingung ini rambut sudah buluk ombre
elidoff,saudara ngecat rambut pakai merk
elidoff,lah agar penjara
elidoff,pilih
elidoff,oo begitu oke terimakasih info
elidoff,gambar navi maksutnya
elidoff,ngepoin gamis gamis ini harus po
elidoff,musik keras pun apalagi lagi bersih bersih sampai beberes saya tidak pakai narkoba
elidoff,benar sekali blender juicer setrika philipsku awet cuma nasi cooker yang rusak bawa layan centernya solo waktu tidak bayar masih garansi syukur fungsi normal sampai
elidoff,tidak mudik
elidoff,siap saudara baca artikel pakai keyword
elidoff,cantik sekali link selendang dong saudara terimakasih
elidoff,threnager sih
elidoff,sesuai abjad
elidoff,saudara wanita sekali konten simbah sampai putune
elidoff,irfan khan dies umur
elidoff,terimakasih hoq
elidoff,sang waktu selalu kejar kesana
elidoff,oiya sudah terimakasih semoga selesai
elidoff,tumben stickernya tidak foto
elidoff,klaten tonton kdrama
elidoff,bantu retweet saudara laki maturnuwun
elidoff,kenapa
elidoff,sih ngebayangin sudah geli ini narsis bagaimana
elidoff,pacar tiru bagaimana
elidoff,ikut pagernya gembok
elidoff,ibu smi jk ibu sus ahok tidak
elidoff,untung missed panggil coba angkat terus logat tidak melayu anak terpotek
elidoff,coba nanem saudara sebentar kalau cemil hasil panen lahap
elidoff,saudara
elidoff,es krim njonja saja
elidoff,kayak memang sengaja
elidoff,both
elidoff,mbaku sekali
elidoff,buat emoji shalihahku
elidoff,ada corona saudara ipar laki yang jatah belanja ini salah daftar belanja
elidoff,pusing uka tidak bedain dentum tanah gemuruh langit
elidoff,suara ya itu baru saja
elidoff,kenapa cerita masih kayak begitu deh repliesnya
elidoff,tidak tahu mungkin jerome paham begini
elidoff,anda harus panggil milik anda ibu nasi cooker saudara laki
elidoff,rawon kuning
elidoff,gempa
elidoff,kayak cabuk rambak tawa
elidoff,jejer
elidoff,solusi renang lagi corona
elidoff,sudah dari saudara mancing panen madu dulu
elidoff,ikan kalau pedas pakai sambal mobil tambah nasi
elidoff,juga heran selow ambil sampai pakai barang orang lain tidak bilang tidak tidak pakai bukan alasan ambil bagaimana mindset
elidoff,ken tapi foto foto di solo
elidoff,jon ki bangke
elidoff,benci sekali masih benci
elidoff,kutuk anda
elidoff,susah jadi stoic bisa tingkat senyum in nyata hidup marah twitter
elidoff,dadi ngelu
elidoff,sedih sampai marah sekali baca pasang teman lega malah dimakamin tempat bagus makam keluarga pahlawan dari karyadi
elidoff,warung dekat kostrad ribu biji
elidoff,raksasa tole iskandar
elidoff,waktu desember tidak sabar ganti tahun agar tanggal merah lah merah hitam saja libur
elidoff,balas ne marah ngekek
elidoff,paling nista moto maling
elidoff,tonton selamat datang untuk waikiki saudara pop sorak atas milik anda hari
elidoff,bayang jama tarawih rumah dengan bacan surat sama hari
elidoff,belum pindah yagh besok tidak tarawih masjid fatimah solo sudah pindah yagh tidak tarawih jama di depok
