username,tweet
tramadanur,semangat nona kuliah
tramadanur,ps mini sampai dreamcast mini
tramadanur,ragu sinetron awal neraka artis jadi hianat tonton buta tidak saat sampai namun saja lestari oleh orang bayar sampai rating nielsen tidak rata serampang
tramadanur,dukung gera sama anti seragam
tramadanur,pakai seragam sesuai sop kecuali usaha pasar tradisional wiraswasta
tramadanur,versi setia font dampak judul pakai xy kids hingga tengah
tramadanur,rindu kompas televisi dulu tidak masih kuis helmy yahya ilmu adalah senang sayang ini ubah ke televisi penuh berita semua saya butuh adalah yang lain dimensi
tramadanur,spongebob baik pindah trans televisi sana buktin nayanginya tidak potong pindah kayak gtv sensor tapi rusak cerita potong adegan nyanyi asal pindah episode baru jalan
tramadanur,mnctv upin ipin kiko sisa antara jaman adit siapa jarwo doyok otoy ali oncom riska sampai gembul
tramadanur,aylebensu ayam oles ruben onsu
tramadanur,samarinda
tramadanur,wib lahir kembali host ridwan remin semoga
tramadanur,cuci tunjuk selamat bengu iflix
tramadanur,ini anda besok celine lusa neona asyikin walau ultang tahun kala merana
tramadanur,sudah
tramadanur,segar
tramadanur,yang laku untuk mariposa anga yunanda utama yoriko angeline film bawah umur pasang kasih walau bioskop buka batas sosial sampai kapasitas tidak tonton mariposa
tramadanur,peran sandrina ganti nicole ros tidak balap tidak apa apa clarice cutie utama film stefi zamora syuting film selesai saya tidak tonton dapat outta disini
tramadanur,masih percaya film drama romansa iman based menung didramatisir tetap realistis sampai logis
tramadanur,remaja gereja anak sekolah minggu mau buat ajak nobar film religi iman based movies yang butuh cerah hidup
tramadanur,satu adegan brit robertson yakin rencana putar dua cocok tidak tonton bioskop sudah buka rusak berat kj dari serial riverdale ken cari film rom com fantasi beda mau tonton film isi bahagia
tramadanur,alas logis nama film religi alias iman based movies kj sampai brit robertson sama sukses peran tokoh versi mahasiswa maupun saat suami istri bedan keren terlalu kana tidak pasutri
tramadanur,satu putar jabar turut orang rada tebak sering jinak film jenis ubah ala five kaki apart rencana putar film memang rada didramatisir tidak ke taraf mua sudah tanam
tramadanur,la la tanah romantis sampai libat planetarium bintang angkasa film jalan kasih dari firman tuhan papar subtil di bagi ada mengurui agak kayak cari hilal begitu bukti begitu modul
tramadanur,kisah hubung tidak bayang ada jean luc nathan parsons itu originals sampai roswel baru mexico yang teman akrab melisa inti awal akan ira ini film musik beri bumbu bumbu ala
tramadanur,maklum belum tahu sosok asli belum cerita saat jeremy kamp kuliah buah universitas alabama saat unjuk bakat panggung temu melisa beri semangat kagum kagum tampil jeremy itu
tramadanur,angkat kisah jeremy kamp nyanyi rohani telur album kenal gitar kj riverdale brit robertson scre itu ruang between kita tomorowland peran melisa kamp sukses saya saat menontonya
tramadanur,kupas film romawi karantina pak masih percaya film romantis penuh mukjizat putar dramatis fantasi fantastis
tramadanur,fine hari ini biterlove superstar
tramadanur,hilang misan nama
tramadanur,juara pantang mundur
tramadanur,beda modal
tramadanur,xy kids mereka baca pantas an online hanya comeback di samping gadis majalah
tramadanur,celine juga saya alami saat sudah bisa belakang konyol celine personil switins sering bilang jimin
tramadanur,dia alih alih kirmizi johanson ariana grande uma thurman utama media pakai majalah
tramadanur,ini meikarta putar john sumbu tempat aneh dana habis iklan televisi saban sih baik dana izin nobar publik
tramadanur,bedan dasar nyanyi drama musikal nyanyi solo atas panggung megah saat
tramadanur,yang ditayangin film impor prestasi contoh itu gentlemen turun turun midsomar
tramadanur,budgetnya sudah habis iklan meikarta televisi
tramadanur,suwer ada kayak
tramadanur,tidak pindah meikarta pembangunanya kayak begitu iklanya doang asik
tramadanur,saat saya tonton buku kalau saya tidak halang halang orangtuaku
tramadanur,kapok kerjasama artis inisial suwer biarpun bioskop buka saya tidak tonton mariposa
tramadanur,pst tidak kelakuanya kayak puput dwi sasono diam diam hanyut tangkap polisi
tramadanur,celine maisha yang yang dapat istri
tramadanur,sejak detik beli ct berita berita banyak artis inisial yang sudut artis cilik inisial na
tramadanur,tapi sebagai thomas mclaire sampai penuh celine di dia photoshot untuk an tween gadis majalah
tramadanur,lupa nambahin film blockbuster kecuali tahun abad sony pictures sampai disney sampai tidak indonesia serial eksklusif non netflix sesuai target marketnya muda dewasa film indonesia banding streaming layan terlalu dikit
tramadanur,tunjuk film pcm segrande la la tanah sampai knives keluar sampai yang kayak mangsa siberia sampai helboy lsf super censored potong omong omong film ngikut sensor lsf ada film prestasi cbi tidak sih
tramadanur,pakai mantel tembus pandang tidak virus
tramadanur,minggu ada tunggu switins undang bagas difa
tramadanur,film holywod rubah movies harus hubung id mnc lihat mnc main lihat hingga keluar serial banyak sinetron tayang televisi grup hingga tarik
tramadanur,picion pelus film film mnc pictures tidak perbarui perbarui atas untuk mahasiswi doang nama cinta timeframenya siap rilis film dikit ada sih film korea tvn ada juga di layan jenis lanjut
tramadanur,grup belah film banyak gundala ada lebih laris ketimbang picion pelus
tramadanur,mie tebal sampai gurih juga apalagi kasih saos bahagia samarinda
tramadanur,mie goreng goreng pinggir jalan koki juga masak nasi goreng mie tebal kecap ada rasa nikmat mie instan
tramadanur,baik versi permen lolipop
tramadanur,sayang belum cakup pustaka goplay genflix hbo pergi sampai vidio perdana menteri
tramadanur,la la tanah john sumbu lawak
tramadanur,shopee kepincut vocer catchplay lebih murah dikit harga toped buat beli saldo tix dua jarang pakai tapi
tramadanur,keburu marini belum iblis jemput butuh uang kayak baginda nic kandang
tramadanur,kursi hijau loket kursi pakai ruang tunggu halte busway leta kerucut tidak sesuai harus samping pintu jaga loket tidak terobos motor parkir jalan halte untuk
tramadanur,omong omong ndgj tayang resmi hoq bangkrut tayangin marlina kafir sekutu setan sampai ambil alih distribusi mekah saya datang sampai habibie ainun kuasa film visinema iflix masuk egnoid sampai bridezila
tramadanur,alih alih london cinta cerita sampai milea surat cinta starla sampai jailangkung baik netflix id cepat tayang film sif hitmaker antologi rumah kentang itu awal dulu beli hak edar film naura genk juara sampai doremi sampai anda
tramadanur,boom boom dar
tramadanur,mantap ini berita dengan tanda yoriko angeline dipublish maret berita dengan tanda naura dipublish januari pro yoriko angeline
tramadanur,lempar itu uang untuk greening ini senjata rather daripada making lagi omong kosong nyata stories
tramadanur,doremi sampai anda lari pantai kita cerita hari
tramadanur,naura yoriko angeline
tramadanur,juga berita iring opini tidak putar psb jokowi resmi pusat perbelanjan juga untung artis inisial
tramadanur,rada ini iya mekah saya datang
tramadanur,gopay
tramadanur,lyodra bakat kecil mengunakanya baik benar dia rata rata kemampuanya
tramadanur,saya di saudara
tramadanur,ganti satin keras sekali tidak kayak premiere xxi bisa periksa ktp pasti alamat rumah
tramadanur,mbah dukun baca mantra aji jelangkung gentayang terusin
tramadanur,lihat judul doang
tramadanur,judul ganti
tramadanur,ziarah bapak
tramadanur,sampai mei mnctv instagram andranindraswari salah budak cinta
tramadanur,catchplay tambah sedia opsi pv sayang film indonesia rada dikit
tramadanur,anyone bisa buat itu tuan
tramadanur,film bagus pilih sampai dengan ajak memaksakanya tonton jumanji baru tonton beku sampai doraemon orang orang tonton danur tonton detik orang orang tonton aladin tonton turun angsa
tramadanur,hayrspray
tramadanur,zwitins kayak merk bedak lebih keren tenebelie belie arti khianat ingkar chevrybele
tramadanur,semoga tidak benar tidak benar buka bisa itu contoh departemen toko orang masuk jika bukti mereka tempat tinggal tiket kotak modifikasi hingga terima bayar uang elektronik kartu kredit isi
tramadanur,menang giveaway pergi bayar akan pakai beli buku majalah gramdig sampai sewa film catchplay wml
tramadanur,bwgu edisi sudah terbit kemarin agar tidak mati gaya saat videocal silakan coba gaya pilih rasi foto instagram mei itu juga tips rindu tidak mudik
tramadanur,waktu indonesia pikir bukan
tramadanur,saya intai premis tarik agar beda taman kanak-kanak polisi celaka saja lumayan quick popcorn flick
tramadanur,cocok tidak tonton bioskop sudah buka rusak dave bautista popcorn tindak film seekers mau cari film ala itu pacifier taman kanak-kanak polisi ide segar cari film tindak serius
tramadanur,itu beberapa dialog muka masih taraf hibur lagi selesai bermingu sempat nulisnya maaf banyak salah lupa
tramadanur,tengah film ada kendur fokus giat sang anak tani agen di sampai dengan namun adegan tidak beri kesan tegang sayang cgi saja rada faktor nyaru
tramadanur,kita sulit ke karakter kate porsi padahal utama peran pada cerita bagai yang jelas ia kerja luar omong omong sudah selesai tonton waktu sekarang sempat tulis
tramadanur,sekuens aksi awal penuh lambat gera mana arah film jalan tokoh sophie sini cerita anak terlalu overprotektif orangtuanya hingga tidak bebas tara teman topik sampai rundung sekolah
tramadanur,rencana menang marquez greg bryk bawa lari istri kate agen sampai sophie bawa keliling tualang seru penuh aksi komedi ambil sedikit campy saya intai sukses film hibur rumus rumus
tramadanur,transaksi agen sama agen bobi kristen schal tugas atasanya david kim kim jeong selidik sophie chloe coleman anak kate parisa fitz henley usia tahun baru pindah chicago itu paksa karena
tramadanur,agen dave bautista tugas cia selidik transaksi plutonium ilegal ukraina laku jenderal rusia gregovich vieslav kristyan orang teroris timur tengah nama hasan basel daoud dapat info lanjut
tramadanur,kupas film romawi edisi newest pos karantina pak saya intai itu pacifier padu taman kanak-kanak polisi lebih tindak
tramadanur,esilaturahmi kirim cemil saja fitur ganti lokasi
tramadanur,paling kiri buka tootsies sampai itu palsu thailand
tramadanur,gramedia digital ribu pakai gopay
tramadanur,sarung tangan putih
tramadanur,imut imut
tramadanur,iflix buat tidak tonton film indonesia bagus sembunyi gem ada sana konten sokong rada lebih parah banding hoq akhir hayat
tramadanur,buruk jenius doang
tramadanur,nyi misni sudah tua tetap buruk ss gila akting konon oma christine hakim awal dingin peran nyi misni gila sampai sakti
tramadanur,tentu beda coba coba belum
tramadanur,titip buat ken siapa model
tramadanur,bisa tidur nyenyak tahu model kemas dancow fortigro yang sering minum nama aurelia syahira
tramadanur,waktu indonesia pikir
tramadanur,hastag henti konser unfaedah turns keluar hanya goreng politik oposisi belaka konser rumah jenis diselengarakan pihak tidak masalah kecuali masih yang nekat konser sampai tarik baru masalah
tramadanur,swedia
tramadanur,benar orang ubah ego masing tinggal bagaimana menemukanya
tramadanur,film wb duo weinstein urus animasi suara lempar buruk cerita tidak spesial ngelihat replyanya harus tangkap itu
tramadanur,inti grite agatha saja kayak topik tidak tingkat
tramadanur,perlu industri belum pesat minimal kolosal sultan agung itu rada sulit alir fantasi sih abracadabra tidak bangun semesta luas
tramadanur,ada
tramadanur,oki sampai nirmala di itu wonderland oki sampai nirmala di itu wonderland pangeran polux oki sampai nirmala di itu wonderland itu baru adventures naga ungu bobumba bagi bagi layak tak batas perang endgame
tramadanur,minus gadis model buru tentu
tramadanur,alas ken tonton ptj pergi main ken rasa detil detil film kembali nikmat nuansa serama
tramadanur,begadang
tramadanur,kira diri akhir agar rasa ptj mulai mei tidak lupa ya natasha bentar di pergi main cantik boys mau di instagram bisa
tramadanur,pos indonesia adalah da terbaik
tramadanur,jejelogy game cine boks bayi itu malas monday
tramadanur,kecuali kuras film kinosaurus indiskop gas saya punya motor
tramadanur,trans televisi film bagus sensoranya iklanya mengangu cerita nama saudara
tramadanur,kalau bahan bercandan yang kayak begitu iblis iblis bingung tonton kelinci bungkus avatar potong film saat klimaks homeshoping dcdc malah ngebecandain yang salah
tramadanur,ada email kata kirim gtv film tiba ganti acara musik sunda tidak gubris
tramadanur,mau tanya makananya cherybele makananya elovi
tramadanur,kfc dvd mcd tidak
tramadanur,periksa toko belah periksa toko shuttlecock cerita hari nanti kita tarkam bulutangkis ya saya setan saya pel pelan
tramadanur,rumah kentang itu awal tayang netflix jamin kocan ngantuk siang
tramadanur,yakin poster resmi beda soal hanya exclusive masih photos
tramadanur,malas tonton belum dengan tualang sherina buat poster materi promosi film bebas lebih wakil versi asli
tramadanur,gopay
tramadanur,benda angkasa selalu saat lebaran astoroid
tramadanur,ganti ola warna beda
tramadanur,ken beli pacar model angkat tidak boleh ibu gara gara majalah gadis
tramadanur,xy kids majalah semua jenis kelamin cuma bahasa utama pria olahraga game komik animasi acara televisi ngebahas suka gadis tidak gadis majalah gadis
tramadanur,tul sekali
tramadanur,bisik iblis cine boks bayi belum iblis jemput film md
tramadanur,teror anak sekolah gentayang anak mata batin sampai kutuk isi anak panti asuh pocong itu asal tidak ada anak anak itu
tramadanur,bahasa putar utama film game animasi begitu rada funky zamanya
tramadanur,tandain
tramadanur,hewan hewan yang kritik bangun tetap asyik katak syarif
tramadanur,rencana putar hastag politik baik kerja
tramadanur,kejut siti
tramadanur,ajak tonton sih
tramadanur,saya sudah muak akun kucing kucing kata akun film malah nyerempet perintah baik ganti nama adminya begitu
tramadanur,sayang hibur spirirual terus waktu indonesia canda jadi kompilasi ngebecandain privasi sampai jawab tanya durasi yang terlalu bisa jadi benang
tramadanur,langsung instagram nanti ikut seluk beluk alumni gadis model buru riah gadsam siapa kalau atalia bunga sampai andra nindraswari saksi sore jam wib instagram teatercahaya cc
tramadanur,majalah pernah bel
tramadanur,tangan sanitizer fans buah pita antis kamtis
tramadanur,ken tonton saya generasi lho masih maju mundur
tramadanur,roh fasik lagi naik bis tengah malam rumah setan film eksklusif bioskop belah
tramadanur,naura rainagumay maishakana lili quenb ney neo janecalista
tramadanur,kelly gang begitu ekstraksi
tramadanur,yaelah andai bisa buru majalah gadis bekas tahu
tramadanur,mekanik mesin majalah multimedia karyawan paruh waktu usaha keluarga sisa buat artikel di fanzine minggu
tramadanur,anak lari saya ibu pulang ada tentara sampai pesawat perwira ksatria cuplikanya rada kecil hilang sinar matahari maskot poster bar pakai baju hitam itu professionals
tramadanur,revisi font artikel humanist
tramadanur,artis suka pamer ditanyain teman gantung gin
tramadanur,jika anda lihat ini tweet kutip itu dengan pictures itu buka milik anda rasa in wanita
tramadanur,yang lain ersa walikota efek
tramadanur,konspirasi elite global televisi nyata
tramadanur,vod batas lepas sabun mandi opera kelas
tramadanur,malah celine switins lho jarang aktif twitter instagram
tramadanur,celine jakarta tani sahur
tramadanur,bukan mantan pacar teman sahur
tramadanur,baik tonton dogal hoodwinked lari diri dari planet bumi
tramadanur,kelam kompas mesti kompres semoga lentera modal indonesia selamat aset milik kompas alhasil tribun kompascom kompas id kompas televisi sampai koran kompas lebur satu pula aset majalah eks majalah
tramadanur,elite global film suka potong senak ngerusak cerita tidak klimaks ganti acara musik sunda acara belanja ditulisin avatar ditayangin kelinci ajar
tramadanur,salah sering dengar puas sekali mendengarkan ersa walikota nyanyi situ
tramadanur,harum mantap lezat palmia margarine kue lembut harum nikmat palmia margarine aroma harum keluarga bahagia terimakasih ibu palmia margarine
tramadanur,keren dar debat mudik lawan pulang desa
tramadanur,ersa walikota efek
tramadanur,harum mantap lezat
tramadanur,gara gara dinyanyin ersa walikota lumayan daripada tidak hibur tidak buka qolbu beda renung jenak ramadan kenapa kuis tidak variatif
tramadanur,masakan kejut
tramadanur,majalah tani kecil biasa dan jawab loakin
tramadanur,liput aice detikcom yoriko angeline
tramadanur,brand mode anak cita cita polisi hakim adil
tramadanur,ada membedakanya kawan jadi cewekbanget situs web sama tribun gadis sempat nerbitin annual edisi covernya andra eks gadis model buru situs web lebih jaga ketimbang cewekbanget
tramadanur,gadis gadis
tramadanur,saya pribadi favorit bwgu isu itu solely made dan iya andra punya an twitter rekening belongs untuk
tramadanur,salah ayahbunda
tramadanur,gosip tidak meng pesan langsung idola hingga seperti itu
tramadanur,dan maksud celine switins
tramadanur,coz swiping kiri benar ganti halaman buku untuk saya
tramadanur,saya pakai media instagram buat aju photoshop resolusi atau itu dimodif halaman mau halaman bisa belah pakai aplikasi photoscape pc hanya
tramadanur,kemarin sampai sobat ambyar rilis sama bioskop jamin sedih ingat lipat ganda waris ada tetap abadi bagai wujud lain
tramadanur,surga lagi butuh pangungnya lupa bassist dewa beberapa lalu mati semoga tenang sana surga di bawah langit tunggu semua istirahat in damai sampai kuasa
