username,tweet
heyhestyy,tidak panen bulan yak
heyhestyy,kenapasih reza rahardian paripurna tampan sementara mau nang lihat
heyhestyy,tidak retweet lelah
heyhestyy,varshow tunggu tunggu
heyhestyy,polaroid saja kalau gagal sayang sekali film refill mahal ngets
heyhestyy,cesa minyak saya hilang panik beli set yang demam turun imun dorong
heyhestyy,ini
heyhestyy,kenapasih saudara laki agung
heyhestyy,gercep webhunt malam ckckck
heyhestyy,saudara laki haneul oke sekali kalau second pimpin pacar total pantas dapat baeksang
heyhestyy,comeback
heyhestyy,kayak tunggu ribu purnama agar dapat kayak tunggu kompas dapat edan lokal bangga
heyhestyy,ibu ibu webhunt itaherl tadi malam jari gercep sih menit sudah jual keluar
heyhestyy,sudah kerja di rumah buat jadwal kenapa pusing ya
heyhestyy,saudara laki agung saudara laki agung
heyhestyy,emas kunyit jahe latte tidak
heyhestyy,sudah suka mendengarkan twice sampai masih suka salah beda momo mina saraf sudah putus kayak
heyhestyy,saya cari episode belum baru intro sudah kaca kaca
heyhestyy,saya juga
heyhestyy,teman instagram sudah perbarui ngumpul lapmer nongkrong kafe cemil restoran pikir
heyhestyy,ampun gemas
heyhestyy,masker anak humoris humoris mau beli buat zafran dipakein mobil ngamuk
heyhestyy,web buru atau instagram buru makim susah sejak corona yang rumah makin saing telat detik habis
heyhestyy,sejak zafran tas cantik sudah tidak harus bawa tas bayi isi ini kecuali masker disinfektan semprot tisu basah burit tisu basah tangan muka popok
heyhestyy,tasya farasya sesal tidak kalau lihat
heyhestyy,mainanya zafran
heyhestyy,pakai ip apaqah sangka seperti gengsi
heyhestyy,nerf diskon sekali heboh gema anak paham
heyhestyy,selamat di wilayah indonesia gtm tangis
heyhestyy,mangats mie demam bayi obat asi doang ya ibuknya kuat
heyhestyy,asi dorong mantap ibu
heyhestyy,mie zafran begitu seminggu rumah demam tinggi turun ke ugd posisi dbf belum benar saya ajar pelekat via youtube
heyhestyy,minum asi dedek bayi ibuknya minum air putih cemil sayur sehat yak dedek sheva
heyhestyy,ampun kucing itu anteng ketimbang zafran tidak dimandin
heyhestyy,ampun minho paripurna sekali
heyhestyy,buah capai baju yudisium pg pakai kemarin kemarin tidak kancing
heyhestyy,di komplek rumah ini sepi sekali syukur rumah padahal kalau lebaran ramai sekali semoga sehat ya semua
heyhestyy,ampun seperti sih rasa hidung rasa ngap ngapan
heyhestyy,prinsip itu film rindu tonton film liam neson tawa
heyhestyy,jadi ucap
heyhestyy,rindu tonton filmya cn
heyhestyy,minesweeper in nyata hidup
heyhestyy,siap celaka hati waktu imiy
heyhestyy,tampan cepat besar sehat
heyhestyy,sudah begitu anak imut bow hampir nutupin kepala
heyhestyy,whatsapp admin muncul
heyhestyy,jojo siwa peran model murid preschool
heyhestyy,capai ini sirbal shopee tanam tawar lelang giveaway lomba foto mamy pokok
heyhestyy,ken beli masker lucuk di endorse yutuber drama kemarin eh malas saya itu
heyhestyy,bosan saya perbarui schology ya
heyhestyy,biasa belanja pakai moselo kesal bats lola sekali
heyhestyy,jam gin tidur jam harus bangun sahur lelah
heyhestyy,lebih hati hati ya ada oknum jual nakal
heyhestyy,betul kalau jual trusted insya tidak ayah ya
heyhestyy,aduh serius kemarin sempat beli tic tic kilo begitu tidak karena tidak habis pikir
heyhestyy,adminya tonton suara ya
heyhestyy,tawa dia doang langgan yang lain tidak kenal
heyhestyy,sial benar sekali
heyhestyy,ini beh
heyhestyy,pikir tidak tidur saya tonton
heyhestyy,jebak dengan nya jb ariana kenapa teulang ulang kepala
heyhestyy,songkok ada beh seyuta tenun
heyhestyy,anak sama kesi sekali udahnya lulus via online ajar keras rumah eh digantungin tidak begini
heyhestyy,tidak gosip corona memang rumit biasa gosip umum ya dari stan tidak buka daftar belum info tunggu kemenpan udahnya kemenpan keluar info stan suruh tanya detail kemenpan ucing saya itu
heyhestyy,sekali tunik tunik cantik tebar ya begitu busui ramah
heyhestyy,barang receh shopee kayak cuma zona jawa ya receh harga tetap kena ongkir mahal sudah pakai voucher
heyhestyy,ampun kulit mulus
heyhestyy,adoh episode rollercoaster yak sudah potek hati ibu ibu
heyhestyy,ingin tahu nah tawa
heyhestyy,marah saudara agar netijen dunia khayal yang liar kwkwkwk
heyhestyy,dengar suara sendu baik ji muda episode apa baik drama mahal
heyhestyy,hari saksi drama selingkuh ckck sungguh produktif
heyhestyy,unroll tolong tawa coba saya itu
heyhestyy,rawat kulit korea diskon saya itu tidak pakai rawat kulit telah hamil lahir sudah tidak tahu rawat kulit cocok bagaimana
heyhestyy,yang nama rencana putar sahabat
heyhestyy,kalau tonton drama itu muntah
heyhestyy,langsung malu tidak saudara semester sih ampun
heyhestyy,jejak digital saya suram eh karena video mau nang lihat
heyhestyy,tawa sial ya video oscar menang ini
heyhestyy,eh sih tidak temu saya itu
heyhestyy,asli sudah bosan ya sampai utama twitter masa manasih rekening idiom tawa
heyhestyy,itusuda bang mau watermark tahun kan
heyhestyy,kesal
heyhestyy,tidak tanggal
heyhestyy,foto pakai zoom bisa
heyhestyy,aduh ya perbarui nanti pakai hashtag
heyhestyy,episode mayan saya menetralisir habis tonton itu dunia dari meni
heyhestyy,dunia paralel saudara wanita halusinasi tapi tampan paripurna
heyhestyy,eh ya pantas saja lihat ini mana kalau klaten
heyhestyy,loh sekolah kbm online apa git sukarelawan corona kah
heyhestyy,seperti sudah kurus jebak smd pulang anda grogot klotok cepat tutup dalam adan fit terus isolasi rumah
heyhestyy,itu sudah aman pakai bata proat
heyhestyy,di cinta tweet kitak
heyhestyy,sial tunggu tawar latih dapetnya gshock menang banya gema kemarin dw rastaclat tidak yang menang kalau ken memang jarang dapat
heyhestyy,hari ngebid tidak dapat
heyhestyy,ish tanyain adekmu aman kah lockdown tahu tahu kurus kering
heyhestyy,tawa kah saudara ish saya yang nembak terus tolak cedih saya itu
heyhestyy,kalau cantik gin tidak aman hamba
heyhestyy,beli hemat di lelang harga baik lelang kan sempat dapat bnib
heyhestyy,ini gelap jokes
heyhestyy,lelah saya itu
heyhestyy,sial bosan bets
heyhestyy,habis nyiram komentar grup sirbal
heyhestyy,lelet dongo goblo bodoh benga bungul tambuk
heyhestyy,arus hobi nyiramin pohon shopee tanam
heyhestyy,keluar beli popok ngebukain rak eskrim diomelin gema
heyhestyy,takut
heyhestyy,kecewa seperti cerita goblin cakanim junjung
heyhestyy,ampun kesal ingin sumpah tonton episode gila gila kesal semua castnya
heyhestyy,ini benar sekali
heyhestyy,hidup rakyat twitter
heyhestyy,emaknya selesai langsung zoom bayi bangun baik budi anak
heyhestyy,bagaimana ini saudara bisnis sebagai biasa
heyhestyy,kesal
heyhestyy,maka semua jadi chef rumah
heyhestyy,adoh dindasapay baca ini
heyhestyy,pompa asi saya saja
heyhestyy,tidak senak uht sop
heyhestyy,ibu ibu memang super bangun pagi bobok malam nyiapin gila sampai cemil malam beberes rumah cuci urus rumah kalau kerja ibu harus kerja nikmat
heyhestyy,kemarin dapat info teman vieneta transmart eh masih kasir tidak mau tempat sampah sudah jual keluar
heyhestyy,ini info imi di indoguna di toko sukanda borneo paradiso
heyhestyy,kalau coconut senang banyak fulcream habis apa
heyhestyy,kenapa susu putih uht kosong sih borong dalgona bagaimana
heyhestyy,sampai episode saudara panjang jalan tunggu suami comeback
heyhestyy,seperti di sih ampun
heyhestyy,aduh jiwa batin saya ronta tonton episode
heyhestyy,tidak tidak tolong kena telah penuh arti dia sejak meskipun
heyhestyy,hari nyanyi lagu januari hanya
heyhestyy,saudara malu
heyhestyy,tunggu saudara wanita nana sarkasin yasona ini ilc malam
heyhestyy,setuju saudara laki kadir
heyhestyy,langanan susu kurma sudah tidak buka ini sangking gabutnya buat susu kurma ya ampun susu kurma susu almond harga mahal buat rumit minum glek glek bentar sudah habis
heyhestyy,buka hardisk temu video pg nyata rindu ya
heyhestyy,priyo gin tahu gadis generasi tawa
heyhestyy,sudah tobat sop
heyhestyy,kejayanku kpopers
heyhestyy,panggil
heyhestyy,ampun budak cinta sih ehm sampai ding
heyhestyy,sudah diskon jiwa ronta raja lembut diskon mamypoko
heyhestyy,sudah benar memang beli saja tunggu kompas tidak dapat hanya selamat tinggal
heyhestyy,periksa adeknya bang
heyhestyy,panggil
heyhestyy,psikopat
heyhestyy,saya kalau dengar intro lagu mahen mobil nyanyi gerincing tepung beras mawar brand
heyhestyy,utama tangkap sapi juga bisa seru tapi pusing pikir terang di pos
heyhestyy,sial sangking gabutnya ikut cenderung buat kopi dalgona utama tangkap ayam sapi
heyhestyy,ada yang rumah pakai masker pakai sarung tangan getah sedih saya itu ngeliatnya rumah stok baik kasih puskesmas lah lambat
heyhestyy,jokowi tekan konferensi yang mberebes mil
heyhestyy,lepas bagai sedih sekali lihat jokowi tinggal ibunda saat kayak gin
heyhestyy,gila baru saja po masker sensi kotak harga rebo kalau lapor polisi tangkap tidak
heyhestyy,tidak ada tanggal merah saudara juga rumah
heyhestyy,iyaloh masih ngawasin anak coba online lelah
heyhestyy,syukur bapak dibuly netizen semoga keluarga anti besar hati sesak kalau resepsi dibatalin begitu demi
heyhestyy,saudara nama bisnis pokok kalau didik bisnis begitu
heyhestyy,kalau masalah dikit si murid yang salah di omelin sudah tekan rumah
heyhestyy,tenaga lepas sistem gaji hitung jadi kalau tidak ya tidak dapat uang urus rumah tangga saudara sampai sampai dengan
heyhestyy,di least usaha saudara memberi gratis tidak begitu ampuh
heyhestyy,efek tidak rasa salah ini siswa nang nang nelpon ajar bimbel rumah dipukulin
heyhestyy,masya ingat cerita ibu umroh sana sekali yang bagin cemil buat kaum duafa jamah umroh makananya enak ibu
heyhestyy,semoga virus lalu
heyhestyy,seperti shandy aulia mantap sekali bada habis lahir buncit
heyhestyy,malu pagi baru rasa kerja di rumah ngawasin siswa untuk online dbf coba kantor gin
heyhestyy,dia missed his putra
heyhestyy,saudara wanita jul uang banya ngets
heyhestyy,gema masih kerja his pantat untuk sekolah dia kuda his sepeda motor dan simpang itu laut oleh speedboat
heyhestyy,kalau bayi sudah tidur gin sekali gabutnya
heyhestyy,habis elus perut tidak mie
heyhestyy,atong tinggal taman sari
heyhestyy,adoh ac pakai acara buntu saudara laki layan langanan mati himbauan pemkot tangis cedih
heyhestyy,aman kah saudara rumah sehat kan
heyhestyy,tidak tahu berita palsu bukan rumah belah sudah positif benar kelurahanya kayak yang di lapor wali kan takut
heyhestyy,ish kesal
heyhestyy,habis lucu ras
heyhestyy,kira balikpapan tidak yang panik beli ken beli kornet kornet sudah habis etalase kosong dulu kornet sarden tidak laku saudara wanita yang borong
heyhestyy,periksa pesan langsung admin
heyhestyy,tonton sudah kayak kali tetap senyum senyum
heyhestyy,balas admin balas
heyhestyy,admin kemarin isi pulsa via atm bri pulsa tidak sih
heyhestyy,apa ini adalah anda sholat jumat
heyhestyy,iya keluar rumah apalagi wilayah balsel
heyhestyy,rumah eh lagi tidak dibp hati yang dibalikpapan
heyhestyy,yang bilang sepingan pratama tidak tahu benar tidak
heyhestyy,pikir awal kira alat bobol atm
heyhestyy,bagaimana kenapa yang hatersnya jukyung
heyhestyy,mental rusa sama muncul saudara wanita jun jin hyun apa tunggu ajasih tonton
heyhestyy,benar ini teh juga beli keju tidak lihat exp maret
heyhestyy,lucu co cwit
heyhestyy,baru saja mall fantasi depan pintu mall saudara laki aman sudah sama termometer tangan sanitizer apa mall dibp ya
heyhestyy,kampus dulu jaman sama tidak promosi twiner totebagnya pakai kepala lari keliling lorong kelas teriak bawa bawa brosur tidak
heyhestyy,uwo
heyhestyy,corona beli tangan sanitizer detol harga ribu benar jarang dan kalau harga ribu
