username,tweet
bibblegumm_,nid preloved tawa
bibblegumm_,sabar lik buka trailer mana sudah bagi harus tetap sabar tamatin satu nanti kena spoiler seperti sudah sudah
bibblegumm_,matkul ibu memang suka buat gadang lama misi seperti kerja habis sph sampai jam pagi selesai
bibblegumm_,nid goa selesai alohu akbar ada kulon pagi ish
bibblegumm_,sungguh asyik bidang jalan virtual ini
bibblegumm_,bagus buat saudara wanita
bibblegumm_,ayo ca buat mau lihat
bibblegumm_,maaf sudah tahu hasil hasil saya waras baik hati
bibblegumm_,semangat nida wuf
bibblegumm_,manusia sahaja tambah
bibblegumm_,dakjal
bibblegumm_,saudara wanita
bibblegumm_,cie nanda sipu
bibblegumm_,kasar sekali bilangin sama bunda ini
bibblegumm_,casting deterjen saudara wanita
bibblegumm_,catat hati mahasiswa baru
bibblegumm_,anda tanya sim bar gantung juga
bibblegumm_,teman goa yang sampai tes baru lulus dapat sim sih susah tidak tahu goa bom tawa
bibblegumm_,hai june kena buat itu buruk ambil sedih lagu dan buat itu lebih baik
bibblegumm_,kan pendiem saudara
bibblegumm_,juga tidak tahu saudara rawat kulit juga bedak bayi liptint sasimi saudara
bibblegumm_,yul yang ngeguru dia
bibblegumm_,kalau digituin bicara ca pura pura tanya saudara foreo dior bibir tato tidak
bibblegumm_,putri bct sekali
bibblegumm_,ambivalensi ambivalensi peras sadar saling hadap situasi sama hadap pada waktu sama
bibblegumm_,tidak punya adab anda
bibblegumm_,kesal sama sel
bibblegumm_,marahin nid ica nakal
bibblegumm_,serius nid cuma mahasiswa baru tidak tahu apa
bibblegumm_,bintik jener
bibblegumm_,hai ada sedih sampai
bibblegumm_,diam masih malu
bibblegumm_,latih agar tidak syok
bibblegumm_,anak biadab anak tobat cari pria lempar goa itu hancur goa tidak ada adab anda jadi diam saya
bibblegumm_,jumpscare tawa
bibblegumm_,tidak ada adab
bibblegumm_,aduh saudara wanita kucing
bibblegumm_,maaf saudara juga spicles
bibblegumm_,kemah dari rumah
bibblegumm_,sel anda si tawa
bibblegumm_,rencana putar tawa juga syok saya exo tawa
bibblegumm_,rencana putar tiba exo tawa
bibblegumm_,gemas emengna
bibblegumm_,sudah tidak ada ada
bibblegumm_,cerita kolam renang pribadi pin
bibblegumm_,renang sungai tidak boleh sama ibu goa ajak teman teman goa mandi rumah goa nyemplung bak kamar mandi goa kita tahu dimarahin habis habis teman teman goa lolos balik goa kuras bak sambil nang
bibblegumm_,ah saham ibu ibu emas deposito saja
bibblegumm_,buat tabung emas teh cepat
bibblegumm_,gadimana anda bahas martabak hanya malas
bibblegumm_,lihat awas anda nan buka kerjain laprak deadline mata itu
bibblegumm_,woiya sadar bahasa goa jelek sekali belepotan
bibblegumm_,saudara akbar ucap terimakasih laporanya lapor terima telah saya proses hai tidak ada adab kalian iya tuhan sih dunia suka iblis teriak teriak iblis ayah teman iblis
bibblegumm_,awet tahun tahun tahun saya paham hukum jeda makin jeda makin sebentar umur jeda cipta patah
bibblegumm_,yul muka goa elah eh si sel yang seperti mabuk tawa
bibblegumm_,hilih jebak zona nyaman
bibblegumm_,bagus tawa selamat coba nid
bibblegumm_,nid beli tidur masknya
bibblegumm_,kartu mahasiswa sial jelek sekali ngeblur sekali foto kesal
bibblegumm_,memang manusia sial anda nularin goa sial
bibblegumm_,kan bom ituanya gc hai
bibblegumm_,siklus krebs siklus menstruasi siklus daur karbon
bibblegumm_,kasi masih muda
bibblegumm_,terjemah eh saudara laki tweet saya tidak ada notif kalau ikut
bibblegumm_,ayo nid tidak traktir ayo tolong tidak mau tahu
bibblegumm_,tidak buat tweet suka muncul bacan orang balas klik pin ada pilihanya seperti di perbarui deh
bibblegumm_,hilih kaum kaum budak cinta
bibblegumm_,tidak buat tweet pilih dapat balas ganti serah anda pilih kalau gasalah semua
bibblegumm_,kuat saya usaha badai akan mesra terik
bibblegumm_,goa sudah tamat sal tawa
bibblegumm_,awas ya kalau kasih tahu mahasiswa baru
bibblegumm_,tidak apa apa goa cuma eh gila sial buat pengar kupu-kupu
bibblegumm_,tidak apa apa cuma nasi
bibblegumm_,nasi tabur nasi buat kesal kalau sahur kenyang sampai usia tua sial
bibblegumm_,spoiler cemil
bibblegumm_,bawa ken kasih tahu deh
bibblegumm_,coba perhati baik typing goa jamet apa
bibblegumm_,coba tolong nid
bibblegumm_,hai gelap sekali tawa
bibblegumm_,ayo beli buna sesal loh tawa
bibblegumm_,hareudang
bibblegumm_,anda muncul hanya pengirim porsi piring sampai alas sampai hatam
bibblegumm_,bom macet sama debu tawa untung fst angin gelebug sama plt tawa
bibblegumm_,kapan libur cih tanggal merah jalan
bibblegumm_,sudah
bibblegumm_,sudah gila anda siapa tidak sakit lihat typing begitu
bibblegumm_,makas ibu
bibblegumm_,ibu turun toko humoris sekali
bibblegumm_,ibu coco
bibblegumm_,alykazahara iya tuhan ken rasa mukjizat dapat thr gipewey gin
bibblegumm_,mal aidzib sal ayo utama kampus kapan
bibblegumm_,bisa kenyang sampai puasa tahun
bibblegumm_,terimakasih akhir tahu surat akan dikemanain
bibblegumm_,gaje anda seperti dora
bibblegumm_,tempat sampah gaya pena
bibblegumm_,ada
bibblegumm_,sekali tolong coklat banyak sekali tidak pelit tidak buat enek pokok wajib coba
bibblegumm_,hai lapak orang
bibblegumm_,ada
bibblegumm_,woiya buat ayan ini uin libur lagi coba jamet itu nanda goa bilangin
bibblegumm_,malu
bibblegumm_,masalah si anda
bibblegumm_,sel
bibblegumm_,sel pada ngirimin goa tawa
bibblegumm_,si bandel bandel jadi kata cepat selesai tidak tanjung gin hanya kasi tidak bisa ketemu sama tua gara gara pandemi si tidak bosan rumah hanya juga psb psb tetap sini ramai sudah kasih cemil ego
bibblegumm_,itu libur itu jenis tumbuh boro boro lebaran masih harus tetap praktikum ngamatin kucing
bibblegumm_,goa hapal lagu lagu kenapa nempel materi kuliah sial
bibblegumm_,hai mainanya buli buli an
bibblegumm_,introvert beda antisosial anda dakjal pura pura introvert
bibblegumm_,iya ampun untung goa paham keti anda tidak apa apa silaturahmi rumah tetangga tawa
bibblegumm_,kucing bilayk si manusia tiap pagi sore ngeliatin hanya dasar penganguran
bibblegumm_,ampun bunda
bibblegumm_,mapin
bibblegumm_,diam
bibblegumm_,mainin jet mandi bosan tidak wc semprot pintu sama dinding tidak tahu ilham darimana jail semprot mulut gigi dirapetin alhasil gusi darah hanya sial bodoh sekali pokok pesan tuk sendiri bawa telepon tuk selametin saat diwc
bibblegumm_,galiat pokok galiat
bibblegumm_,iya ampun sal
bibblegumm_,hapal dong tawa
bibblegumm_,seperti kartun raindrop spaceton
bibblegumm_,kesal mabuk seperti
bibblegumm_,hai mana jamet itu bekas di planet bekas piramida louvre balik
bibblegumm_,bdmt
bibblegumm_,orang bangga sekali bodoh
bibblegumm_,lahir subang di subang bapak subang ibu subang alias tidak ada blaster blasteranya sial gasik tanya sunda bisa bicara sama tidak
bibblegumm_,selamat ulang tahun tapi
bibblegumm_,sampai sampai sudah kadaluarsa eh goa pikir tahu sudah buang sampah bom
bibblegumm_,si noah
bibblegumm_,deh opini mantap
bibblegumm_,anda goa normal normal ya kalau urus begini ibu
bibblegumm_,iya ampun goa keren sekali angkasa
bibblegumm_,anda keramas pakai facial cuci
bibblegumm_,ada ada anda
bibblegumm_,bodoh adalah kenapa jendela pernah tanjung tidak anda gin hanya
bibblegumm_,gin
bibblegumm_,bisa mimpi adopsi rafi ahmad si rafi ke gamebot goa nyelametin pokok gamenya tembak tembak luar angkasa tidak tahu hasil tidak keburu bangun nangung pikir sekarang ini tanda saya seperti raya
bibblegumm_,semangat tidak
bibblegumm_,ayo lapraknya tunggu tawa
bibblegumm_,saudara wanita kesini cuma bilang pokok hati hati saudara wanita
bibblegumm_,laiya sudah ribu
bibblegumm_,hai nang hanya kepala awas kalau nanti semester ketemu anda kepala sudah kan galucu adalah
bibblegumm_,baik sop buah jus buah nanti minum pakai infus mulut tawa
bibblegumm_,iya ampun rindu maksiat
bibblegumm_,awetanya bau
bibblegumm_,mau ngelab rindu
bibblegumm_,iya ampun bahagia tidak laprak ini hai itu laprak cih
bibblegumm_,jerit validasi sang tuan catat april sayang pulang tugas usai agar buana jemput renjana istirahat dengar buah balada picis
bibblegumm_,catat april sayang cepat engkau tidak lara kerap bengu tidak anda penjara bilur elegi filantropi nyaris langas jebak fatamorgana selaka arah tidak pernah hilang
bibblegumm_,mulut gaberenti bicara keanekaragaman ekosistem citayem
bibblegumm_,goa anda sekali buka twitter undang emosi
bibblegumm_,goa yang tumpah hai
bibblegumm_,bege tidak ada humoris humoris
bibblegumm_,hai foto yang yulia arak
bibblegumm_,tidak di checkout langsung normal harga kesal sekali
bibblegumm_,hai goa gebug anda
bibblegumm_,memang tapi goa suka pikir pikir beli buku goa tipikal yang baca doang sayang
bibblegumm_,tidak usah bahas bahas ujian buat emosi doang
bibblegumm_,nanti goa baca hujan juni doang kalau sapardi tawa
bibblegumm_,asik sombong tawa
bibblegumm_,duluan saudara wanita
bibblegumm_,ratus purnama bagi ini buku
bibblegumm_,tidak utbk goa sampai bandung jam coba tawa saking takut macet
bibblegumm_,muhun sawios enakeun dihandap tis balas eh ini dong ada leueuteun tidak gaduh nanaon da dong bumi saya ibu sayana haduh padahal bawa seperti cemil beruang hibernasi sial saking
bibblegumm_,oke
bibblegumm_,bintik sebagai roti john
bibblegumm_,gangerti tolong
bibblegumm_,bisa meses roti lebih rapi hidup goa
bibblegumm_,hai rindu bisa lupa bawa helm tuhan pinjam helm harga motor
bibblegumm_,bapak terima kasih semoga semua diridhai tuhan swt amin
bibblegumm_,cakep sekali webtun webtun webtun
bibblegumm_,bayar fotokopi beli ubin masjid
bibblegumm_,congratulations hari ketika sudah milik anda manusia bruno mars seseorang anda loved lewis capaldi juga baik untuk ucap selamat tinggal bruno mars somebody else itu lagu buat rasa gagal pindah nyala tidak gagal pindah nyala tolong
bibblegumm_,planet tempat syuting film orang asing sesuatu itu upside turun gangerti
bibblegumm_,sadar jadi roh dini
bibblegumm_,ca ayo ke kamar goa martabak ini
bibblegumm_,buat martabak ca ngabuburit asik tahu tawa
bibblegumm_,sudah sabar tiap punya ritme porsi masing
bibblegumm_,hai kenapa goa hai kesal sekali
bibblegumm_,kotaro seperti balon tolong sudah ibu bulet ini terbang terbang
bibblegumm_,dibilangin goa ibu tonton saja bebas tawa goa pernah tonton si tawa
bibblegumm_,sph bagaimana hai malas ngapalin
bibblegumm_,tahu nyasarin bodoh yang bisa sudah tidak apa apa panik dikit
bibblegumm_,goa ngabuburit tj sudah ngerencanain gin
bibblegumm_,goa buat dati jam bom selesai selesai saudara goa ibu goa ibu goa tanya apa teh sekarang bom selesai video
bibblegumm_,yang utama sebuah cinta jadi indah si cina si auah tawa
bibblegumm_,buat apa apa doang bagus
bibblegumm_,yak
bibblegumm_,diam
bibblegumm_,bisa hubung tawa sampai dikatain anak bodoh orang asing waktu pbak
bibblegumm_,hai sembarang anda gin pendiemnya goa bilang tidsk akhlak
bibblegumm_,soto babat pakai lambung mana monyet kalau menstruasi bagaimana agama anda anut alelo
bibblegumm_,monyet mestruasi sudah nya goa kerjain sampai jam
bibblegumm_,hai baru selesai kerja kuis
bibblegumm_,si konten konten jenis deep web gelap web seperti gin muncul beranda goa hanya
bibblegumm_,apa anda suka susah kalau dibangunin
bibblegumm_,sabar lik besok wisuda
bibblegumm_,eh sitasi eh goa bom selesai gambar bangunin goa mnt eh tidak bisa tanggal merah diliburin eh bagaimana ini tidur eh ganemu sitasi kurang tahun sudah eh tidak buku sumber ipusnas gambar bahan apa sudah gjls sekali
bibblegumm_,ngabuburit bareng naik tj bom terima goa puasa diciputat atulah
bibblegumm_,lapar goa lihat seperti klepon
bibblegumm_,duar laprak bom tugas seperti buat video seminggu ayo ayo
