username,tweet
dalgonasachet,sudah semoga berhasil sidang taruh in itu hitam kotak
dalgonasachet,tidak heran
dalgonasachet,cuma nama mantan sama gebetan saya lihat
dalgonasachet,sya turut prihatin anda yang ajak jalan cemil chatan jadi yang bukan anda
dalgonasachet,ubah dia name atau tambah berapa icons nyala kontak doesn buat dia tinggal
dalgonasachet,anda bukan sayaji tawa
dalgonasachet,dengar podcastnya mau suara indah topik banyak yang hubung juga kita ini nama sudah kantor hours podcast
dalgonasachet,dulu rumah atau tidak mana setuju nama yang jual
dalgonasachet,mau tembus ribu teman teman
dalgonasachet,hanya tweet tidak tahu apa yang pikir bisa solusi orang
dalgonasachet,pernah yang bilang konten di sosial media buat senang bukan orang apalagi timbang persepsi orang
dalgonasachet,berat
dalgonasachet,untung tidak kasi teman
dalgonasachet,cie chatanya siapa sayang siapa cie
dalgonasachet,tydack akhlak
dalgonasachet,tydack tahu
dalgonasachet,ingat kalkulus aljabar linier tidak simbol maaf lahir batin bang nuel ada salah tidak komentar podcast aoh tinggal aman dan sehat ngab
dalgonasachet,sudah tidak syok bang nuel karakter masyarakat
dalgonasachet,tolong buat yang tidak offbeat bwang
dalgonasachet,mari lihat tidak lebaran hari minggu serame
dalgonasachet,bablas sahur saudara laki nik
dalgonasachet,use milik anda otak untuk tonton keluar milik anda mulut
dalgonasachet,buat anda ingat ketika anda gabung twitter buat
dalgonasachet,loh
dalgonasachet,bosan pilih loh konteks hubung
dalgonasachet,iya bosan cipta cuma ngetes seti
dalgonasachet,seperti kalamangna waktu virus corona
dalgonasachet,pantas masker hilang nimbun ini
dalgonasachet,astaga rindu
dalgonasachet,peras peras semua nyata
dalgonasachet,yang dengan suhu dinginya bandung memang makasar yang panas mafela lade
dalgonasachet,kayak salah deh salah saya yang harap
dalgonasachet,pena putus kalau gin tidak pacar
dalgonasachet,kaumo alip
dalgonasachet,bosan taruh tuhan tolong hamba kirimin seperti hamba agar teman ngobrol
dalgonasachet,saking tidak tahu apa sudah bicara sama lampu tidur ini bang nuel
dalgonasachet,ibu muda rekam jelas detik detik gerakanya kepala siapa yang buat remixnya
dalgonasachet,seprtinya butuh
dalgonasachet,seperti masih langsung lama sabar yah saudara wanita juga mulaima bicara lampu tidur kamar
dalgonasachet,beda tipis tekan dipakama tawa
dalgonasachet,ingin pergi jadi sendiri tapi tidak ingin tahu bagaimana itu terasa
dalgonasachet,kenyat pahit kenapa telat tahu
dalgonasachet,seorng kwan tanya rasa saling sapa saling doa bagaimana anda tahu doa dia diam kemudian tanpa patah dengan teguk minum tang
dalgonasachet,jumlah kalian perihal hubung awal pacar akhir pelamin ingat
dalgonasachet,kapan di spotify
dalgonasachet,semoga temu lebih dari ya
dalgonasachet,masuk tidak karena rilis belum keluar buru coba kamera macronya kamar
dalgonasachet,nescafe susu beruang iklan naga oplos na anak saudara
dalgonasachet,jawab adalah ketika anda percaya anda tidak percaya orang orang celaka cinta terlalh percaya dengan ada bodoh dibilangin
dalgonasachet,yang celaka cinta pada bodoh sudah dibilangin
dalgonasachet,dokter nang nyanyi langit baca
dalgonasachet,sudah belakang pakai fitur kalau tidak salah perbarui darkmode instagram saudara laki
dalgonasachet,sesuai titlenya daftar putar yang dengar jam
dalgonasachet,jenis jenis takut takut setan takut gelap takut tinggi takut saya tidak baik anda maaf kayak temenan sungguh
dalgonasachet,kali sakit faktor orang pria fagboi memang sudah bakat fagboinya
dalgonasachet,mulai duluan inisiatif bicara
dalgonasachet,pernah hidup tentang pilih lang maju jalan tempat tangis rindu temu saling tatap singah waktu saling tapi satu dalam hidup yang bisa pilih kepada hati celaka
dalgonasachet,sudah
dalgonasachet,ini rencana mau lari cuma hujan bandung awet benar kayak hubung sama semoga besok cuaca cerah bisa bangun pagi lari pagi kali
dalgonasachet,perlahan tari semua milik anda pikir kenapa milik anda soul gone dingin dan semua harap has run kering mati dalam tidak pernah enough untuk lupa itu anda baca satu dari itu sepi
dalgonasachet,sore belum panggil ibadah maghrib beraniko saya baku susunko bapak tidak takutja ini
dalgonasachet,cheating akhir lari cuma lama itu yang begadang buka naik turun lari hujan an
dalgonasachet,peras nyaman sama seperti mata jk suatu benda yang jarak jauh tapi mata lihat suatu benda sgt bentuk tidak sama dengan peras nyaman mkn puf saja hilang
dalgonasachet,hal bukan antara pilih jadi satu ada pilih yang lain
dalgonasachet,benar yang dengan hati akan hianat
dalgonasachet,sambat dikit ya kemarin siang wifi kamar mati hari tahu ya provider yang masalah gin jaring saudara kandung sama banyak parah
dalgonasachet,pagi run kemarin minggu ini istirahat besok gas target kilo terus cepat naik
dalgonasachet,bukti konkret mulai bias lari benang akan diupdate kali selesai lari ajar konsisten sadar salah kurang saya lihat konsisten saya depa
dalgonasachet,salah target tahun selain lulus kuliah lari telah sekian henti baru mulai lagi yang payah ini salah karena cemil berat belum lari
dalgonasachet,tidak yang di sayang
dalgonasachet,yak mundur lagi lompat saudara laki sakit dalam
dalgonasachet,erti juang proses teman yang sudah masih jalan koas yang saya merinding bukan ruang ina setan wc ruang awat ketika dokter pidato sambut kelulus baik kerja doc
dalgonasachet,tawa mundur kenapa anda jaga jodoh
dalgonasachet,kanan grak
dalgonasachet,kita humoris anda bajing
dalgonasachet,jadi ketidaksempurnan anda hal sempurna orang
dalgonasachet,gagal anak gagal manusia
dalgonasachet,yaudahlah
dalgonasachet,itu tahu alasan karena jadi apa bohong depan dan bagi sudah dari
dalgonasachet,yang diretwet paman supet kaitanya anak saudara makasar tidak baca balas an tojeng saja pangaukang nu anak
dalgonasachet,tertawa bahagia ya derit
dalgonasachet,pisah tentu ada temu pedih taruh kayak luka sobek sabun
dalgonasachet,sesuai apa bang bilang kemarin topik ini benar seru posesif posesif kayak hal yang humoris tapi takut diceritain
dalgonasachet,episode sayang kenapa digituin
dalgonasachet,pulang malu pulang hilang anda
dalgonasachet,tonton awal akhir sadar tidak takut darah
dalgonasachet,ada lagi cinta beda reaction anda sayang dia dia tidack malu
dalgonasachet,beda dengan yang sikap adan putus karena sadar sadar mantan adalah proses bentuk anda contoh di selingkuh anda jadi yang dengan percaya isu
dalgonasachet,topik tarik turut saya ini hubung gagal hubung yang kenal putus saya bilang akan hubung semua karena hampir semua orang pasti gagal hubung
dalgonasachet,episode adalah keluar sekarang lagi tinggal selebgram di ikut dian santro tawa
dalgonasachet,cuma mirip
dalgonasachet,nama arham nama pangilan bugis arhang nge
dalgonasachet,itu cara dia laku anda itu spesial yang mungkin dapat lwan jenis umum lantas masih tunggu inisiatif dia anda tidak tiba undang lebih duluan ke rumah akhir anda sesal
dalgonasachet,bisa punya milik anda perhati tolong
dalgonasachet,ini khatam kayak mendengarkan podcast anda bang tawa
dalgonasachet,terimakasih anda untuk spending hours dengan saya ini tahun nyala anda adalah saya
dalgonasachet,di fase usaha keras ikhlas belum jadi
dalgonasachet,otherwise saya baca dating untuk apa untuk senang atau apa dapat hobi jika anda ingin untuk dapat senang kena use yang lain orang jantung untuk senang
dalgonasachet,bojongangsa hujan admin dunia kelas universitas wisudan
dalgonasachet,tawa muhun saudara laki
dalgonasachet,buah batu nyala
dalgonasachet,resisten latar belakang pinterest
dalgonasachet,ini janji jiwa jadi kopi susu buat
dalgonasachet,anda bisa jadi orang itu mereka pernah wanted anda bisa buat semua perfectly tapi itu masih wouldn jadi enough cause tidak apa apa adalah pernah enough
dalgonasachet,ibu guru eh selamat guru omong omong coba terap atur paling rapih duduk duluan pulang tawa
dalgonasachet,harap boleh saja harapanya leta tempat rendah kalau sesuai ekspektasi santai
dalgonasachet,monosodium fluktuasi glukosa
dalgonasachet,tolong kepada apa faedah video cemil youtube micnya di mulut
dalgonasachet,tidak peduli hadap benar bentuk peduli hadap itu
dalgonasachet,e sebuah oke l sebuah
dalgonasachet,insaf perempuan tanah jahanam
dalgonasachet,sana damping bukan harus saya yang anda cinta bukan
dalgonasachet,benar sama saudara laki niko maksud selubung konte twitter
dalgonasachet,harus tahan nanti akan sakit baik ikhlas saudara laki
dalgonasachet,lemahna mamo mata bela kena kipas
dalgonasachet,harap bisa temu bahagia cara masing tidak sama
dalgonasachet,tidak egois diri dong selalu utama kebahagian sekitar lantas lupa bahagia bukan sendiri terus yang bahagia saya
dalgonasachet,benci jadi sendiri
dalgonasachet,bosan rekomendasi film serial favorit
dalgonasachet,cerita ayo hari kemarin
dalgonasachet,pasang instagram yang seperti yang komentar karena banyak cuma suka tidak berani bicara tawa kredit
dalgonasachet,henti anak itu semua over
dalgonasachet,selamat malam kaum kaum rebah
dalgonasachet,jaman masih smsan tidak ada ken rumit cari parsel smsan yang bisa kirim sms ke semua operator malu
dalgonasachet,ken pelihara ikan cupang oke ikan gigit bandung jual admin
dalgonasachet,di pesan langsung
dalgonasachet,tidak aktivasi parsel mytelkomsel dialpad telepon costumer layan sibuk saya bagaimana
dalgonasachet,pakai google temu saya alat tinggal masuk akun gmail log in alat hilang semoga cepat ketemu
dalgonasachet,menikah goals saling bantu temu kuat dukung sama sisa cuma individual goals coba jalan atau semua adalah menikah goals
dalgonasachet,buat salah adalah bukti itu anda adalah coba
dalgonasachet,sobat abmyarquh tawa
dalgonasachet,daritadi pagiji siap pakai kemeja putih tunggu telfonya siapma tunjuk menteri pemberdayan perempuan tinggal tidak sayang sayang
dalgonasachet,buah seni sikap saja sayang hiyahiya
dalgonasachet,bajing anda insomnia
dalgonasachet,kadang manusia lupa yang alas dan tahan sesuatu
dalgonasachet,peras paling siksa rasa belum untuk tapi butuh tati tayang pelhatian
dalgonasachet,lagi bukti betapa mematikanya perkatan kalian anggap canda tutup kalimat yaelah seperti itu bawa rasa anda anak tahun laku untuk bunuh diri akibat olok an kenang pahit dendam
dalgonasachet,heres lagu untuk anda tadow oleh masego
dalgonasachet,itu kenapa itu keras untuk tidur
dalgonasachet,pikir saya kembang itu gelisah tentang enam months lalu sampai sekarang
dalgonasachet,tidak dari jalan hubung niat memang tidak setia herman itu jadi orang setia itu niqmadh
dalgonasachet,pa gigit ayam lalo
dalgonasachet,terlalu koi saya ale ale mountea frutang marimas jasjus
dalgonasachet,pilih hidup dengan yang cinta atau hidup dengan anda cinta
dalgonasachet,sakit sakit senang senang tentu bisa sakit sakit begitu
dalgonasachet,komitmen lama tunggu menikah kenapa jaga jodoh tawa
dalgonasachet,pacar pasti komitmen komitmen tentu pacar beneng dor tidak
dalgonasachet,yang lain cerita dari sa jaga baik baik pu jodoh
dalgonasachet,jadi
dalgonasachet,semangat sehat
dalgonasachet,kalimat andalanya anak saudara masa
dalgonasachet,korea buginese
dalgonasachet,sudah ibu liga malam jumat seri
dalgonasachet,aneh sudah henti belum berani
dalgonasachet,tidak tidur tadi pikir tingkat tinggi serius hal hubung
dalgonasachet,tolong gar vans oldskolnya
dalgonasachet,rindu sang rindu lampu tidur remang paham gelisah
dalgonasachet,detik habis kampas rem bana
dalgonasachet,tinggal aman makasar
dalgonasachet,akhirat sama tidak
dalgonasachet,tanggung besar sudah anda selesai
dalgonasachet,hidup cuma siapa menang yang kalah
dalgonasachet,apa ribut tawa tidak bahan dari kemarin jaka tidak muncul beranda
dalgonasachet,kenapa satu ketawa
dalgonasachet,sampai selamat anda
dalgonasachet,kena punya banyak untung ketika itu comes getting dekat untuk orang
dalgonasachet,apa rasuk sampai telinga waktu percaya
dalgonasachet,pantau ayo anak kuat bisa
dalgonasachet,anda anda usaha begadang ros sulit untuk konsisten
dalgonasachet,kebahagian datang mana dan tular orang kita kebahagian saudara wanita tular saya sederhana
dalgonasachet,sadar bukan cuma tampan cantik relatif waktu demikian
dalgonasachet,prioritas tanggung besar yang anda penuh prioritas orang ekspektasi harus jalan realita dan tidak mudah jadi coba difikir kalau mau tuntut jadi prioritas
dalgonasachet,telepon pro maag
dalgonasachet,nyaman saudara laki alit tawa
dalgonasachet,anda luka terlalu buru buru sembuh hilang sakit nikmat perih beri hingga rasa sakit jadi manusia yang lebih untuk manusia lain
dalgonasachet,satu normal jam tidur dengan tidur
dalgonasachet,perlopean butuh juang
dalgonasachet,hadap kemarin sudah skenario tuhan yang harus jalan hidup tugas akhir itu skenario yang untuk dan ada alas itu gantung lihat sudut pandang jadi malas nah kenal baru
dalgonasachet,ke sering tweet malas pendekatan tahu fase kenal obrol telfonan jalan nyaman eh tiba hilang banyak gadis keluh tidak salah cowonya saya juga tidak salah ki terlalu cepat nyaman bawa rasa
dalgonasachet,dan itu itu harap punya itu hanya benda tahu itu simpan saya hidup
dalgonasachet,terima kasih selalu usaha ini
dalgonasachet,ganti permen karet teman teman mau henti rokok
dalgonasachet,na bilang akh janko suka pacar an saudara agar tahun kenapa jungkir pacar ada yang datang lamarki mauko tawa
dalgonasachet,pernah sebanga dengan pasang
dalgonasachet,cinta tidak saya
dalgonasachet,tawa dilema pdahal dilema tidak sekali
dalgonasachet,seti adalah pilih orang manusia saat dna tarik lebih satu manusia lain milik akal budi naluri cari yang dia pada pasanganya dia bisa saja pilih setia
dalgonasachet,naluri sekali tidak albatross kenapa seti pada manusia buah pilih beda albatross suruh bydesign untuk setia pasanganya
dalgonasachet,manusia milik pasang coba cari lain karena hal dapat pasanganya bilang persentase sudah ada pasang nya yang tidak dia temu munculah naluri cari yang
dalgonasachet,kitab kita percaya manusia cipta pasang pasang oleh dna manusia betul milik tari rasa lebih satu manusia lain kenapa yang nama poligami
dalgonasachet,beda kita manusia didesign milik akal budi naluri hingga manusia milik pasang ada satu komitmen ada manusia dengan naluri akal budi cari pasang lain
dalgonasachet,tuhan cipta albatross oleh desain itu bilang paten albatross adalah pasang dan juga albatross cipta milik akal budi naluri
dalgonasachet,seti kita ajar burung albatross setia tunggu pasanganya jauh dia pergi ada albatross yang coba
dalgonasachet,semangat fildzah karirnya
dalgonasachet,sekarang tanggung yang selesai tunda tapi someday sudah ada dalam ember daftar goa balik keliling sulawesi motor doa semoga tahun bisa saudara laki
dalgonasachet,rasa peras muncul turun tuhan tidak tolak terima dengan konsekuensi hitung twetnya jam yang iya tahu saya insomnia
