username,tweet
_chaendelier_,tidak semua orang learns dari mereka alam utama saya
_chaendelier_,gadis
_chaendelier_,tidak langgar teman teman tapi kesane yang ciwi itu suruh muluk begitu dikiro pria atm lebah
_chaendelier_,yaowo nenek saya dadi lanange pegat pikir yaopo neh ayo cinta adalah buta jare
_chaendelier_,mangat beibz
_chaendelier_,keras
_chaendelier_,juga saya tidak pada si sike
_chaendelier_,anda saya
_chaendelier_,terima kasih saudara wanita salsa semangat ujan juga
_chaendelier_,buat minder saja yh ted ini
_chaendelier_,tawa kabeh gramed daftar putar mgene kabeh tidak
_chaendelier_,tawa tepat
_chaendelier_,asik giveaway menang nagih itu kemarin saya dapat lipie
_chaendelier_,tidak saya rindu konco kremes kriwul
_chaendelier_,rindu kunci motor mwesti ketinggalan parkir bikin
_chaendelier_,hanya selesai tulis saya akhir tugas sike halaman dari
_chaendelier_,saya sndri
_chaendelier_,lega
_chaendelier_,ken tapi ujan huf ngene ikilo
_chaendelier_,sebentar tunggu tengah malam
_chaendelier_,saya baik yang tidak ngebolehi nang karena da capew
_chaendelier_,tidak boleh nang
_chaendelier_,bom coba sal
_chaendelier_,tidak kenapa sal seperti jadi seperti menthol begitu tapi
_chaendelier_,akhire nyentuh kasur
_chaendelier_,saya pakai saya mayan tapi deep exfo begitu sal jadi saya seperti tidak beli kembali lagi terus karena arang jadi panas begitu seperti balsem
_chaendelier_,eh omong omong selamat ulang tahun temenya firman
_chaendelier_,maret sih
_chaendelier_,saya ultang tahun tidak mbo manusia
_chaendelier_,sikat saudara wanita
_chaendelier_,saudara wanita saya sebentar mbe ve
_chaendelier_,anda ayo buka jam pagi
_chaendelier_,ayo anda tunggu sayang
_chaendelier_,jayko iku bakat gam isok gambar
_chaendelier_,jayko sudah cemil
_chaendelier_,iya tuhan sumpah gskerasa sudah tahun cuy saudara laki mangkelin saja saudara ckckck semoga ubah sudah itu anak
_chaendelier_,jektas saja saya nutup laptop
_chaendelier_,amin yarab gusti
_chaendelier_,tawa saudara arum saya mau tanya jurus boleh tugas akhir
_chaendelier_,kenapa does semua punya untuk jadi kompetisi hadu
_chaendelier_,mindere tengah mati
_chaendelier_,hago
_chaendelier_,saya mingdep sudah ujan ini
_chaendelier_,yaudala ini mau tugas tok selamat tinggal film sike
_chaendelier_,btul malu jadi malu peta
_chaendelier_,parsel giveaway kenapa lom datang
_chaendelier_,loro ini tidak bom dibehel terus rambutq pendek cara harfiah pendek pol an se foto guyon alias iya tuhan sehat ya rek yang suka malu in orang based nyala mereka cacat
_chaendelier_,butuh cangkir dari latte fr
_chaendelier_,tunggu lembut launching ny mas
_chaendelier_,cantik abadi
_chaendelier_,penistan
_chaendelier_,pikir
_chaendelier_,peluk gulimg saja
_chaendelier_,uwes maeng
_chaendelier_,harap bisa henti doing impulsive sesuatu aduh
_chaendelier_,akulo sekarang sudah hari saudara wanita tapi ncen ketok podoae
_chaendelier_,emi chloe benda sama alexis ren
_chaendelier_,okinawa sumpah
_chaendelier_,gadeng realized itu itu rencana adalah universal enough untuk semua orang untuk hubung untuk
_chaendelier_,sudah ketika pertama saw apa cinta jujur seperti itu film tapi didn sepenuh paham umur tahun tapi rewatch adc ini pagi dan realized ranga rambut bagus tawa
_chaendelier_,mw
_chaendelier_,deb adalah indah dengan punya anda milik sendiri cara henti comparing diri sendiri untuk lain semua itu kutuk waktu
_chaendelier_,tidak aren
_chaendelier_,saya lihat orang ulas instagram terus coba beli di toko yang kenapa hmnm ckck pikir
_chaendelier_,mentai cemil aneh telah sushi
_chaendelier_,pesan langsung
_chaendelier_,saya pisces tapi saya tidak akan buat anda melow misuh anda
_chaendelier_,pait
_chaendelier_,mute gas
_chaendelier_,iii truly tuju dengan ini
_chaendelier_,penistan
_chaendelier_,kalau kanab pwety qyut sama waktu
_chaendelier_,nf kalau habis coba kasih pengirim
_chaendelier_,mbhek
_chaendelier_,foto belah kiri versi lebih rem saudara benar kanan si saudara tapi saru kalau pos
_chaendelier_,wala amin ris karena sudut kalik
_chaendelier_,tawa tidak sama lihat saudara wanita zan cantik pwol eh sekarang ketemu lagi fakultas tamba lebih cantik
_chaendelier_,rubung semut
_chaendelier_,ncen gabedo manusia mek bedo rambut tok mala karuan sg sebentar soale jek pola cemil tidur sehat
_chaendelier_,awak ws dudui sg saya nyekel es teh wkwowk
_chaendelier_,isin brouw ws tidak faedah pokok begitu lantai
_chaendelier_,karena cahaya tepak saudara wanita
_chaendelier_,wkwkak sas
_chaendelier_,catfish periksa
_chaendelier_,sebentar onok anda gam pose megang es teh tangan damai gaero saya faedahe apa sampai saiki
_chaendelier_,sebentar gret saja cuman beda rambut
_chaendelier_,tidak sama gadis sampul
_chaendelier_,ame
_chaendelier_,lihat highschol saya lawan arus saya wkwz
_chaendelier_,adalah itu gud banyak yang bilang sukel ichiji tapi lom coba huf
_chaendelier_,loalah awak sudah tahu jak anda gam
_chaendelier_,mbe saya santai
_chaendelier_,ganyangka skale tutup
_chaendelier_,cerita
_chaendelier_,selalu coba temu keluar
_chaendelier_,ayo main kesini manusia
_chaendelier_,masio ngelakuin sg benar saja tapi salah jadi lakuin saja yang pena dilakuin
_chaendelier_,edgy habis
_chaendelier_,cakep
_chaendelier_,gret titip anak
_chaendelier_,sudah sampai mer lagi rumah karena risolku lupa bawa
_chaendelier_,tepat
_chaendelier_,retweet sampai boleh kalik
_chaendelier_,ncen gtg sekali
_chaendelier_,ekstrim
_chaendelier_,yang laen palagi pena masak roti tapi roti iya
_chaendelier_,salah ente tidak tidur lagi tapi kongkon ngolek nenek durung ketemu gaoleh mole turu ng indomaret
_chaendelier_,yang laen gam agar tidak bosan saja yang hilang eh iya ampun peta iya tuhan canda
_chaendelier_,maaf sudah hilang
_chaendelier_,tidak mau uner tugas akhir tidak curhati
_chaendelier_,ayo lagi saya rindu nuduh anda
_chaendelier_,nf bimbel saudara tempat ngaji
_chaendelier_,dadi arang maeng saya rapat atek google peta
_chaendelier_,indosiar bisa tidak pernah
_chaendelier_,sam terus pikir abt dat sejak allah knows bagaimana panjang
_chaendelier_,kira lukis kanab
_chaendelier_,wuih jwujur kagum pol sama teman saya yang sudah banting tulang begitu bantu tangis saya senyum pek ngeliate kadang
_chaendelier_,tunggu oke
_chaendelier_,sudah diam saja sudah
_chaendelier_,hanya henti comparing urself untuk lain semua itu kutuk waktu tangis
_chaendelier_,tawa saudara laki saja yang seperti begitu saudara wanita semoga cepat ya ayah saudara wanita
_chaendelier_,tidak sama semoga saya kalau telat ortuku disuruh bk kasi rumahq rungkut malu gaperna bk saudara
_chaendelier_,nasi padang lauk paru
_chaendelier_,benar memang sangkal adalah kuat obat xixix
_chaendelier_,untuk godsake kenapa saya jadi impulsive
_chaendelier_,iya ampun imut saudara wanita begitu lantai
_chaendelier_,begitu lantai
_chaendelier_,punya ekspektasi tinggi saya
_chaendelier_,wi mangat sal
_chaendelier_,baca lepas kerja lepas
_chaendelier_,kon marah marah sekali karena tidak jadi lihat konser atau datang festival karena pandemi ini pernah gas pikir bagaimana nasib lepas layar industri kreatif sampai
_chaendelier_,tengkuk
_chaendelier_,ofkorx
_chaendelier_,maaf untuk ucap tapi lebih suka avatar daripada kora
_chaendelier_,du disepik saudara wanita dayu rek
_chaendelier_,pol saudara wanita taum hidup bondol tapi sekarang mau coba panjangin
_chaendelier_,saudara wanita ini rek ayune tala saya pena potong rambut tapi takut sesal kali potong ngikuti kiko mizuhara tidak sama jatuhe mala seperti kiko mikuah
_chaendelier_,bagus dari studio ghibli ris spirited jauh totoro ponyo
_chaendelier_,embuh matkul
_chaendelier_,opose gamasuk akal
_chaendelier_,ngelamar
_chaendelier_,gila gila
_chaendelier_,sudah tanggal kenapa saya gadipangil pa rezeki
_chaendelier_,bagaimana untuk reincarnate sebagai sayur-mayur
_chaendelier_,malu sholeh
_chaendelier_,tidak tempat sampah kue saudara wanita kalau ketemu benar anda suka kue indie
_chaendelier_,pikir eneg hsmpir seperti kue pada umum cuma pikir tidak tapi tidak apa apa coba saudara wanita
_chaendelier_,pikir bagaimana bagi
_chaendelier_,saya tempat sampah tante pwrnah kalau beli bom
_chaendelier_,btul
_chaendelier_,bagi mangkelno kakaku oleh ketawa
_chaendelier_,kon kabe gagelem tuku saudara saya rek
_chaendelier_,saya tidak saudara
_chaendelier_,mal aidzin sal selamat lebaran
_chaendelier_,brief lidi pada an eid al fitr online hubung
_chaendelier_,mal aidz gas
_chaendelier_,eh edi eid maksudq
_chaendelier_,kejut kiko mizuhara desu
_chaendelier_,yah gakebaca tulisan itu wishing sebuah sangat senang edi saudara wanita riuh may semua milik anda baik deeds accepted oleh tuhan swt
_chaendelier_,loh arang anda islam ada tanya di tahun
_chaendelier_,sepupu cakep si
_chaendelier_,tawa sepupuq humoris sekali semoga tahun bisa sby saya ajak jalan
_chaendelier_,adalah itu rude untuk ucap iri bilang bos in fit konteks
_chaendelier_,heres lagu untuk anda lalu karena dia goes oleh itu
_chaendelier_,sama
_chaendelier_,yarab kupas hamba sabar sg katah
_chaendelier_,syukur trnyt ini matkul pku pakai hidup
_chaendelier_,gadis tersebut lihat pria baju merah itu seperti keren lebih hebat dari cowonya gadis itu ningalin cowonya karena tahu pacar saja nah trnyt cowonya lebih hebat daripada rambut putih tidak si gadis mau ya si pria yang sudah jadi mantan kecewa terus pergi
_chaendelier_,bosan sungkan terus
_chaendelier_,pikir saya pernah bilang di saudara wanita vid itu kenapa cinta
_chaendelier_,peras sudah kampus buat ospeknya seru dan tidak pernah marah an gajelas tapi wakil ini ngelebih tidak fufufu
_chaendelier_,jika anda teman teman berkata cemil ini murah wenak kon jajal nyobao arang akan selalu jadi saya weak titik
_chaendelier_,tolong saya ken lihat teater
_chaendelier_,gamasuk akal
_chaendelier_,tidak fit in bagaimana cause jadi banyak cacat nyala saya dia
_chaendelier_,kalau doaq cpt wujud yang mala songong kalik
_chaendelier_,untung sekarang punya batas elus dada sabar
_chaendelier_,benar maret kemarin sudah mau lihat anda sudah bli tiket juga
_chaendelier_,pwegele mugo berkah
_chaendelier_,dokter seperti sepatu bot dora
_chaendelier_,sungguh punya untuk belok mati saya notifications cause mereka buat unecesary sesuatu become necesary
_chaendelier_,iya ampun tunggu kirimin anda deh tawa
_chaendelier_,pesan langsung saya
_chaendelier_,itu haunting dari bukit rumah vin netflix ente harus lihat
_chaendelier_,tonton sudah selesai br tahu kalau hontunya sela film
_chaendelier_,gotta ambil berapa waktu untuk log keluar ini twitter kira
_chaendelier_,sudah apa begini
_chaendelier_,anda sudah cakep foto yang anda pos kemarin sudah kece
_chaendelier_,mashalah benar memang saudara wanita zan itu
_chaendelier_,iya ampun saudara wanita zan bisa begini omong omong cantik pek saudara wanita sudah kerudung sekarang
_chaendelier_,alam pikir nanah sama filosofi teras saya pdf kalau anda cerita para kasih saya buku bibir bibir tidak utama dengan kelamin medium rum
_chaendelier_,maksud in lain cara gtlo aduh guyon ini opose ganyampe
_chaendelier_,alam pikir yunani moh hata cerita para kasih agus nor anda hapus bekas bibir bibir bibir hamsad rangkut gpnya bukuny tapi lihat cerpen via medium filosofi teras henry manampiring utama utama kelamin djaenar maesa ayo
_chaendelier_,kenapa tidak sensei vin
_chaendelier_,kenapa ya orang tidak bisa bicara makas huf basic padahal ini
_chaendelier_,iya tuhan konco saya nenek mari semir rambut ini mesti mlayue ng tangis keren lagi jadi pena
