username,tweet
kepikbesar,beda jenis kelamin tidak yang gadis memang kecil
kepikbesar,cerewet
kepikbesar,tidak minat manusia kalau marah basa basi kucing ken nang
kepikbesar,tidak bisa bohong kalau marah nada ngomongnya naik
kepikbesar,putar tolong kasi muka mengnya jorok
kepikbesar,sebuah e
kepikbesar,ini monbyul
kepikbesar,tuhan ken seperti malu
kepikbesar,avatar ang lengkap
kepikbesar,sorop simpleman bom selesai
kepikbesar,mati mati saja syukur sebentar indonesia orang bodoh
kepikbesar,jenazah infeksi vid paksa bawa pulang tolak cepat uji blokade jalan tambah nge klaim sehat anda bodoh tidak habis
kepikbesar,baca pasang horor tengah malam jadi seperti baca jam gin
kepikbesar,sembunyi jauh saya feelings adalah saya baru kerja
kepikbesar,bilang ngadu habis jatuh
kepikbesar,sekali protes asin sekali nama cumi asin sial habis dia kesal ken nonjok
kepikbesar,dat wuwu tawa sehat mbanya tidur
kepikbesar,jenis dari hubung saya lucu
kepikbesar,kalau pisang cocol sambal gin tepung manis tidak
kepikbesar,panggil saya agung agung
kepikbesar,mendengarkan ini kemarin comot tweet koh alex nyertain tweet lengkap asal nyomot klarifikasi tidak koh
kepikbesar,sejuk di jalan tawa
kepikbesar,tidak
kepikbesar,kelas maudy dapat lpdp saya biasa harap lpdp itu bagaimana mana usaha
kepikbesar,takut ambil
kepikbesar,ayo kasih nama kiby
kepikbesar,mainin jari kaki babu anda cipon
kepikbesar,tuhan sedih baca rep seperti gin sembur minum saya
kepikbesar,adalah itu apa maksud tawa
kepikbesar,iya atau tidak
kepikbesar,kesal kyknya putus asa sekali seperti pria biji doang
kepikbesar,dia otak hanya untuk dekorasi
kepikbesar,celaka cinta patah hati logika hilang parah saya putus muka saya cahaya siapa lagi ya anda lah gila sakit dari ini
kepikbesar,tidak saudara akhlak memang
kepikbesar,l o oke mati gosip manis balas dendam jadi awkaowko selamat tinggal anak laki
kepikbesar,datang kembali ini buat pusing alir
kepikbesar,apresiasi pos rambut mulai shinning shimmering megah sekarang sudah ganti seperti rambut anak utama layang thn
kepikbesar,bingung pikir bagaimana bagus
kepikbesar,rambut sudah bagus awat tahun tapi ini rambut bleaching jadi kering naudzubilah rawat bulan ngerusaknya doang sesap
kepikbesar,kenapa sama kalau pakai atm nama kartu atm kalau pakai bayar belanja nama kartu debet tinggal saja pembayaranya via debet tidak
kepikbesar,selamat lebaran saya mupeng lihat bisa lebaran
kepikbesar,yahilah penyok sudah ketupat
kepikbesar,kalau dosen fungsional tatabahasa yang benar speak bahasa indonesia kalau pakai bahasa jadi bias dan bahasa bukan represent bahasa indonesia dan kalau jelasin foreigners akan bingung artin bahasa maksud
kepikbesar,tantang mau kalah an lemah sendiri kalau anda cari tidak akan ujung kurang baik temu keluar bagaimana agar bagus bicara praktek banyak tolong orang bisa bantu semangat
kepikbesar,underrated komentar tawa
kepikbesar,bawain itu baju
kepikbesar,biadab tetap saja untuk keluarga yang benar ibu selingkuh koplok
kepikbesar,dagu
kepikbesar,sapi pacar ucap hai nama rawon
kepikbesar,khianat adalah saya old teman
kepikbesar,malak alus
kepikbesar,ayo semangat agen dari ubah
kepikbesar,anda dikatain tai model manusia terima gilir saya ejek anda tai sebentar anda marah pengirim sudah tahu tidak mau pertahanin lagi simpan diri sendiri
kepikbesar,begitu kue garpu
kepikbesar,tidak periksa lihat riwayat habis mana bapak ibu kemarin belanja dokter emol satpam tolong ini suruh saja tuman
kepikbesar,misi lengkap
kepikbesar,si ngelamun hanya masalah
kepikbesar,kenapa yang oren tawa
kepikbesar,mau jalan kenapa ya gapeduli pulang desa belanja nakes usaha sampai gin
kepikbesar,pelihara anak singa benar pengirim
kepikbesar,saudara wanita ini cocok
kepikbesar,beri saudara wanita negara hadiah
kepikbesar,kali ingat itu buat sakit kenyat kalau saya anda sian
kepikbesar,whopsie cemil itu selamat tinggal selamat tinggal taik ledig
kepikbesar,punya slither io bangga anda pengirim
kepikbesar,suruh nyantumin sumber valid memberi video dedy sudah
kepikbesar,karung beras gotong begitu pengirim
kepikbesar,bct anda kontol otak kosong koar nomor baik cemil nastar
kepikbesar,pandemi gin tidak usah tonton konspirasi kata corona tidak lah baik waktu cemil sehat ajar baru ketrampilan baik diri sendiri untuk jadi lebih baik lelah dengar bodoh hanya
kepikbesar,ikhlasin saudara wanita saudara laki cocok koleksi canda
kepikbesar,milik ya
kepikbesar,bonbinya yang dana pakan fortunately yang galang dana
kepikbesar,memang saudara wanita indira suka keliru meh
kepikbesar,tijus apel air banyak
kepikbesar,ciri pria motor softboi
kepikbesar,iya tuhan saya jadi fckng sudah dengan saya sajak untuk ini tugas
kepikbesar,yang dong hai
kepikbesar,saudara wanita kalau tidak ngumpat kasih bintang
kepikbesar,bilangin teman anda sakit anda
kepikbesar,dong apa saya tekan tugas rumah kalau begitu
kepikbesar,lulus botol aneh
kepikbesar,saudara syena saudara bima itu emas
kepikbesar,tidak sahur kerja usul teliti dengar jadi mcd sarinah sumpah untuk allah mereka rusak saya seluruh hari
kepikbesar,tadi malam ngumpul mcd sarinah saya sumpahin otak hilang sayang mcd sih saya benar gila nya ngadain ramai seperti begitu tahu psb tidak alat kelamin
kepikbesar,aduh twt ulang tahun
kepikbesar,punya twt tidak mau kasih saya harga user tambah ini
kepikbesar,baru saja baca utas modus curi seperti gin
kepikbesar,abu
kepikbesar,sama seperti saya bayangin saudara laki onomatopoeia mahir sekali
kepikbesar,senang hatek euy
kepikbesar,selalu ingat kita ini cara
kepikbesar,ada sudah bahas pikir apa bahas ujung diri yang hilang bilang tidak apa apa
kepikbesar,sebuah ba eng sebuah sa
kepikbesar,sajen
kepikbesar,keliatanya buntel oren ngambek pengirim tiati caplok tawa
kepikbesar,kemarin orang malaysia banyak atas surat malaysia kalau tidak salah saya juga kurang tahu
kepikbesar,magosh aplikasi itu buat toefl siap
kepikbesar,benar tapi di least sudah kena pidana
kepikbesar,benar tidak mslh cari kriteria pasang yang pintar banyak orang juga pasti seperti begitu salah karena underestimated pria pikir pria tidak bisa sukses banyak jalan roma kalau memang sayang ibu bantu kecuali ngeyel tidak mau usaha cerita
kepikbesar,oke tonton kalau sudah gratis terimakasih
kepikbesar,semoga tidak sebar video juga tidak tega lihat
kepikbesar,drama korea bom tonton baik catat
kepikbesar,sedih kenang indah di main daftar
kepikbesar,mari peluk
kepikbesar,cemburu itu keras untuk saya untuk ucap saya cemburu dari itu cara anda baca senang tanpa saya
kepikbesar,aduh pakai baju sapa itu
kepikbesar,saran tonton tidak bosan malas kerja tugas
kepikbesar,cemil tidak ilmu si
kepikbesar,dokter kasi lihat kucing terimakasih dokter
kepikbesar,bisa bantu awam seperti gin takut salah cepat sembuh meng
kepikbesar,sok biadab mana ini buka chef memang sudah ya menurut pendapat saya
kepikbesar,tugas tidak puasa tidak lihat sekali beda kemarin tidak puasa kerja tugas dari pagi sampai buka sudah puasa kerja tugas macet
kepikbesar,khusyu sekali tidur
kepikbesar,gadis ngapel
kepikbesar,twt sayang tidak lapor tidak false informasi banyak sekali sebar berita palsu twt
kepikbesar,tolong sos sudah bosan hai nyanyi saya yang lelah michael lawak
kepikbesar,lemme tahu
kepikbesar,maaf nimbrung pernah baca hamil ngidam karena tubuh suatu zat badan semacem kirim sinyal kalau badan lagi butuh buat menuhin butuh bada tapi sih nyimpulinya ngidam
kepikbesar,tuman cemil nanas lidah ada ledes
kepikbesar,anak krekelan
kepikbesar,teman pacar
kepikbesar,kalau sih bilang oiya saya editin terus tidak kirim sisain nim saja lain kosong lupa tambahin catat saya undur diri jadi gadis anda kerjain ndiri
kepikbesar,tawa dakjal
kepikbesar,bilang lagi tidak mau tempat sampah ini kucing saya
kepikbesar,hwa sa gorjes
kepikbesar,rata kalau bantu begitu juga data kepala rumah tangga doa semoga beri mudah saudara
kepikbesar,pengirim maaf maksud saya prihatin saya dapat info dan kalau pengirim domisili jabodetabek sekali kontak nomor tera semoga bantu sehat keluarga
kepikbesar,ayo semangat tidak usah mendengarkan yang suka cerewet kalau kampus hormat lihat anak pg paud yang lagi ajar bisa sabar kreatif tawa
kepikbesar,aspek dasar yang dibutuhin ajar waktu anak paud sudah tidak usah cerewet biadab kalau tidak tahu susah ajar bom tahu rasa ajar anak malah yang gerogi anak pg paud tidak usah minder hebat
kepikbesar,guru paud ajar anak agar dapat rangsang buat besar kalau ajar anak sampai sama tinggal ajar materi sudah tahu yang bnr salah ajar anak justru anda salah murid salah harus kuliah pg paud agar ilmu
kepikbesar,hai tolong mulut yang suka cerewet begitu jadi guru paud itu susah sok coba ajar harus siap banyak media tarik warna warni agar anak tidak bosan belum lagi anak itu masih susah dapat arah saya yang anak didik ajar usia seperti itu yang krusial
kepikbesar,titik tanggal merah deadline
kepikbesar,sial pena saya gelplak mulut brisik
kepikbesar,tidak salah saya blok akun pacar hidup julid
kepikbesar,semoga baik mengnya
kepikbesar,sebentar sebentar saya ketawa sedih
kepikbesar,ada ilmu bajing tidak usah cocokologi hanya hidup anda nyusahin
kepikbesar,periksa luka tidak kalau tidak ada coba pijit pelan hasil
kepikbesar,seperti anak tiup kalau habis jatuh
kepikbesar,paksa saja kolong terus mulut kalau busa putar kasih kelapa muda cepat sembuh meng
kepikbesar,tahu sibuk game couturier tidak dimainin sabar sayang diselesain tugas agar tenang bisa desain baju yang bagus
kepikbesar,saling paham buat rp indikator rp bagaimana ya
kepikbesar,nerbener menstruasi pertama lezatos sekali kram gel lemas
kepikbesar,mau beli layang takut muka anda galak dek
kepikbesar,buru bersihin pakai kain bada
kepikbesar,putar mata bada pakai air hangat kasih cemil minum tempat hangat tidur terimakasih pengirim
kepikbesar,benar tayo dia gemas
kepikbesar,kucing dulu si foto sama oren yang mata sedih ayo ngaku bukan
kepikbesar,adoh humoris sekali
kepikbesar,saya pria minci maafin
kepikbesar,mukaya seperti espanol begitu bapak suka bawa pistol
kepikbesar,muka cocok sekali dinamain alvonso
kepikbesar,nasib kucing bulu item
kepikbesar,tidak repot kalau malam meng kalian tidak lihat tawa
kepikbesar,saya yang kandang gogok
kepikbesar,sudah lelah suruh nombok astaga tenang hidup seperti begitu suka nyolong
kepikbesar,baik humoris sekali
kepikbesar,seperti istri tidak gigi
kepikbesar,anda pecel lele pese ayam baik goreng ayam rumah pecel lele untuk hidup
kepikbesar,tuhan surgical topeng boleh tim medis
kepikbesar,mosok sih
kepikbesar,campurin basah makan pengirim kalau nanti kesana takar kering makan lebih dari basah makan
kepikbesar,ikut mutualan
kepikbesar,ayo mutualan
kepikbesar,yic benar rada hambar banding yakult saya yakult
kepikbesar,buat look peduli tidak
kepikbesar,kucing pacar kasih jadi gembwul
kepikbesar,kapas tidak berudul lidah suka nempel tidak kalau kapas kyknya tidak apa apa kalau memang kecil rindu induk
kepikbesar,baik saya tonton hwasa
kepikbesar,kenang kenang saya taroh saja
kepikbesar,hua terimakasih saudara
kepikbesar,sudah temu ncep
kepikbesar,lihat resep ayam sihlin ncep yak tidak temu euy
kepikbesar,semoga lancar usaha
kepikbesar,sebentar napas tidak kalau peluk cing
kepikbesar,kasi saya suka nontonin natgeo sedih benar seperti lihat
kepikbesar,ciri mahasiswa tidak mau ajar dongo gblg sudah begitu tidak mau usaha ken nilai bagus
kepikbesar,nahkan sedih
kepikbesar,di periksa sih seperti kemarin lagi seperti gin dokter gigi tidak praktek kalau tidak gawat sekali desak
kepikbesar,kasih kardus tolong dialasin kain taruh di tidak usah bawa kasih cemil minum
kepikbesar,listnya tidak kalau boleh lihat
kepikbesar,benar umur hidup saja
kepikbesar,saling yang jual spotify rep
kepikbesar,saya marah sekali ini
kepikbesar,ya
kepikbesar,gemas saudara wanita ayo mutualan
kepikbesar,lihat bibit barbar mok barbar kah
kepikbesar,klaim ros bungkus nasi doang et
