username,tweet
firstyfelanda,itu kejar dari hapynes
firstyfelanda,lately ngetwet disimpen konsep baru sebentar di pos langsung tweet kayak mcd baru saja saja typonya
firstyfelanda,butuh menu italian makan yang layak utama pasta tolong ayo cipta sabar tunggu
firstyfelanda,spaghetinya mcd sih enak punya fast makan tetangga tapi dibandingin punya restoran yang memang based italian makan masih kalah
firstyfelanda,sampai mcd keluar menu italian makan pasta kondisi gin pasti pergi saya
firstyfelanda,akhir cemil mcd tanggal februari ingat sekali ini tangalnya mcflury yang warna warni saja belum coba bagai tidak resmi duta mcd gagal
firstyfelanda,senang fakta corona sudah tidak cemil mcd loh drivethru malas pergi buat kesana terus bawa pulang baik cemil tempat kalau cemil tempat tidak ya kalau kirim kurang suka biasa sudah dingin
firstyfelanda,mcd japanase makan iya tolong
firstyfelanda,rasa suatu senang in itu air taman sari yogyakarta
firstyfelanda,lurus untuk neraka chilling adventures dari sabrina kecil braver uncontrollably fond drama korea lagu penuh english
firstyfelanda,jembatan untuk terabithia
firstyfelanda,buka rugi operasional besar tutup tidak pasu serba salah sudah sabar tunggu bioskop buka semoga pandemi cepat selesai amin
firstyfelanda,bioskop bantu jual cemil pesawat tapi pandemi gin kayak lebih rasa aman tidak jajan lagi kursi karena dijarakin tentu isi juga pesawat yang nekat bawa pax tapi jelas rugi tidak
firstyfelanda,pertanyanku hari pikir bisa itu duduk kasih jarak kayak pesawat terus teringat oiya lupa bisnis sama kayak pesawat untung datang jumlah kursi yang penuh seatnya malah sebentar rugi operasional serba salah
firstyfelanda,jadi benar mereka hidup sedih dan sedih hidup dijelasin kayak juga tidak ubah kayak gin ini
firstyfelanda,tolong tell chanyeol itu dia did sangat baik kerja
firstyfelanda,mv gemesin tidak walaupun layar recordku salah tidak benar suara tidak apa apa saya pos saja tawa suara chanyeol sayup kedengeran
firstyfelanda,bagi chanyeolnya seuprit iya  cuma featuring doang lambat santai begitu lagu mv lee sunhe anbu prestasi chanyeol via
firstyfelanda,coba bedain komentar orang sayang ini
firstyfelanda,loh tidak semangat kan yang salah memang nyemangatin sendiri heran itu kalau instagram panen kayak gin tidak kenal juga
firstyfelanda,kembali untuk itu masa depan iya tuhan terimakasih anda
firstyfelanda,saya favorit televisi seri pernah
firstyfelanda,jika ini adalah akan jadi gosip gadis reboot dengan itu asli casts saya akan jadi itu happiest gadis nyala bumi
firstyfelanda,saya tidak pindah haluan jual utama tetap jalan products
firstyfelanda,kadang takut soal kayak periksa keluar shopee buka rekening begitu sudah hubung uang kepercayan tawa benar loh cuma jail jawabin yang saja tidak pakai maksa suruh beli buat
firstyfelanda,dalam edisi kejut ini adalah sekarang hashtag tidak saya itu sengaja promosin yang pekerjaan saya kantor jalan hotel restoran ekspedisi jarang sebut any brand untuk maju medsosku kecuali mcd tidak tweet menfes tawa
firstyfelanda,komplit sekali info tawa terimakasih info sebentar saya coba
firstyfelanda,lari susah ijinya saya hampir pingsan jalan tidak lari
firstyfelanda,ken keliling pakai sepeda kayak tapi tidak naik sepeda bosan olahraga di rumah
firstyfelanda,pos foto diri canda itu matches milik anda kepribadian
firstyfelanda,untung baca balas an tweet tidak cumi rumah sudah habis
firstyfelanda,manusia siapa collects manis photos dan videos dari dia dan his istri seperti ini dan taruh itu semua together nyala video dengan taylor swifts lagu in itu kembali adalah jadi lucu tawa beri anda saya hormat tuan
firstyfelanda,minum madu seperti ini tawa
firstyfelanda,lagi
firstyfelanda,iya tuhan bisa pelihara alpaca
firstyfelanda,sah blonde
firstyfelanda,oma sekali iya ampun rindu
firstyfelanda,tidak bisa bayang jika tumbuh atas in somewhere else dimana mcd adalah tidak ada saya seluruh hidup akan jadi beda
firstyfelanda,baca balas an tweet jadi syukur punya mcd zona hak istimewa
firstyfelanda,loh tapi sama
firstyfelanda,warna tanggal lahir biru
firstyfelanda,percaya tidak obrol kasih tahu orang obrol terus orang obrol kasih tahu orang di obrol didnt harap itu anyone akan bicara tentang saya dan spreading itu berita jadi fast tawa omong omong obrol kemarenan tidak baru satu
firstyfelanda,gemas sekali pada peduli padahal yang tahu orang rumah kantor doang loh tangis sayang sekali
firstyfelanda,mcd alas lapar saya saudara wanita favorit utama prosotan utama senang mealnya belum lengkap ibu mau french fries kan agar tukang becak yang nganter ke mcd mcd dapat uang cara harfiah ucap ini iya tuhan tawa
firstyfelanda,dulu waktu juga kalau minta cuma beda tidak buat pt sih
firstyfelanda,senang ulang tahun
firstyfelanda,dari gitar jl ikan piranha langananku tahun an cocok sekali dari prasodjo sawojajar juga
firstyfelanda,sudah istirahatin yogyakarta makan bulan saya orang yogyakarta benar
firstyfelanda,heran foto lain lho yang capai banyak foto di yogyakarta
firstyfelanda,omong omong tadi perumpaman minggu pasang foto libur padahal ada pasang foto masa kecil throwback foto tidak lebaran halowen lain tidak juga minggu pasang lololol pikir stok foto aman tapi tetap jalan lah
firstyfelanda,sudah tebak ya sumbang foto darimana saja zona istimewa
firstyfelanda,jelek adan tahun buat tidak jalan sekali tolong tidak syukur stok foto aman sampai tahun depan
firstyfelanda,bagaimana saya tidak virgo dan tidak punya any virgo in saya grafik tapi kenapa yang kayak gin pakai dijadwalin
firstyfelanda,gemas sekali foto lebaran nyempil tidak teman sebar gara reschedule tawa sabar sabar
firstyfelanda,satu lain masuk dadak sosial media detox ive telah doing harus reschedule jadwal pos makan instagram sudah atur rapi sampai september foto sudah tinggal retouch sudah tidak apa apa ada waktu ganti tema foto
firstyfelanda,tapi anda tahu apa saya cat hanya meowed benar in depan dari saya telinga sambil saya tidur rasa betrayed tawa
firstyfelanda,ken toilet kucing tidur deketku tidak berani kenapa in soal saya bangun kasur kucing sebentar bangun tawa ada kayak anak bayi
firstyfelanda,apa apa coba tawa
firstyfelanda,sudah waktu tahun tantang
firstyfelanda,kalau splurging cemil bola baik restonya five bintang hotel cemil enak layan viewnya tidak kalah bagus kalau cadang ke ya
firstyfelanda,tahu jadi kayak gin itu pantai klub tinggi kelas kafe restoran di bola
firstyfelanda,terimakasih anda untuk itu jenis kata nin
firstyfelanda,saya genuinely oke meskipun jika saya jadi diam locked saya rekening dan tidak pos apa pun anda tahu ini adalah semua hanya bagi dari saya sosial media detox
firstyfelanda,saking tidak bahan di pos throwback daripada pikir kenapa malu apa dunia sudah hidup in
firstyfelanda,buat sungguh punya untuk pos suatu untuk bukti itu saya oke
firstyfelanda,kena anda bayi menang anda bayi kena anda
firstyfelanda,kemarin mau ngetwet tapi tidak cuma di konsep doang dingetin
firstyfelanda,pcys yang lain colab saya jadi kati
firstyfelanda,sejak saya tidur schedule adalah kacau saya dreams has telah aneh ketika woke atas tidak bisa henti pikir tentang bagaimana aneh itu adalah
firstyfelanda,eh ide pavinganya humoris ini tidak monoton jadi artsy
firstyfelanda,syukur
firstyfelanda,terimakasih anda masternim untuk semua dari milik anda hardwork anda yang saya favorit fansite senang anniversary dan chanyeol loves anda
firstyfelanda,tolong tolong jadi baik june
firstyfelanda,selamat yang jalan
firstyfelanda,tidak tahu warna pantone loh pantas saja
firstyfelanda,saya wondering kenapa itu seems seperti bisa hubung untuk pantone warna every tahun ingat ketika ini adalah itu warna adalah hidup karang dan somehow bisa hubung untuk itu hanya seperti ini tahun warna klasik biru
firstyfelanda,iya tuhan saya jadi lambat tapi itu pantone warna adalah klasik biru
firstyfelanda,iya tuhan maloe tawa efek rekam asli ibu beda terimakasih anda nin
firstyfelanda,tidak tidur tidak ngantuk warna napas tumben
firstyfelanda,saya tidur schedule adalah kacau in itu akhir hours hanya slept untuk hours
firstyfelanda,amin amin ayo semangat cathy bisa
firstyfelanda,si saudara laki bule yang sabar cath kalian suruh istirahat terus tidak sudah siap disatuin
firstyfelanda,lucu sama capa ini
firstyfelanda,situ seni
firstyfelanda,insomnia adalah itu buruk
firstyfelanda,setuju jam felan tidur
firstyfelanda,bagaimana buat voiceover gin susah ya
firstyfelanda,pikir saya bakat buat podcast kayak saudara wanita rintik
firstyfelanda,senang st ulang tahun ajawi saya sayang di buka tidak dengar suara ghaib
firstyfelanda,bisa estetis koranya buat kayak gin tempel datar begitu terus satu sisi bik semua toko baju yogyakarta di zona taman sari sederhana effortless sekali kan sampai saya foto
firstyfelanda,semoga cepat ya semangat
firstyfelanda,psb sudah selesai
firstyfelanda,tawa tidak deng canda bagi ken covidnya pergi tidak canda sudah ayo pandemi
firstyfelanda,sayang in soal yang sayang sebentar pergi
firstyfelanda,nina tayang maci sekali anda yang itu terbaik memang mwa mwa
firstyfelanda,sudah batal periksa keluar mes yang tidak amat waktu diskon besar an uang advisor dan saya bank akun harus jadi jadi bangga dari saya
firstyfelanda,iya ampun pernah acak ken jajan fitbar tidak terbang kalau tidak salah yang jual cuma tidak qg doang lelah maskapai harus jual juga
firstyfelanda,kejut keren ini besar jendela adalah terus gantung baju gemas sekali di pojok tiru di kamar gantung baju yang pakai
firstyfelanda,sudah minggu tidak buka netflix target minimal tidak netflix dan dingin bisa
firstyfelanda,oi sekali tidur
firstyfelanda,langit bagus
firstyfelanda,saya
firstyfelanda,yang lepas prequelnya ya mockingjay bagi ibu sudah lepas kapan tahu
firstyfelanda,sisi kerja felan sales langgan layan bank yang selubung banyak lho yang buka rekening gara saya bilangin sayang tidak sempat saya kasih kode referral tawa jenius mandiri bca tidak ken kasih thr sales cs selubung ini
firstyfelanda,kobes favorit titik nyala saya tempat tidur
firstyfelanda,ya
firstyfelanda,tidak tahu berapa ini hasil browsing gin suku bunga
firstyfelanda,buat bank dapat sertifikat begitu tapi pencairanya tidak ke bank mobil ke rekening di foto sekarang tapi daftar mandiri online tidak sertifikat sekarang juga langsung dibatalin sampai mobil rekening uang dulu tidak tahu
firstyfelanda,halal bihalal sama bca
firstyfelanda,waktu sih tidak cair tidak kayak begitu masuk rekening sama
firstyfelanda,waktu tidak ke bank langsung cair ke rekening
firstyfelanda,hanya untuk informasi anda jarang use modal surat utama in itu tengah dari kalimat
firstyfelanda,iya tuju profesor in uang heist adalah pintar satu tapi untuk jadi jujur tidak satu adalah akan kalah spencer reid in pidana minds dia isnt hanya pintar dia adalah jenius ken sekali otak kayak
firstyfelanda,tapi asli cantik
firstyfelanda,iya tuhan nina jadi pwety
firstyfelanda,berani underlined
firstyfelanda,zoey cinta semua saya former dan arus cats sama tapi jika harus pilih saya most favorit ini adalah akan jadi bayi zoey dan kobe
firstyfelanda,baca begini nang teringat waktu zoey mati sedih tidak karuan
firstyfelanda,catat kalau orang biasa ibu tidak susah dipikirin
firstyfelanda,perbarui cerita yang benar normal saya pikir ya tidak maksud apa juga aduh gara sore habis lihat cerita doang bisa sampai pikir gin
firstyfelanda,such suasana hati
firstyfelanda,baru baik lagu waspada baekhyun permen mv via
firstyfelanda,salam sudah maafin sudah dimafin malang
firstyfelanda,doing eid dandan dengan saya saudara wanita dan ini daftar putar jadi played in itu latar belakang adalah jadi senang
firstyfelanda,jadi bahkan jika ada tidak corona wouldnt jadi able pergi untuk itu mesjid either saya tentu allah buat itu jadi tidak akan jadi sedih itu punya untuk hilang itu doa allah adalah jadi baik benar
firstyfelanda,every tahun saya praying untuk tidak punya periode sekitar eid jadi bisa doa untuk itu mesjid karena cinta itu doa jadi banyak jadi benci ini corona situasi karena tidak bisa buat saya favorit doa tapi untuk itu pertama waktu in jadi banyak tahun punya periode in itu waktu untuk eid
firstyfelanda,eid doa in itu mesjid adalah saya favorit doa pernah itu ambience adalah beda dan cinta itu untuk informasi anda cinta untuk buat every prayers di rumah karena tidak seperti praying in publik jadi bisa punya pribadi waktu dengan allah except untuk eid doa tapi punya untuk hilang todays eid doa
firstyfelanda,senang eid al fitr semua orang
firstyfelanda,tahu begitu sen kemarin hampers humoris yang kayak saya sekali yaudalah tidak apa apa syukur untung dapat
firstyfelanda,dada sekali tidak tahu akan dikirimin tidak kalau tidak kirim maksud hati kirim kue lebaran yang humoris tapi hubung nelfon toko roti malang raya sudah jual keluar hampir tutup jadi ubah cari hampers
firstyfelanda,balada cari hampers lebaran telepon cari hampers yang siap obrol jual di untung sekali masih sisa yang siap tidak sampai jam sudah selesai urus hampers an
firstyfelanda,hari ramadhan tahun syukur pernah siang sahur walaupun tidak tidak puasa tetap sahur omong omong
firstyfelanda,malu tan kalau memang sudah takdir ujung kenapa kayak sama saudara laki yang tidak sangka sudah lamar
firstyfelanda,cont saya maaf jika saya tweet doesnt correlate dengan itu berita sudah hanya cara sederhana correcting apa mereka ucap jadi itu tidak akan jadi lagi in itu masa depan karena jakpost adalah satu dari saya favorit berita sumber punya nice hari
firstyfelanda,cont sejak jakpost adalah berita sumber yaitu cara itu shouldve telah based oleh fakta tidak hanya tentang itu berita tapi semua itu rincian in itu berita isnt itu itu wartawan shouldve telah teliti itu exact lokasi pertama cont
firstyfelanda,tentu tapi sudah correcting apa mereka ucap tentang berapa dari itu temples mereka mentioned located in pusat java mentioned in itu tweet dan in itu artikel sebagai jadi yaitu in fakta berapa dari itu adalah in yogyakarta cont
firstyfelanda,hari ini adalah itu akhir hari pergi untuk itu kantor belum itu eid libur ayo semangat
firstyfelanda,sudah talking tentang itu temples benar tidak itu jalan masuk iya saya tentu
firstyfelanda,rumah
firstyfelanda,baru saja cerita sahabat saya anda dan rasa senang mereka ucap saya sparks adalah beda ketika tell mereka tentang anda avoided any pria karena saya asa doesnt seperti itu except anda lihat bagaimana nyata itu adalah itu terasa jadi nice ketika ini adalah tentang anda saya asa knows ini adalah rumah
firstyfelanda,benar lho peras tidak bohong jaga peras tahu rumah awal sempat ragu felingku nyata tidak cara masih gin tidak ketemu tidak bisa kenal lagi sekarang sekali ini asa adalah nyata itu flows jadi tentu saja
firstyfelanda,kejut tweet ledak cuma jail pikir balas tweet penuh rentan anku jam pagi
firstyfelanda,tahu saja saya pakai simbol cinta yang juga buat nunjukin sayang sama kayak yang merah lebih spesifik warna biru
firstyfelanda,senang ulang tahun kita pimpin nim suho terimakasih anda untuk taking peduli dari itu kelompok anda yang hebat pimpin itu boys dan exo ls adalah bangga punya anda sebagai exos pimpin cepetan dari wajib militer
firstyfelanda,tapi prambanan dan ratu boko temples adalah in yogyakarta tidak in pusat java
firstyfelanda,mobil rekening tidak dulu coba yang tahun
firstyfelanda,yang digengam erat sesak yang mengengam yang digengam juga yang lepas kalau milik akan kenapa bebasin peras yang tulus tidak akan pernah bohong tahu rumah harus jaga terus
firstyfelanda,kali tidak puasa tetap ikut sahur tidak cemil maghrib rada malas kalau cemil
firstyfelanda,dingin sebagai anda pesona perfectly baik jantung selamanya dan selalu putih kuda itu cara loved anda semua juga jadi gaya ini cinta getaway mobil crazier kasih kembali untuk december cornelia jalan mati oleh ribu cuts kita kosong ruang
firstyfelanda,tapi heres songs dari itu anda harus dengar semua has ubah cinta cerita bersih tak kenal takut teardrops nyala saya gitar itu saat knew hampir buat anda yang tidak maaf itu cerita dari kita kertas rings datang kembali jadi disini anda bong dengan saya
firstyfelanda,orang siapa knows taylor swifts songs orang siapa knows taylor swifts songs dan did ini manis kecil benda untuk his gadis tapi orang siapa saya pada tapi mungkin tidak tahu any dari taylor swifts songs masih dapat karena
firstyfelanda,cemilan sehat
firstyfelanda,belum coba kayak begitu di aplikasi mandiri online tidak pilih panjang begitu kayak sudah pilih tahun dikelarin tahun lanjut periode pilih yang tahun bisa langsung urus bank tidak tahu ya
firstyfelanda,halloo trm beda sama axa axa usah asuransi mandiri trm bank mandiri begitu aman kalau trm sudah coba tes waktu yang tahun benar uang lagi rekening tahun pun saya masih pakai trm
firstyfelanda,tenang kartu buat nabung teman teman klarifikasi ada yang negatif pikir
firstyfelanda,tiap buka rekening buat cc saudara wanita kartu kayak bagaimana tidak cuma kan yang pilih jenis rekening gantung kartu
firstyfelanda,hua dulu ngincer kartu xpresi bca yang humoris tapi tidak sempat hanya buat terus tidak tahu orang bca datang kantor mobil di jalan kantor demi kartu tawa monmap itu budak cinta kartu
firstyfelanda,saran ini buat didik mandiri tabung rencana autodebet bik dari mandiri online terus bisa pilih tujuanya kayak foto sudah ngetest yang jangka tahun jadi terus rekomendasi
firstyfelanda,ngototnya juara bilang tidak masih lagi tidak saya tidak saja begitu ya tetap nawarin tawa sekarang suka tidak aman yang nelfon nomor saya ini ax kalau ax tidak minat yah
firstyfelanda,yamplop saya sekali ditelfonin mereka nawarin asuransi alas harga cc saya lancar pikir harga tapi suruh bayar premi kalau tidak angkat ditelfon kali pagi kali sore angkat ngomongnya super cepat sampai heran nafas bagaimana
firstyfelanda,ini adalah indeed keras waktu untuk semua dari kita ayo hanya harap untuk itu terbaik saya prayers goes untuk semua dari kita
firstyfelanda,sudah itu lelah pm dan sudah jatuh tidur woke atas ini pagi untuk sahur dan itu rasa jadi baik
firstyfelanda,prinsip nomor pakai kredit kartu cc tidak hutang tidak billing nyata harus bayar penuh celaka tempo tidak paid in minimum bayar takut semua cc saya syukur lancar tidak berani buat belanja yang tidak butuh biaya aman
firstyfelanda,sudah kebal tanya kayak gin saya diemin doang sambil ketawa terus pergi eh habis mereka tanyain ibu ayah jadi tidak saya
firstyfelanda,psb hari ayo semangat ayo
firstyfelanda,puasa media sosial sekali
firstyfelanda,buat bumi baik tolong tidak sembunyi milik anda sihir coban rondo malang jawa timur
firstyfelanda,had nice hari terimakasih
firstyfelanda,ambil peduli kita sayang suho exo ls akan hilang anda untuk tentu
firstyfelanda,malu maci tanti
firstyfelanda,bahahaha semoga senang akhir orang yang di waktu yang tan
firstyfelanda,dulu jaman sampai menikah lucu asiknya senang akhir tawa amin senang ya tan
firstyfelanda,cie langeng ya tan si saudara laki
firstyfelanda,saya tidak bukan ramadhan jarang sekali tidak malah balas obrol jam pagi sudah bangun baca chatnya otak suka kacau takut ngomongnya macam jam lagi rentan sekali saya pikir adalah nyata
firstyfelanda,kejut pagi sudah pikir otak panas jam gin tawa saya pikir lebih biasa adalah kinda useful pikir
firstyfelanda,jt pisah dana darurat usaha simpan pinjam mereka butuh modal buat mulai kembang usaha syariah mau tabung investasi tidak paham investasi ajar banyak jenis investasi cuma saham cari yang cocok yang
firstyfelanda,majikan saya akur
firstyfelanda,batik keris bateq itu banyak baju batik pasang
firstyfelanda,rindu tonton film bioskop
firstyfelanda,tidak pakai berapa oleh mie fuschiaskincare instagram jual dan sudah asli soal langanan beli itu biasa dan memang asli produk dari malang jadi ongkirnya tidak mahal
firstyfelanda,iya ampun ingat salah episode itu baik tempat yang kayak gin
firstyfelanda,apa anda pilih dan apa anda sacrifice itu depends nyala bagaimana milik anda moral milik anda jantung milik anda pikir dan milik anda logika kerja together untuk buat itu putus
firstyfelanda,pantas saja beda agama rumit orang yang iman beda ilmu prinsip imanya yang susah nyatuinya sejak itu yang cari orang yang nerima prinsip saja lelah cemil hati sama yang beda prinsip
firstyfelanda,yang kayak gin tidak ketemu tengah susah alam sudah usaha bisa ketemu tengah eh tetap dorong saya untuk pergi untuk his sisi nanti penuh jala tawa tidak lah sama juang ini saya doang
firstyfelanda,tidak panas malah nyaman pakai tidur tidak terang luar ruang tapi tetap lihat lebih lihat tidak pakai yang loreal banding yang dalam gelap pakai flash cahaya normal natural cahaya lampu terang omong omong maafin muka tawa
firstyfelanda,serius syukur rambut tidak kering sama kayak di cat beda warna sekarang
firstyfelanda,inalilahi wainailaihi rojiun duka cita saudara laki semoga amal ibadah ibu terima tuhan swt amin
firstyfelanda,maleman selesai cat jam keramas jam pagi besok
firstyfelanda,yogyakarta desember
firstyfelanda,disini hari biasa kurus jeans besar tidak celana gombrong kecuali max tidak apa apa mau otd niat pakai dress rok celana pendek inti lihat jari kaki buat lihat tinggi in saya dapat oiya besar tidak juga pakai datar shoes baik sepatu kets tumit agar terlihat taller
firstyfelanda,saya saudara listened untuk chanyeols baru lagu dan dia asked tentang itu lyrics adalah itu adios bayi dan sudah seperti sakit jadi milik anda bayi
