username,tweet
andiniayu,acak ken kue balok karamel kue bika ambon terus ken cemil ikan laut yang masak ibu sus vlognya yasudahlah mimpi makanya
andiniayu,saya juga begini tris pusing pikir tugas pulang kuliah malam sikat kamar mandi bknya langsung tidur
andiniayu,tahu kalau spotify sync musixmatch bisa floating liris ih ciamik ini
andiniayu,shopenya saudara cocok tanem yang
andiniayu,selalu bicara kalau lihat rumah rumah menteng bagaimana nyapunya mana kalau sudah tua sepi tidak punya tetangga garam habis beli
andiniayu,kalau kompor gas oven yang bagus merk ya saudara
andiniayu,hidup baru normal parno orang ramai banyak cuci gosok karena kseringan ganti baju
andiniayu,jaga lapasnya kan ada yang jaga warga tempat sampah yang obat malu bobok rumah
andiniayu,lebaran tahun rumah tidak kedengeran suara bangun sudah mandi ayo mandi ganti sudah itu
andiniayu,tawa buat buka usaha toko roti bisa itu
andiniayu,beli kerabat beli dapur bantu tawa
andiniayu,saking hari bicara sama orang yang itu lama pandemi ditelfon tugas survei jadi saudara wanita
andiniayu,eucalyptus yl sudah mahal begitu banyak yang beli tawa minyak kayu putih topi lang idolaque
andiniayu,iya saudara
andiniayu,ikan tombro br dgr malu ikan saudara laki ya maksud
andiniayu,ibu andai ajar jenis ikan gin lihat makhluk masuk kurikulum sekolah shg anak sudah akrab dengan laut dari sampai omong kosong kelola laut dengan saya tahu nama jenis ikan laut stlh menikah harus pasar kadang dibongin tkg ikan
andiniayu,buka ini cemil bakwan pontianak sama roti tetfai rekomendasi berkat jastib babang mantap bang tunggu jasa titip menu lain jajan
andiniayu,tawa lempar tiap buka puasa ken macam gara lihat instagram cerita ibu tidak usah kirim an parsel tetap hati
andiniayu,sprite ini sore sore panas gin
andiniayu,lihat media sosial yang pasang ibu hari karena kerja di rumah kadang lupa jadi ingat apa sudah desember nyata ibu hari hari itu beda
andiniayu,ayah nyanyi bareng ini sama pakde
andiniayu,casenya banyak warga sudah jalan hidup normal karena bosan rumah
andiniayu,insta cerita isi pada cemil kue cuci mulut
andiniayu,sudah turun masker niat beli saudara wanita olip kalau pergi seperti kantor begitu trnyata sudah turun indomaret baru sekali saya kesana negh skriner ribu yang kerudung
andiniayu,suka berangan pindahin tugas kota yang beli sayur murah segar begini terus beli ikan segar murah hari
andiniayu,bawan jogjes bel sudah pikir besok mkn bahkan besok lagi cemil ya
andiniayu,sekarang atau tidak pernah
andiniayu,beli dulu bel daripada bawa mimpih
andiniayu,sudah temu ini nu shopee bandung
andiniayu,nu rumput laut yang es
andiniayu,beli rumput laut kering jakarta ya
andiniayu,ngidam bel isi
andiniayu,sudah genep kerja di rumah ken ngebut keliling ringroad bareng ciciks
andiniayu,ayo
andiniayu,dong
andiniayu,kalau ini bunga pohon coklat sudah tahun tahun bertenger wallpaper whatsap
andiniayu,tidak sakit rumah sakit nanyain bagaimana tanemanya rumah sudah siram buah tidak sudah bunga belum yang ditanyain tanemanya beberapa hari ini kamboja jepangnya mekar cantik pa
andiniayu,kantor hukum jl kolonel sugiono jakarta timur bang
andiniayu,kemarin lihat jalan mbatin apa disinfektan jalan di disinfektan jalan aspal juga tidak yang megang pakai tangan
andiniayu,dampak positif wabah corona awan jakarta pusat ini cerah biru rona bumi ingin istirahat
andiniayu,ampun ini nte tidur habis jatuh mobilanya
andiniayu,utama ini tidak tidur tidur tante dian
andiniayu,minggu sampai bosan aktivitas yang nama cemil
andiniayu,neraka sekali kalau benar wabah buat
andiniayu,cerita kerja di rumah atas tahu tahu anak cari ibu ibu dimana adalah anda ibu sayang bagaimana tidak ibu leleh turun tidak jadi kerja di rumah
andiniayu,kenapa gula banyak yang habis supermarket iya nimbun gula di cemilin kerja di rumah
andiniayu,saudara waktu tes alami gejala flu
andiniayu,saya juga tawa
andiniayu,ingin tongseng balung suradal biarawati di
andiniayu,sesunguhnya panik beli masker sama belanja supermarket baik ayce macam shaburi kintan shabujin banyak cemil protein imun kuat
andiniayu,seru jakarta pagi
andiniayu,telah di sana pusing nang nyeri dada nyerin perut cari google sakit jantung klinik asam lambung
andiniayu,whatsapp terimakasih mas info
andiniayu,stasiun cakung stasiun bekas
andiniayu,krl stasiun kranji stasiun bekas aman genang admin operasi normal
andiniayu,benar sekali ketemu jadi diam an kelakar cakap cuaca panas hujan hari
andiniayu,admin sekarang tidak tugas nyala boardnya tugas nyala naik sgt bantu untuk kursi prioritas atur padat tumpang
andiniayu,sekali minggu tonton aruna lidah telat yang bahas sebar virus flu burung kejut ada sebar virus corona perintah cpt tanggap dengan pasang thermo scanner pikir ini modus yang seperti film
andiniayu,minum tolak angin tidak lagi begadang tugas seperti minum vitamin sudah sudah mudah sekali karena murah sudah tidak minum sekarang beli eh ribu dapat sachet ternyta demandnya tinggi karena orang indonesia sakit tolak angin obat
andiniayu,sudah bel jalan jakarta ayo jumpa
andiniayu,kalau saya mangkok pengaruh bang kalau mangkok yang gambar ayam lebih banding mangkok melamin
andiniayu,takut lorot
andiniayu,tidak sadar tanda untuk tj tanda ya larang buka rok wanita di dalam untuk bagaimana
andiniayu,teman saya tahun kesana bel tidak apa apa bel dengan selamat
andiniayu,bahagia mudah tonton tonightshow tawa tawa tawa
andiniayu,tahu saja tahun keluar kepompong ini
andiniayu,tidak libur libur klub
andiniayu,sekali kerabat daster kasih bergo sudah kayak pakai dress
andiniayu,mon peta pajamasnya murah coba pakai daster saudara wanita ornamen bolong ben isis
andiniayu,kali anker mau nang tiba masinis ngerem anker ayun terombang ambing jadi wahana ketawa tiwi dalam gerbong yasudahlah apa nang yang bahagia
andiniayu,saat libur gin enak gaikut macet an leyeh leyeh rumah tonton masak masak voila juga buat ikan kakap bakar
andiniayu,semangat sekali ini tidak sabar ken tahu bagaimana kebijakanya jaman sekarang anak sekolah buku tebel banyak teori banding praktek semangat nadiem
andiniayu,mody juragan kos
andiniayu,ken sekali ayam katsu sampai bain beli fillet ayam entah tidak sempat masak jail coba kimukatsu mak
andiniayu,ajar ajar tidak sen airbnb kalau sekira banyak tanggal vacant lebih baik coba dulu
andiniayu,jail coba airbnb pilih inap nyaman terus reviewnya bagus eh tidak sampek kenapa beda dalam designya old gaya sepi sekali tapi seperti banyak yang liatin alhasil tidak bisa tidur
andiniayu,dikangenin yogyakarta beli cemil jari kaki sampai ngantri
andiniayu,makas saudara
andiniayu,mak semarangan saudara
andiniayu,saudara luncur tempat kejadian perkara
andiniayu,saudara laki luncur tempat kejadian perkara
andiniayu,iya saudara wanita yen belum yogyakarta jadi tidak bisa cari ancang ibu agar mudah saudara wanita
andiniayu,saudara luncur tempat kejadian perkara
andiniayu,jual nasi tim ayam bakmoy yogyakarta ya
andiniayu,eiya teman kantor pada bilang telkomsel lambat sesunguhnya matriks sudah kemarin lambat sekali
andiniayu,pakai matriks indosat ampun sinyal lambat kale
andiniayu,sudah coba darat yia jalan yia kota betul lama yia kota jakarta yogyakarta
andiniayu,hadudu eh hadudu
andiniayu,lempar tk tawa uang uang
andiniayu,otak kusut mendengarkan ar rahmanya mishary rasyid eh ada penelitianya
andiniayu,hamil tidak lihat pipi gembung hft
andiniayu,panas panas musim panas
andiniayu,cita cita guru tk sulit wujud
andiniayu,gemas sekali lihat poster selamat sakti pancasila instagramnya pres hai hai dia wanita baju merah saja tim kreatif sirat pesan
andiniayu,oyasumi
andiniayu,tiada maaf saudara
andiniayu,indosat aktif nomor indosat yang sudah non aktif bulan bagaimana iya ampun lupa isi pulsa
andiniayu,enak sekali keju juara admin
andiniayu,jurnal teliti akuntansi indonesia jrai pakai bule cir yogyakarta domisili insya tuhan saya saudara laki email kontak
andiniayu,teh kue balok jadi ken
andiniayu,ajar saudara laki sekolah jual permen gulali bentuk
andiniayu,buru undur diri ngelamar sampai dengan saja ngajarin lagu mahir pikir
andiniayu,yoayo yang cuti mulai hari kamis harga tiket pesawat benar sudah turun
andiniayu,waktu sholat dengar lagu bayi hiu aduh nyanyi
andiniayu,na ini yang buat tiket mahal
andiniayu,loli saya pernah seperti begitu hantu jaman sekarang melek teknologi kesal
andiniayu,oyasumi
andiniayu,rindu yogyakarta tiket com ada promosi diskon tiket pesawat tanpa minimum beli
andiniayu,rindu orang yang dapat lagi anda temu doa perjumpan mimpi jadi obat
andiniayu,selera admin mantap ini sate padang rumah makan siti nurbayanya maknyus
andiniayu,acak cari grabfod adak cuma sayang tidak menu sate padang luncur mes
andiniayu,kalau anak kalau jatuh kejedut bilang dinding nakal ya begini ini
andiniayu,mau
andiniayu,warbiyasak tiket pesawat harga cari celah harga murah tetap ada syok
andiniayu,matahari bel cakep
andiniayu,thr belum cair online pasar sudah racun ramai sekhale diskon tokopedia
andiniayu,ikut grup jual cemil organik yasalam daging sapi yang harga lipat dari harga pasar ban kaldu sapi ban langsung jual keluar singkong jual dari harga pasar organik kalau gin saya jadi ingin tanggal desa jual sama ibu di grup
andiniayu,masak cemil beli cemil juga cemil rindu masak nasi goreng bisa lahap habis
andiniayu,tim maksud bagi tagih orang faktur saya sudah hubung cs via wasap telp email belum yang responsif bantuanya via pesan langsung ya
andiniayu,siap mantengin airasia yang rambah sebagai online jalan agen ide biasa dengan diskon diskon tarik
andiniayu,tahu di era telepon dagang in telepon jadi telepon kalau tahu hapenya dihargain periksa pakai apps tutamera apsnya langsung ambil data dalam henfon ada several uji perangkat telepon
andiniayu,ini gojek driverny gadis masih muda wangi lagi begitu lihat pk cincin kawin spnjang prjlnan lebih suka tidak tanya kenapa jadi ojek online ada alsn kuat sampai turun jalan eh tidak hobi kalau jadi laki ingin bicara menikah sama aa ayo
andiniayu,racun
andiniayu,oyasumi
andiniayu,kira siput hewan imut layak gary spongebob nyata cem zombie
andiniayu,ayo eh buka lagi ausie sudah pulang
andiniayu,bunga bunga tam haha
andiniayu,pumping publik tempat lagi nyusuin saudara wanita kalau sedot kering lho senyum malu anak berapa bulan oo ya netijen kadang suka simpul ckckck
andiniayu,tonton anak ngapak polapike youtube sudah omong kosong ketawa cekikik selera humor receh
andiniayu,tahu
andiniayu,bau kentang goreng malam itu tanda
andiniayu,oleng kira jakarta lagi
andiniayu,pindah jakarta lagi bi
andiniayu,minum teh stroberi eh sudah februari
andiniayu,boleh juga cari filmya tonton besok smbil pumping
andiniayu,tawa sekali
andiniayu,saya juga ngalamin begitu rute putar sekali tarif mahal
andiniayu,perkara batal batal mes ojek online seperti orang pacar yang lagi hangat terus mw nutup telepon bang ojek online saudara wanita yang duluan batal saudara laki yang duluan saudara wanita duluan saya tangguh saudara laki duluan sya susah dapat ojek online lagi ros
andiniayu,apa sdg salah tarif tarif rute jalan jam ini tidak biasa
andiniayu,hari anak utama rumah nama saudara ais nama saudara ais ngeja nama saudara sebuah saya s sambil ngeja nada kesal tawa baique
andiniayu,coba jakarta toko progo seperti yogyakarta swalayan lengkap serba perabot dari yang model tradisional sampai elektronik ada
andiniayu,sama dong beli yang gajelas negh rules ongkirnya kadang gratis ongkir kadang tidak
andiniayu,sekarang kalau belanja online lebih trtarik lazmal dibnding shopee tampil huruf lebih bsar ibu sudah tua tata letak lebih lihat sampai sempat dapat flash jual diskon lebih tapi shopee tetap lihat jadi patok lihat harga
andiniayu,bangun malam terus lihat telepon terus lihat diskon pospak lazada mayan sekali eh eh terus klik klik halaman lain banyak yang gerobak ambil semua saya uang t
andiniayu,gara negh tawa
andiniayu,dari lihat tasya farasya dandanin kekeyi terus nyasar vlog yang rumah masya tuhan terus vlog resepsi nikah yang uwow gaunya meghan markle kalah mari gandeng erat sobat misqin tunggu tanggal saja lama
andiniayu,bagaimana agar tidak ngantuk kalau diboncengin motor anak angin milir dikit langsung merem
andiniayu,coba jual
andiniayu,euphoria asi games buat rakyat indonesia mesra sekali padu dukung indonesia menang mbok gin lho hari tidak tengkar isi berita televisi kemesran tidak cepat
andiniayu,hobi dini utama ludo raja
andiniayu,ayo
andiniayu,obrol di laktasi tidak dari produksi asi kembang anak akhir jadi banding anak yang dan anak yang ugh
andiniayu,prolaktin
andiniayu,tadi malam mimpi tidak kerja tugas matkul bahasa indonesia sama ketinggalan ujianya sampai harus ngulang semester biarpun sedih kutp rindu kuliah yang cuma pikir tugas uji sama besok cemil dimana
andiniayu,bentar lagi juga yang buat gemez tawa malu lancar lancar salin momy
andiniayu,totoro adalah nyata
andiniayu,ketemu orang dengan badan habis lahir kurang bulan cuma ngurus anak seperti keluar dari goa aneh aneh enak
andiniayu,rindu
andiniayu,hibur ibu sederhana pergi indomaret pilih belanja butuh senandung lagu yang setel indomaret
andiniayu,hay gadis utama ayo rasyid agar tidak bingung hilang arah
andiniayu,pernah tj persis dari stasiun cawang tidak halte pinang ranti tapi cari rute trafi ada
andiniayu,admin tanya rute stasiun cawang pinang ranti umpan kalau pagi jam ya
andiniayu,bawain oleole dong
andiniayu,waktu ibu hamil tidak ngidam jadi busui jadi ken cemil itu
andiniayu,malu mbayu makas saudara wanita ayo
andiniayu,saudara wanita anak nempel maknya tinggal samping ada maknya tidak mandi mandi bau sudah tidak karuan
andiniayu,itu harus pindah cepat
andiniayu,kalender libur tidak tangalan merah orang luncur nyusuin
andiniayu,andai rumah sakit ruang tunggu ibu hamil bisa tidur an tunggu antre dari obgyn lebih jam
andiniayu,hamil bisa siang jalan asemka tidak betah diam rumah anak ibu yang doyan keluyur
andiniayu,tawa syukur hasil beli kipas diskon ribu
andiniayu,hay tidak rindu saya gelby sudah makasar oleh
andiniayu,looking terus info diskon admin
andiniayu,coba promosi bukalapak menit kuota kode voucher sudah habis oleh warbiyasak grecepnya
andiniayu,tawa kacruts
andiniayu,ditengokin saudara induksi alami lho
andiniayu,handal kook tawa bisa akun jasa pijat bumilnya tes pacar saya sudah cobak
andiniayu,pijat ibu hamil pergi pijat saudara ke ibu jo ayo tawa
andiniayu,waktu jalan pantai yogyakarta kuliah tidak jalan ramai tengah malam tidur pinggir pantai lihat milkyway sampai dengan baluk jembrana wuhu waktu flies jadi fast
andiniayu,habis lihat film susah sinyal tempat jadi milkyway sumba pikir syukur lihat milkyway sudah kali
andiniayu,ayo
andiniayu,sampai hafal lagu tunggu tapi tidak yang ngangkat baca pos tweet sampai sama ulas google kasus banyak kecewa pakai sampai
andiniayu,saudara parsel dengan tidak resi belum ke terima tapi ket web sudah terima panggil centre j sampai cikande juga tidak yang angkat info lanjutanya
andiniayu,sejak pagi hingga siang panggil centre ada yang apa layan pilih atas bisa
andiniayu,tidak tinggal jakarta nada iklan meikarta
andiniayu,saudara terimakasih fast responsif
andiniayu,saudara tanya jalur kereta yogya jakarta jayakarta premium jalur kena dampak bencana mohon info
andiniayu,lho blitar tren tema
andiniayu,tidak tawa saudara laki nyala lampu lagi genit yang tunggu diperhatin
andiniayu,tivi mati dan belum merem tidur harus bagaimana
andiniayu,sekarang sudah buibu sosmednya srg mampir cokpad voila udang manis pedas
andiniayu,orang ban kendaran pulang rumah sore lebih keri orang demo hari depan monas
andiniayu,suasana terminal terbang lionair tunda tidak info jdwl brkt
andiniayu,ken jalan terus terbang kayak lolong jakarta macet wis tidak keruan
andiniayu,asik sekali sekarang pakai apps trafi tahu trayek angkut umum untuk transjkt krl angkutan umum bisa mantau posisi sudah dimana tidak lagi php
