username,tweet
iqbalpaz,orang punya pikir bunuh saya setuju tweet
iqbalpaz,saran coba konsultasi profesional sudah mengangu fungsi hari sudah kategori gadget addict perlu terapi intervensi psikologis
iqbalpaz,perintah benar segala ya cari uang
iqbalpaz,saya ex didn buat ini bahkan jika ask dia untuk pikir wasn attractive tidak itu tidak dia hanya didn hormat saya
iqbalpaz,sudah kordinasi saudara
iqbalpaz,preferensi orang beda saudara
iqbalpaz,tabu itu ibu ja
iqbalpaz,tidak zomba
iqbalpaz,omong omong anda pulang indonesia tidak tahun tapi jadi
iqbalpaz,dunia abu abu ir benar salah beda tipis
iqbalpaz,ini hubung banyak angkat
iqbalpaz,tes narkoba kalau bredel
iqbalpaz,ajar online ngantuk gilir netflix belo
iqbalpaz,yah sedih
iqbalpaz,netflix haduh bawa earphone tidak
iqbalpaz,sedih
iqbalpaz,tonton alas kenapa memang dari disclaimernya tidak lewat penting sekali beberapa utama punya tendensi bunuh bisa ketriger gara gara tonton
iqbalpaz,tidak buka email wakakak
iqbalpaz,punteun anda seperti orang riung bandung kalau samsat hijau baru ajaib dunia
iqbalpaz,selamat pimpin nago pernikahanya
iqbalpaz,luas sekali sayang kembang garut kota kalau akses pantai kan jadi uang
iqbalpaz,perilaku tunjuk laku caci maki sikap welas asih tidak mampu memafkan sayang terima kasih dokter sempat ajar ini periksa kelas sembuh luka memafkan
iqbalpaz,analisis sih tidak tahu ada motif di cercan seperti ken viral lain yang jelas saya itu tidak malah rugi sendiri orang
iqbalpaz,bukti lihat di twitter isi cercan maki akun ybs tanya buat ngelakuin ybs sudah maaf kalianya yang hati keras tidak maafin lain
iqbalpaz,sedikit tanggap kait isu lagi ramai manusia pasti laku salah adalah kita besar hati terima salah dan memafkan sangkut deh tidak orang
iqbalpaz,tolong bantu
iqbalpaz,seperti retweet dong bang
iqbalpaz,yang cari buku agama islam periksa benang oke
iqbalpaz,saya adalah manusia sudah semua saya buat mistakes
iqbalpaz,benar
iqbalpaz,seperti yang ken resepsi mewah dalih menikah cuma saudara laki saudara wanita saja resepsi mewah coba lihat habis menikah punya uang tidak tidak humoris kalau menikah mewah habis cemil mie hari
iqbalpaz,anda
iqbalpaz,bahagia tanggung masing kale
iqbalpaz,lagi dokter jiemi izin lain bantu kalau nutup pintu bagaimana lain bantu iya sama seperti kunjung rumah pintu buka tidak etis kalau pintu dobrak memang mau nangkep buron
iqbalpaz,benar kalau hidup sudah berat baik cari bantu lain bantu bukan tanda lemah tanda kita bijak sikap tahu bagi susah sekali minta tolong karena alas pun
iqbalpaz,tidak apa apa pria kalau nang pria punya peras omong omong buat nang video adalah bahas suicidality kebunuhdirian pernah masih tendensi arah makanya rutin psikolog bulan
iqbalpaz,pagi pagi sudah nang tonton video terimakasih dokter buat insightnya ini
iqbalpaz,otak ketinggalan
iqbalpaz,sobat sehat buku sudah restock ini pesan langsung kalau tanya buku periksa twitter langsung
iqbalpaz,sesi pimpin colek pimpin
iqbalpaz,admin tolong bantu
iqbalpaz,dia loncat
iqbalpaz,praktik pilih milik anda tarung dokter tidak tanjung argumen orang yang tidak
iqbalpaz,kalau teman ibu sial dengung teh mahal harus piduiteun mun boga dengung ibu
iqbalpaz,tawa mun gelap cokelat ibu tidak karasa dong susu na
iqbalpaz,imbang teh nu maha
iqbalpaz,kalau kalimat dar bagaimana dokter
iqbalpaz,coba jelasin mekanisme situ bayar netflix pakai
iqbalpaz,buku paman sudah siap lho
iqbalpaz,mereka tuhan hingga hak hakim
iqbalpaz,sudah minum obat kadang perlu psikoterapi dokter
iqbalpaz,untung tonton film
iqbalpaz,seperti tempel
iqbalpaz,iya tuhan triplets
iqbalpaz,goreng ja isu agama ibu payu
iqbalpaz,habis yoga lapar haha
iqbalpaz,biasa itu tidak apa apa
iqbalpaz,mau ajar salur emosi baik cara laku tulis hal yang lalu semua saya tulis saya pikir buat buah tulis jadi tulis
iqbalpaz,lagi marah usaha regulasi emosi cara baik dasar alam kalau marah teriak teriak mecahin barang
iqbalpaz,wakakak di rumah fungsi jalan baik
iqbalpaz,buku buku kembang dan psikologi
iqbalpaz,alam pakai ads lagi cari ads yang efektif online toko
iqbalpaz,siap pimpin
iqbalpaz,kelelawar saya ngefans ini
iqbalpaz,nyata pria cuci piring
iqbalpaz,awal ngira dari jepang buat lagu ost satu piece
iqbalpaz,tidak aman tidak punya pasang
iqbalpaz,ya pikir keras baik seperti waktu mental rusa banyak support bisa bangkit itu cara banyak
iqbalpaz,bilang ke teman padahal mental tidak baik
iqbalpaz,kalau whatsapp begini tidak yang tanya tawa
iqbalpaz,ayam katering saya kecil pik
iqbalpaz,nyiram taneman ja
iqbalpaz,teman masuk
iqbalpaz,lagu afi
iqbalpaz,ges dintip pidio keren
iqbalpaz,dari kesan filsafat topik berat awang awang filosofi teras sifat praktis relevan hidup generasi milenial gen masa
iqbalpaz,stoisisme filosofi teras filsafat yunani romawi kuno bisa bantu atas emosi negatif hasil mental tangguh hadap turun hidup
iqbalpaz,tahun buah mazhab filsafat temu akar dan solusi dari banyak emosi negatif
iqbalpaz,saya mikirnya gin beberapa konseling tidak begitu konselor cuma fasilitas untuk tumbuh putus di tangan masing
iqbalpaz,terima kasih saudara
iqbalpaz,saudara tolong bantuanya
iqbalpaz,pesan langsung
iqbalpaz,terpangil
iqbalpaz,edan nyekil
iqbalpaz,kalau penasaran coba tonton polisi
iqbalpaz,konseling kalau nang kadang cerita teman mereka tahu kalau saya juga kadang suka nang tidak saudara wanita doang
iqbalpaz,gin tidak
iqbalpaz,dengan perhati sangkut kalau teman ken nang ya kasih waktu sebentar kalau butuh bantu dia kalian orang bisa bantu akan kontak
iqbalpaz,ngelakuin karena paham nang wajar nang salah cara lampias emosi turut nang itu tidak makanya lama ditemenin tidak teman saya ini nang
iqbalpaz,di bandara ada gadis telepon bilang kalau telepon tante mau nang baik matin telponya nang salah bentuk emosi sangat wajar pernah nyamperin teman lagi nang benar diam mendengarkan nang
iqbalpaz,tidak pakai sikm
iqbalpaz,ner juga
iqbalpaz,sudah tidak di ruang publik saudara wanita sekali dengar ngobrol logat sunda
iqbalpaz,cerai memang tidak mudah
iqbalpaz,racun hubung selingkuh buat nyaman tidak nyaman saat sama dasar yang baca rata butuh siklus putus nyambung benar lepas racun hubung
iqbalpaz,longar dikit sikat
iqbalpaz,bentar tapi aneh kalau hokien kalbar akal kenapa di kaltim kaltim lebih orang bugis chinese
iqbalpaz,kejut tahun tinggal kalteng belum dengar umpat apa teman baik
iqbalpaz,twitter dagang tidak lepas serang pop
iqbalpaz,ingat tidak ajar bab reproduksi pikir aktivitas seksual hal esensial seperti menstruasi tidak diperhatin
iqbalpaz,maksud dijelasin merk wings ukur yang teh dinoy pakai
iqbalpaz,tawa benar kasih tahu merk yang pakai teh dinoy sudah sih
iqbalpaz,sayang tidak mati
iqbalpaz,ajar pandang jadi buka tidak rasa canggung ngobrolin hal ini gadis
iqbalpaz,kalau tahu siklus menstruasi guna rencana hamil tunda hamil ajar balut tampon menstruasi cangkir penting itu organ vital uang
iqbalpaz,bagi sudut pandang bagai pria tidak pria paham menstruasi saya penting apalagi pria hetero akan paham ada ubah suasana hati menstruasi perut perempuan sakit waktu pertama haid
iqbalpaz,yowes kiri kelompok saja
iqbalpaz,saya jadi ngurus cerai corona da anda ge mantu ketang tawa
iqbalpaz,saya cerita hikmah pandemi tapi takut hujat yang gagal kawin gara corona
iqbalpaz,diri layan
iqbalpaz,punya hancur
iqbalpaz,sama seperti yang kalau rumah pakai kaos bujur sarung
iqbalpaz,tawa sangkal
iqbalpaz,apa
iqbalpaz,iya ada penasaran konseling saya konseling ya saya konseling tatap muka sejak pandemi jadi konseling online via video suara panggil
iqbalpaz,lelah segala drama hidup tidak apa apa sekali istirahat dulu siap energi besok
iqbalpaz,dengar cerita sukses dengar cerita gagal podcast coba bahas gagal buat normal memang gagal normal sekali mari ajar gagal
iqbalpaz,bagi peran tanggung ini paham laku dua belah hingga cipta hubung harmonis
iqbalpaz,tingkat relasi adalah tingkat tinggi buah hubung tingkat kita bagi peran tanggung peran dalam buah hubung sangat variasi tiap hubung unik
iqbalpaz,fungsi rasio netral emosi hingga bisa ambil putus rasional samping emosi
iqbalpaz,tingkat koneksi tingkat rasio akal sehat utama mulai usaha usaha selalu hubung pasang konflik muncul sini
iqbalpaz,yang suka seperti lihat terus tidak kurang
iqbalpaz,hubung romantis seperti utama game tingkat tingkat adalah atraksi tingkat kita tari orang baik tari fisik hobi hal lain tingkat penuh emosi hingga selalu bunga bunga
iqbalpaz,paporit
iqbalpaz,susah sekali menikah saya anggar dua lipat gara undang lingkar teman orang tua tawa
iqbalpaz,aduh episode podcast besok bahas ya
iqbalpaz,kurang cepat
iqbalpaz,lagu tani masa bunuh diri
iqbalpaz,sudah ngurus tanggal bom selesai ini
iqbalpaz,masa ya dulu waktu tidak wajib sikm
iqbalpaz,yang terbang cgk tidak bawa sikm
iqbalpaz,tidak euy bisa meunang sikm
iqbalpaz,ken beli kursi tapi rasa mahal tidak tega keluar uang
iqbalpaz,itu nyata tawa
iqbalpaz,umur celah usia seperti makin tidak tidak tidak kentara waktu kuliah
iqbalpaz,acara sebar alumni sama
iqbalpaz,bos mzbojo
iqbalpaz,tidak pergi pijat
iqbalpaz,sikm kapan selesai
iqbalpaz,habis antar teman sumbang darah tempat cemil sudah ramai
iqbalpaz,doa
iqbalpaz,tolong bantu butuh darah detil ikut golong darah jumlah labu cp pasir domisili bandung sumbang pmi jalan aceh
iqbalpaz,nama sekali
iqbalpaz,monmap tawa
iqbalpaz,juga dan langsung pergi kalau bandung ibu
iqbalpaz,tolong bantu butuh darah detail sb golong darah butuh berapa labu labu cp rias magenta domisili bogor
iqbalpaz,saudara sudah aju sikm via email kemarin masih ada balas saat bisa tolong bantu
iqbalpaz,tolong periksa pesan langsung saudara
iqbalpaz,mari sudah utama gamenya ayo tidur
iqbalpaz,oke terimakasih saudara
iqbalpaz,dokter minta pencerahanya
iqbalpaz,tawa
iqbalpaz,pelit tawa
iqbalpaz,sudah kontak saudara
iqbalpaz,tidak saudara
iqbalpaz,sih kucing suka duduk laptop
iqbalpaz,mantap bunda dong icip makananya
iqbalpaz,izin tanggap bunda gula kental manis jauh banyak gula susu
iqbalpaz,skm apa teh
iqbalpaz,gengs yang dan hasil sikm sudah kirim syarat via email malah mailer daemon seperti email lebih beban
iqbalpaz,kasi klaten tidak
iqbalpaz,sudah lihat untuk haduh admin orang indonesia tawa
iqbalpaz,benar bahasa indonesia
iqbalpaz,agar puas
iqbalpaz,tidak lama
iqbalpaz,waktu bagi otak ikut antre malah kabur saja seperti gin
iqbalpaz,uras energi grup keluarga itu
iqbalpaz,maha ini
iqbalpaz,kalau kenang bandung punya banyak kenang yogya kapan lagi harus tunggu luka sembuh supaya berani kembali ke kota
iqbalpaz,mun saya ibu ngajedog haduh kamar
iqbalpaz,ada dan tidak bang
iqbalpaz,baru monetisasi jis kemarin kualitas tidak uang tawa
iqbalpaz,sudah saudara
iqbalpaz,surabaya coret maksud sidoarjo
iqbalpaz,bantai tawa
iqbalpaz,tolong periksa pesan langsung saudara
iqbalpaz,wakakak menikah tidak yel anda himp memang tidak mau sih
iqbalpaz,lebih humoris itu belum solat jumat solat gaib ini baru bangun tidur tidak tahu dia rukuk bingung
iqbalpaz,tawa generalisasi
iqbalpaz,lelah segala drama hidup tidak apa apa sekali istirahat dulu siap energi besok
iqbalpaz,orang tua lumayan terima yang rutin konseling memang dijelasin pelan dokter sabar
iqbalpaz,panci ada nu tawa
iqbalpaz,kieu tidak
iqbalpaz,saya ingin keluarga akan ikut tawa
iqbalpaz,tembu teh
iqbalpaz,bodor sial
iqbalpaz,kalau dasar peta hidup saya buat waktu ic tahun sudah anak sekarang nyokapnya bom
iqbalpaz,keren ini buat fans spesial seperti dilakuin jakarta idola kpop
iqbalpaz,boardgamearena
iqbalpaz,ken ingin tahu tidak ingin tahu pikir apa saudara laki pacar sudah tidak peduli baik cari yang buat anda saudara wanita
iqbalpaz,pantas serta anak anak sama tawa
iqbalpaz,umur umur online kelas via zoom kali chatnya berisik sekali serta sih
iqbalpaz,semoga ketemu saudara
