username,created_at,text,retweet,favorite
adityalinardi,2020-06-06 11:37:55,Mudah memaafkan bukan berarti mudah melupakan.,2,0
adityalinardi,2020-06-06 10:15:09,@strawbery021 Mayan mengisi kegabutan wqwq https://t.co/zc1zQFbbJK,0,0
adityalinardi,2020-05-30 19:50:27,"Terlihat baik-baik saja dan hepi-hepi aja. Pahadal, cuma pinter menyembunyikan dan memendam masalah.",0,0
adityalinardi,2020-05-26 17:13:25,"Lagi berhayal : Mau jalan kesana mau jalan kesini Mau beli ini mau beli itu Lalu, muncul pertanyaan ""Uangnya dari mana?"" Ok, cukup menghayalnya.",0,0
adityalinardi,2020-05-25 19:21:28,"@cakiww ga ada, ga buat nastar tahun ini udah keabisan nastar yaak?wkwkw🤣",0,0
adityalinardi,2020-05-25 19:04:35,@cakiww mon maap lahir batin juga yaa buuk🙏🏻,0,0
adityalinardi,2020-05-25 04:14:11,Udah minta maaf sama orang lain Minta maaf sama diri sendirinya udah?,1,0
adityalinardi,2020-05-19 17:47:21,"Everyone is a genius. But if you judge a fish on its ability to climb a tree, it will live its whole life believing that is stupid. -Albert Einstein",1,0
adityalinardi,2020-05-12 07:56:59,"@fauziafaradisca iyaa dis, mending yg 50gb. kalo unlimited sih kayak nanti bakal dikurangin gitu speednya kalo udah sampe batasnya, gua ga percaya sama yg bener2 unlimited wkwk",0,0
adityalinardi,2020-05-12 07:26:14,@fauziafaradisca kanan sihh,0,0
adityalinardi,2020-05-09 15:27:14,basa basi yang sebenarnya basi. alias buang-buang waktu dan gak penting.,0,0
adityalinardi,2020-05-05 04:13:57,"@AsrinaArselan memang sedaap, cuma rasa itu aja tapinya wkwk",0,0
adityalinardi,2020-05-04 15:10:34,@AsrinaArselan kalo pilihannya di ganti indomie kari atau mi sedap kari spesial baru pilih mi sedaaapp wkwkw,0,0
adityalinardi,2020-05-04 10:28:32,@AsrinaArselan Indomie dongg,0,0
adityalinardi,2020-05-03 11:29:03,"Sering dianggep keras kepala. Padahal, tau apa yang diinginkan.",0,0
adityalinardi,2020-05-02 18:43:41,@fauziafaradisca ga abis beli yang bikin pusing-pusing kan?wkwkw,0,0
adityalinardi,2020-05-02 18:26:32,@fauziafaradisca kasih tau dis,0,0
adityalinardi,2020-05-02 14:30:37,"Ada perbedaan besar antara gua yang gak jelas, dan elu yang gak ngerti. Jadi, sebelum lu bilang gua gak jelas, pastikan dulu elu ngerti.",1,0
adityalinardi,2020-05-01 22:37:45,@cakiww tidak seseram makhluk tak kasat mata (?),0,0
adityalinardi,2020-05-01 21:42:07,@honpohon berat banget keknya wkakaka,0,0
adityalinardi,2020-05-01 16:40:03,@IndryAsmita tetap bertahan hidup walau tetap dilanda kebosyanan tanpa tahu kapan akan berakhir,0,0
adityalinardi,2020-05-01 16:24:05,"@honpohon lebih kearah kehidupan sehari-hari, karir atau masalah percintaan?wkwkwk",0,0
adityalinardi,2020-05-01 15:11:23,@honpohon berasa bgt ya di pandemi ini huhu,0,0
adityalinardi,2020-05-01 14:15:51,merasa hidup tapi bagaikan tidak hidup. hhh,0,0
adityalinardi,2019-11-20 20:30:28,Yg make tsel pada amankah? Apa cuma gua yg ga bisa akses internet?,0,0
adityalinardi,2019-10-23 04:24:23,"@aapsupalleB Gua belom pernah ngeojol pus, tapi lagi mau buat sih sama kayak elu. Tinggal bikin skcknya gua wkwkwk lu udah nyiapin buat bikinnya?",0,0
adityalinardi,2019-10-22 21:56:25,"@aapsupalleB Kalo dipikir ada engganya sih pasti ada aja beberapa yg begitu, bikin aja udahh",0,0
adityalinardi,2019-10-15 00:35:13,"@MeSoInLoveWYou @gojekindonesia Yailah perkara nasi goreng, dan dia juga minta maaf kok. Toleransi lo terhadap sesama manusia rendahkah? Enteng bener kayaknya bilang sampah",0,0
adityalinardi,2019-10-14 04:52:17,"@pergijauh Nahh ini. Soal rasa, liong bulan aku tetap padamu.",0,0
adityalinardi,2019-10-07 18:03:48,"@fauziafaradisca Saat kita bercermin, kita tersenyum. Lalu ia ikut tersenyum, disitulah ada makhluk ciptaan-Nya yg sempurna sambil menatap balik dan tersenyum.",0,0
adityalinardi,2019-09-19 20:17:24,Entah kenapa gua ga bisa nyembunyiin kalo udah ga suka sama sikap seseorang hhhh,0,0
adityalinardi,2019-09-15 06:52:26,@fauziafaradisca @Bolang_Mks Eh masi gonta ganti line ga? Kalo udah engga bagi sini hahaha,0,0
adityalinardi,2019-09-15 06:50:06,"@fauziafaradisca @Bolang_Mks Lucu sih, tapi kek boneka babi wkwkwk okaaay masi gua liatin",0,0
adityalinardi,2019-09-15 06:39:47,"@fauziafaradisca @Bolang_Mks Gakocak, tapi lucu makanya w rituitt wkwkwk yakin? Keknya lagi banyak pikiran nih wkwk",0,0
adityalinardi,2019-09-15 04:23:04,"@fauziafaradisca @Bolang_Mks Haha-hihi aje lu, gimana kabar?",0,0
adityalinardi,2019-09-15 04:21:23,@melatiuuu Kurang-kurangin ngepushnya mel wkwk,0,0
adityalinardi,2019-09-14 02:45:01,"#CukupSudah, @KPK_RI @gakkumklhk @HumasPoldaRiau segera periksa dan hukum perusahaan pembakar lahan di Riau - Tandatangani Petisi! https://t.co/1piXWakOw5 via @ChangeOrg_ID",0,0
adityalinardi,2019-09-13 13:42:03,Terkadang seseorang yg berkeluh kesah hanya ingin di dengarkan saja.,0,0
adityalinardi,2018-11-12 08:25:38,"@IndosatCare min indosat kenapa sinyalnya turun naik mulu sama 4Gnya ga bisa di lock keganti mulu ke h+,3G",0,0
adityalinardi,2018-10-25 18:21:00,"@fauziafaradisca Oalah baru tau gua haha, lagi parah banget yak-_-",0,0
adityalinardi,2018-10-25 18:19:02,@fauziafaradisca Make indosat juga?wkwk,0,1
adityalinardi,2018-10-25 18:13:52,"@IndosatCare indosat kenapa ya min dari tadi datanya suka ilang-ilangan, ada gangguan?",1,0
adityalinardi,2017-12-11 15:14:18,@Telkomsel Min telkomsel koneksi nya lagi bermasalah? Dari tadi putus2,0,0
adityalinardi,2017-04-15 06:42:48,"@Telkomsel min sinyal full tapi, lagi main game kok ilang2an ya koneksi di gamenya ?",0,0
adityalinardi,2015-07-22 14:03:13,Ngopsmoree. [pic] — https://t.co/0ZaOoWosFB,0,0
adityalinardi,2015-07-22 05:49:44,At @hokben — https://t.co/QaS8uzNpyX,0,0
adityalinardi,2015-07-17 10:40:52,At Bakso kumis 2 — https://t.co/lpDyb03LxN,0,0
adityalinardi,2015-07-14 16:30:54,"Nongkrong bareng intel. (Indomie telor) (with Herdy, Dimas Dwi Khomsa, and Mr.) [pic] — https://t.co/JLBcEnltxs",0,0
adityalinardi,2015-07-12 01:45:50,#THANKYOUIKER [pic] — https://t.co/cuR0NUv83Z,0,0
adityalinardi,2015-07-02 02:32:46,Watching Source Code — https://t.co/5TWnmPOxsj,0,0
adityalinardi,2015-06-22 15:54:53,At RSIA Hermina — https://t.co/m9Zzff3rvg,0,0
adityalinardi,2015-06-17 18:26:13,Watching Hugo — https://t.co/WeArqO8Ip8,0,0
adityalinardi,2015-06-09 07:52:13,Flashback masa kecil.. [pic] — https://t.co/l23MclNTOk,0,0
adityalinardi,2015-06-08 04:34:10,Ada yg berani bayar berapa nih? [pic] — https://t.co/H0LQdCggo4,0,0
adityalinardi,2015-06-03 23:43:39,Morning Glory by Oasis — https://t.co/oq4E5A9qEE,0,0
adityalinardi,2015-05-26 08:30:39,Dunia Bersamamu by TheOvertunes — https://t.co/dB5ANVEJVl,0,0
adityalinardi,2015-05-18 16:43:07,Gbt [pic] — https://t.co/SgYmapPxXe,0,0
adityalinardi,2015-05-08 18:25:17,With kanyab!! at Menara Saidah — https://t.co/rTDsof5KmS,0,0
adityalinardi,2015-04-19 20:16:10,Show Me What I'm Looking For by Carolina Liar — https://t.co/2pdYtDqWUV,0,0
adityalinardi,2015-04-13 08:58:27,One and Only by @OfficialAdele — https://t.co/QQXIgspW5H,0,0
adityalinardi,2015-04-10 14:03:21,"Dapet juga nihh.. (with masgils, Dimas Dwi Khomsa, and Bayu) [pic] — https://t.co/SlsaEO5i3f",0,0
adityalinardi,2015-03-31 19:53:36,Watching Tamara Drewe — https://t.co/LpVD4oiI1y,0,0
adityalinardi,2015-03-24 18:44:25,City of Angels by Thirty Seconds to Mars — https://t.co/2gBNch3Scn,0,0
adityalinardi,2015-03-20 11:06:25,Champagne Supernova by Oasis — https://t.co/Qn3knayCXx,0,0
adityalinardi,2015-03-18 22:09:10,Ett dah--' [pic] — https://t.co/wMvboYDzIV,0,0
adityalinardi,2015-03-18 18:20:42,"Bahagia itu sederhana, nemu loot beginian. Ahaha [pic] — https://t.co/a0kg4Yx1qz",0,0
adityalinardi,2015-03-18 13:18:25,Just posted a photo — https://t.co/iTmgFZbesc,0,0
adityalinardi,2015-03-18 11:13:40,Menikmati sore hari dengan secangkir kopi. (with Fajar at Warung Kopi Dulu) [pic] — https://t.co/29xY403gs6,0,0
adityalinardi,2015-03-16 21:04:24,"Young, Wild &amp; Free (feat. Bruno Mars) by @SnoopDogg — https://t.co/G5IKe5AnE9",0,0
adityalinardi,2015-03-08 20:04:51,The Reason by Hoobastank — https://t.co/4w0zh9aIbl,0,0
adityalinardi,2015-02-24 09:03:11,Iseng-iseng jadiin +7 [pic] — https://t.co/hfMLVEDaYK,0,0
adityalinardi,2015-02-18 21:41:04,"Final Score FC Schalke 04 0, Real Madrid 2",0,0
adityalinardi,2015-02-10 17:05:20,Tambahan koleksi s card lagi. [pic] — https://t.co/y9wn3JtpR2,0,0
adityalinardi,2015-02-10 13:35:11,Ngopsmore.. [pic] — https://t.co/CP84YdWfna,0,0
adityalinardi,2015-02-10 13:13:48,You Ruin Me by The Veronicas — https://t.co/YkzJE7yfD3,0,0
adityalinardi,2015-02-06 09:35:31,Jangan tegang-tegang cup wkwk (with Muhammad) [pic] — https://t.co/0eJBgejAWq,0,0
adityalinardi,2015-02-04 21:38:18,"Final Score Real Madrid 2, Sevilla 1",0,0
adityalinardi,2015-01-15 12:13:05,"Perpaduan pas kopi hitam, ubi goreng, pisang goreng. (with Wisnu, Hilmy, and Fajar) [pic] — https://t.co/uTMkHdsraU",0,0
adityalinardi,2015-01-07 00:36:20,The Reason by Hoobastank — https://t.co/J7BZE9b6IT,0,0
adityalinardi,2015-01-05 21:24:35,Nanggung mau tidur mending ngopsmore.. [pic] — https://t.co/yFhzTj8P8a,0,0
adityalinardi,2015-01-05 20:10:46,I Don't Love You by My Chemical Romance — https://t.co/ENbDjFw7BX,0,0
adityalinardi,2015-01-05 03:28:56,I Don't Want to Miss a Thing by Aerosmith — https://t.co/MWd4AnhsEa,0,0
adityalinardi,2015-01-05 02:13:02,At @7elevenid — https://t.co/Uw5nquF7sy,0,0
adityalinardi,2015-01-04 20:44:27,The Only Exception by Paramore — https://t.co/8S6A5R6ufL,0,0
adityalinardi,2015-01-04 18:27:57,She Loves You by @thebeatles — https://t.co/KE2iEYf5Sj,0,0
adityalinardi,2015-01-03 17:18:32,Watching Dead Silence (with Bayu and dimas) — https://t.co/8XZMG6z3Gs,0,0
adityalinardi,2015-01-03 01:08:28,Here Comes the Sun by @thebeatles — https://t.co/RZNP1S0dEu,0,0
adityalinardi,2015-01-02 19:57:44,Let It Be by @thebeatles — https://t.co/X6StEfLcN7,0,0
adityalinardi,2015-01-02 19:12:15,Whatever by Oasis — https://t.co/eZqoXD0agb,0,0
adityalinardi,2015-01-01 15:47:38,Imagine by John Lennon — https://t.co/jYdf5eAesj,0,0
adityalinardi,2014-12-31 16:52:39,"With vajry, Bayu, and 2 others at Pondok Serambi Mie Aceh — https://t.co/wu6a09igt2",0,0
adityalinardi,2014-12-31 14:01:27,Hey Jude by @thebeatles — https://t.co/j155fA0yZA,0,0
adityalinardi,2014-12-31 09:49:08,Seperti Yang Kau Minta by Chrisye — https://t.co/yLcxVuQdLs,0,0
adityalinardi,2014-12-29 07:13:30,Stand By Me by Oasis — https://t.co/AlYp2WjXkC,0,0
adityalinardi,2014-12-29 05:54:04,1000 Tahun Lamanya by Tulus — https://t.co/3HMxa5a7yh,0,0
adityalinardi,2014-12-27 07:22:27,"Jangan chat di path, gak ada path talk nya. Line aja:adityalinsky. [pic] — https://t.co/mN8fOSonzg",0,0
adityalinardi,2014-12-27 06:39:38,Terlalu Lama Sendiri by Kuntoaji — https://t.co/4zEcCkac7g,0,0
adityalinardi,2014-12-26 18:28:06,"Aneh, ini barracks lvl 1 ada wizzardnya. (with Fajar, Muhammad, and 5 others) [pic] — https://t.co/zwBJ1DezJf",0,0
adityalinardi,2014-12-24 14:57:43,"PALA PELER ( Pecinta Alam Pendaki Lereng ) , 27 September 2014 MT. Gede… (w/ Riyan, vajry, &amp; 3 others) [pic] — https://t.co/liVX3rnraK",0,0
adityalinardi,2014-12-23 12:51:53,Don't Look Back In Anger by Oasis — https://t.co/kNDU0PEVT6,0,0
adityalinardi,2014-12-22 18:19:21,Hari terakhir.. (at HOM Platinum Hotel) — https://t.co/Dxp4MRuIzW,0,0
adityalinardi,2014-12-19 15:38:19,"Skooyyy (with Adi, Fajar, and 2 others at Circle K) — https://t.co/A5RZD3izrX",0,0
adityalinardi,2014-12-18 20:01:52,At Hotel Nirwana Jimbaran — https://t.co/fwhYBhO56p,0,0
adityalinardi,2014-12-17 13:46:43,"Update juga ah, biar kayak orang-orang. ★ Mama (with Kanyab) — https://t.co/A5w2yy8tk1",0,0
adityalinardi,2014-12-17 00:24:05,Don't Look Back In Anger by Oasis — https://t.co/8OGqHK5OAT,0,0
adityalinardi,2014-12-16 20:42:09,"Kalau kita sering minum yang pahit, kita gak akan lupa gimana rasanya manis. [pic] — https://t.co/JTjVU3HM8i",0,0
adityalinardi,2014-12-16 17:04:16,No Sleep by Wiz Khalifa — https://t.co/iC9Xlwr0be,0,0
adityalinardi,2014-12-16 13:33:11,With Doni and Bayu at Angkringan Panjer Wengi — https://t.co/NAxzJGHJk4,0,0
adityalinardi,2014-12-12 21:35:52,"Final Score Almería 1, Real Madrid 4",0,0
adityalinardi,2014-12-12 17:04:46,Terlalu Lama Sendiri by Kuntoaji — https://t.co/LpuXGHsJk6,0,0
adityalinardi,2014-12-11 01:13:47,Twist and Shout by @thebeatles — https://t.co/NDC5UxluSJ,0,0
adityalinardi,2014-12-05 12:31:17,Cup udah 25 belom? (with Muhammad) [pic] — https://t.co/3R3AQZ3psU,0,0
adityalinardi,2014-12-05 00:08:08,Morning Glory by Oasis — https://t.co/c9hVFouJtl,0,0
adityalinardi,2014-12-04 02:45:37,"Ngabisin 150 diamond dapet 4 s pendant nihh. (with Muhammad, Fajar, and 2 others) [pic] — https://t.co/zjQXn3PV5y",0,0
adityalinardi,2014-12-03 01:29:43,Salah Benar by 3 Composer — https://t.co/PykVQCuq1m,0,0
adityalinardi,2014-12-02 20:51:36,"Final Score Real Madrid 5, UE Cornella 0",0,0
adityalinardi,2014-11-28 02:07:10,Cemilan - cemilan skoooyyy (with Fajar) [pic] — https://t.co/6JQXxHpRkH,0,0
adityalinardi,2014-11-24 19:54:04,She Will Be Loved by @maroon5 — https://t.co/9tE8fQq28v,0,0
adityalinardi,2014-11-24 13:19:20,Ngopsmore~ [pic] — https://t.co/eC3lQetFUf,0,0
adityalinardi,2014-11-23 17:59:48,Please Don't Say You Love Me by Gabrielle Aplin — https://t.co/nkni8NnrzI,0,0
adityalinardi,2014-11-20 20:45:27,Last Friday Night (T.G.I.F.) by Katy Perry — https://t.co/qsokiGlDaX,0,0
adityalinardi,2014-11-17 18:05:11,Watching The Ugly Truth — https://t.co/M5cKGcnjc4,0,0
adityalinardi,2014-11-12 11:42:22,"Ngopsmpore gelap-gelapan. (with Fajar, Chandra, and emok) [pic] — https://t.co/ZgWGmVccsF",0,0
adityalinardi,2014-11-11 11:28:57,Don't Look Back In Anger by Oasis — https://t.co/uBe1vg8nui,0,0
adityalinardi,2014-11-11 11:16:56,When We Were Young (feat. The Chain Gang of 1974) by Dillon Francis &amp; Sultan &amp; Ned Shepard — https://t.co/Pjy11Nx34R,0,0
adityalinardi,2014-11-10 18:59:50,Please Don't Say You Love Me by Gabrielle Aplin — https://t.co/1w0aLZPuWg,0,0
adityalinardi,2014-11-10 16:55:58,Watching Green Lantern — https://t.co/ynPQlJ1CcS,0,0
adityalinardi,2014-11-10 11:33:56,Watching War Horse — https://t.co/eDaivBINbC,0,0
adityalinardi,2014-11-09 20:14:03,Watching John Carter — https://t.co/jlXlnagaUz,0,0
adityalinardi,2014-11-06 18:29:46,Lagunya bikin ga mau bobo.… ♫ Get Low by Dillon Francis &amp; DJ Snake (w/ Fajar at Puri insani 2 grand depok city) — https://t.co/CQNUf5T3nv,1,0
adityalinardi,2014-11-05 17:17:46,Habits (Stay High) by Tove Lo — https://t.co/wU2u3YYZvY,0,0
adityalinardi,2014-11-04 16:14:43,"Akhirnya Marinano juga, kapan pada nyusul? xD (with Muhammad, Fajar, and 2 others) [pic] — https://t.co/t3RKp7a98Z",0,0
adityalinardi,2014-11-04 15:28:56,Lumayan buat nyari diamond nihh. xD (with Fajar and Hilmy) [pic] — https://t.co/hh8zJrssZp,0,0
adityalinardi,2014-11-03 21:42:30,"Kopi hitam selalu bercerita kepadaku, bahwa yang hitam tak selalu kotor, dan yang pahit tak selalu… [pic] — https://t.co/u7GGJh8NM1",0,0
adityalinardi,2014-11-01 16:53:39,"Final Score Granada CF 0, Real Madrid 4 #HalaMadrid",1,0
adityalinardi,2014-10-29 14:10:54,The Spirit Carries On by Dream Theater — https://t.co/E9vD19mtUr,0,0
adityalinardi,2014-10-27 12:19:38,Sambil ngopsmore. ♫ Don't Look Back In Anger by Oasis — https://t.co/9Z0q6TfzjE,0,0
adityalinardi,2014-10-26 18:04:39,"Dapet bola enak gitu, hoki emyu mok-_- ""@MassDimass24: Gajadi narik wkwk RT @adityalinardi: Mayan jigo dari aji wkwk ""@MassDimass24: Calm!",0,0
adityalinardi,2014-10-26 18:02:18,"Hoki cuk. ""@my_supersoccer: TANPA FELLAINI, VAN PERSIE GAK MUNGKIN CETAK GOL. #LEGEND",0,0
adityalinardi,2014-10-26 17:17:25,"Mayan jigo dari aji wkwk ""@MassDimass24: Calm! RT @adityalinardi: Nambah 1 goal lagi nih mok, hazard belom ngegolin. ""@MassDimass24: GOAL! D",0,0
adityalinardi,2014-10-26 17:15:02,"Nambah 1 goal lagi nih mok, hazard belom ngegolin. ""@MassDimass24: GOAL! Drogba :')""",0,0
adityalinardi,2014-10-25 17:49:57,"Final score Real Madrid 3, Barcelona 1 #HalaMadrid",1,0
adityalinardi,2014-10-25 14:52:47,Ride Wit Me by @Nelly_Mo — https://t.co/dfRbiCqguR,0,0
adityalinardi,2014-10-24 18:30:26,"Menunggu mentari pagi, ngopsmore dulu. (with Fajar) [pic] — https://t.co/R1oLiY3wBn",0,0
adityalinardi,2014-10-24 12:59:24,Lama bener nungguinnya.. [pic] — https://t.co/wil9C6AtsQ,0,0
adityalinardi,2014-10-23 11:17:52,"Walaupun hujan, tetap hangat.. (with Fajar, @chanderah, and emok) [pic] — https://t.co/FaC0H4FEQi",0,0
adityalinardi,2014-10-23 03:37:38,City of Angels by Thirty Seconds to Mars — https://t.co/wmhAQUt4q3,0,0
adityalinardi,2014-10-21 17:42:59,"Siapapun presidennya, hidupmu tetap tanggung jawabmu.",0,0
adityalinardi,2014-10-21 10:35:47,"Ngopsmore dulu.. (with Fajar, @9ERIY, and 5 others) [pic] — https://t.co/6kd4dHPTch",0,0
adityalinardi,2014-10-19 23:28:15,Ltpst. [pic] — https://t.co/S2eoAXse6F,0,0
adityalinardi,2014-10-19 10:13:30,Koleksi S card lagi. [pic] — https://t.co/69Wo3VEke5,0,0
adityalinardi,2014-10-17 16:10:34,Watching Mad Max — https://t.co/TZaRh9jrfa,0,0
adityalinardi,2014-10-17 13:29:15,"Kesetiaan sesungguhnya adalah saat kamu lepaskan dia, tapi dia balik-baliknya ke kamu lagi, dan kamu balik-baliknya ke dia lagi.",1,0
adityalinardi,2014-10-16 23:41:13,Trumpets by @jasonderulo — https://t.co/tf0vHqJo3l,0,0
adityalinardi,2014-10-15 14:27:29,"Duh, dapet S card lagi.. [pic] — https://t.co/zbstGB6neW",0,0
adityalinardi,2014-10-14 18:31:18,She Will Be Loved by @maroon5 — https://t.co/Zv9wbFQZWD,0,0
adityalinardi,2014-10-12 11:53:17,Invisible by Hunter Hayes — https://t.co/EIZyZuEdlf,0,0
adityalinardi,2014-10-12 11:19:11,Please Don't Say You Love Me by Gabrielle Aplin — https://t.co/It7akcpUQj,0,0
adityalinardi,2014-10-12 08:57:41,Dealova by Once — https://t.co/0pbAy1vKca,0,0
adityalinardi,2014-10-11 11:29:56,Amnesia by 5 Seconds of Summer — https://t.co/QGWxEjETwY,0,0
adityalinardi,2014-10-11 07:56:14,Gold sama diamond tinggal segini aja gara-gara naikin lv s card. [pic] — https://t.co/ecXgWkjXQP,0,0
adityalinardi,2014-10-11 07:40:39,We Found Love (feat. Calvin Harris) by @rihanna — https://t.co/jLJHsrKaCs,0,0
adityalinardi,2014-10-05 20:49:11,"Final Score Real Madrid 5, Athletic Bilbao 0",0,0
adityalinardi,2014-10-05 20:45:21,"C. Ronaldo!!! Real Madrid 5, Athletic Bilbao 0",0,0
adityalinardi,2014-10-05 20:25:53,"K. Benzema!! Real Madrid 4, Athletic Bilbao 0",0,0
adityalinardi,2014-10-05 20:15:05,"C. Ronaldo!! Real Madrid 3, Athletic Bilbao 0",0,0
adityalinardi,2014-10-05 19:41:55,"K. Benzema!! Real Madrid 2, Athletic Bilbao 0",0,0
adityalinardi,2014-10-05 19:04:49,"C. Ronaldo!! Real Madrid 1, Athletic Bilbao 0",0,0
adityalinardi,2014-10-05 18:57:48,Spaghetti + coffee.. [pic] — https://t.co/PijgB2lUYE,0,0
adityalinardi,2014-10-04 11:55:52,Watching The Prince — https://t.co/LspZFlJA05,0,0
adityalinardi,2014-10-03 18:33:12,"""@Footy_Jokes: Iker Casillas 2000 to 2014. Legend. http://t.co/pz9mzq9czA""",0,0
adityalinardi,2014-10-03 15:07:26,All About That Bass by Meghan Trainor — https://t.co/4CfD3XJTP6,0,0
adityalinardi,2014-10-02 23:14:01,Sarapan pagi + ngopsmore. [pic] — https://t.co/619IpT3v2S,0,0
adityalinardi,2014-09-29 23:14:55,Amnesia by 5 Seconds of Summer — https://t.co/KnH7FiVYWb,0,0
adityalinardi,2014-09-26 14:26:07,Bismillahirohmanirohim.. (with SKUNUY!!!) [pic] — https://t.co/uXPldgnsN9,0,0
adityalinardi,2014-09-26 10:50:27,@gibranalfian gak jadi bran gua udh kesana duluan,0,0
adityalinardi,2014-09-23 02:34:36,Help! by @thebeatles — https://t.co/xTMkICDMrq,0,0
adityalinardi,2014-09-23 01:49:00,Cepu by Dhyo Haw — https://t.co/ufn0OjE6Ze,0,0
adityalinardi,2014-09-22 14:57:17,My Heart Will Go On by Céline Dion — https://t.co/4vwQbOWWZ0,0,0
adityalinardi,2014-09-22 13:54:21,All About That Bass by Meghan Trainor — https://t.co/SuKjtoqgKS,0,0
adityalinardi,2014-09-21 14:45:14,"😂 ""@Footy_Jokes: Real Madrid fans after watching Di Maria goal... http://t.co/wfGl0H1TS7""",0,0
adityalinardi,2014-09-21 14:42:30,"Manch3-5ter United. ""@bayuagungprams: Pusingnya ilang sedikit emyu kalah, tapi masih kebayang liverpool kalah :(",0,0
adityalinardi,2014-09-21 08:48:15,Make It Bun Dem by @Skrillex — https://t.co/c0nuZ8fQwP,0,0
adityalinardi,2014-09-19 08:38:48,Manusia alig! (with Bayu) [pic] — https://t.co/FmOvgbDGWZ,0,0
adityalinardi,2014-09-15 17:06:36,Amnesia by 5 Seconds of Summer — https://t.co/A5CghlsJHR,0,0
adityalinardi,2014-09-14 14:56:50,"😂 ""@Footy_Jokes: James http://t.co/cF9G3kPGBe",0,0
adityalinardi,2014-09-14 12:03:10,At Luxo Barbershop — https://t.co/jXEqjUTn33,0,0
adityalinardi,2014-09-13 17:47:23,"""@Footy_Jokes: Football http://t.co/4JPVmX2tWw""",0,0
adityalinardi,2014-09-13 13:53:44,"With Fajar, @chanderah, and 2 others at ZOE Café &amp; Library — https://t.co/hQc3CAtg8s",0,0
adityalinardi,2014-09-12 16:17:40,You &amp; I (Nobody In the World) by @johnlegend — https://t.co/rDjboGGqSl,0,0
adityalinardi,2014-09-12 16:04:31,Take Over Control (Radio Edit) [feat. Eva Simons] by Afrojack — https://t.co/IpdUiu51i0,0,0
adityalinardi,2014-09-09 17:17:19,"4x main, 4x tourism.. [pic] — https://t.co/3HGvL5kHjo",0,0
adityalinardi,2014-09-09 14:42:36,"4 lebih mantap. (with Fajar, satriaaaaji , and emok) [pic] — https://t.co/lWcOq8InHA",0,0
adityalinardi,2014-09-08 06:26:11,At @7elevenid — https://t.co/AUeJMbij4H,0,0
adityalinardi,2014-09-07 03:42:55,On get rich. Line: adityalinsky [pic] — https://t.co/N5I1zStnKk,0,0
adityalinardi,2014-09-04 04:42:20,Haha xD [pic] — https://t.co/bfKqNtb3hs,0,0
adityalinardi,2014-09-02 17:10:28,DJ Got Us Fallin' In Love (feat. Pitbull) by @UsherRaymondIV — https://t.co/ZuSDjo6cXA,0,0
adityalinardi,2014-08-31 21:09:47,Huft 💔😭 [pic] — https://t.co/AxpTBLMYaB,0,0
adityalinardi,2014-08-31 21:01:16,"😭 ""@Footy_Jokes: Miss us Real Madrid? http://t.co/nhtGzKzNHm""",0,0
adityalinardi,2014-08-31 20:53:28,"Final Score Real Sociedad 4, Real Madrid 2 Kehilangan bener ga ada Xabi sama Di Maria.. Huft.",0,0
