username,created_at,text,retweet,favorite
achadianrani,2020-07-05 05:06:54,"Terima kasih kepada suami w yg gak pernah rewel soal makanan. Masak sendiri hayuk, w masakin tapi masakannya b aja hayuk, beli makanan hayuk, yg penting kenyang. Mengingat banyak suami suami di luar sana yg rewelnya minta ampun soal makanan.",0,0
achadianrani,2020-07-04 06:46:55,"W sama nyokap bondingnya kuat bgt. Walopun dah beda rumah, ngegosip dan ngejulidnya tetep lancar bgt di wa wkwkwkw",0,0
achadianrani,2020-07-03 11:45:41,Jadwal wfo yg ganti2an gini knp malah bikin cepet capek ya,0,0
achadianrani,2020-06-30 11:58:25,"Kerja gamau yg sulit, tapi gaji mau yg gede. Bajingan semua emang. https://t.co/XTDqHNOc75",1,2
achadianrani,2020-06-30 10:49:07,@asepsahrudin7 Mention orangnya dong 🙃,0,0
achadianrani,2020-06-30 05:19:06,Bayarnya pake kredivo w lagi wkwkwk. Dia gatau aja bininya lintah darat https://t.co/ROSxAxPz3R,0,0
achadianrani,2020-06-30 05:09:48,Laki w ada2 aja hari ini. Pagi2 heboh gegara hapenya nyemplung di ember kamar mandi. Trs panik lgsg beli hp baru krn takut kerjaan jd ketunda. Sampe sengaja milih pengiriman yg same day biar besok hapenya udh bisa dipake kerja lg. Eh gataunya hp yg nyemplung idup lg dong wkwk 🙃,0,0
achadianrani,2020-06-29 23:54:00,@yudeeMATTA @xximbecile Aokwowkowkok,0,1
achadianrani,2020-06-29 13:06:29,Jangan sampe jadi orang kaya yg kayak gini. Jangan sampe amit-amit. https://t.co/bJyprdpEvT,0,0
achadianrani,2020-06-29 08:14:16,"Pengen banget ke jepang pas wedding anniversary. Entah ke yg berapa, pokoknya pas wedding anniversary.",0,0
achadianrani,2020-06-29 04:08:49,@tubbirfess Gak sih ini lebih ke bapak bapak yg suka buang reak di tengah jalan,0,0
achadianrani,2020-06-28 05:33:33,Ii kangen maen ini 🥺 https://t.co/qYW8AWRiEq,0,0
achadianrani,2020-06-27 11:50:58,Gapernah segininya ngebet buat belajar,0,0
achadianrani,2020-06-27 11:19:06,"Gapapa sih sbnrnya abis nikah tinggal di kontrakan kalo emg gajinya blm cukup untuk kebeli rumah. Yg jadi masalah itu, udah harus ngontrak, terus jg harus nutupin hutang yg dikeluarkan untuk pesta pernikahan yg jumlahnya wadaw. https://t.co/M90ALYGJJa",0,0
achadianrani,2020-06-27 07:54:02,"Nyobain brisket sambel koreknya mangkokku, mayan sih dagingnya banyak bisa buat 2 kali makan, nasinya malah dikit bgt. Tp grilled beefnya MangGang tuh tetep juara sih buat w. Lebih murah juga lagian wkwkwk",0,0
achadianrani,2020-06-27 07:29:45,Julidin tweet yg mengandung sari-sari kebahagiaan orang lain kayak gini tuh cuma bikin u makin keliatan sebagai pribadi yg hateful dan unblessed sbnrnya https://t.co/5tAGME9b5B,0,0
achadianrani,2020-06-27 06:27:20,Jadi dia w degdegan sih https://t.co/iRhYIP6L9O,0,0
achadianrani,2020-06-27 05:54:33,"Browsing ttg boleh tidaknya minum kopi pada saat lg flu dan batuk. Ada artikel yg bilang boleh, ada yg bilang jangan. W ikutin yg bilang boleh 🙃",0,0
achadianrani,2020-06-27 05:30:13,Nemu harta karun di superindo. Ena bgt sampe gamau meninggal 🥰 https://t.co/4weBhMjtAB,0,0
achadianrani,2020-06-26 14:37:44,"W tuh bingung sbnrnya ya, emang kenapa dah kalo ada yg minum amer terus diposting kok pada sewot bgt. Lah ya suka suka sbnrnya mah. Kalo dia emang demen posting lagi minum gitu kenapa mesti diomelin sih heran wkwkwk",0,0
achadianrani,2020-06-26 06:31:20,Nah yg kayak gini nih idaman mba mba cringe rahim anget. Yang berseragam dan demennya nginjek pala orang sampe bocor. https://t.co/oYNvZKylYS,0,0
achadianrani,2020-06-26 05:44:28,"Dark season 3 udh mau nongol aja, w season 1nya aja blm kelar nonton",0,0
achadianrani,2020-06-26 05:33:31,https://t.co/ZlcyJqUUki https://t.co/0TFaJng7ie,0,0
achadianrani,2020-06-26 04:47:21,@txtanakfesbuk :) https://t.co/fjzYltjT1y,0,0
achadianrani,2020-06-26 02:28:55,"W terpikir buat manggil orang aja buat bersihin rumah. Sakit berduaan suami, kerjaan rumah pada numpuk semua anjir pusingggg 🙂",0,0
achadianrani,2020-06-25 10:46:43,Mau ini ga? @asepsahrudin7 https://t.co/qZA9gkCbjs,0,0
achadianrani,2020-06-25 06:22:41,"Ada ya orang nanyain lowongan kerja, pas gue kasih kaga ada terima kasihnya cuma di-read doang ckck. Biar kata lu lulusan sarjana kalo attitude lu jelek sampe kapan juga kaga bakal dapet karir yg enak lu. Gedeg bgt asli",0,0
achadianrani,2020-06-24 02:59:37,"Gatau. Baru ngebayangin aja udah gelisah. Punya anak tuh pekerjaan paling sulit di dunia menurut gue. Lu harus mendidik, membesarkan, menghidupi anak manusia yg kita gaakan tau bakalan jadi apa nantinya. Sumpah gue takut sih punya anak :( https://t.co/6ixeQncUGG",0,0
achadianrani,2020-06-24 02:56:02,@AREAJULID Gudeg,0,0
achadianrani,2020-06-22 04:29:33,"Jadi intinya, serah deh lu mau selingkuh kek, atau mau jadi selingkuhan kek. Tp jangan bawa2 temen lu ketika akhirnya lu ketauan. Jd sama2 tau diri ya ler.",0,0
achadianrani,2020-06-22 04:27:31,"Tp moment babi-nya adlh ketika temen w itu berantem hebat sm suaminya gegara akhirnya ketauan dia selingkuh. Suami temen w neror semua penghuni kantor, terus nyalah2in gitu katanya sebage temen knp lu gk larang temennya slengki. Yeee emg w emaknya, ya lu lakinya kemane aje sob?!",0,0
achadianrani,2020-06-22 04:25:08,"Dia sih he'eh he'eh aja. Tapi gaada niatan buat akhirin hubungannya dgn si selingkuhan dan gk jg memperbaiki hubungannya dgn suaminya. Ya kita2 sebage temen emg cuma bisa ngingetin sih, gak bisa menghakimi tindakannya juga.",0,0
achadianrani,2020-06-22 04:23:02,"W pernah punya temen 1 kantor yg nyelingkuhin suaminya. Selingkuhannya sering dibawa ke kantor, kita2 juga pernah beberapa kali hangout bareng (sama dia dan selingkuhannya). W cuma ngingetin dia kalo masalah rumah tangga gakan kelar dengan lu selingkuh, justru malah memperparah.",0,0
achadianrani,2020-06-22 04:16:39,"@AREAJULID Mind ur own business, sist. Udh diingetin kalo masih ngelakuin ya berarti itu jalan hidup yg dia pilih. Belajar buat gak terlalu jauh ikut campur sama hidup orang lain, sekalipun sahabat sendiri.",0,2
achadianrani,2020-06-22 02:14:06,EA~ https://t.co/kdUepUSd7H,0,0
achadianrani,2020-06-20 05:36:03,"W ngerasin bgt ini pas kura-kura w meninggal. Rasanya kayak ditinggal anggota keluarga, sakitnya sama 💔😭 https://t.co/ilo5wqV687",0,0
achadianrani,2020-06-20 05:03:12,@AREAJULID Gosah sakit hati sama omongan jamet. Karena mau diedukasi kayak gimana juga otaknya tekbal. Solusinya ya jangan cari calon suami yg jamet wkwk.,0,0
achadianrani,2020-06-20 04:52:49,@rurunda Himalaya bukannya herbal juga yak?,0,0
achadianrani,2020-06-20 04:22:23,"Tapi emang salah w sih ya, muka lagi jerawatan w hantem aja pake scrub hehe. Tp kan ya karena iq w di atas rata2 jd w pikir dia lembut ini di muka, gakan jadi masalah pasti. Dahlah w gakan nyerah, abis jerawat bersih w akan coba lagi huhu.",0,0
achadianrani,2020-06-20 04:20:29,"Suka sedih sama produk skincare yang dipakenya enak bgt tp ternyata gak cocok di muka. Jd w kemaren sempet nyoba himalaya scrub, enak bgt butirannya alus, wanginya Ya Allah lembut bgt gak songong, gak bikin muka ketarik jg. Tp ternyata pas w pake 3x bikin jerawat jd nyebar :((",0,0
achadianrani,2020-06-19 09:07:43,:') https://t.co/iURcY15dMD,0,0
achadianrani,2020-06-19 09:04:08,Sendirian di rumah terus ujan gede. Suara ujannya bikin merinding. Takut :((( https://t.co/8NL80UOEt2,0,0
achadianrani,2020-06-18 06:58:49,Apa benar begitu pak? @asepsahrudin7 https://t.co/8mktCPWVGL,0,0
achadianrani,2020-06-17 06:06:20,WKWKWKWK https://t.co/6t2EndhRik,0,0
achadianrani,2020-06-17 01:05:14,Kalo standarnya gak sesuai sama kemampuan lu berarti ya targetnya bukan lu. Bikin standar sendiri lah. https://t.co/7B1NQU2ZFS,0,0
achadianrani,2020-06-16 01:37:52,Mati gaya bgt gapunya stok kopi,0,0
achadianrani,2020-06-15 12:06:23,"Udah telponan belasan jam sampe congenya nimbun, eh masih mesti mantau lakinya di twit. Yhaa~",0,0
achadianrani,2020-06-15 12:01:34,Kasian bgt waktu 13 jam terbuang sia sia cuma buat naracap https://t.co/jdszmtYV24,0,1
achadianrani,2020-06-15 09:18:01,"@asepsahrudin7 Tenang gan, bebas tugas cuci piring untuk malam ini",0,0
achadianrani,2020-06-15 09:08:01,@asepsahrudin7 https://t.co/IynhbYieGl,0,0
achadianrani,2020-06-15 08:05:03,W jadi terpikir buat bikinin. Sedih bgt kalo bapak mertua w lagi ngejokes suka dibilang garing sama anaknya sendiri. Kalo di fb mungkin blio sudah dapet banyak likes dan laugh react dr khalayak ramai.,0,0
achadianrani,2020-06-15 08:02:55,Bapak mertua w kalo bikin akun fb mungkin isinya kurang lebih begini https://t.co/noSzHzzXd1,0,0
achadianrani,2020-06-15 07:50:53,Bisa gak sih kalo naik motor lewat gang sempit itu gausah ngeklakson kenceng bgt. Lu nyuruh anak bocah pada minggir pake mulutlu juga bakal kedengeran se RT. Tolol bgt emang manusia manusia ini.,0,0
achadianrani,2020-06-14 12:05:18,Susah susah bangun citra Diancurin sama admin ig holywings Wkwk https://t.co/27wt2Vi5gr,1,0
achadianrani,2020-06-13 13:06:03,Seru ni https://t.co/SgTwhYsgxs,0,0
achadianrani,2020-06-13 06:13:09,@NetflixID Cinta bgt sama mereka🥰 https://t.co/46iLQ6PObo,0,0
achadianrani,2020-06-12 16:18:48,Ini negara apaansih anjing,0,0
achadianrani,2020-06-12 12:15:28,"@tubbirfess Your lie in april ngebosenin, baru 2 episode udah males ngelanjutin",0,0
achadianrani,2020-06-12 09:11:04,https://t.co/41Z8T5v6HU https://t.co/4H7TpDG0dd,0,0
achadianrani,2020-06-12 05:57:01,Need a break.,0,0
achadianrani,2020-06-11 04:21:36,Tp ini lebih lama ketimbang ngitung perkalian ke bawah. Kalo ikut calistung udh kalah poin ini mah. https://t.co/2dILb7SgvV,0,0
achadianrani,2020-06-11 03:52:10,Kok bisa ya kreatip begini. Nemu aja idenya. https://t.co/iobS7MTlvZ,0,0
achadianrani,2020-06-11 03:48:45,@counterhell @memefess Nyesel gue klik,0,0
achadianrani,2020-06-10 07:03:22,Apaansih lawak wkwkwkwkwk https://t.co/A5GgED5PLg,0,0
achadianrani,2020-06-10 07:02:31,"Dari tadi kepikiran di otak kata ""ol reliable"" apaan yak. Ternyata jaring ubur-uburnya spongebob anjir gak penting bgt.",0,0
achadianrani,2020-06-09 10:42:34,Drama apa ini??? Knp tiap episode bikin nangis!?!? 😡😭 https://t.co/hMW9pMWqCF,0,1
achadianrani,2020-06-09 03:17:41,Maap bgt kyknya w masi blm cocok jd ibu. Denger anak tetangga nangis ngerengek-rengek aja benci bgt. https://t.co/PHb86VO2ce,0,0
achadianrani,2020-06-07 11:11:22,Sumpah sedih bgttttt 😢 https://t.co/Far8qNvxHT,0,0
achadianrani,2020-06-07 10:58:37,Ya Allah enak bgt tidur siang,0,0
achadianrani,2020-06-07 07:14:25,Hah? Hah? Hah? Isi reply-nya pada manggilin keong https://t.co/lS2abpJYqY,0,0
achadianrani,2020-06-06 04:20:39,Gak semua cowok yg numbuhin kumis jadi ganteng. Banyak yg jatohnya jd kyk jamet.,0,0
achadianrani,2020-06-06 03:22:50,Ancur bgt ni hati ngeliat anaknya kebanting 😭💔 https://t.co/z7d495q0lp,0,0
achadianrani,2020-06-05 05:56:47,Yg pria harganya lebih mahal karena di akhir sesi akan ada ujian prakteknya https://t.co/3pTG3V85XR,0,0
achadianrani,2020-06-05 05:11:11,"@tubirfess Berani. Gue akan mempertahankan pendapat yg gue yakini itu benar, sekalipun harus ngotot-ngototan sama ortu. Paling ujungnya kalo debat sm bokap gue akan dicap ngelawan. Tp ya udah biasa sih.",1,6
achadianrani,2020-06-04 04:21:45,"@tubirfess Lu mau nyemangatin cewek2 yg punya dada kecil tp ngerendahin cowok yg punya selera dada yg besar. Sama aja kekanakan banget. Lagian itu semua cuma selera knp mesti dipusingin. Mending belajar mencintai diri sendiri dulu deh pada, drpd saling ngerendahin 1 sama lain.",0,0
achadianrani,2020-06-04 04:16:37,Ada kok yg udah usaha mati2an tapi jalannya gak mulus karena keterbatasan. Tp w yakin bbrp tahun kemudian orang ini akan nyesel pernah ngetweet kayak gini. https://t.co/6FQ3L6n2XI,0,0
achadianrani,2020-06-04 02:18:49,Banyak makanan dirumah tp isi rumah cuma 2 orang https://t.co/xCnukJDLOW,0,0
achadianrani,2020-06-03 15:14:50,Aneh bgt sih orang yg gasuka nonton anime,1,0
achadianrani,2020-06-03 12:42:00,Itu sabun apa kok warnanya lucu... https://t.co/D3g0VSQkkp,0,0
achadianrani,2020-06-02 16:47:01,"@txtdaricowo Coba palanya botakin, kali aja rambutnya menghambat pertumbuhan otaknya",0,1
achadianrani,2020-06-02 13:22:20,Lawakan demenannya @asepsahrudin7 https://t.co/xHE0zzXIZe,0,0
achadianrani,2020-06-02 11:42:29,Btw kopi soe soya ena juga. Aman bgt buat w yg gasuka susu sapi. Walopun aftertaste-nya kyk abis minum sari tumbuhan.,0,0
achadianrani,2020-06-02 11:36:35,"Bbrp minggu setelah wfh diberlakukan rasanya kangen bgt kerja di kantor, kangen nghaha nghehe denger celotehan temen2 sedivisi, dll. Skrg setelah nyaman bgt dirumah aja keluarlah IOM u/ mulai masuk kerja kembali di minggu depan. Knp idup mesti berubah2 mulu sihhhh",0,0
achadianrani,2020-06-02 10:43:58,@asepsahrudin7 Tunggu reward dr aku nanti malem 💖,0,0
achadianrani,2020-06-02 09:56:39,"W paling susah buat nabung, dulu pernah bikin tabungan emas di pegadaian. Ujung2nya nyokap w yg nerusin tabungannya. Nyimpen sendiri jg gabakal berhasil karena bakal w ambil terus. Semoga kali ini w bisa konsisten nabung di jenius.",0,0
achadianrani,2020-06-02 09:34:10,"Wow. Just, wow. https://t.co/hjpNmPGPRy",0,0
achadianrani,2020-06-01 11:11:04,(((wadidaw opinion))) https://t.co/NRWSumoHky,0,0
achadianrani,2020-06-01 09:10:16,@uusbiasaaja Wkwkwkwkwkwk,0,0
achadianrani,2020-06-01 09:04:38,Wkwkwkwkwkwk https://t.co/af0A5a3N7N,0,0
achadianrani,2020-06-01 08:38:47,"W ngelongok kedepan, ternyata doi masih ngeloneng di teras mushola, makan kacang sama bapak2 yg lain. Terus tadi siapa anjir depan pager 😭",0,0
achadianrani,2020-06-01 08:37:00,"Laki w lagi ke mushola lalu w lg duduk disamping jendela, fokus emg ke hp tapi sudut mata w ngeliat laki w masuk buka pager. W tungguin kok gak masuk2, gak buka pintu. Pas nengok gaada siapa2 depan pager. Padahal tadi kyk ada yg berdiri, pake baju koko sama sarung 😥",0,0
achadianrani,2020-06-01 07:50:14,Pengen punya anak kayak gini buat ngimbangin ibunya yg pemalas. https://t.co/C3ocEqniLL,0,0
achadianrani,2020-06-01 04:37:01,@radtherandom https://t.co/V1YOyoQoQa,0,0
achadianrani,2020-06-01 04:17:42,"Maap kayak mamank mamank yg biasa ngomong ""pila pila pila"" sambil bawa senter https://t.co/THfUXlXHbo",0,0
achadianrani,2020-06-01 04:15:59,Lah ngatur https://t.co/Q3xngKmiAI,0,0
achadianrani,2020-06-01 04:14:01,WKWKWK https://t.co/Dh4eMG49hW,0,0
achadianrani,2020-06-01 04:09:51,Aku di tanggal merah https://t.co/9GFpAqbIok,0,0
achadianrani,2020-05-31 10:32:24,Bosen tuh wajar. Namanya juga manusia. Lagian sekedar ngeluh gaakan ngerugiin siapapun. Lu siapa nyuruh2 orang bersyukur? Tuhan lu? https://t.co/kJZ4ULtATN,0,0
achadianrani,2020-05-31 10:29:57,"Serial yg lawakannya cocok bgt sama w itu emg friends. Belasan kali nonton, bahkan di episode yg itu2 lagi tp gapernah bosen.",1,0
achadianrani,2020-05-31 03:04:10,"Kocak bgt sih ini di lingkungan rumah w ada kerja bakti, bukannya dipasangin lagu2 yg bikin semangat malah dipasangin rekaman ceramah. Lagi bersih2 sambil inget neraka wkwkwkwk",0,0
achadianrani,2020-05-31 02:55:17,Pengennya dipajang masukin pigura https://t.co/Frhz0I7u0t,0,0
achadianrani,2020-05-31 00:42:08,Yakin sih gue someday laki w bakalan jadi ketua rt,0,0
achadianrani,2020-05-30 04:56:13,Wkwkwkkw lu siapa minta dipikirin perasaannya? https://t.co/YNlNvedBf8,0,0
achadianrani,2020-05-30 04:32:02,@asepsahrudin7 https://t.co/YhtSkVEiRI,0,0
achadianrani,2020-05-30 04:24:02,"@asepsahrudin7 waktu masih bujang juga gabakal bisa bikin kamarnya kek gini. Boro2, beresin kamar aja musiman. Baju udah dipake ditumpuk sm baju bersih. Barang2 berceceran dibawah kasur.",0,0
achadianrani,2020-05-30 04:20:24,"Kamarnya kecil, rapi tapi bikin nyaman kyknya. Ubin semen tuh bikin adem juga sih. Btw enak ya kalo masih single bisa gantungin baju gitu doang. Tunggu sampe punya bini, lemari segede apa jg gabakal muat rasanya 😂 https://t.co/he4e9EquW9",0,0
achadianrani,2020-05-30 01:12:18,Kayak acara lu pada bagus aja https://t.co/BzZFNSGopX,0,0
achadianrani,2020-05-29 15:59:32,Baru kelar nonton perfect blue. Ikutan gila udahannya. https://t.co/KI01Ne6fYY,0,0
achadianrani,2020-05-29 09:48:41,Gasabar nunggu rak ambalan buat di kamar nyampe :3,0,0
achadianrani,2020-05-28 17:18:39,Lg scroll quora trs nemu foto cewek cina yg palanya tengkleng aneh gitu anjir kebayang terusss. Itu setan apa orang aneh sih.,0,0
achadianrani,2020-05-28 12:17:19,@galihajklmn Teuing. Capek kali mau ngeue mesti nunggu rumah kosong dulu wkwkwk,1,0
achadianrani,2020-05-28 12:08:02,Living tugeder mah living tugeder aja. Ngapain nungguin supaya di-normalize. Mau sok rebel tapi nanggung. https://t.co/87L6bvbFnc,0,1
achadianrani,2020-05-28 10:52:39,Danshi kokosei anime tolol emang wkwkwkwkw https://t.co/aNkInGWSb8,0,0
achadianrani,2020-05-28 10:05:56,Telat gak sih umur segini baru kepikiran harus punya asuransi kesehatan swasta dan baru terpikir juga untuk punya investasi,0,0
achadianrani,2020-05-28 02:17:27,@syidhiqarachman @YBRAP @_Wendywalters Wkwkwkwkwl tolol,0,0
achadianrani,2020-05-28 02:12:16,Kaget bangsat https://t.co/alBw7qmXwA,0,0
achadianrani,2020-05-28 02:08:34,Bakayaro https://t.co/i5nZf1LMkI,0,0
achadianrani,2020-05-26 09:33:52,Emang ya dapet duit yg gak disangka-sangka itu enak bgt rasanya,0,0
achadianrani,2020-05-26 09:30:24,"Sampe kuliah ya sarasa sih, pas kerja se-dikasihnya sama orang GA wkwk https://t.co/XWlc8uBr61",0,0
achadianrani,2020-05-25 02:11:24,"Selain gravity-nya mba sara bareilles&amp; secret love song-nya little mix, sweet scar-nya weird genius juga mantap bgt kalo dinyanyiin tereak-tereak sambil nangis pas lagi patah hati.",1,0
achadianrani,2020-05-24 22:43:15,"@arinylnf Udah rin januari kemarin, tengkyu rinnn 🥰",0,0
achadianrani,2020-05-24 14:37:28,"Corona kapan kelarnya, belom hanimun nih w",0,0
achadianrani,2020-05-24 03:03:57,@DoankUnk Wkwkwkw skinkernya air wudhu mas,0,0
achadianrani,2020-05-23 23:59:23,Enaknya rumah depan mushola adalah u gaperlu berkumpul dengan orang2 untuk ikutan solat ied. Tinggal buka pintu dan jendela trus ikutan deh di ruang tamu~ Btw kenapa kinclongan laki w ya.. https://t.co/yAUrwykF5h,0,1
achadianrani,2020-05-23 07:26:23,Nga dapet hampers kerana w nga punya teman dan laki w temannya miskin semua. Tp mau dapet mi ayam dari salah satu teman laki w. Ngaapa lah yha.,0,0
achadianrani,2020-05-22 21:26:05,"Dirumah w yg keliling bocah2 sambil bawa bedug, terus collab sama bapak2 di mesjid yg ngebangunin pake speaker. Satu2 nama penduduknya diabsen suruh bangun wkwkwk https://t.co/xm6zRHNFYV",0,0
achadianrani,2020-05-22 21:15:22,Wadooohhh https://t.co/4a08SggQwG,0,0
achadianrani,2020-05-21 10:30:12,Kalo puasa gaboleh makan ceplok sih emang. Tp kok w mikirnya yg lain wkwk https://t.co/SPuRKdOhQj,0,0
achadianrani,2020-05-20 16:58:56,"Laki w di dapur mulu, lama-lama bau bawang u.",0,0
achadianrani,2020-05-20 05:12:26,@semocca @txtdaricewe Wah ngadi ngadi.,0,0
achadianrani,2020-05-19 07:44:18,Anjir merinding liatnya 😨 https://t.co/QW9VKCxDmr,0,0
achadianrani,2020-05-19 07:38:46,@galang199 @AREAJULID Berarti banyak yg pikirannya gk sama kayak gue,0,0
achadianrani,2020-05-18 20:26:28,"HAHAHAHA pusing gak sih lu sama ni negara. Ditambah dengerin mereka nyanyi, tambah pusing gak sih lu. Alias lu ngapain woyyy malah bikin lagu????? https://t.co/g79LQuJpe6",0,0
achadianrani,2020-05-18 15:03:36,"Laki w kalo w tinggal ke kantor jadi rajin bgt. Pulang2 piring udah dicuciin, lantai dipelin, sampah dibuangin, teras disapuin. Hm mantap ini mah.",0,0
achadianrani,2020-05-18 05:10:33,Hal penting ketika punya rumah yg baru kusadari : harus sering disapu. :(,0,0
achadianrani,2020-05-18 05:04:43,WKWKWKWKWKWKWKWK BODOHNYA KORANG https://t.co/nz5fojlMre,0,0
achadianrani,2020-05-18 05:00:12,"@AREAJULID Ni gue bingung ya, replynya kok pd ngomel2. Pdhl maksudnya dia gk suka sama yg bohong kan, ngaku perawan pdhl udh gk?? Kok malah pd nangkepnya dia ngerendahin yg udh gk perawan. Bacanya pake emosi apa gmn sih wkwkwk. Jangankan laki, perempuan kalo laki2nya gk jujur jg gasuka kan?",0,7
achadianrani,2020-05-18 03:17:16,Kangen banget baca komik monika dan kawan-kawan,0,0
achadianrani,2020-05-17 13:53:38,@asepsahrudin7 Ichi ocha aja qaaa~~~ Ichi ochanya qaqaaa~~~ TUHKAN AELAH.,0,0
achadianrani,2020-05-17 13:48:43,Jingle ichi ocha ini kenapa stuck in ma head ya,0,0
achadianrani,2020-05-17 06:33:35,@memefess Introvert itu bukan mental illness 🤡,0,0
achadianrani,2020-05-17 04:32:55,"Sebenernya yg terpenting ketika lu ngelakuin kesalahan (entah itu kecil atau besar), lu sadar kalo itu salah, minta maaf, lalu jadi pribadi yg lebih baik lagi. Karena yha lu gabisa sih terus dengerin omongan orang yg gamau berhenti nyari kesalahan lu.",0,0
achadianrani,2020-05-15 17:22:33,https://t.co/yonvuh28mE https://t.co/1jTQzwDchK,0,0
achadianrani,2020-05-15 17:22:29,Menolaq lupa wkwk https://t.co/I6OpYnF3uq,0,0
achadianrani,2020-05-15 17:08:13,Pengen jajan simply. Kangen liat abang2nya ngegerus tebu 🥺,0,0
achadianrani,2020-05-15 13:48:33,@asepsahrudin7 Dah bang.,0,0
achadianrani,2020-05-15 01:45:45,Ini alesan w males ngirim2 makanan ke orang lain kecuali nyokap w. Mending w ngaku aja gabisa masak drpd makanan w dikoreksi orang lain wkwkwk. https://t.co/xEEyFPAfMT,0,0
achadianrani,2020-05-14 11:20:18,"Asep ampe disebut 2x, damagenya gak ngotak pasti @asepsahrudin7 https://t.co/7EXfoCCFF2",0,0
achadianrani,2020-05-14 11:13:17,Laki w demen bgt bikin cemilan enak. W sebage istri yg baik dgn senang hati nyikat semua hasil karyanya. Kemudian glesoran kerana kekenyangan.,0,0
achadianrani,2020-05-14 11:07:45,Gila plot twist. https://t.co/EoGwS5XDiJ,0,0
achadianrani,2020-05-13 22:16:28,"Pertanyaan gue, lu ngapain nyindir2 cewek yg belom tentu juga dia jadi istri lu?? https://t.co/qCx9vHCvzv",0,0
achadianrani,2020-05-12 06:53:52,Walopun lg gak puasa tp tetep males makan soalnya gada yg nemenin,0,0
achadianrani,2020-05-11 04:48:37,@asepsahrudin7 Pisces tukang ngolekin duit,0,0
achadianrani,2020-05-11 04:24:20,@jst1878 https://t.co/fltty0aDLd,0,0
achadianrani,2020-05-11 03:06:01,Gemini tukang ngumpulin sampah,0,0
achadianrani,2020-05-10 10:51:19,Shitpost fesbuk tuh emg bangsat bgt bikin ngakak wkwkwkwkwk https://t.co/Ln48qTVkeV,0,0
achadianrani,2020-05-09 13:17:23,"@AREAJULID ""apa bedanya yg nyiksa sama si ferdinan.. bla bla.."" lah ya gaada bedanya lah orang mereka juga sesama narapidana kan.",0,0
achadianrani,2020-05-09 05:26:00,Bikin kesalahan dikantor. Pengen coba benerin tp wa blm direspon atasan. Kok pengen nangis jadinya 😭,0,0
achadianrani,2020-05-08 09:16:58,@naufalhasibuan_ Lha ya sama wkwkwk,0,0
achadianrani,2020-05-08 09:15:02,Kok bisa sih ngedekor kamar sampe estetik gitu. Apakah gapada males ngebersihinnya? :|,0,0
achadianrani,2020-05-08 02:45:48,Enak bgt extrovert kalo lagi ngantri di bank bisa lgsg ngobrol2 sama orang di sebelahnya,0,0
achadianrani,2020-05-08 02:33:14,Lha gimana sih wkwkwkwk https://t.co/9CAMphOXUQ,0,0
achadianrani,2020-05-07 10:18:39,"Wkwkwk ini bokap w bgt sih dulu. Kalo skrg udah lumayan, tetep gak mau bantuin di dapur tp jadinya lebih milih ngeluarin motor terus beli lauk mateng :))) https://t.co/xekgiql5Pb",0,0
achadianrani,2020-05-07 09:18:41,"Orang yg punya gangguan kepribadian aja masih mati2an buat healing dirinya sendiri, lah sharing bareng sm sesama orang yg masih ""sakit"" yg ada makin gak kelar2 penyakitnya. https://t.co/H4yjy4ZQIW",0,0
achadianrani,2020-05-06 21:31:49,Uuuu kasiaann 🥺 https://t.co/CENRHFIEYN,0,0
achadianrani,2020-05-06 11:06:18,Tadi sore kek liat temen w si shinta di alsut,0,0
achadianrani,2020-05-06 11:00:37,Da lah ngapain punya temen kalo ribud teroz https://t.co/f3tqnf0jWl,0,0
achadianrani,2020-05-06 03:49:50,"Aktor yg kiri pernah di satu judul jadi peran yg ditindas istri, w otomatis ngatain mampus karena saking seringnya dia jd peran suami bangsat di cerita yg lain 🙃 https://t.co/IDMqTwcD0f",0,0
achadianrani,2020-05-04 21:43:39,WKWKWWKWKWK https://t.co/Y4Tt5ljLrf,0,0
achadianrani,2020-05-04 21:10:08,Kok gaada MiFa MaFa &amp; Kata Mutiara??? https://t.co/K96SK0hbgc,0,0
achadianrani,2020-05-04 02:24:46,Ya Allah kangen berenang,0,0
achadianrani,2020-05-03 14:40:22,Bacain quora ttg kisah para ibu2 yg kena babyblues setelah melahirkan kok bikin gue jadi takut :(,0,0
achadianrani,2020-05-03 12:01:05,"Tereak tereak body shaming, ngeliat anak abg yg ""beda"" dikit lgsg dikatain dr atas ampe bawah. Standar ganda.",0,0
achadianrani,2020-05-03 11:59:58,"Gue sebenernya muak ya sama orang2 yg pada reply, yg salah itu karena mereka pada ngumpul di saat2 kayak gini. Knp malah pada ngatain mukanya tua, ngatain lonte, ngomentarin eyelash extension, ngomentarin baju, ngomentarin sepatu. Enteng bgt jarinya. https://t.co/0LpJ3qzleu",0,0
achadianrani,2020-05-03 10:11:43,4x4=16 https://t.co/69ufTOVJ5q,0,0
achadianrani,2020-05-02 14:16:32,"Harusnya tinggal bilang aja ""sorry gue gamau"", kalo ngetik panjang lebar kayak gitu maksud hati biar dibilang savage tp malah kesannya miskin https://t.co/ydQoiSgzXf",0,1
achadianrani,2020-05-02 05:06:36,Ngibul. W pisces tp jahat gasuka bantuin orang. https://t.co/2GlpoiBoNo,0,0
achadianrani,2020-05-02 04:25:01,I-itu sabunnya kebanyakan https://t.co/yfqvmH9bkn,0,0
achadianrani,2020-05-01 10:34:25,Hubungannya apa sama merusak nama islam????? https://t.co/Zb8nCXhoQp,0,0
achadianrani,2020-05-01 10:31:25,Bapaknya bader bgt. Disuruh isolasi mandiri malah pergi tarawih. Hasil tes udh positif tp gak lapor ke kepala lingkungan. Pas dijemput bilangnya malah begini : https://t.co/NpoXJQftuO https://t.co/2CcrNjt3qH,0,0
achadianrani,2020-04-30 09:45:46,"Udah punya laki, punya kerjaan enak, udah dapet rumah enak juga, keknya udah saatnya w coolyeah lagi",0,0
achadianrani,2020-04-29 21:12:24,Lucu bgt😍 https://t.co/SONlXlZ9Zs https://t.co/nC00UzXbcm,0,0
achadianrani,2020-04-29 10:02:13,Lama-lama jengah juga liat cewek cantik bikin video tiktok. Bosen bgt kontennya itu itu doang.,0,0
achadianrani,2020-04-28 09:45:56,"Padahal si cowok udah bilang ""kalo keberatan gadilanjut"" tp diotaknya si cewek isinya cuma ""WAH KONTEN NIH"". Emg goblog. https://t.co/8PK7PXs6Ye",0,0
achadianrani,2020-04-28 06:05:26,@jst1878 @indostruggles Wkwkwk biji,0,0
